body,score_hidden,archived,name,author,author_flair_text,downs,created_utc,subreddit_id,link_id,parent_id,score,retrieved_on,controversiality,gilded,id,subreddit,ups,distinguished,author_flair_css_class
"Thank you for this, really sad to hear. I remember a very similar thing with my own grandfather, everyone was Mary! My thoughts go out to you and your family",,,,Harvington-Steel,,,1449681234,t5_2r8fp,t3_3qm1tw,t1_cwsfesy,1,1451539097,0,0,cxszszq,Alzheimers,1,,
"If memory problems are seriously affecting daily life activities, these could be early signs of Alzheimer’s. Know more about Alzheimer's Disease symptoms and signs along with how to manage them effectively, on PatientsEngage.",,,,surendar_pal,,,1450950797,t5_2r8fp,t3_3y2hv4,t3_3y2hv4,1,1451831339,0,0,cy9wtm2,Alzheimers,1,,
"I'm glad they've approved further funding, but I can't but help but have mixed feelings when the same bill was used as a Trojan horse to slip in the previously rejected (multiple times) CISA funding as well.",,,,dlayknee,,,1450538515,t5_2r8fp,t3_3xd7gr,t3_3xd7gr,1,1451738143,0,0,cy4in8r,Alzheimers,1,,
"Thank you. I needed some perspective. Merry Christmas to everyone! ",,,,Ras-Algethi,,,1451015094,t5_2r8fp,t3_3y2tqu,t3_3y2tqu,1,1451844251,0,0,cyanrxs,Alzheimers,1,,
"Had to get my mom on SSDI about two or three years ago. I don't remember much but for whatever it's worth... 

So we live in Texas. My mom was 54 at the time. She got laid off so I applied online for SSDI and just waited for phone calls. I think it took a few weeks but first phone call was to inform me that I needed to take her to get her tested. So took her there and she failed pretty bad. Simple math, adding subtracting money, remembering sentences words. There's a name for the test but my memory sucks. 

I applied for Medicaid (I think that was an option while applying for SSDI) but she got denied due to her assets. Too young for Medicare also (more on that later). Thank you Obamacare. 

It took a few months but she was eventually approved and the money started getting deposited. What a damn lifesaver. This wasn't a difficult process at all. 

Fast forward a few years. I had to put my mom in a personal care home. While you're early in this process, PLEASE get power of attorney taken care of. I waited too long, my mom got much worse and I had to take the guardianship route, which took around 9 months and thousands of dollars for a lawyer. This entire time, I was paying 3k a month (out of my own pocket) for her personal care home and this was the most brutal part. Sorry if I'm digressing but this condition is unpredictable, so prepare for the worst. 

And I have no idea what happened but my mom qualified for Medicare this year. She just turned 57 and qualified on her birthday month. ",,,,uncex3,,,1450373166,t5_2r8fp,t3_3x5vqd,t3_3x5vqd,1,1451701545,0,0,cy2egzs,Alzheimers,1,,
"Thank you for this. We are traveling with my mother-in-law for what will most likely be her last Christmas with the family. Next year she will too much to manage, she may be too much this year, but we are going to try it. 

Thank you for your encouragement it is really helpful.",,,,sharpstick,,,1450968060,t5_2r8fp,t3_3y2tqu,t3_3y2tqu,3,1451833529,0,0,cya1gx9,Alzheimers,3,,
"Exactly, stage 4 or even 4/5 is usually when most people are diagnosed. This is beyond sad. When you do finally take someone in for a diagnosis, for some it has taken close to a year for a diagnosis. This is totally unacceptable. 

I realize there are a lot of people that do not feel this way, but from what I have seen an experienced, the drugs used today to delay the progression of the disease are just ""Hope in a Bottle."" Why would you want to live with moderate to severe Alz. for a longer period of time? That's all these drugs are doing. By the time the disease has progressed to the moderate stages, your mind had deteriorated to the point where you are completely dependent upon others for your existence. Not to mention the hardship for the family's and the outrageous cost of care. 

As humans, we are conditioned to prolong human life as long as possible. We would rather see our loved ones suffer through this disgusting, undignified, protracted disease than let then go through the stages more quickly. Sometimes it seem like the families are thinking more of themselves, when agreeing to letting their loved one take these drugs. We treat our animals better than humans. Just my opinion as a caregiver.  ",,,,KBH1220,,,1451438654,t5_2r8fp,t3_3xpzbj,t1_cyfl5de,1,1451930302,0,0,cyfmr8w,Alzheimers,1,,
"Yeah, they just put her on anti-biotics for UTI. Hopefully that helps. I would have never suspected that a UTI could cause such a thing. Thanks for your advice, this makes me feel a lot better!",,,,partiallypro,,,1451536806,t5_2r8fp,t3_3yuonh,t1_cygz764,2,1451953722,0,0,cygzeu6,Alzheimers,2,,
"Keep a close eye on her once they stop the antibiotics.  They can reoccur easily and as you have found the symptoms sneak up on them. ",,,,Myfeelingsarehurt,,,1451537259,t5_2r8fp,t3_3yuonh,t1_cygzeu6,1,1451953827,0,0,cygzmus,Alzheimers,1,,
"By no means am l an expert in alzheimers or memory loss. I do however know from life experience that often when I was depressed I was not as sharp as usual. It seems like you have a lot of weight on your shoulders right now. My advice is Get Out. Meet new friends and find something to occupy your time and mind. I joined a website called Meetup when I was at a very low point in my life. I made friends, had events to look forward to and eventually met my wife in one of the groups from the site. [Here] (http://www.meetup.com/?set_mobile=off) is the link to Meetup. It's not a dating site. It's a get out and meet people site. Of course I would advise seeing your doctor as well, but I think you need a good healthy dose of positive life. Get out!",,,,shalom_shmucko,,,1450266419,t5_2r8fp,t3_3x2bx7,t3_3x2bx7,2,1451675649,0,0,cy0wkk6,Alzheimers,2,,
"I enjoy the article. 
",,,,nibble25,,,1450691951,t5_2r8fp,t3_3xm2wi,t3_3xm2wi,2,1451771515,0,0,cy6g8w3,Alzheimers,2,,
"offers widespread information, medical news &amp; reviews, and expert advice to empower patients as well as caregivers in the effective management of Alzheimer's disease.",,,,surendar_pal,,,1450950059,t5_2r8fp,t3_3y2h1q,t3_3y2h1q,1,1451831258,0,0,cy9wngx,Alzheimers,1,,
"I have read a lot of information about memory exercises to help PREVENT Alzheimer's. But no concrete proof. I've known and worked with many Alzheimer's patients and many had advanced degrees, were socially active, were in Bridge clubs and were involved in all types of activities. They were already doing the types of things some scientist are studying as possible preventions. My mother has Alzheimer's and she was very active in clubs, charities, and did crossword puzzles (for as long as I have know her), word search games, words scrambles. She has always been healthy except for a ruptured disk in her lower back many years ago, some nasal allergies. No heart problems. Never overweight. The only thing I can think that may have put her at risk, is she has had progressive hearing loss for many years. Even though all her children, grandchildren and doctors would talk to her about getting hearing aides. She never would and used every excuse in the book. I believe her untreated progressive hearing loss is what put my mom at high risk for Alzheimer's.

Sorry for the ramble. To answer you question, I have not seen anything about doing memory exercises to delay the progression of Alzheimer's. The only thing I know that works, at this time, is medication. I'm not saying you should not do your own research and do the memory exercises, but I have not seen anything to support that doing memory exercises, once there has already been a diagnoses of Alzheimer's, will slow the progression. 

If you know of someone with early stage Alzheimer's, keep them active as long as possible. If this person does not have a family member to who can help them stay active on a daily basis. If possible, hire a part-time companion (to start with).  ",,,,KBH1220,,,1449699665,t5_2r8fp,t3_3w4n29,t3_3w4n29,4,1451545654,0,0,cxtdf7b,Alzheimers,4,,
"Your mom sounds like an awesome person, and you sound like an awesome daughter. I could feel the love you have for your mom through your post. Don't ever feel guilty or ashamed. Love to you, your brother and dad.",,,,ritamorgan,,,1449415012,t5_2r8fp,t3_3vmeax,t3_3vmeax,2,1451472356,0,0,cxp4hdv,Alzheimers,2,,
"I call it the space stare, like he's looking right through you into space.  But yeah he's only 74, his mother eventually passed from the disease.",,,,armedredneck,,,1449618287,t5_2r8fp,t3_3vvg8k,t1_cxs5qvb,3,1451525070,0,0,cxs6idt,Alzheimers,3,,
[removed],,,,[deleted],,,1450291439,t5_2r8fp,t3_3x3zqc,t3_3x3zqc,1,1451682056,0,0,cy1a0qr,Alzheimers,1,,
"Thank you! I did not realize that there was an automatic pill dispenser and alarm. Thats a good idea! The button is a good idea, mainly for my MIL (who's not in the best shape) so if she gets into trouble, she could call someone.",,,,getthefacts,,,1449845934,t5_2r8fp,t3_3w9jzh,t1_cxuyk9i,2,1451579998,0,0,cxvcu8g,Alzheimers,2,,
There's an app called Life360 that we use. Its helped us many times.,,,,bloodygoodtimes,,,1449796108,t5_2r8fp,t3_3shwph,t3_3shwph,1,1451570336,0,0,cxuss86,Alzheimers,1,,
"I've actually been told the opposite of mister text wall's answer. At least in regard to little puzzles and toys and such, something my father used to love before his Alzheimer's really took off. The frustration they can experience can be more harmful than good.",,,,angrydroid,,,1449715223,t5_2r8fp,t3_3w4n29,t3_3w4n29,3,1451550369,0,0,cxtn5o1,Alzheimers,3,,
[removed],,,,[deleted],,,1448981811,t5_2r8fp,t3_3v04ba,t3_3v04ba,1,1451368757,0,0,cxj4ye8,Alzheimers,1,,
Can't help with the clock but we got a BIG calendar with squares for the days and write things in. Then mom puts an X through the box when she goes to bed.,,,,weezyb1217,,,1450457276,t5_2r8fp,t3_3xad7a,t3_3xad7a,1,1451721112,0,0,cy3j90q,Alzheimers,1,,
"Hi.  Are you saying you suspect you have one copy of the 3 allele, but don't know the other one? ",,,,apricotpajamas,,,1450477300,t5_2r8fp,t3_3rsig2,t1_cy3hsok,1,1451727316,0,0,cy3w46r,Alzheimers,1,,
"This is such great news. This is they type of progress we can make as a country when there is partisan support in our government.  ",,,,KBH1220,,,1450482056,t5_2r8fp,t3_3xd7gr,t3_3xd7gr,4,1451728583,0,0,cy3yt0n,Alzheimers,4,,
"Sorry as I am sure you can relate being in the situation we are in burn out can make you very touchy and on edge. ",,,,HasturLives,,,1450461068,t5_2r8fp,t3_3x5vqd,t1_cy341pm,1,1451722281,0,0,cy3lqa8,Alzheimers,1,,
I know several individuals the drank two to three glasses of wine/beer/alcohol a day and still developed Alzheimer's.,,,,KBH1220,,,1450144687,t5_2r8fp,t3_3wsptr,t3_3wsptr,2,1451649301,0,0,cxzdpx0,Alzheimers,2,,
"That whole situation sounds rough, and I'm sorry to hear that. I hope you can manage to spend some time with your parents over the coming weeks anyway, without all the bullshit your sister and her husband bring to the table. Also, Merry Christmas to you.",,,,MattinatorHax,,,1451003623,t5_2r8fp,t3_3y2tqu,t1_cyafmt6,3,1451842061,0,0,cyaj4mb,Alzheimers,3,,
"My grandma loves to fold laundry ",,,,Provol0ne,,,1451411414,t5_2r8fp,t3_3y4wsm,t3_3y4wsm,1,1451921638,0,0,cyf58w2,Alzheimers,1,,
"Mechanism seems to correlate with Batten Disease.  Hopefully, researchers are already aware and pursuing similar treatments studies.",,,,jimbuttmeta,,,1451435278,t5_2r8fp,t3_3xvhhi,t3_3xvhhi,1,1451929330,0,0,cyfkoxj,Alzheimers,1,,
So cute! How far along is your dad?,,,,KBH1220,,,1449613904,t5_2r8fp,t3_3vvg8k,t3_3vvg8k,3,1451523692,0,0,cxs3l24,Alzheimers,3,,
"Concur.  My EOAD wife only presented #9 and #10 (until the car crash) because, like many otherwise bright AD patients, she was compensating for all the others through careful thinking.  Once the loss becomes so great that even care can't work in time-critical situations (driving), the diagnosis becomes obvious.  Unfortunately, this can be at Stage 4 or even 4/5.  Very sad and can bring on both depression and harsh social situations until everyone understands.  Heartbreaking.",,,,jimbuttmeta,,,1451435998,t5_2r8fp,t3_3xpzbj,t1_cy88ih2,2,1451929545,0,0,cyfl5de,Alzheimers,2,,
"Apricot, it is a huge relief to read your response. I have trouble putting things into perspective to ignite change. I can tick off at least 4 of those detrimental lifestyle habits so if I value my mental health and the future of my family, I'll get my rear in gear. I will look up the Mediterranean diet and start little by little improving my lifestyle, including at least some form of exercise that will get my heart going. Luckily my job and my yearning for knowledge have helped with the last part of your advice. I am going back to school, also trying to get out of routine and change things up. 

Trying to be present and listen is something I've recently put on priority, it has also helped my daily depression which is fantastic.

I'll definitely email you, this is something that I'd like to keep fresh in my mind every day as affirmation to help me change. Thank you very much for all your help, talk to you soon.

",,,,DreamInWhichImDying,,,1450325813,t5_2r8fp,t3_3x2bx7,t1_cy12uvu,1,1451692552,0,0,cy1vu86,Alzheimers,1,,
"Well for my grandparents we would lock any doors leading to stairs, like the basement or back deck. 

We also started locking the front door at night with a key, that way they can't figure out how to open the door and eventually go back to bed.",,,,Electrivire,,,1449343387,t5_2r8fp,t3_3viw0f,t3_3viw0f,1,1451457970,0,0,cxoafaa,Alzheimers,1,,
"I can see how that would happen. ",,,,KBH1220,,,1449740358,t5_2r8fp,t3_3w4n29,t1_cxtn5o1,1,1451555446,0,0,cxtxs6h,Alzheimers,1,,
"Remember that the AD sufferer will at some stage forget know how to get to the toilet and later, how to turn their body so as to sit on the toilet, how to wipe themselves clean, how to pull the chain, how to pull the toilet paper off the roll, how open their hand so the used toilet paper drops into the toilet, etc - so the problems and solutions related to toilet use and pooing are ever changing, usually for the worse. So, make sure you are never too lazy to put your thinking cap on, because not putting it on is so much worse not only for the AD sufferer, but for you too. Here are some solutions I've had to come up with that may help others: 

Kiddy locks, those ones that stop kids opening and shutting the toilet lid - Stops the AD sufferer from putting things in the toilet

Balancing something precariously on the cistern lid - stops the AD sufferer lifting and fiddling in the cistern, or putting dirty toilet paper etc in there, because as soon as they start fiddling the object crashes to the ground, stopping them and warning the carer there is a problem

Take the key out of their toilet door - can't lock themselves in

Attach a length of elastic, threaded with things that jingle, between the door and doorjam - you can hear when they try to open the door to go to the loo unattended

Use adult diapers - stops the big and dreadful mess

At night use adult diapers with a catsuit put on backwards so it cannot be taken off - stops night poos all over the place, and the catsuit stops the AD sufferer from removing the diaper

Keep a special purpose hygiene mop and bucket in the bathroom - use the mop to mop down the person when you get them in the bath to clean up after they have messed themselves, and then use it to mop out the bath, and then rinse and disinfect the mop ready for next time

If the person begins to look or behave with more agitation than usual, don't get tired of ask the basic questions (whether they need the toilet, are thirsty, in pain, hungry or tired) - stops many toilet related accidents :)

Diarise each and every poo for a while to see if there is a pattern in relation to eating - lets you institute a meal plan that suits when you can be there to attend to toilet-going. 

Work out a schedule of assisting the person to the toilet - maybe every couple of hours, and immediately on waking, and last thing at night

Always keep Imodium on hand and treat diarrhea as soon as it makes itself know - saves a lot a lot of issues

Always (always!) check out the floor where you are walking - never know when you will come across some poo. 

Stick soiled clothes, blankets etc in the washing machine and get the wash going as soon as you can even if it is the middle of the night - because there is not much worse than coming back later or the next morning to a poo cleanup half done!

An AD sufferer's behaviour around toilets is ever changing but doing the bad things (like insisting on breaking up the poo with their hands because they've forgotten how to pull the chain) does eventually pass. So don't give up hope :)
",,,,seedpod02,,,1449783844,t5_2r8fp,t3_3w9jzh,t3_3w9jzh,5,1451566676,0,0,cxul5zk,Alzheimers,5,,
"http://www.alzstore.com/alzheimers-dementia-wandering-s/1828.htm

There are a few items on this site that may help. The confounding door lock and the door mural are interesting options. ",,,,Myfeelingsarehurt,,,1449333338,t5_2r8fp,t3_3viw0f,t3_3viw0f,1,1451455297,0,0,cxo4whk,Alzheimers,1,,
"There are a lot of people on Reddit that know a lot about Facebook. I would repost your question on r/Facebookhelp or r/Facebook.  ",,,,KBH1220,,,1450676096,t5_2r8fp,t3_3xn4m2,t3_3xn4m2,1,1451769088,0,0,cy6b8r3,Alzheimers,1,,
"Haha, I understand completely! Trust me, I am very familiar with the combo of stubborn + dementia. :) 

If she's refusing or forgetting to take meds, she does need more/different care-- I think a hospital evaluation and placement is a good step. Don't expect that this is the end of the road, though- many people have a very difficult adjustment to 24/7 care. If she does stay in a dementia unit/nursing home, one way you can ease the transition is to say that ""you can go home once you're healed and the doctor approves it."" Most will be agitated and demand to go home, but framing her stay there as a medical necessity may help. After some time, she might stop asking to go home. 

 The good news is that with UTIs, once the infection has been dealt with, there is often a slight improvement in behavioral issues- the UTI definitely temporarily exacerbates symptoms. If the doc doesn't bring it up first, ask about taking antibiotics as preventive treatment; people with multiple UTIs are much more likely to contract another one. Cranberry supplements are also a great preventive. ",,,,applesangria,,,1450892703,t5_2r8fp,t3_3xytl7,t1_cy946y1,2,1451817811,0,0,cy94po1,Alzheimers,2,,
"It works through bluetooth and gps. If you're within 100ft you can ring objects with tiles from an app on your phone (you can ring each tile individually) or make your phone start ringing by pressing on one of the other tiles.

If it's further than 100ft (like you left your ipad in the car down the street) you can see it on a map where all the tiles appear as pins.",,,,weary_dreamer,,,1448939092,t5_2r8fp,t3_3uw6fk,t1_cxia1c9,1,1450555270,0,0,cxip6zq,Alzheimers,1,,
merry Xmas all.,,,,HasturLives,,,1451022589,t5_2r8fp,t3_3y2tqu,t3_3y2tqu,1,1451845816,0,0,cyaqy0m,Alzheimers,1,,
"Good point, and good for you.

If it is that rapidly advancing, there's a possibility she has something else going on, medically, that is causing the advancement- UTI or other infection, high blood pressure, etc. Make sure she gets a full check up as well as the dementia assessment. ",,,,applesangria,,,1450890961,t5_2r8fp,t3_3xytl7,t3_3xytl7,2,1451817292,0,0,cy93m1c,Alzheimers,2,,
"Do you have any source on that, I find it really interesting. My dad walks a lot (2-3 hours per day) and stretching exercices (5 minutes per day) but no resistance training.",,,,lavertuross,,,1450702306,t5_2r8fp,t3_3w4n29,t1_cy6ihid,1,1451772758,0,0,cy6ivut,Alzheimers,1,,
[deleted],,,,[deleted],,,1450891888,t5_2r8fp,t3_3xytl7,t1_cy93m1c,1,1451817566,0,0,cy946y1,Alzheimers,1,,
"Alzheimer’s is one of the biggest difficulties affecting our seniors today. An estimated 44 million seniors currently, although most cases aren’t yet diagnosed. Recent studies suggest that veterans who experience traumatic brain injuries and post-traumatic stress disorder are at an even higher risk than the rest of the population of contracting Alzheimer’s

It pays to recognize it when it occurs. While there’s no cure, there are treatments that can slow the effects of the disease, and veterans and their family members can tap into special services to help cover the costs of care.",,,,VeteranAid,,,1449599906,t5_2r8fp,t3_3vyn0x,t3_3vyn0x,1,1451518529,0,0,cxrsxga,Alzheimers,1,,
"I would have her checked for a urinary tract infection as sudden onset confusion is a big symptom in the elderly. Start with her Primary physician and ask for a neurology consult if they suspect dementia or Alzheimer's.  ",,,,Myfeelingsarehurt,,,1451536370,t5_2r8fp,t3_3yuonh,t3_3yuonh,2,1451953622,0,0,cygz764,Alzheimers,2,,
"Thank you so much, these qualities give great insight into what i'm searching for. Things I'd have missed as a child and not been around for, I hope to that she stays happy for the longest of time!",,,,Harvington-Steel,,,1449684464,t5_2r8fp,t3_3qm1tw,t1_cwh8ilc,1,1451540212,0,0,cxt2638,Alzheimers,1,,
"Been where you are myself. The hardest part is taking that first step. May I also suggest taking something like a cardio kickboxing class. Intensive exercise will sharpen your reaction times and give you mental focus. Good luck my friend. ",,,,shalom_shmucko,,,1450353209,t5_2r8fp,t3_3x2bx7,t1_cy1vlsl,1,1451696711,0,0,cy24in4,Alzheimers,1,,
"Awesome, thanks.",,,,lavertuross,,,1450705898,t5_2r8fp,t3_3w4n29,t1_cy6k30f,1,1451773355,0,0,cy6k5ey,Alzheimers,1,,
You are wrong to blame Obamacare.  My wife was diagnosed with Early Onset Alzheimer's at 55 and after being on SSDI for a year she was automatically enrolled in Medicare for free.  I think you might want to check with your state laws.,,,,HasturLives,,,1450407669,t5_2r8fp,t3_3x5vqd,t1_cy2egzs,3,1451711731,0,0,cy2zsh4,Alzheimers,3,,
"Good. Visited my grandma over the weekend and she had no idea who I was.  Terrifying to think that is probably going to happen to my Dad and probably me. ",,,,tcpip4lyfe,,,1450533923,t5_2r8fp,t3_3xd7gr,t3_3xd7gr,1,1451737266,0,0,cy4gxjk,Alzheimers,1,,
"Best of luck with your fundraising, sounds like an interesting project! I would love to hear your story, how does one PM?",,,,Harvington-Steel,,,1449684378,t5_2r8fp,t3_3qm1tw,t1_cwqb3l0,1,1451540181,0,0,cxt23t0,Alzheimers,1,,
[deleted],,,,[deleted],,,1450893445,t5_2r8fp,t3_3xytl7,t1_cy94po1,2,1451818036,0,0,cy956t8,Alzheimers,2,,
"Get a lawyer to help with applying for SSDI.  They can get her on SSDI the first try.  My lawyer only charged a few hundred dollars.  If she is in the early stages see if you can find an adult center that will watch her during work hours.  So far I have been able to take care of for almost 3 years.  She is getting worse and will have to go into a home with a year I am thinking.  I agree get her to sign over guardianship or at least durable power of attorney for health care decisions and also Financial power of attorney ( they are 2 separate things).  ",,,,HasturLives,,,1450408304,t5_2r8fp,t3_3x5vqd,t3_3x5vqd,1,1451711962,0,0,cy304qc,Alzheimers,1,,
