body,score_hidden,archived,name,author,author_flair_text,downs,created_utc,subreddit_id,link_id,parent_id,score,retrieved_on,controversiality,gilded,id,subreddit,ups,distinguished,author_flair_css_class
"All theses suggestions are wonderful. I have been a private caregiver as well as a caregiver for my mom who presently suffers with Alzheimer's. 

First of all, you are a very brave and super young women for moving back in with your mother to help care for your grandmother. I'm sure you have realized by now, until you actually are an Alz. caregiver, there is no way you can understand the depth of this extremely difficult and overwhelming job. It is the most physically, mentally, and emotionally draining job, I have ever done. That's why I firmly believe, that you cannot be what a person with Alzheimer's needs unless you can take care of yourself. You already work at a job and go to school. For your sake and your grandmothers sake, see if there is any way that your mom can have a/the caregiver come in at 7:00 am when your she leaves for work. On you days off, be the caregiver your grandmother needs you to be. Get up when she gets up. Nap when she naps. Keep her engaged. Make her meals, Eat with her. Talk with her. Take her outside. Take her on errands with you (if she's able). Go shopping (if and for how long she is able). 

You are 24 years old. You need to work your job, you need to go to school, you need to study, you need a social life, and you need to take care of yourself!      

 ",,,,KBH1220,,,1449296089,t5_2r8fp,t3_3t7aoz,t3_3t7aoz,1,1451450261,0,0,cxnu8mo,Alzheimers,1,,
Hello! Yes please do email.  I'll help.,,,,apricotpajamas,,,1450383482,t5_2r8fp,t3_3x2bx7,t1_cy1vu86,1,1451704882,0,0,cy2leqx,Alzheimers,1,,
"My mom also has Alzheimer's, and both of the replies (before mine) are excellent. I would Google - digital large display clocks with a record voice reminders feature, and start from there. Also call your local Alzheimer's association or your local Council on Ageing, and maybe they will know of a device that would be helpful to your mom. 

If for some reason you cannot find exactly what you are looking for, tell the managers, supervisors, and staff at your moms assisted living facility to be her reminders. If and when she shows and interest in an activity or event, ask them nicely to be your moms reminders, and hold them to it. You are paying for this service, and this is part of their training in caring for Dementia patients. Good luck!",,,,KBH1220,,,1450483213,t5_2r8fp,t3_3xad7a,t3_3xad7a,1,1451728871,0,0,cy3zf2a,Alzheimers,1,,
"Merry Christmas to you and yours. 
I really needed this today. Thank you.",,,,Lazycrazyjen,,,1450973777,t5_2r8fp,t3_3y2tqu,t3_3y2tqu,3,1451834842,0,0,cya43xu,Alzheimers,3,,
Link is not working or incorrect?,,,,KBH1220,,,1451514478,t5_2r8fp,t3_3yrz8r,t3_3yrz8r,2,1451947702,0,0,cygmxp6,Alzheimers,2,,
"We got a cheap buzzer at Walmart for the doors. It sticks on and you can set it to either off, alarm or chime when the door is opened. We use chime during the day, so I can tell if my loved one is going outside, and alarm at night so it will wake me up. You could do that for the bedroom door, or even just put a noisy bell on the door. Baby monitors are cheap, if your loved one doesn't move things around too much- maybe hide it under the bed. 

Consider night lights to light the way to the bathroom (maybe a string of Christmas lights), a strip of rough tape leading from the bedroom to bathroom (there is tape that's rough like sandpaper on one side), removing the toilet lid and replacing the seat with a different colored one (not black), removing the waste basket, AND perhaps the best is a bedside commode (reduces opportunity for falls, mess, and wandering). A basket with wipes (throw them out, don't use flushable! It clogs up eventually), gloves, and whatever else you might need, should be kept right next to the toilet in easy reach for the carer. 

Beyond that... Don't stress about the mess. They're not doing it on purpose. Clean it up and move on. OdoBan is a gift from the gods- I buy it in gallon size from walmart and add it to all laundry, especially soiled with poop/pee. Plain white vinegar is a wonderful cleaner and deodorizer. For the floor, pine sol and straight bleach are my preferences. ",,,,applesangria,,,1450891763,t5_2r8fp,t3_3w9jzh,t3_3w9jzh,1,1451817529,0,0,cy9443g,Alzheimers,1,,
"Thank you.  ",,,,kippy236,,,1450987226,t5_2r8fp,t3_3y2tqu,t3_3y2tqu,3,1451838329,0,0,cyabcr1,Alzheimers,3,,
"Just over 2 years diagnosed, was diagnosed in the early stage.  He's doing okay, has his good and bad days.  My mom gave up her job as a nurse right now to get thing in order and give him the time he needs.  Her working 2nd shift wasn't helping him at all.",,,,armedredneck,,,1449615467,t5_2r8fp,t3_3vvg8k,t1_cxs3l24,3,1451524203,0,0,cxs4o4x,Alzheimers,3,,
"Unfortunately, a lot of the time their motives are not in the best interest of all the people in our country. Only special interest, and that's sad.

Also, the reason this bill was passed is because in 10 to 20 years from now Medicare costs will triple or even quadruple if this bill did not pass. But for whatever reason, it is a move in the right direction.",,,,KBH1220,,,1450486873,t5_2r8fp,t3_3xd7gr,t1_cy40cnm,1,1451729746,0,0,cy419xt,Alzheimers,1,,
This is great news! Thanks for the share.,,,,KBH1220,,,1450315587,t5_2r8fp,t3_3x35kv,t3_3x35kv,1,1451689732,0,0,cy1q08m,Alzheimers,1,,
"Unless you get a brain scan well before any symptoms present themselves, at this point in time, we truly do not have a way of detecting Alzheimer's early. All the information I have studied says that once symptoms start presenting themselves, the person is usually already at the end of the early stage. And then, most diagnosis takes so long that they can be in the beginning of the moderate stage by the time they are actually diagnosed. This has been my experience as a caregiver.

We know when most people start having symptoms,  they will hide as well as deny to themselves and others that they are experiencing problems. I believe, until we can find ways for quicker diagnosis, much better treatments to either slow the progression of the disease to such a degree a person would have a better chance of dying from other causes, or to cure the disease altogether, maybe in the early stages such as we do now with a lot of cancers, there is not going to be an incentive for a person to get an early diagnosis. Who wants a death sentence, 5, 6, 10 years or more before they lose their life to such disgusting disease? ",,,,KBH1220,,,1450820630,t5_2r8fp,t3_3xpzbj,t3_3xpzbj,1,1451802416,0,0,cy88ih2,Alzheimers,1,,
"Google search has been a great help to me. As far as the stair gate, It will need to be tall/high enough so that if she is wondering, she will not fall over it. Good Luck!",,,,KBH1220,,,1450315855,t5_2r8fp,t3_3x2itl,t3_3x2itl,2,1451689807,0,0,cy1q5z0,Alzheimers,2,,
"Do you have an alarm system? Some can be set with a chime that goes off every time a door is opened. While a lock he can't figure out seems to be a good idea at first, there's always the possibility emergency (like a fire) where he'd need to get out.

Lots of people with dementia have ""sundowners""... we notice with my FIL that he is often much less coherent after dark. 

Look for a local Alzheimer's Organization and see if they have other suggestions.",,,,not-rocket-science,,,1449327389,t5_2r8fp,t3_3viw0f,t3_3viw0f,2,1451454051,0,0,cxo29bo,Alzheimers,2,,
"Thank you so much, I received similar advice today. I think I need to sharpen my social skills. The MDD caused me to be very internalized for a long time, I became very introverted and I'm proof that if you really don't use your social skills they can deteriorate. Thank you so much for the meetup link, I will definitely try it out, they have some great boardgame and DnD meetups I'm interested in. I appreciate the time you took to help, thanks again.",,,,DreamInWhichImDying,,,1450325359,t5_2r8fp,t3_3x2bx7,t1_cy0wkk6,1,1451692441,0,0,cy1vlsl,Alzheimers,1,,
"I know that my mom really enjoys watching older shows that she used to watch when she was younger. Because it's familiar to her, she still enjoys it even if she doesn't really know what's going on in the show.",,,,ketchupsoverrated,,,1451081642,t5_2r8fp,t3_3y4wsm,t3_3y4wsm,2,1451855077,0,0,cyba6k6,Alzheimers,2,,
"I have spent time with many elderly people. I have provided caregiving for Alzheimer's/Dementia patients. Besides loosing some abilities to perform normal self care, one of the first symptoms I will usually notice is Asking the same questions over and over. 

I have seen many elderly try and hide the fact that they are having difficulties. But, they will ask the same question, or even repeat the same thought/comment over and over again, because they cannot remember ever asking the question or making the comment before. This is a HUGE RED FLAG.

I have also seen many, many families deny to themselves that their parent or loved one may have Alzheimer's and thus will put off providing them with the appropriate care needed until an accident happens. I believe denial among the family is almost as epidemic as dementia itself. This to is SO SAD. 

Moreover, a lot of adults that have parents or loved ones with visible signs of dementia will put off getting the appropriate care because the parent or loved on is fighting against that possibility, and do not believe they are having enough difficulty to accept outside help. If this happens, it is So IMPORTANT that the child (or now the adult child) becomes the PARENT. It can be very difficult to become the parent of your parent. But you must. And, you must make some decisions that your parent or loved one may not like. Of course, be a very gentle parent to your parent, but do whatever you have to do to get them on board. Tell them it's only for a few days or a couple weeks.

My mother began calling my sister and me at work several times a day. She resisted in-home care. We told her we worried about her during the day while we were working, and we needed not to worry about her while we were working. She reluctantly agreed. Within three weeks she thought is was one of the best decisions SHE ever made.   

",,,,KBH1220,,,1449616538,t5_2r8fp,t3_3vyn0x,t3_3vyn0x,2,1451524538,0,0,cxs5dre,Alzheimers,2,,
And also to you and yours.,,,,MattinatorHax,,,1450974494,t5_2r8fp,t3_3y2tqu,t1_cya43xu,2,1451835021,0,0,cya4hja,Alzheimers,2,,
"Do you know anything about having a missing variant and having one apoE 3?  Paternal grandfather has Alzheimer's, but I'm unsure if that's where the apoe 3 came from or if it matters.",,,,Spitsongoats,,,1450454987,t5_2r8fp,t3_3rsig2,t1_cwr5pvq,1,1451720427,0,0,cy3hsok,Alzheimers,1,,
"XPost Subreddit Link: /r/dementia 

Original post: https://www.reddit.com/r/dementia/comments/3vw2qe/common_prostate_cancer_treatment_may_double_risk/",,,,XPostLinker,,,1449551231,t5_2r8fp,t3_3vw30j,t3_3vw30j,1,1451508348,0,0,cxr7rsw,Alzheimers,1,,
this is great sutff,,,,stackered,,,1450513901,t5_2r8fp,t3_3xd7gr,t3_3xd7gr,1,1451735051,0,0,cy4c8da,Alzheimers,1,,
"I'm just glad it helped someone, that maybe something good can come out of the crap we're going through here.

All the best with the trip and with your mother-in-law, and I hope and pray you might get some great and lasting memories out of it.",,,,MattinatorHax,,,1450969227,t5_2r8fp,t3_3y2tqu,t1_cya1gx9,2,1451833756,0,0,cya1ybq,Alzheimers,2,,
"They have analog clocks that point to the day of the week rather than a time. I got my mom a digital watch that's pretty basic, and it lists the day and month as well. 


Is she in assisted living or memory care? My mom had too much trouble with assisted living. There weren't enough prompts, and no amount of scheduling or clocks were helping her take care of herself properly. She's so much happier now in her memory care unit. They'll come knock or whatever if she forgets something or to go to an event she mentioned wanting. 

Not all memory care units are nice, but the ones with caring, well trained staff are phenomenal for people with Alzheimer's. My mom hasn't been this happy in years. ",,,,msgreyson,,,1450428581,t5_2r8fp,t3_3xad7a,t3_3xad7a,2,1451715858,0,0,cy388ze,Alzheimers,2,,
"My mom's early symptoms included confusing television shows with her life story, ie she'd integrate something she'd seen as something that happened to her. She also repeated the same sentence over and over and over - not a question, but a statement, as if she hadn't told me before.
She also started a 'journal' and wrote things down, like what she ate or when she took her medications, so she wouldn't forget.
She got a pill box, for a week's worth of meds, so she'd always know where she was.
She wanted people to go to the doctor or shopping or whatever with her.
She stopped coming to stay overnight with her kids. We all live in the same city and have taken turns having mom over for the weekend, the holidays, whatever.  In the beginning, she no longer wanted to sleep over, then she no longer wanted to come over.  (I now know this is because she felt safer in her own home and her own environment.)
She also reverted to some really, really old behavior, like reusing her wash water for her hands and face. (She was raised on a farm and well water was never wasted.)
More frequent confusion of words or forgetting of specific words.
Stopping activities she loved - crocheting, quilting, sewing - because she said she was sick of them. But in fact, she'd forgotten how to do them.
Collecting odd things - mom collected pictures of animals used in print ads by one of the phone services.
Pre-preparing meals way too early and then serving them heated from the microwave or cold because she can no longer plan and sequence things. This leads to not eating properly.

the list goes on and on. The big lesson I had to learn was to identify what was unusual with my mother, because while AD patients have many similarities, they also have many many unique manifestations of the illness, especially at the beginning.
",,,,weezyb1217,,,1449679637,t5_2r8fp,t3_3vyn0x,t3_3vyn0x,1,1451538549,0,0,cxsyn4j,Alzheimers,1,,
"America's Funniest Home Videos is a good choice. There's no plot, and they need laughter. ",,,,winnie1968,,,1451348646,t5_2r8fp,t3_3y4wsm,t1_cyba6k6,2,1451908389,0,0,cyedkx0,Alzheimers,2,,
"Has she been to a neurologist yet? A sudden change like this can be brought on by some other ailment that contributes to Alzheimer's or dementia symptoms. That being said, Alzheimer's is a progressive disease, so in general, she is only going to get worse. However, I would highly recommend a full neurological work up.


For general info, ""The 36 Hour Day"" is a good primer.",,,,oosetastic,,,1451531549,t5_2r8fp,t3_3yuonh,t3_3yuonh,2,1451952345,0,0,cygwn0g,Alzheimers,2,,
[deleted],,,,[deleted],,,1449016900,t5_2r8fp,t3_3uw6fk,t1_cxjkmee,1,1451380389,0,0,cxjt1is,Alzheimers,1,,
"No, I didn't mean it in a bad way. Obamacare came at a perfect time as I went through the situation with my mom. It was either COBRA or nothing. I immediately signed my mom up for Obamacare the moment it became available. Half a year later, my mom ended up in the hospital and it was 20-30k in bills. So when I say Thank you Obamacare, I honestly mean it. I also have no idea how my reply would be blaming anything on Obamacare?",,,,uncex3,,,1450416200,t5_2r8fp,t3_3x5vqd,t1_cy2zsh4,2,1451713807,0,0,cy341pm,Alzheimers,2,,
Cool!,,,,catiracatira,,,1449004494,t5_2r8fp,t3_3uw6fk,t1_cxip6zq,1,1451376351,0,0,cxjkmee,Alzheimers,1,,
"
The number one thing is to set up a network of people. They can be old coworkers, his friends, her friends, family members, church members, neighbors, paid caregivers, who knows maybe boy scouts that need a badge, to give respite care. This can be sitting with them and chatting while you do laundry in the other room, taking them for icecream, letting you go to the doctor yourself, run errands, or just sit with them while you bang you head against the wall. Set them up before you need them, I have one person stop by once a week at least. I try to make it be around the same day/time so I can plan to take ""me time"" while they are there. This week I went for a massage, last week I took a nap. If you don't take care of yourself you will snap. 


Bed alarms are great! They also make matts you can sneak under the carpet by the front door to prevent wandering. 

I find making my day easier gives me more time to care properly which in turn makes my day easier! I do this by automating things when I can. I use one of these so I only have to sort pills once a week and can't forget a dose because of a minor catastrophe.  

Ivation Automatic Pill Dispenser, https://www.amazon.com/dp/B00FL620B0/ref=cm_sw_r_cp_awd_JcKAwbXNQMT9X

I bought a good shower bench and shower wand to make shower time easier on me, as well as a wall based shampoo soap and conditioner dispenser so I don't have to fiddle with bottles. Something like this:
https://www.amazon.com/dp/B000FGE5KA/ref=cm_sw_r_cp_awd_aiKAwb2Y8YGED


I love this help button!!!!!
LogicMark Freedom Alert Emergency Alert System -https://www.amazon.com/dp/B002IMW8O4/ref=cm_sw_r_cp_awd_ekKAwbHQ5JNY6

It works like a cordless home phone and has to be connected to a landline. You don't pay a monitor fee like most. You program it to call 4 numbers in order and then can choose to have it call 911 if the 4 people don't answer. I have it call me twice and the hired caregiver twice. When you answer it tells you it's and emergency and asks you to accept the call by pressing 5 so it isn't tricked by voicemail. It reaches way further than expected and you can speak to them through a mic and speaker in the button!

I also have to say that YouTube and Netflix are good too. Is he reminiscing about a certain time period? Pull up YouTube and find a documentary or news reel. Pull up Netflix and find an old film! Also for some reason my household can watch Simons cat animations for hours just laughing. 

I put an iPad mounted to the wall by his bed. The tv was too hard for him to use and he lost the remote constantly , but you can lock a iPad into ""guided access"" meaning it won't do anything but the app it's in when you start it. I lock it in Netflix and start a movie at bedtime and he happily goes to bed instead of complaining he is not tired (even though he was just snoring in his chair). He can use it easily because you just tap the movie you want to watch.  (He just chooses from the few he can see on the screen as he's not great at navigating) 

In another way to make my day easier I got a automatic pet feeder and pay to have groceries delivered (thanks Safeway!) I use the app for my pharmacy to help me keep track of refills. 

",,,,Myfeelingsarehurt,,,1449805533,t5_2r8fp,t3_3w9jzh,t3_3w9jzh,2,1451573131,0,0,cxuyk9i,Alzheimers,2,,
"Haha, that's too funny!! Sounds good to me! See if there is a liquid cranberry that you can add to her glass! ",,,,applesangria,,,1450894218,t5_2r8fp,t3_3xytl7,t1_cy956t8,2,1451818266,0,0,cy95odd,Alzheimers,2,,
"My mother was diagnosed 2 years ago with early stage. She was 85. She has now progressed to moderate stage. 

Your dad has the same look on his face that my mom has sometimes.",,,,KBH1220,,,1449617095,t5_2r8fp,t3_3vvg8k,t1_cxs4o4x,2,1451524710,0,0,cxs5qvb,Alzheimers,2,,
"My pleasure, and have a Merry Christmas.",,,,MattinatorHax,,,1451003398,t5_2r8fp,t3_3y2tqu,t1_cyabcr1,2,1451842018,0,0,cyaj1bt,Alzheimers,2,,
"Maybe a cheapie tablet or refurbished iPad, for the calendar function? Perhaps you could mount it on the wall like a clock. Obviously someone would have to program events in for her, but that's even something you could do remotely if you have ""her"" ID and password. ",,,,applesangria,,,1450891218,t5_2r8fp,t3_3xad7a,t3_3xad7a,1,1451817369,0,0,cy93rvm,Alzheimers,1,,
"He did not look as old as my mom. The space stare is a very good description. 

I've also noticed that my mom has lost a lot of normal facial expressions. At first, I noticed it in pictures. She can smile some, but she cannot use her eyes and facial muscles (eyebrows, forehead, etc...) to show expressions.   ",,,,KBH1220,,,1449620515,t5_2r8fp,t3_3vvg8k,t1_cxs6idt,3,1451525718,0,0,cxs7vtn,Alzheimers,3,,
"Here's one to get you started, but it shouldn't be hard to find a few more studies http://archinte.jamanetwork.com/mobile/article.aspx?articleid=1135414",,,,Nu5ZCa,,,1450705729,t5_2r8fp,t3_3w4n29,t1_cy6ivut,1,1451773323,0,0,cy6k30f,Alzheimers,1,,
"Thank you very much for this, really helpful x
",,,,Harvington-Steel,,,1449681056,t5_2r8fp,t3_3qm1tw,t1_cwugh0o,1,1451539036,0,0,cxszoax,Alzheimers,1,,
"Fuck what your brother says. He's guilt tripping you because he doesn't want the responsibility. What about his duty? She raised him, too. Seriously, fuck that. You need to SHUT DOWN this conversation- ""brother, enough. This is my decision, not yours. Mom and I have talked about it. If you're not okay with it, feel free to step in and be mom's caregiver. But we're done talking about this."" Even from a distance, you will still be involved, as her advocate and daughter- for peace of mind, hire a companion to keep your mom busy. Stay in frequent contact so you're aware of any changes and can hire more care when needed.",,,,applesangria,,,1450891441,t5_2r8fp,t3_3x9n2u,t3_3x9n2u,2,1451817436,0,0,cy93wxk,Alzheimers,2,,
"YES, exactly.  Our government can do great things, but half of them are too concerned with who's red and who's blue.",,,,StartlingRT,,,1450485024,t5_2r8fp,t3_3xd7gr,t1_cy3yt0n,2,1451729311,0,0,cy40cnm,Alzheimers,2,,
"My EOAD/S5 wife likes reality shows like Pawn Stars, Hard Core Pawn, American Pickers, Undercover Boss, and Forensic Files; talk shows like The Doctors and Dr. Phil; plus games shows like The Price Is Right and Let's Make a Deal.",,,,jimbuttmeta,,,1451434648,t5_2r8fp,t3_3y4wsm,t3_3y4wsm,1,1451929138,0,0,cyfkaas,Alzheimers,1,,
"I am a professional caregiver for people with Dementia. My mom also has Alzheimer's. From my experience with my family as well as seeing what other family's go through as a result of Dementia/Alzheimer's, I would encourage you to move and get your life back on track. If you do not have your life in order, you cannot properly care for someone with Alzheimer's. When it comes to caregiving the old saying is true.....You cannot care for someone else until you can care for yourself. Listen to you mom and do not let anyone guilt you into anything ever. That's manipulation. Once you have moved, visit and call your mom as often as possible. Do what you can for her from a distance. Your mom is right, you need to start your life. ",,,,KBH1220,,,1450398425,t5_2r8fp,t3_3x9n2u,t3_3x9n2u,4,1451709365,0,0,cy2urnf,Alzheimers,4,,
Thank you for sharing your experience,,,,fletchowns,,,1449804785,t5_2r8fp,t3_3vmeax,t3_3vmeax,1,1451572920,0,0,cxuy462,Alzheimers,1,,
"My mom has Alzheimer's too.  MOVE. get on with your life.  You've done your share and it's time for you to start building your future.

good luck",,,,weezyb1217,,,1450457196,t5_2r8fp,t3_3x9n2u,t3_3x9n2u,1,1451721088,0,0,cy3j76o,Alzheimers,1,,
"You don't do memory exercises to delay the progression of alzheimer's. You do **physical exercises**. It is well established that intense exercise (particularly when it includes resistance exercise, i.e. weightlifting) is the best known intervention for dementia.",,,,Nu5ZCa,,,1450701004,t5_2r8fp,t3_3w4n29,t3_3w4n29,2,1451772571,0,0,cy6ihid,Alzheimers,2,,
"Thanks. This is the best post of the past year in this sub. My father is in a very good facility but this will be the first Christmas in a while where I won't be seeing him, mostly because my sister, who has mutual power of attorney with me, has basically started to exclude me from the process. But it is also the first Christmas where my parents won't be going to her house for a few days for the holiday. I'm feeling really guilty for not actually feeling bad for not having to go down to endure her and her drunk, belligerent husband's BS while spending time with my mom and dad. And it's so much *more* complicated than that even, as I am sure you can imagine. But Merry Xmas to you too.",,,,angrydroid,,,1450995860,t5_2r8fp,t3_3y2tqu,t3_3y2tqu,2,1451840344,0,0,cyafmt6,Alzheimers,2,,
"Hi.  I work in a neurology dept.  We have an Alzheimer's prevention clinic.  Part of my job is to read  the medical literature on a daily basis to ensure we stay current.  Large studies show (check out David Bennetts work at Rush Hospital Chicago) that brains of people with genetic predisposition (apoE 4/4) often have normal cognition until death even though they are riddled with amyloid and tau, and people without apoE 4 can have cognitive decline.  Genes may only account for 1/3rd of cases.  The rest is based on modifiable factors (early menopause without estrogen replacement, mid life obesity, hypertension, cardiovascular disease, stroke, concussion, depression, standard American diet, lack of exercise).  Near daily strenuous exercise (just get the heart rate up!) and adopting the Mediterranean diet (vegetables, fruits, whole grains, fish, white meat, 4 tbl olive oil a day, fish 3-4 times a week, way less white bread, way less red meat, coffee, dark chocolate, red wine) can cut your risk by at least 50%.  The way most of us eat leads to a state of chronic inflammation. At your age you have plenty of time to alter your genetic ""destiny"".  Also... Learn a new language, a new skill, a new instrument.  And stay mindful... Try to keep your mind on the task you're doing instead of thinking about other things.  Listen intently to others.  If you want more information... Email me at amfwork@gmail.com.  If you live in the area you can come to the center :)",,,,apricotpajamas,,,1450280903,t5_2r8fp,t3_3x2bx7,t3_3x2bx7,2,1451678613,0,0,cy12uvu,Alzheimers,2,,
