body,score_hidden,archived,name,author,author_flair_text,downs,created_utc,subreddit_id,link_id,parent_id,score,retrieved_on,controversiality,gilded,id,subreddit,ups,distinguished,author_flair_css_class
"Yes I agree with playing music from her youth. Dementia and Alzheimer's is in effect the stripping away of the more short term memories. My grandmother has dementia also. The brain works backwards in effect and causes her to eventually forget the more recent things and remember her earlier memories as a child and young adult. We played my grandmother music from her youth and she was dancing in her chair, clapping along and knew a lot of the words. The earliest memories will be the last to go in this disease and so things from this time are more likely to spark her interest or cause her to remember things and find enjoyment and pleasure. Hope this helps!",false,true,t1_c9g8uez,Monkey_socks,,0,1366116799,t5_2r8fp,t3_18dt64,t3_18dt64,2,1431539511,0,0,c9g8uez,Alzheimers,2,,
How old is he? He's diagnosed clinically and is still driving a truck?,false,true,t1_ce96ssi,angrydroid,,0,1387888752,t5_2r8fp,t3_1tldwq,t3_1tldwq,1,1428004080,0,0,ce96ssi,Alzheimers,1,,
"I am currently a third year student at hertfordshire university studying product design. My project is based on Alzheimer's patients and helping to improve communication between the carers and the partners who are suffering from Alzheimer's. I would really appreciate and criticism or feedback you may have about my concepts.
Thank you for your help :)",false,true,t1_c92ic4s,kmobrien,,0,1364268805,t5_2r8fp,t3_1b0r56,t3_1b0r56,1,1431704637,0,0,c92ic4s,Alzheimers,1,,
thank you - i appreciate your response.,false,true,t1_cb5xa4y,honkshus,,0,1374239606,t5_2r8fp,t3_1ikq5u,t1_cb5jlje,1,1430411426,0,0,cb5xa4y,Alzheimers,1,,
"My mother died of Alzheimer's, so I speak here from personal experience.

Maybe it would help if you can help your brothers and other family members realize that she remembers some things (people) and not others because of how and where the brain has been damaged.

It's got absolutely zero to do with who she cared about, how much she loved.

It's 100% to do with the mechanics of which parts of her brain have been damaged, which have not.

If everyone can take that to heart, there's no awkwardness when she remembers one of you and not the other.

Also, on things like her husband -

The concept of lying has no place in this situation.  We tell people the truth out of respect, because it would be condescending or manipulative to misrepresent the truth to a person who's fully capable of comprehending and dealing with the truth.

But she's no longer capable of those things.  Just as there would be no sense in saying ""Look at that sunset!"" to a blind man, there's no sense in ""telling the truth"" to a person who can't remember it.

If she cries when you remind her (with context) of who you are, make a big deal over how ""everyone forgets things, don't worry about it, come on Grandma, did you think you'd hurt my feelings ?!  We know you love us!!""

And no matter what, she's not a stranger - She's a wonderful person who gave life and countless memories to you and your brothers - Your gift to her now, that shows your love and appreciation better than anything, is to do whatever it takes to make your visits happy times for her.",false,true,t1_cdbw8g3,calicoan,,0,1384195363,t5_2r8fp,t3_1qd8fk,t3_1qd8fk,1,1428702220,0,0,cdbw8g3,Alzheimers,1,,
"Hey, don't know if this is too late, but I heard about this: http://www.gpsshoe.com/faq.cfm",false,true,t1_cat2cwz,slumber42,,0,1372576669,t5_2r8fp,t3_1d7lws,t3_1d7lws,1,1430634472,0,0,cat2cwz,Alzheimers,1,,
"Asking him how he's feeling is definitely a good thing to do.  I'm sure he could use someone to talk to, who is just there to be supportive and listen.",false,true,t1_ce8ttna,geektress,,0,1387842259,t5_2r8fp,t3_1tgu79,t1_ce87c97,3,1428010276,0,0,ce8ttna,Alzheimers,3,,
"Taking care of an elderly loved one can be very difficult at times, but Home Care Assistance of Kansas City is here to help. Click at our link and learn a few tips on how you can be the best caregiver for a patient who has Alzheimer.",false,true,t1_ce1935c,homecarekansascity,,0,1386983578,t5_2r8fp,t3_1su5fk,t3_1su5fk,1,1428141999,0,0,ce1935c,Alzheimers,1,,
"my dad is further along.  get him tested with an MMSE.  mini mental status exam.   standard list of tasks and questions (whats your age, whats your address, phone number, what day/date/year is it, remember these three words for five minutes, draw a clock from memory, etc.).   questions that have been statistically validated to test for short term memory loss, orientation to time and place, executive function, etc....and to look for damage in the parts of the brain affected by dementia.  that plus a detailed history will get him on his way to an answer.

have you noticed any ""forgetting the basics"" things yet?  ie phone number, age, etc?

you should try and be in the room with him and the neurologist.   watching the test being given will be scary but its the only way to get the process started.   score of 25 or below is impaired.   my pops scored a 24 (he's a former university professor).

as a truck driver - getting lost on a familiar route is an excellent indicator of something wrong - has that happened to your dad yet?",false,true,t1_cear0jc,gothamguy212,,0,1388098196,t5_2r8fp,t3_1tldwq,t1_ce9lqsn,1,1427976402,0,0,cear0jc,Alzheimers,1,,
[deleted],false,true,t1_cccex0y,[deleted],,0,1379725919,t5_2r8fp,t3_1k31k4,t3_1k31k4,1,1429394137,0,0,cccex0y,Alzheimers,1,,
[deleted],false,true,t1_cb422tx,[deleted],,0,1374011688,t5_2r8fp,t3_1dq35g,t1_cb2peg6,1,1430443739,0,0,cb422tx,Alzheimers,1,,
http://recuerdame2013.blogspot.com.es/2013/06/las-caidas-en-el-enfermo-de-alzheimer.html,false,true,t1_cauns5b,leo23rec,,0,1372791813,t5_2r8fp,t3_1hijom,t3_1hijom,1,1430606094,0,0,cauns5b,Alzheimers,1,,
"It worries me too...after talking to several family members yesterday it seems I'm the only one who is thinking this way. Everyone thinks he has another 5 to 10 good years and we shouldn't worry until then.  It's annoying trying to talk sense into any of them. 



",false,true,t1_ceam2o8,butterflyblue,,0,1388084522,t5_2r8fp,t3_1tldwq,t1_ceabsb5,1,1427978720,0,0,ceam2o8,Alzheimers,1,,
"If he's willing to talk about it, ask questions and talk about it.  I am sure he knows how difficult things are going to get, and he knows it is going to be very difficult for his family to watch him decline.  That's why it is so important that he understands you love him and will be there for him no matter what.

It is so difficult to see my mom, and to know that she doesn't even know that she has a daughter by my name.  She knows, though, that I am important to her on some level.  Even though she doesn't know me specifically, her face lights up when she sees me.  Yes, it hurts.  What's more important, though, is that it brings her some joy -- even if only for a little while.",false,true,t1_ce8tsjd,geektress,,0,1387842179,t5_2r8fp,t3_1tgu79,t1_ce87d65,3,1428010291,0,0,ce8tsjd,Alzheimers,3,,
"Awesome poem! My paternal grandfather passed away in March of 2010 after battling Alzheimer's for nearly 11 years. This poem doesn't really remind me of him as I don't remember too much about him since he was diagnosed with the disease when I was 8 or 9. HOWEVER, it does remind me of my dear maternal grandmother who just passed away on Black Friday (Nov. 23) 2012. She loved the shore and I loved going there with her and boy, do I have a lot of memories of her! I can only hope she's right where she should be—watching the waves roll out to sea.",false,true,t1_c9m8d5k,chip91,,0,1366870114,t5_2r8fp,t3_173y5l,t3_173y5l,1,1431435822,0,0,c9m8d5k,Alzheimers,1,,
[deleted],false,true,t1_cal0k80,[deleted],,0,1371526529,t5_2r8fp,t3_1gkaan,t3_1gkaan,1,1430773462,0,0,cal0k80,Alzheimers,1,,
"I watched a documentary called ""You’re Looking At Me Like I Live Here And I Don’t."" on netflix. It's about a woman who has Alzheimer and lives in a rest home.  Its exactly how you describe..haunting.  I'm sorry you are going through this. I wish there was some kind of early warning tests available but the more I read I've learned that it's hard to diagnose. 

 In the documentary the saddest part was when this woman was pulling her clothes out of the closet and picks up this beautiful blue suit and says."" this is what I got married in.""  The man with the camera asks her when she got married and she replyed, ""I got married the day after tomorrow.""  but when he asked if she missed her husband she started to cry and said yes.  But there was something in her eyes....like for a single moment she remembered..then suddenly it was all gone.  Such a sad disease.",false,true,t1_ceabbme,butterflyblue,,0,1388036128,t5_2r8fp,t3_1tldwq,t1_cea8evz,1,1427983877,0,0,ceabbme,Alzheimers,1,,
[deleted],false,true,t1_cdc8sxi,[deleted],,0,1384224351,t5_2r8fp,t3_1qd8fk,t1_cdbw8g3,1,1428696211,0,0,cdc8sxi,Alzheimers,1,,
This is beautiful. My mother is suffering from Early Onset Alzheimer's and I'm her primary caregiver. This sums up a lot of what I feel. Thank you for this.,false,true,t1_capo1u4,AliLynne,,0,1372134499,t5_2r8fp,t3_1dq35g,t3_1dq35g,2,1430693137,0,0,capo1u4,Alzheimers,2,,
"Thanks. We just started caring for my husband's grandma in her home. It's all big open windows and not many lights on- so when it gets dark outside, it gets dark inside. I am buying blinds and lamps ASAP!",false,true,t1_cb5jnq4,Kaleiope27,,0,1374186149,t5_2r8fp,t3_1ikq5u,t3_1ikq5u,1,1430418001,0,0,cb5jnq4,Alzheimers,1,,
"So many typos, I can't possibly buy into this proposal.",false,true,t1_cc0qzaj,kaze0,,0,1378191543,t5_2r8fp,t3_1llrc8,t3_1llrc8,1,1429607267,0,0,cc0qzaj,Alzheimers,1,,
[deleted],false,true,t1_cc0a605,[deleted],,0,1378140070,t5_2r8fp,t3_1ll23l,t3_1ll23l,1,1429615344,0,0,cc0a605,Alzheimers,1,,
"Yeah. GPs aren't really much help in a situation like this. They just keep doing cognitive testing. ""What day is it? Who is the president?"" stuff like that. They did prescribe him Aricept eventually, as well as Saw Palmetto. And we had him eating coconut butter or something like that based on some other crap we read... can't really say whether any of it did any good.",false,true,t1_ceabuuy,angrydroid,,0,1388037952,t5_2r8fp,t3_1tldwq,t1_ce9lp6m,1,1427983627,0,0,ceabuuy,Alzheimers,1,,
"Not a caregiver, I'm a grandson. My grandmother is past that stage. Unfortunately the nurses and her carers told us that there is nothing we can stop anything like this happening or improving her memory. I will give you one piece of advice, music. Music, music and more music. Seeing my grandmother dance, smile and sing again was amazing. Try playing music that your wife would listen to in her youth. Hopefully this brings a few smiles and laughter to your home. ",false,true,t1_c8o1u32,oduibh,,0,1362171734,t5_2r8fp,t3_18dt64,t3_18dt64,3,1431452878,0,0,c8o1u32,Alzheimers,3,,
"he is 63.  He hasn't been diagnosed. He is just displaying the same aggressive and withdrawn behavior that his dad did before he was diagnosed.  ",false,true,t1_ce9lsfd,butterflyblue,,0,1387936102,t5_2r8fp,t3_1tldwq,t1_ce96ssi,1,1427996005,0,0,ce9lsfd,Alzheimers,1,,
I will second the music thing. Not a scientific thing...but nothing made my grandma happier than hearing her favorite songs. They put her in a place where she recognized something. Those smiles are worth a million. I am sorry you are going through this.,false,true,t1_c8xf4lp,Peteyisthebest,,0,1363553974,t5_2r8fp,t3_18dt64,t3_18dt64,2,1431616461,0,0,c8xf4lp,Alzheimers,2,,
[deleted],false,true,t1_ce87c97,[deleted],,0,1387768466,t5_2r8fp,t3_1tgu79,t1_ce84jh8,2,1428021038,0,0,ce87c97,Alzheimers,2,,
[deleted],false,true,t1_ce87d65,[deleted],,0,1387768531,t5_2r8fp,t3_1tgu79,t1_ce7w1gn,1,1428021026,0,0,ce87d65,Alzheimers,1,,
"A dog would be wonderful! My grandfather is in the mid/late stages of the disease and our cats are definitely good for him. We call them his 'therapy cats' because they are always nearby and he loves interacting with them. ",false,true,t1_cdcsyhk,Lisalou64,,0,1384290468,t5_2r8fp,t3_1kujfz,t3_1kujfz,1,1428686665,0,0,cdcsyhk,Alzheimers,1,,
[deleted],false,true,t1_ccpc318,[deleted],,0,1381459882,t5_2r8fp,t3_1n6r1m,t3_1n6r1m,1,1429171955,0,0,ccpc318,Alzheimers,1,,
[deleted],false,true,t1_cceypft,[deleted],,0,1380088028,t5_2r8fp,t3_1n33uv,t3_1n33uv,1,1429350595,0,0,cceypft,Alzheimers,1,,
"I mentioned to his wife to talk to his doctor.  She refuses because of the financial issue.  I don't know who his Doctor is but I could probably find out easy enough.  He has to get a physical every year for his Company so he can continue driving.  I don't think they are looking for anything other than what is required for his DOT medical.  ",false,true,t1_ce9lp6m,butterflyblue,,0,1387935796,t5_2r8fp,t3_1tldwq,t1_ce98n5a,1,1427996046,0,0,ce9lp6m,Alzheimers,1,,
Good luck. Maybe they can point you in the right direction http://www.alz.org/,false,true,t1_cbauqad,Peteyisthebest,,0,1374861391,t5_2r8fp,t3_1io459,t3_1io459,2,1430326315,0,0,cbauqad,Alzheimers,2,,
"Oh man, yes. Sadly this all sounds too familiar. My father, who is in his 80s, went through various stages of anger and denial earlier on. Its normal and seeing as your father was a mental health professional I can't imagine that making it any easier. And now here's you feeling in a position that you have to parent your own parent, which is a strange enough situation for me to be feeling at almost twice your age. I don't have any magical advice though. Wish I did. But if you need to vent or ask questions to a complete stranger on Reddit feel free to drop me a line.",false,true,t1_cdvx7hn,angrydroid,,0,1386438124,t5_2r8fp,t3_1sbgey,t3_1sbgey,1,1428353224,0,0,cdvx7hn,Alzheimers,1,,
"The film director Jake Schreier's debut ""a friend to Frank"" opens the debate about the future possibility of combining technology and world welfare in the daily care of Alzheimer's patients at home. U.S. The film futuristic science fiction award in the Sitges and Sundance launch this hypothetical view to move to the question Is it possible to use technology to care for Alzheimer's patients? ",false,true,t1_cav2xni,leo23rec,,0,1372840973,t5_2r8fp,t3_1hk29n,t3_1hk29n,0,1430598807,0,0,cav2xni,Alzheimers,0,,
"Yours, too - I almost cancelled mine after reading yours, it seemed to be saying so much the same things...",false,true,t1_cdcavbh,calicoan,,0,1384229292,t5_2r8fp,t3_1qd8fk,t1_cdc8sxi,1,1428695247,0,0,cdcavbh,Alzheimers,1,,
"It will be important for him to know you love him and will be there for him. It's about him, and if you keep that in mind no matter how bad it gets, you will do the right thing.",false,true,t1_ce7w1gn,geektress,,0,1387741497,t5_2r8fp,t3_1tgu79,t3_1tgu79,3,1428026988,0,0,ce7w1gn,Alzheimers,3,,
"Ah, I see. Just being aggressive and withdrawn by themselves aren't necessarily conclusive.",false,true,t1_ce9p8ve,angrydroid,,0,1387947799,t5_2r8fp,t3_1tldwq,t1_ce9lsfd,1,1427994391,0,0,ce9p8ve,Alzheimers,1,,
"Thank you! My uncle passed away in Spring of 2007 after a relatively quick but sharp decline (basically by the time his symptoms really started to manifest themselves it was pretty late in the game) so I was able to spend the first 13 or so years of my life with him. A lot of this poem stems from the memories I made at a family get-together the last time I saw him, when he was still himself, pretty much right after his wife figured out what was happening.

I'm glad you liked the poem :) The fact that it resonates with anyone but me is pretty powerful!",false,true,t1_c9m9501,sdh59,,0,1366873997,t5_2r8fp,t3_173y5l,t1_c9m8d5k,2,1431435457,0,0,c9m9501,Alzheimers,2,,
she may have Capgras delusion... this is exactly what it looks like,false,true,t1_ce6mq0x,afriedman174,,0,1387576969,t5_2r8fp,t3_1t9jo5,t3_1t9jo5,1,1428048625,0,0,ce6mq0x,Alzheimers,1,,
"As per the [Reddit User Agreement](http://www.reddit.com/help/useragreement#p_17):

&gt;You may not provide to or post on or through the Website any graphics, text, photographs, images, video, audio or other material that constitutes junk mail, spam, advertising, and/or commercial offers.

Quit posting your blogspam.  Reddit isn't here to offer you a free format for your crap.  If you want to advertise on the site, you must contact the [Ad Team](http://www.reddit.com/ad_inq/).

",false,true,t1_cdyn7pa,Cdresden,,0,1386717029,t5_2r8fp,t3_1sgz5j,t3_1sgz5j,1,1428279760,0,0,cdyn7pa,Alzheimers,1,,
Kickstarter.com,false,true,t1_c9bktc3,idl3mind,,0,1365515709,t5_2r8fp,t3_16b0i3,t3_16b0i3,1,1431620267,0,0,c9bktc3,Alzheimers,1,,
[deleted],false,true,t1_cb2peg6,[deleted],,0,1373846397,t5_2r8fp,t3_1dq35g,t3_1dq35g,1,1430467000,0,0,cb2peg6,Alzheimers,1,,
It sounds like you're doing the right thing by talking to them even if they aren't receptive to it. It has to start somewhere. My wife has been a tremendous asset in coping with all this for me.,false,true,t1_ceamwvm,angrydroid,,0,1388086769,t5_2r8fp,t3_1tldwq,t1_ceam2o8,1,1427978316,0,0,ceamwvm,Alzheimers,1,,
"You're welcome, and again, good luck...",false,true,t1_c9tk7vv,calicoan,,0,1367865475,t5_2r8fp,t3_1dq35g,t1_c9t50x2,2,1431283497,0,0,c9tk7vv,Alzheimers,2,,
[deleted],false,true,t1_cdbsfwc,[deleted],,0,1384186452,t5_2r8fp,t3_1qd8fk,t3_1qd8fk,1,1428703989,0,0,cdbsfwc,Alzheimers,1,,
[deleted],false,true,t1_cazocyn,[deleted],,0,1373463612,t5_2r8fp,t3_1i08do,t3_1i08do,1,1430519203,0,0,cazocyn,Alzheimers,1,,
[deleted],false,true,t1_caqgnvr,[deleted],,0,1372233019,t5_2r8fp,t3_1dq35g,t1_capo1u4,2,1430679368,0,0,caqgnvr,Alzheimers,2,,
"We don't really know to be honest. They told us that it will progress into the Alzheimer's that we all know about and that we associate with the older generation but we have no idea how exactly it will happen or when. They said it could be a year or 10 years. He is very positive about it all and has no exact memory loss at the moment. Currently he has visual and spacial problems and spelling and maths are affected greatly as well as trouble finding the right words. His intelligence is still intact but he has a lot more trouble with computers now which was a large part of his job prior to diagnosis. 
I am sorry for your loss. I hope at least she was happy in herself and comfortable. My grandmother has dementia and is now in a home however I find it a help to see her happy and laughing more than ever - music is a fuel for her happiness I have found. ",false,true,t1_c9gjw18,Monkey_socks,,0,1366147945,t5_2r8fp,t3_1cghg4,t1_c9gejv8,2,1431534234,0,0,c9gjw18,Alzheimers,2,,
"I totally agree with this. He can draw disability already and I feel that if he filed bankruptcy today that he wouldn't lose his house.  He's to close to paying it off.  I seem to be the only one in the family thinking about other people...those strangers he could possibly kill.  ",false,true,t1_ce9lqsn,butterflyblue,,0,1387935944,t5_2r8fp,t3_1tldwq,t1_ce97w80,1,1427996026,0,0,ce9lqsn,Alzheimers,1,,
"best site if you or someone you know have Alzheimer ",false,true,t1_cbu4usq,nellersxoxo,,0,1377306559,t5_2r8fp,t3_1kz8ui,t3_1kz8ui,1,1429720436,0,0,cbu4usq,Alzheimers,1,,
"Sounds similar to me too. My grandmother used to take the keys and go for random walks to the point where she'd get lost and the police had to take her home, where she'd get very annoyed and aggressive. Eventually we can to get cameras on her inside porch to check if she leaves, have links to the council about alarms going off if the door was opened and what-not.

I was only ~13-17 at that time and don't really know how to handle it as it was my dad who handled it.

However, in response to number two, chances are he won't suddenly die unless he carries on, in relation to question one, junk eating. I'm no doctor, but his health could deteriorate due to abuse of his cholesterol. Should he stay healthy, he could turn out to live to a ripe old age, however the Alzheimer's could deteriorate.

My nan was given drugs/medicine that drastically 'slowed down' the rate at which Alzheimer's progressed. Maybe you could look into that if he's not already on medicine.",false,true,t1_ce6pmn6,mr_nogga,,0,1387584624,t5_2r8fp,t3_1sbgey,t3_1sbgey,1,1428047235,0,0,ce6pmn6,Alzheimers,1,,
[deleted],false,true,t1_cbueev1,[deleted],,0,1377352637,t5_2r8fp,t3_1kujfz,t3_1kujfz,1,1429715846,0,0,cbueev1,Alzheimers,1,,
"I guess I should mention that this has information about my mom's fundraiser for an Alzheimers foundation, Hope 4 Alzheimers. Sorry about the vagueness.",false,true,t1_c8o9v0z,Whitbutter,,0,1362199961,t5_2r8fp,t3_19iaui,t3_19iaui,1,1431456763,0,0,c8o9v0z,Alzheimers,1,,
"He needs to see a Dr. A diagnosis could trigger disability pay. A car accident with injuries or fatalities could bankrupt everyone financially, and create tremendous pain and heartache.",false,true,t1_ce97w80,culocho,,0,1387894898,t5_2r8fp,t3_1tldwq,t3_1tldwq,1,1428003569,0,0,ce97w80,Alzheimers,1,,
"I wish I had answers for you since my mother is probably going to go through the same thing with my grandpa, except that I am around to help out, both being physically there and financially. 

Even with that being said I still worry about her overall well being too. How do I help her while she is slowly watching her father deteriorate and is completely helpless in doing anything about it?

My heart goes out to you, I hope all the best for you.",false,true,t1_ccb8b8v,wherewhoresgo,,0,1379563481,t5_2r8fp,t3_1mnbgf,t3_1mnbgf,1,1429414312,0,0,ccb8b8v,Alzheimers,1,,
"Hi. I'm sorry to hear about your father, but I think you're right on the money with this one. My mother hasn't been officially diagnosed, but it's in the cards. It's something that has been in our family and she's definitely showing signs and has been for a while. 

One of those signs is the inability to sleep. She is up all hours of the night and sleeps all day. So her interactions during the day with normal people, if she's awake, tend to be confused and drawn out. No theme whatsoever. Nights are not better as she tends to fall and hurt herself while doing god knows what. 

We've recently had a few meds changed around per doctors orders and she's been catching up on sleep lately. It hasn't been perfect, there are still lots of issues we need to address once we get her into a neurologist. But just by virtue of being awake during the day she has been able to go outside, breathe fresh air, interact more and hopefully progress. This is all anecdotal of course, but I encourage you to look up the scientific research and feel free to post it here. I think this subreddit needs to become more active, and that would be a good start. ",false,true,t1_cb5jlje,lolwut_noway,,0,1374185987,t5_2r8fp,t3_1ikq5u,t3_1ikq5u,1,1430418019,0,0,cb5jlje,Alzheimers,1,,
"Sorry for your dad's diagnosis.  Is it thought to have a rapid progression?

My mom died at 87 after about 8 yrs progression of Alzheimer's - The hardest part was when she was still competent enough for the problem's to be not easily apparent if you didn't know her well enough.  She'd insist she was fine, make us ""kids"" (all in our mid-late 40's at the time) out to be too young to get it that there's a normal process of decline in getting older.   But I think that was mostly her personality - She never was one to admit ""weakness""!",false,true,t1_c9gejv8,calicoan,,0,1366134345,t5_2r8fp,t3_1cghg4,t3_1cghg4,1,1431536750,0,0,c9gejv8,Alzheimers,1,,
Alzheimer’s Disease: A Daughter’s Tale,false,true,t1_c7qbf42,jcampbell77,,0,1357226511,t5_2r8fp,t3_15w2sc,t3_15w2sc,1,1430843478,0,0,c7qbf42,Alzheimers,1,,
"Also, an early diagnosis could just mean meds and antidepressants which can make his moods more stable.",false,true,t1_ce97wmh,culocho,,0,1387894950,t5_2r8fp,t3_1tldwq,t1_ce97w80,1,1428003564,0,0,ce97wmh,Alzheimers,1,,
"No insurance though, and trying to get a referral to one via the community health system is almost impossible. I'm trying to get to one. I have a referral to an Endocrinologist, just need to fill out a phone book worth of paperwork to qualify for reduced rates there. Not easy doing that with my brain function suffering. I haven't functioned even well enough to get my taxes from last year figured out. I have moments of clarity, but they never align with my SO so we can get the paperwork figured out. My SO is doing her best, but right now she is dealing with her own health issues that I won't go in to.

Bonus - because I was self employed, it's almost impossible to qualify for anything like Medicare or other public assistance. Waiting for my parents to get back in town and am hoping my dad will be able to help me get through some of this.",false,true,t1_cb6wxhi,something-anonymous,,0,1374367170,t5_2r8fp,t3_1io459,t1_cb6tynj,2,1430394394,0,0,cb6wxhi,Alzheimers,2,,
Thanks for link,false,true,t1_c84hir1,[deleted],,0,1359306872,t5_2r8fp,t3_11l3dq,t3_11l3dq,1,1431097135,0,0,c84hir1,Alzheimers,1,,
[deleted],false,true,t1_c9me17m,[deleted],,0,1366901471,t5_2r8fp,t3_1d22vd,t3_1d22vd,2,1431433080,0,0,c9me17m,Alzheimers,2,,
"Ask him how's he's feeling and go from there. Nothing has changed this week that wasn't there last week, he's still the same.",false,true,t1_ce84jh8,culocho,,0,1387761337,t5_2r8fp,t3_1tgu79,t3_1tgu79,3,1428022464,0,0,ce84jh8,Alzheimers,3,,
"the nurse called it ""sundowning"" if you'd like to look more into it. i hope it can help somehow.",false,true,t1_cb5x9zz,honkshus,,0,1374239590,t5_2r8fp,t3_1ikq5u,t1_cb5jnq4,1,1430411427,0,0,cb5x9zz,Alzheimers,1,,
[deleted],false,true,t1_cdccn8i,[deleted],,0,1384234015,t5_2r8fp,t3_1qd8fk,t1_cdcavbh,1,1428694419,0,0,cdccn8i,Alzheimers,1,,
"You need to go see a neurologist immediately. ",false,true,t1_cb6tynj,Waiting_for_Merlot,,0,1374356428,t5_2r8fp,t3_1io459,t3_1io459,3,1430395792,0,0,cb6tynj,Alzheimers,3,,
