body,score_hidden,archived,name,author,author_flair_text,downs,created_utc,subreddit_id,link_id,parent_id,score,retrieved_on,controversiality,gilded,id,subreddit,ups,distinguished,author_flair_css_class
"I guess I'm happy for you that this particular ordeal is over, but I feel incredibly sad for you that the situation came to be. With my mom, who's in her mid-80s, it's vascular dementia, and personality-wise, she's still the same, and she's not incapacitated, but it's still hard. I can't imagine what it must have been like for you and yours. My thoughts are with you, and I hope you never have to experience similar ever again. I hope your dad is also doing as well as can be hoped for.",,,,argyle47,,,1466241424,t5_2rfqf,t3_4ojlbz,t3_4ojlbz,2,1469124558,0,0,d4e4ndf,dementia,2,,
"If she's this advanced, I'm not convinced that she will be able tell whether she's in Uruguay or Brazil.  In any case, you really need to secure your own position in order to give her the best care possible.",,,,Lordica,,,1467318911,t5_2rfqf,t3_4qn31b,t3_4qn31b,3,1469406711,0,0,d4ugny6,dementia,3,,
"Basically when Mom was no longer safe without someone watching over her and Dad couldn't be expected to do 24 hour care, we put her in a facility. She was confused at first and wanted to go home, but then the Lewy Body Dementia got worse and she didn't remember to miss anything.",,,,DocCyane,,,1465477590,t5_2rfqf,t3_4n91o4,t3_4n91o4,4,1468918141,0,0,d427wzx,dementia,4,,
[removed],,,,[deleted],,,1466094736,t5_2rfqf,t3_4oe81y,t3_4oe81y,1,1469083875,0,0,d4brpfj,dementia,1,,
"I would do my best to get her off the streets if you see her as a danger to herself and other drivers. 

There is such thing as age related memory impairments. However, repetition of the same story on numerous occasions is abnormal. 

The frequency of falls place her at risk for a traumatic brain injury (TBI). TBI in geriatric patients can display similar impaired memory systems like dementia, specifically Alzheimer's. You also mentioned she has diabetes. Any patient with a history of uncontrolled diabetes is at risk for a cognitive impairment as well. 

Personally, I would try to get an MRI or CT to see if there are changes in her brain. Additionally, I'd also seek a speech-language pathologist (SLP) to evaluate her cognitive functioning. There are many assessment tools SLPs utilize to compare her cognitive functioning with that of others of same age and/or gender. SLPs can also treat the cognitive communication deficits (e.g, memory, executive functioning, language).  ",,,,leahxdarling,,,1466941913,t5_2rfqf,t3_4otqn0,t3_4otqn0,1,1469304184,0,0,d4oiw6p,dementia,1,,
"From what I've heard, confirming certain types of dementia is difficult without an autopsy. There are so many types, so MDs have to use what tools they have to deduce the type based on patient characteristics, family reports, observations, cognitive testing, etc. Some cognitive characteristics are similar (memory problems) but there are key distinguishing features. Here is a chart that describes types of dementias: http://www.asha.org/Practice-Portal/Clinical-Topics/Dementia/Common-Dementias/

",,,,leahxdarling,,,1466942696,t5_2rfqf,t3_4oil7n,t3_4oil7n,2,1469304291,0,0,d4oj4dm,dementia,2,,
"Hi! I'm sorry to hear that your mum - and you and your family - are going through this. It's one of the most heartbreaking illnesses I have ever experienced - along with everyone else that goes through it. 

Just to introduce myself - I am 22 years old and I have a Granddad who has Dementia, and has done for around 6 years. . . although he was properly diagnosed only a couple of years ago. I was one of the first people to spot that my Granddad wasn't well back when I was 16/17 through little things that he did (quite similar to your mum, actually) like getting lost driving through a town that he knows like the back of his hand, driving through red lights and forgetting who Saint George was, which, believe it or not, was a massive flashing warning sign in my head, as everyone in my town referred to him as that (my Granddad is a bit of a local celebrity). From the point that I could see he wasn't very well, he declined rather rapidly and nothing could be done to stop it. During the time of his decline, around two years after we spotted the early signs, I was at university in London whilst all of my family were the ones experiencing the effects of Alzheimer's back home. In my mind it made me sad knowing that I wasn't there whilst he was ""well"" and, to some extent it still gets to me but, what I will say (and this may sound selfish, but please don't see it this way) if I was there, back home, I would have gotten very annoyed at him for the little things he couldn't help doing - like my family often did whilst they were trying to deal with it. I'd have regretted having a short temper with him, I'd have regretted getting annoyed when he couldn't remember my name or that I was his granddaughter (which he would often ask me when I went home during term time) so, what I would say is this (and excuse the bluntness please, I just want to be as real with you as I can): 

Don't go home. If you put your life on pause to go home to help a situation that can't be stopped when you are struggling already, you will come to despise everything surrounding you. You won't remember your mum in the way you'd like to. You would witness your mum's decline everyday and, slowly but surely, your childhood memories would be replaced by you witnessing your mother digress to a childlike state.

Whilst she will be mentally ""gone"" at some point once the illness takes its toll, what I will say is this; just because she will not be able to do the things she once could, she is still there. In human, living form at least. A common situation I have found from Alzheimer's is that people see the person as dead once the Alzheimer's has taken over, and that's not the case. When my Granddad got put into a home last year, my uncle spiralled into a downward spiral of depression and didn't work for nearly a year. He witnessed my Granddad become progressively worse day in, day out as they lived together and, eventually, just didn't acknowledge that he was actually still alive when he moved to a home. From this I have learnt that any time you spend with your loved one suffering from Alzheimer's is just as credible as spending time with them when they're lucid, so you don't need to move home. What I would suggest you do is come to terms with Alzheimer's first, read up about it and become acquainted with it so that when you see your mum, you will be able to embrace it rather than get upset and struggle some more. 

Whenever I see my Granddad now, we are still making memories. Sure, it's more one-sided, but take it with a pinch of salt. I love seeing my Granddad and he comes out with some of the most hilarious things I've ever heard. He's still there as the sarcastic, cheerful ladies man I've always known him to be, but he just doesn't remember things. I do think that my response to his condition is partly credited to the fact that I wasn't at home all the time during university, where I would've become annoyed. 

If both your dad and brother are struggling to cope at home, then I would suggest that they look into a home that specialises with Alzheimer's patients or getting a visiting nurse to pop in to help around the house to ease the pressure. 

Please don't feel selfish or helpless. There are things you can do, which will make a huge difference. Just be there for her when you can, don't be short tempered around her and embrace the illness as much as possible. There is an amazing network around for those who are affected by the illness such as the Alzheimer's Association, The Alzheimer's Society and many, many more, who are all there to offer guidance and support to you when you need it. They will be able to listen to you and reassure you that everything will be ok but, in the mean time, what I would suggest - and it worked for me, but obviously may not work for you - is that you read up about Alzheimer's, what happens to those that have it and just generally become acquainted with it - because if you understand it and come to terms with it, it will most likely affect how you respond to your mum. 

Try and get involved in these societies in whichever way you can - me and my mum raised £2,500 for the Alzheimer's Society this Christmas because I want to raise awareness for it and hopefully find a cure. Maybe this will make you feel a bit less helpless. 

If you ever need to chat, please just let me know. I know how difficult it is and think that having a support network to listen and talk to is the best way to cope with these things! And sorry again for being straight to the point. ",,,,rosiep93,,,1465763262,t5_2rfqf,t3_4k6wsq,t3_4k6wsq,1,1468991261,0,0,d46emrv,dementia,1,,
"Give him as much time as possible and be as encouraging as you can when he becomes frustrated. Your instinct will be to help and to break the awkwardness that is present, but resist this at all costs.

You can also get a set of cards that say ""I have dementia/alzheimer's, please be patient with me/let me finish speaking"" from various places, which can help if you are dealing with people in public and he is comfortable having people know what is going on with him.",,,,hithazel,,,1465355257,t5_2rfqf,t3_4mzcuk,t3_4mzcuk,3,1468886397,0,0,d40dw8f,dementia,3,,
I hope you can hold onto this peace as you and your family move on. Take care.,,,,hithazel,,,1466193841,t5_2rfqf,t3_4ojlbz,t3_4ojlbz,3,1469113409,0,0,d4dhb4q,dementia,3,,
"If it's possible to make her more active and awake during the day, she may be better able to sleep through the night. Consider medication as well.

Generally just delaying with telling her they will be here after her nap or that they called and said they aren't ready yet and that she can keep sleeping and that you'll come get her as soon as they arrive would be my tactics. Assure her that you'll be watching out and that she is safe and fine.",,,,hithazel,,,1466788481,t5_2rfqf,t3_4pfjsv,t3_4pfjsv,1,1469268586,0,0,d4mgu8f,dementia,1,,
YES! I think it's part of the paranoia that is common with Alz.,,,,jkbsncme,,,1467158960,t5_2rfqf,t3_4nzlf1,t3_4nzlf1,1,1469362834,0,0,d4rx7se,dementia,1,,
"Hi - If you are in the U.S., the Department of Health and Human Services has a site to help folks in your situation called EldercareLocator.gov. This is a free resource.  

You will find some quality information about things like...where to find benefits programs that can help pay for prescription drugs, health care, rent, utilities, and other needs. There are other tools to help with long term care and advanced care planning and more.  Again, these resources are free to use as a service from the HHS.gov. 
http://www.eldercare.gov/Eldercare.NET/Public/Index.aspx

I hope this ends up being helpful. 

jb",,,,MedicalLibrarians,,,1465306946,t5_2rfqf,t3_4mes2r,t3_4mes2r,1,1468869739,0,0,d3zf0hc,dementia,1,,
"That's a good question and one I should probably look into. ",,,,hardful,,,1466202214,t5_2rfqf,t3_4ohd2t,t1_d4dhoql,1,1469116167,0,0,d4dn51v,dementia,1,,
"Thank you so much for your kind words and links! ",,,,BerbleBap,,,1464891502,t5_2rfqf,t3_4m2d0k,t1_d3spve0,1,1468765925,0,0,d3tef0w,dementia,1,,
"You can take your grandmother to see a speech-language pathologist to evaluate her cognitive skills at an outpatient clinic. If the evaluation reveals a significant memory and overall cognitive decline, you can use the data from the therapist to support your claim. As a therapist, a large percentage of patients (especially in skilled nursing facilities) are diagnosed with dementia. We don't fix dementia, but we can assist with improving cognitive skills or her independence in her activities of daily living. Patients with dementia have the capacity to learn new things (depending on when intervention is provided and the severity). Unfortunately, these patients aren't referred for speech services until later stages. 

I hope this helps. I'm sorry to hear you are having a hard time with your healthcare provider. ",,,,leahxdarling,,,1466940681,t5_2rfqf,t3_4pb3k4,t3_4pb3k4,2,1469304023,0,0,d4oijzd,dementia,2,,
You sound like an absolute angel. I sincerely hope you are able to realize your hope to become a CNA! :),,,,not-rocket-science,,,1465771608,t5_2rfqf,t3_4no4x1,t3_4no4x1,2,1468994132,0,0,d46kmac,dementia,2,,
I understand that feeling.,,,,caseyoc,,,1466183635,t5_2rfqf,t3_4ojlbz,t1_d4d4set,6,1469109548,0,0,d4d99jk,dementia,6,,
Help him have a very bad fall and make it look like an accident.,,,,I_WantMyMother2Die,,,1467301812,t5_2rfqf,t3_4qltih,t3_4qltih,0,1469400191,0,0,d4u34j9,dementia,0,,
"Thank you for sharing your experience, it is helpful to have someone else from Canada, and the suggestion of taking her into the ER when she is in a heightened confused state is one that I fear we may have to take to get something on her medical records to help get the ball rolling on some sort of professional support. How did you go about making an appointment with her doctor with out her? Our GP has given us a lot of push back on this when we bring up her symptoms and says he can not discuss another patient with us.  

Also would you be able to send me the link to where you got your Grandmother's ID bracelet from? I had not thought of this but am now thinking that this is a very good idea. 

Best of luck with your Grandmother, this isn't easy, but it sounds like you and your Mother are doing a very good job of handling things for her.",,,,SoSullied,,,1466637621,t5_2rfqf,t3_4pb3k4,t1_d4jnfyo,1,1469227359,0,0,d4k31pt,dementia,1,,
"I work in long term care. When I interact with residents with dementia I always take behaviors with extra care and consideration. I try to learn what they are likely to do and plan around it. Like I always keep residents that ""goose"" me positioned so I  don't have my back turned to them. If I know they are non compliant with diet I don't leave them unattended with food on the table.

Think of it in the same mindset you would handle a child. He simply didn't know any better. If you are acting as a caregiver it's important that you always remember he doesn't know better and it's why he needs the help.

Going forward anticipate the behavior and plan around it.  

Being a caregiver isn't easy.  I can't even begin to imagine what it's like to care for your own family member. If you are feeling overwhelmed or even need a short break to handle the recent situation con the social worker and see if he's eligible for respite care.

You can't be the best care giver if you're not the best you. It's important to know your limits.  

I hope my babble has been helpful. I'm wishing you all the best. ",,,,rocketduck413,,,1464924945,t5_2rfqf,t3_4mayt5,t3_4mayt5,3,1468776905,0,0,d3u19rs,dementia,3,,
"I have been taking care of my grandmother for 3 years and there are 3 other caregivers that come to give me relief. There are a couple of hurdles that exist when having multiple caregivers so I'll try my best to explain tyw issues that I have dealt with.

-Confusion is a part of dementia care. Doing things in blocks does help, but it also helps to have a weekend specific person. Somehow we are trained to look for something different on the weekend and whenever we had a person who was just there on weekends (sat and sun only) that seemed to help. Try to shoot for 2-3 days IN A ROW per person, if you REALLY love someone, but they can only work one day per week, make sure it is a Friday or a Monday. 

-The biggest issue with multiple caregivers is simply getting all the caregivers on the same page and KEEPING them on the same page. 

So many times I have torn my hair out because there was a med switch and one of the caregivers didn't check the text I sent them or whatnot. We have since adopted charting. We keep a spiral bound notebook and whoever is on shift that day is obligated to write pertinent information in it. Nurse/hospital visits, calls from medical providers and details,  anything new with the patient? Acting different? Experiencing ANYTHING out of the ordinary? Write it THE EFF DOWN! This will help you identify trends even though you aren't there. It will help you identify issues before they possibly turn into a needed hospital visit. It is a caregivers job to read through the log to see what has been going on for the past few days.

-Make each day the same. We do 24 hour care here for gram. Shifts begin at the same time, and end at the same time for everyone person, ever day. You are going to have people try to push back on this. For the sake of the patient, don't let them. I once had a caregiver try to tell me she couldn't stay past dark so her schedule needed to change to mirror when the sun set. Caregiver changes happen at 8am or 8pm. I politely told her to EFF off. It is set specifically at those times for a very good reason and it is because of pill schedules and such. 

-The fridge! This is a newer issue since I have cut back my hours. The fridge becomes a sea of partially consumed items...non of which you or the patient will be able to see when it was opened and whether it is still safe to consume. Make it a household rule to label anything that has been opened or made. A small plate of sausages lurking in the back of the fridge? Who made it? Doesn't matter if it has a date on it. We keep masking tape and a permanent marker on the kitchen counter. You would be shocked how much of an issue food poisoning can be with a bunch of people coming and going.

-Hire a cleaner to come at least once a month if you don't already have one. I have said it once and I will say it a million times more: Caregivers are there to care for a patient. They are not maids. This is a difficult distinction to establish in the beginning for a patient new to caregiving (especially non family) but it is crucial to establish. You don't talk to your maid about health issues, and a patient needs to see a caregiver as a caregiver, and not a maid specifically for that reason.  Light cleaning like keeping a kitchen clean and wiping up spots is expected. Never expect a caregiver to get on their knees and scrub out a toilet. A caregiver needs to be able to focus on the monitoring and care of the patient and not the patients house. There are other reasons, but these are the main ones. I have it outlined for my caregivers what is expected to be cleaned up and I draw the line at 'if you wouldn't do it at least daily, then a cleaner needs to do it'. Every caregiver needs to contribute in the same ways. 

Making everything as fair is possible makes things easier. Pay everyone the same. No pay  premiums for certain expertise. That will only cause problems for you down the road with the other caregivers. 

I'm sure there are other things. These are the things that were big things that immediately sprang to mind. Feel free to ask questions. ",,,,DoctorFlimFlam,,,1464907335,t5_2rfqf,t3_4m70wy,t3_4m70wy,2,1468771580,0,0,d3tq4bl,dementia,2,,
It would be cool if walking charged the device. Maybe that's  too far in the future.,,,,jkbsncme,,,1467177732,t5_2rfqf,t3_4l0264,t1_d3k96qa,1,1469367887,0,0,d4s7s7f,dementia,1,,
[removed],,,,[deleted],,,1466375785,t5_2rfqf,t3_4otqn0,t3_4otqn0,1,1469154487,0,0,d4fv7jy,dementia,1,,
"Sorry, I wrote that too quickly - I was trying to get to work! 
My dad's symptoms line up with the progranulin gene pretty much spot on. My family thinks it's sporadic, but I'm not convinced. My grandmom died of Alzheimer's complications supposedly, but I'm not sure she was ever actually correctly diagnosed, AZ was just assumed. I've looked into it a little bit and it seems like she could have lvPPA. After reading this article, seeing the GRN symptoms and a possible link to PPA I feel like this kind of confirms my suspicions a little. Definitely keep me informed about any genetic testing info you come across, it'll help me with my case to do it with my family!",,,,erhatfield,,,1464757465,t5_2rfqf,t3_4kpbz4,t1_d3qxwy5,1,1468731173,0,0,d3rdrdg,dementia,1,,
"Researchers have successfully begun reversing memory loss in a small number of people with early-stage Alzheimer’s disease using a comprehensive treatment program, which involves a combination of lifestyle changes, brain stimulation, and medication.",,,,Taking22Tango,,,1466608637,t5_2rfqf,t3_4pb60q,t3_4pb60q,1,1469216491,0,0,d4jgavk,dementia,1,,
"Thank you for this!

I truly wish that she had someone like you when she was in a facility...

My mom is living with me now and I try to do this with her. 

It's definitely a struggle sometimes...

I try my best to never let her see my frustration, I know I'm doing a good job with keeping her happy, but sometimes I have to remind myself to be sweeter.",,,,NightPirate,,,1465721432,t5_2rfqf,t3_4no4x1,t3_4no4x1,2,1468980148,0,0,d45tacs,dementia,2,,
"Alongside impulse control issues, individuals with dementia often rely on random contextual cues to work out what's going on because they can't remember moment-to-moment to maintain a coherent internal narrative. It's possible an ambiguous social signal was misinterpreted while he was missing the context of *who you are* among other things like his age/date/place, making it exceptionally unfortunate, inappropriate and uncomfortable for you.

My first strategy would be to alter my own behaviour, keep a bit more physical distance and definitely change the goodbye ritual to a gentle pat on the arm or shoulder instead of a hug or kiss. I might even consider wearing specific clothing, basically anything I can do to provide him with contextual cues that guide him toward the appropriate behaviour.

I wouldn't get too concerned by a single instance but certainly take steps to avoid it occurring again. It's a much bigger of a problem if the behaviour persists and becomes habitual.",,,,dysmetric,,,1464938676,t5_2rfqf,t3_4mayt5,t3_4mayt5,2,1468779791,0,0,d3u7chz,dementia,2,,
"My father has frontotemporal dementia, and as a result he has lost 99% of his speaking and communication skills -- he has a small set of actual words he still uses to speak but it is mostly an indecipherable and unrelated words.  However, in the past 6 years since his diagnosis it was not always this way and he would constantly forget words and be frustrated. I would either write them down on paper for him or just help complete his sentences. 

Nowadays, I typically just agree with what he says to me, regardless of how nonsensical it is, so that he doesnt get frustrated.",,,,jaboloff,,,1465327765,t5_2rfqf,t3_4mzcuk,t3_4mzcuk,3,1468877209,0,0,d3zukg1,dementia,3,,
"This is probably the best answer! When my grandma was in a rehabilitation center, there was a woman who would scream for help over and over for hours as well. Turns out they were neglecting her and leaving her in bed all day. We later found out they were doing the same to my grandma. As /u/thatredheadedfella said, better safe than sorry",,,,youngmermaid,,,1467087515,t5_2rfqf,t3_4q6mf0,t1_d4qqxbc,3,1469344066,0,0,d4qtvtm,dementia,3,,
"I couldn't. My mother is in the late stage of what we think (family history) is Alzheimer.  I converted the family homes dining room into what looks like a hospital room. Hospital bed, foyer lift,  slings, hard floor, new lighting etc.

Then I hired full time around the clock nursing care. In Chicago that runs me about $1,700 a week. Dementia out smarted me.",,,,namtog1,,,1465773546,t5_2rfqf,t3_4mygu6,t3_4mygu6,3,1468994704,0,0,d46ltzy,dementia,3,,
"We hit a point where my father couldn't be adequately cared for in his own home; he wasn't safe, nor was he happy.  I visited *every* memory care unit within a reasonable distance.  We were very lucky and my fathers finances allowed for our first choice.  Once he was settled, he was much happier and far better cared for.  ",,,,Lordica,,,1465447019,t5_2rfqf,t3_4n91o4,t3_4n91o4,3,1468913023,0,0,d41x6rs,dementia,3,,
[deleted],,,,[deleted],,,1466359553,t5_2rfqf,t3_4ohd2t,t3_4ohd2t,1,1469149702,0,0,d4fl2zc,dementia,1,,
"Understood, and agreed. Good luck!",,,,seb21051,,,1467325633,t5_2rfqf,t3_4qgw60,t1_d4tzhjw,1,1469409045,0,0,d4ulm8r,dementia,1,,
"You are the kind of amazing person that makes my mom's life in a memory care unit worthwhile. Thank you. Finding the patience and humanity to make a difference in their and their families lives. ",,,,msgreyson,,,1465695507,t5_2rfqf,t3_4no4x1,t3_4no4x1,3,1468975140,0,0,d45iysv,dementia,3,,
