body,score_hidden,archived,name,author,author_flair_text,downs,created_utc,subreddit_id,link_id,parent_id,score,retrieved_on,controversiality,gilded,id,subreddit,ups,distinguished,author_flair_css_class
"If this were me I would call her doctor. Explain what's happening and request hospice. It's usually covered by most insurances and if not they will work with you as I understand it. But echoing everyone else here it seems like these are the end stages for her. It's probably time to prepare yourself and anyone else who may love her to spend some time with her before she passes. I'm sorry you're going through this and hopefully you have someone near to lean on for support. ",,,,mgcarter3,,,1470490366,t5_2rfqf,t3_4wd0ff,t3_4wd0ff,2,1473253474,0,0,d66n10q,dementia,2,,
"Of course you can. It's called hospice care. It is not shady at all. It's legitimate and respectful end of life care. Look it up online, and get it set up through your insurance. ",,,,applesangria,,,1471319114,t5_2rfqf,t3_4xxiz8,t3_4xxiz8,8,1473427629,0,0,d6j9kvw,dementia,8,,
"So, i think you're right for the frontal temporal dementia. I'll ask in the morning.

I don't know the full details, i'll ask about the ""custody"" thing too.

And no, we were told specifically if we were to take care of him, she would be getting paid a set amount, we had discussed that for months before going into this. So that's one thing I know for sure, but i'll bring all of this up to her tomorrow and get back to you",,,,PsychoticDreams47,,,1470377670,t5_2rfqf,t3_4w7d3r,t1_d651fa3,1,1473232618,0,0,d651ha6,dementia,1,,
"Also to clarify he is 59 years old. ",,,,dementiaman,,,1470321142,t5_2rfqf,t3_4w4re9,t3_4w4re9,1,1473217718,0,0,d63xz5h,dementia,1,,
"Thank you. Yes, that would be our guideline as well. His current suffering is what is driving our concern. We wouldn't want to do anything that would cause any additional suffering. It just seems cruel to us to artificially prolong his life when he is so miserable. ",,,,dontmakemelivethatwa,,,1471320031,t5_2rfqf,t3_4xxiz8,t1_d6j9ygt,2,1473427814,0,0,d6ja3qz,dementia,2,,
"You might consider filing for disability (before the GOP takes it away). Depending on where you reside there may also be work programs for people with cognitive/memory issues; I know they have such programs in my County. 

You could also try to get a prescription medicine called Provigil. I was able to get it because I have sleep apnea and also have early onset dementia, which impacts my memory. The Provigil helps with that. 

I would suggest you go and have a look at the /r/nootropics and /r/stackadvice subreddits, as well as my own /r/oldernoots for more information about Over The Counter Smart Drugs. They have helped me a lot.

I lost my last job as a project manager because of cognitive/memory issues as well. I was lucky that I was old enough to get into Social Security at the time, so I applied for that and Disability and am now fully retired.

Edit:- You should try a tablespoon of Coconut Oil in the mornings; the taste is entirely neutral, I put mine in my coffee. There are reports that it has had some success with Alzheimers cases:

https://www.youtube.com/watch?v=_9INyTTXfR0",,,,seb21051,,,1471445419,t5_2rfqf,t3_4y33n1,t3_4y33n1,1,1473453296,0,0,d6l6g81,dementia,1,,
"Its so hard. My mother died yesterday, a couple of months after presenting with rapid onset dementia ( actually brain tumours). We talked as a family with her doctor, and  threw out all her medications so she didn't accidentally overdose. She quickly lost the ability to feed herself, communicate, or move on her own, so we concentrated on treating her with dignity,and giving her the best supportive care. She was assisted with food and fluids she enjoyed , washed and dressed and cared for, and  needed pain relief only in the last few days of her life . In the end, she just quietly stopped breathing.",,,,squashedpossum,,,1471335075,t5_2rfqf,t3_4xxiz8,t3_4xxiz8,6,1473430077,0,0,d6jgcd6,dementia,6,,
"Yes, my mom's pretty much ""WTF?!"" my dad seems more resigned, like he knew it was eventually going to happen. ",,,,AvengeThe90s,,,1472484916,t5_2rfqf,t3_502vif,t1_d70u2wu,1,1473663289,0,0,d71as4i,dementia,1,,
"In my experience you don't get paid for offering to care for someone. Unless she is a licensed nurse I don't see that happening. I'm caring for my father full time and I don't get anything. If he has social security that money should still be coming to him but none of it can legally go to your mother. HE has a right to file for copies of his medical records but if he won't sign them you're out of luck. Usually in this scenario the person being cared for has been labeled disabled or partially disabled by a court of law. Has that happened? He probably needs to be in a VA run nursing home, I would make contact with the VA he was already at and see if there's someone there who can help you. Remember, the squeaky wheel gets the oil and you will have to HOUND them to get anything done. ",,,,mgcarter3,,,1470420724,t5_2rfqf,t3_4w7d3r,t3_4w7d3r,1,1473240859,0,0,d65o9a6,dementia,1,,
[deleted],,,,[deleted],,,1470516602,t5_2rfqf,t3_4wd0ff,t3_4wd0ff,1,1473259332,0,0,d671q9s,dementia,1,,
"&gt;She thought I was a double, or my own ""evil twin

My grandma thinks random people in cars we pass are her sons using her GM pension to get new cars so she won't recognize them.  

&gt;She also did the thing about seeing little kids or babies that needed her help

Once, grandma woke up in the middle of the night and stood in the hallway yelling ""Kids! Where are you?!"" When mom went to help her back to bed, she kept asking my mother ""where are the kids? I heard the kids."" Like I said, only the once, but it was a WTF moment.
",,,,AvengeThe90s,,,1472096231,t5_2rfqf,t3_4z37nk,t1_d6sprgh,1,1473588694,0,0,d6vmzcu,dementia,1,,
"I cannot see why you don't want her in a lock-down memory care unit. ",,,,LadyInTheWindow,,,1471836502,t5_2rfqf,t3_4rfufq,t3_4rfufq,1,1473532975,0,0,d6rfgwu,dementia,1,,
"I have not heard of this. Elaborate! Can we send our demented loved ones to Thailand?! Honestly if someone is going to Thailand id like it to be me! ",,,,mgcarter3,,,1470414268,t5_2rfqf,t3_4w8pwy,t3_4w8pwy,1,1473239045,0,0,d65j3fz,dementia,1,,
"I'm not sure, I wasn't there when mom spoke to the doctor before they discharged grandma. But I was reading up on TIAs today, and apparently sometimes they happen as ""before shocks"" (to use an earthquake term) to a full-on stroke; when it is, one article (I read wikipedia, Web MD and MayoClinic ones) stated that the full-on one usually occurs anywhere from two to ten days after the mini stroke. So I'm going to let my parents know about what I read and keep an eye on her. My dad thinks that the busy day we had may have brought it on; grandma went to an adult day care program while my parents and I went to a caregivers' class, then we went to meet up with my cousin and his family (from out of town) and had lunch, and grandma got real emotional because none of us had seen him since he was eleven (he's mid 30s now). All of that may have worn her out.",,,,AvengeThe90s,,,1471746796,t5_2rfqf,t3_4yrqaw,t1_d6q285j,1,1473516118,0,0,d6q50rf,dementia,1,,
"A new app for dementia support, created by a group of Cornell students, offers to help patients stay connected to their friends &amp; family.",,,,Taking22Tango,,,1471979516,t5_2rfqf,t3_4z873k,t3_4z873k,1,1473562294,0,0,d6tmucn,dementia,1,,
Specifically say that she is showing anxiety and can they prescribe something.  Think about the movie North by Northwest (or most any other Hitchcock movie) where the expectations for a person change completely and the main character has to try to figure out who is out to get him and who are friends or trustworthy or are dangerous. I kind of think this is what my dad goes through every day - he can't connect things properly and thinks external forces are somehow altering his reality. When I consider it this way it makes it easier to respond to his incessant repeated questions with patience - but I am determined to get him back on his meds.,,,,MET1,,,1470633892,t5_2rfqf,t3_4wj7ts,t1_d67ry9j,1,1473282961,0,0,d68owl3,dementia,1,,
"These people are trolling to see who they can directly market their product to.  They should come out straight and admit that, not try to disguise it as academic research!

The OP's account is 1 day old; looks suspiciously like a throw-away.",,,,seb21051,,,1471021426,t5_2rfqf,t3_4x9a19,t3_4x9a19,4,1473367059,0,0,d6ergdz,dementia,4,,
"Is there anyway you can connect with his case manager at the VA, or at least try to get him one? If your mom was promised to get paid for care, he would have had to had some evaluation, and thus someone should have done the paperwork. I could contact the local VA branch and speak with their social work department. Also, is he on medi-cal? He can also get a caregiver through IHSS (in home support services), and again I would ask for a case manager to help sort through it. Good luck! ",,,,bevkc,,,1470357371,t5_2rfqf,t3_4w7d3r,t3_4w7d3r,1,1473228556,0,0,d64pt6j,dementia,1,,
"be sure to try www.mindmate-app.com as well :) It's free and already more than 30,000 people use it! 
",,,,Gabrielaellala,,,1472594735,t5_2rfqf,t3_4z873k,t1_d72myt8,1,1473686342,0,0,d7376l7,dementia,1,,
"I have to say I think you're spot on here. It took MONTHS to get my dads medical records, numerous court dates to gain guardianship, a metric FUCKTON of paper work for the state, social security, and his retirement system. It's an unending shit show and hard as fuck. I also do not believe for a second the state has offered to pay close to 2k a month to someone caregiving. Also, you can expect a man with dementia to consistently remember to give someone money or not eat someone's food. My dad takes money when he sees it out. He forgets he's eaten. It's beyond maddening. ",,,,mgcarter3,,,1470421115,t5_2rfqf,t3_4w7d3r,t1_d650c4o,1,1473240963,0,0,d65ok9l,dementia,1,,
"You did it.

I need therapy to come to this conclusion. This really helps, and I thank-you,.",,,,Geology_Daze,,,1472512779,t5_2rfqf,t3_4x962n,t1_d6e7urs,1,1473670394,0,0,d71vz33,dementia,1,,
"The earlier the dementia sets in the higher the chance of genetic hereditary, to my knowledge this accounts for all types of dementia (not in line with the comment from zebra-stampede). But, FTD often has an earlier onset than alzheimers or vascular dementia.

Edit: literature supports my statement concerning heredity.",,,,Fromfam_Ritter,,,1471884788,t5_2rfqf,t3_4yej1n,t3_4yej1n,1,1473541311,0,0,d6s1olk,dementia,1,,
"I am not trying to be insensitive, but why don't you want to just walk out on the shit show? It sounds like you don't have much love lost for Ronnie. Are you involved out of concern for Sam? Just so you know, I am sympathetic as I am dealing with a somewhat similar dynamic regarding my parents. ",,,,LadyInTheWindow,,,1471836095,t5_2rfqf,t3_4vy8xe,t3_4vy8xe,1,1473532890,0,0,d6rf8bw,dementia,1,,
"Has she been taking any Ensure? My grandma may take a long time to eat, but she actually looks rather healthy. My guess is the Ensure she likes drinking.",,,,xcelleration,,,1471418431,t5_2rfqf,t3_4wd0ff,t1_d6f9jsd,1,1473448687,0,0,d6kuq6p,dementia,1,,
"Gee, good question. I can see that problem coming my way with my mother, very soon. I very often now have to feed her with a straw, and its always liquidized food these days. Often she purses her lips instead of opening them when I use a spoon. And sometimes she just does not get the idea of sucking the straw, and she has been loosing weight :(",,,,seedpod02,,,1471045126,t5_2rfqf,t3_4wd0ff,t1_d665apj,1,1473373805,0,0,d6f9jsd,dementia,1,,
"Acupuncture for memory loss may be beneficial for people with memory problems, but don't yet have dementia, suggests a review by Chinese researchers of five earlier studies.",,,,Taking22Tango,,,1470753022,t5_2rfqf,t3_4wwg69,t3_4wwg69,1,1473306439,0,0,d6aecu9,dementia,1,,
"So, lots of love to you and everyone going through our struggles :)",,,,seedpod02,,,1472662521,t5_2rfqf,t3_4x962n,t1_d71vz33,1,1473699966,0,0,d7477aw,dementia,1,,
"Good checklist - I think I saw some of that recently on a news site.  Last year I was writing notes on index cards and slipping them to the receptionists or nurses - not nearly as complete as this list which is organized well and easy to understand.  ",,,,MET1,,,1470633626,t5_2rfqf,t3_4wj7ts,t1_d68di43,1,1473282917,0,0,d68oskq,dementia,1,,
"Adult day care. They reach a point where, like toddlers, they want to do things on their own, but they really can't. ",,,,LadyInTheWindow,,,1471836631,t5_2rfqf,t3_4r7jxn,t3_4r7jxn,1,1473533001,0,0,d6rfjm6,dementia,1,,
"I wish I could tell you that it was going to get better and that he's going to become one of those sweet old dementia patients that everyone enjoys taking care of.  My experience is otherwise--my dad has been verbally abusive for many years and is getting worse with the dementia because his impulse control is nil.

What helps is finding some medical/psychiatric care for him and ensuring he stays on the medications they prescribe.  With these aggressive older men, they've been used to being in charge for a long time, and when they feel like they're losing control of their lives due to dementia, one of the things they try to establish control of is whether they take their meds or not.  *They really need to take their meds.*  It will help make you caregivers' lives easier.

I'm sorry, I understand your pain.  ",,,,caseyoc,,,1470674098,t5_2rfqf,t3_4watlr,t3_4watlr,1,1473289830,0,0,d696dsr,dementia,1,,
"Thanks for this. For the moment is isn't on any meds. I've tried taking him to doctors in the past and he's yelled at them and they said they couldn't do anything. I'm taking him back on Monday with a plan that i won't leave until they the help him. 

And I'm sorry that's happening to you and your dad. It's so hard. ",,,,Mommob,,,1470578377,t5_2rfqf,t3_4wj7ts,t1_d67iehb,2,1473269801,0,0,d67ry9j,dementia,2,,
"There's really no way to tell. Those are a bunch of big changes for her. It may take time for her to adjust to the day program, but I think it's worth a shot. ",,,,applesangria,,,1471967512,t5_2rfqf,t3_4z2yr0,t3_4z2yr0,1,1473558618,0,0,d6td1t4,dementia,1,,
"It is gross. My dad was doing this to some extent too. I caught him with a full gallon of ice cream once. Thankfully I randomly had two fridges and one wasn't in the kitchen.  I just hid all the stuff he'd get into in the second fridge. ",,,,mgcarter3,,,1472471669,t5_2rfqf,t3_502vif,t3_502vif,2,1473660646,0,0,d7131wr,dementia,2,,
"I work with people living with dementia we call this stepping into their world which is basically being with them wherever and whenever they are in their mind. If she is happy and content just go with it :) ",,,,punysnack,,,1472511722,t5_2rfqf,t3_507188,t3_507188,8,1473670161,0,0,d71v9eq,dementia,8,,
"I would suggest getting a neurologist to
Check her out or atleast a second opinion and a full dementia panel testing done.  ",,,,bevkc,,,1471031409,t5_2rfqf,t3_4xf5uc,t3_4xf5uc,2,1473370118,0,0,d6ezn3h,dementia,2,,
"I think count it as a blessing that he doesn't understand and let it go quickly from conversation. ",,,,LadyInTheWindow,,,1472233388,t5_2rfqf,t3_4zjyd1,t3_4zjyd1,1,1473615972,0,0,d6xrybo,dementia,1,,
"Thank you so much for your kind words. This past week has been rather difficult because of the hard time she's had in the care home. Glad to say she's home now, but we do need to look towards the future.

You're right - I can't turn back the clock or invent medical science to help. I did send her flowers, and she was thrilled (over and over as she kept remembering about them!)

My dad shares the martyr mentality sadly... but he's still my dad. Perhaps he needs someone professional to talk to outside of family... =)

Thank you again for reaching out. I'm glad someone replied and that I felt heard.",,,,IHaveSomethingToAdd,,,1472566213,t5_2rfqf,t3_4zkqfm,t1_d6xkrnl,1,1473678855,0,0,d72lgvz,dementia,1,,
"If she ultimately ends up with FTD which is very unlikely (even with familial) there is nothing to be done except make the most of life.  Stress will always make a neurologic issue much worse.  Make sure her family history is on her medical file and just get on with living.  I'm 46 with 3 children and have FTD.  Life changes but it moves forward.  The key is to let go of what can't be controlled and get to living.  To overly stress out about something not diagnosed is destructive and almost an insult to those who are tackling life with the actual disease.         I'm sure the weight of seeing her mom deal with it is a major trigger.  So just keep being supportive but steer her to the positive and move forward. ",,,,ftdALIVE,,,1472569018,t5_2rfqf,t3_4wtccs,t3_4wtccs,1,1473679509,0,0,d72nfbb,dementia,1,,
"Thank you, I'll check those links out. He's thought these things were funny originally, but it does seem to feel a little more--which is where I'm sure the dementia kicks in. Also, he does go to the doctor pretty regularly, and to be honest I don't know what they have him on, but I'm sure that he's on at least one thing for it/related symptoms. ",,,,EvinceAgape,,,1470421371,t5_2rfqf,t3_4watlr,t1_d65nruk,1,1473241032,0,0,d65orf8,dementia,1,,
I love it when professionals come in and check this sub.   Thank you for being here!,,,,caseyoc,,,1471888284,t5_2rfqf,t3_4yz8og,t1_d6s0apt,3,1473542306,0,0,d6s4f10,dementia,3,,
"Memory care is much better equipped to deal with the specific problems of dementia, especially belligerence and violence.  Don't hesitate to lie to your dad.  Don't specify that this is memory care, tell him this is temporary while you look for somewhere else, tell him whatever you have to to keep him calm and compliant.  Moves are especially agitating for dementia patients and any good facility knows that and knows how to deal with it. ",,,,Lordica,,,1470152485,t5_2rfqf,t3_4vsnry,t3_4vsnry,1,1473155572,0,0,d614i1f,dementia,1,,
"Firs of all: if its a recurring problem, you should take her to see the doctor. as others write, it might be something that he can help with - maybe she needs something for her digestion, maybe there is an ulcer, whatever.. 

i work in my school holidays as a caregiver at a nursing home, sometimes they will say things like this, that they need something for their stomach, more out of habit than anything else. I.e. they feel ""something"" is wrong, but they can't quite place what it is, because often that feeling is more psychological than physical and related to the dementia, but because they cannot express that, they will say its the stomach. The ones complaining often get some prune juice: it is really good for the stomach and helps with digestion (which can in fact suffer if they have this feeling of unease, and cause the stomach aches). As you write, she keeps asking cause she doesnt get anything, so just the whole placebo effect, the feeling of ""being heard"", of getting something to help with the stomach might really help her a lot, to calm her down and help get rid of the feeling of unease. Say the prune juice is for her stomach and it will help, maybe this is enough to help her :)

To keep her occupied: Music from when she was young and old movies, that she know, are great occupations. Also, if anyone in the family has a pet that can come visit, this can really help with cheering up :) does she know how to knit or do anything with her hands? If she is still quite fit, this kind of repetetive motions she might still remember, and still be able to do. Also simple tasks like folding clothes, wiping the table etc. ",,,,pll1234,,,1470535006,t5_2rfqf,t3_4vi8n0,t3_4vi8n0,1,1473263400,0,0,d67c0fk,dementia,1,,
"I don't personally have experience w/elder care attorneys, I didn't handle any of the paperwork etc. I am only involved with the ""hands on"" care, not any of the legal stuff. Other people in the family handled that. As it stands, two family members share POA (financial) and guardianship (medical). It was an extremely emotional &amp; difficult process, because my family member refused to do either, so it went through court &amp; Adult Protective Services, and then the two guardians conflicted as to what they wanted. Many lawyers were involved. I highly recommend that you see one, because this stuff can get tricky, especially with finances. It's expensive, but a good lawyer will help make obtaining guardianship etc easier for you. 

Getting him back onto Seroquel sounds like a good idea, even if he only takes it at nighttime or at a lower dose. I understand the concern for falling etc, but honestly.. if it makes him peaceful and calm, it's worth it. The memory care unit is generally smaller and self-contained, so they'll be able to keep a closer eye on him. I can see how they wouldn't be enthused about it in the AL section, but it may be different in the MC section. The transition between one med to another can be rough, especially if they didn't wean him off slowly and build up slowly (I really, really hope they did!). Any abrupt changes in meds will result in an abrupt change in behavior. I'm sure they understand this. That's awesome that you have a good psych nurse on your side. 

It sounds to me like a 5150/geri psych inpatient stay probably won't be necessary. It might be a really rough transition, but it sounds like the AL/Memory Care place he's in is willing to work with him, on meds &amp; behavior. I honestly think that if they weren't confident they could handle him, they wouldn't have offered him to move to Mem Care in the first place--they would've said ""He needs more than we can offer him,"" and encouraged you to look elsewhere. It's promising that they're trying new things with his meds. ",,,,applesangria,,,1470160921,t5_2rfqf,t3_4vsnry,t1_d61aojz,1,1473158037,0,0,d61bano,dementia,1,,
"I'm not a medical expert, but this sounds like the last stage of dementia, where they forget how to eat, and so they don't.  

How are you doing?  It's hard to care for a loved one, especially in the late stages.",,,,plotthick,,,1470485563,t5_2rfqf,t3_4wd0ff,t3_4wd0ff,3,1473252800,0,0,d66lbea,dementia,3,,
"I have read posts of people that did that; we just might have to, just to keep from getting sick.",,,,AvengeThe90s,,,1472484693,t5_2rfqf,t3_502vif,t1_d717vk7,2,1473663237,0,0,d71amhx,dementia,2,,
"Can she mirror expressions? Try to open your own mouth when she needs to open her mouth. Make sound while opening your mouth. Practically like feeding a baby really..

I figure she might be in her last stadium of dementia? Since her primal functions seem to dissapear (opening mouth, swallowing). Also when the food is in her mouth, you could stroke her throath to induce a swallow reflex. Sometimes this works.

Another question: does she even want to eat? What about depression? You should also take into account that maybe she's 'done with life' and this is her way to express it. 

I'm not trying to be harsh.. I feel really sorry for your situation. Sounds devestating :(",,,,Fromfam_Ritter,,,1470472294,t5_2rfqf,t3_4wd0ff,t3_4wd0ff,3,1473251340,0,0,d66hszn,dementia,3,,
"happy to help. I'm a former social worker and worked with the VA quite a bit in California. They should be able to help you get better settled. Also, dependent on his VA benefits, they also have housing for some Vets with care which may be a better option for him.",,,,bevkc,,,1470376459,t5_2rfqf,t3_4w7d3r,t1_d64qyng,1,1473232437,0,0,d650y23,dementia,1,,
"The funeral was lovely,a real celebration of a life enthusiastically lived. Coming out of church dad pitched over head first so  ended up in ED to check for brain bleed, and had a very late night. He looks like the recipient of a Glasgow kiss . I guess weird things happen around funerals...",,,,squashedpossum,,,1471498749,t5_2rfqf,t3_4xxiz8,t1_d6jopfe,1,1473467504,0,0,d6m9gou,dementia,1,,
"&gt;Put a mini fridge in your room?

You mean *her* room?, ",,,,AvengeThe90s,,,1472484648,t5_2rfqf,t3_502vif,t1_d719fuh,1,1473663226,0,0,d71albq,dementia,1,,
"Everything you've described is very common and 'normal' in dementia. It sounds like you guys aren't prepared for this emotionally, or for the daily grind of caregiving. You went into it with good intentions, but that's often not enough to make it work, realistically.

 Like someone else said, get in touch with the VA and have your mom relinquish her rights. If she can't get info from the VA, call Adult Protective Services. What's important is that you've realized this isn't working, and that it's not fair to him. Do it sooner rather than later, especially because he's suffering emotionally &amp; psychologically without his medication. ",,,,applesangria,,,1470373741,t5_2rfqf,t3_4w7d3r,t3_4w7d3r,1,1473232000,0,0,d64zoiv,dementia,1,,
Pretty good summary.,,,,imekon,,,1470225909,t5_2rfqf,t3_4vu017,t1_d62a75k,1,1473172145,0,0,d62crqg,dementia,1,,
