body,score_hidden,archived,name,author,author_flair_text,downs,created_utc,subreddit_id,link_id,parent_id,score,retrieved_on,controversiality,gilded,id,subreddit,ups,distinguished,author_flair_css_class
"That's rough. Caregiving is something you have to WANT to do, otherwise it turns into a huge burden. 

Have you sat down with her for a heart to heart? Explained that you're losing sleep, not doing well in classes, etc?

A few things I can suggest to make your life easier: get door alarms (we have cheap stick on ones from Walmart that work great; you can set them to chime, alarm, and off). Unless you hear the alarm going off in the middle of the night, let him wander throughout the house. ""Baby proof"" the house by hiding tools, taking knobs off stove, putting household cleansers out of sight, etc. Make sure there are clear paths to walk, that he doesn't have to navigate around shelves and tables to get out of his room. Make the house as safe as possible. Put the dogs outside during meal time, or in a different room. 

A lot of these issues are him trying to be helpful- fixing the sink, rearranging things, feeding the dogs. Find a way that he thinks he's being helpful, and gear it towards his interest. Maybe a fiddle board depending on how advanced he is? Can he sort a big bucket of nuts and bolts? With dementia, they can't be expected to entertain themselves. Try playing music he likes, as well. 

These are all just small things you can try. If you can't cope with the situation, and Mom isn't willing to make any changes, I'd suggest picking up a part time job and moving out. ",,,,applesangria,,,1467296693,t5_2rfqf,t3_4qltih,t3_4qltih,6,1469398287,0,0,d4tz8fr,dementia,6,,
"My father went through a period like this after he had been at the assisted living for a while. When I came to visit he believed I was there to take him home, especially when I was getting ready to leave. During this time he thought the assisted living was ""work"". I assured him I would take him home soon, then changed the subject. Often, but not always, he would let it go. Eventually - maybe after two months - he stopped talking about going home as frequently and over time it ceased altogether.

I don't see any way around getting up and reassuring her that she is going home ""soon"". Hopefully it's just a temporary thing and you'll go back to full nights of sleep. 

As /u/not-rocket-science said, consider discussing the situation with her doctor - and much respect for taking care of her at home. Best of luck!",,,,xnedski,,,1466682378,t5_2rfqf,t3_4pfjsv,t3_4pfjsv,2,1469237317,0,0,d4knqc5,dementia,2,,
"I've seen my mom exhibit the latter. Its probable mixed with some paranoia, she feels we're keeping stuff from her and gets suspicious.",,,,goosetavo2013,,,1465925654,t5_2rfqf,t3_4nzlf1,t1_d48mme9,1,1469036193,0,0,d490c5e,dementia,1,,
"All of these are fabulous suggestions. 

I would also add for OP's mom to get the lack of sleep issue addressed by a doc. My grandmother used to get up an average of 6 times per night. Her dementia got super out of control and part of that was because her condition was being exacerbated by lack of sleep. Perhaps OP's grandad would benefit from a visit to the doctor to discuss possible sleep aids. ",,,,DoctorFlimFlam,,,1467300157,t5_2rfqf,t3_4qltih,t1_d4tz8fr,3,1469399577,0,0,d4u1tji,dementia,3,,
"She will usually eat what she successfully sneaks back to her room unnoticed if she first succeeds in making a palatable combination of food in the first place. Her ability to consciously make edible foods has mostly disappeared and she will throw a variety of whatever is in the fridge together which I assume is the excitement of making it to the fridge and wanting a bit of everything. Due to constant efforts on the entire family to discourage her from using the stovetop, as she usually leaves the heat on, and the microwave, where she puts things in for hours instead of minutes, she has successfully stopped using them. What I take from that is that she's still capable of learning not to do something due to creating a dangerous situation whether it be burning the house down or maintaing a dangerous blood sugar level throughout the day (still working on this one). 

Her craving for coffee in ungodly which I can only presume is for the effects of the caffeine, she will similarly go to great lengths to try and make it regardless of us making her a cup for breakfast. Due to her breaking a glass pot style coffee machine in the past we upgraded to a Keurig which has the benefit of never having any leftover coffee in a pot for her to focus on. Regardless she still makes attempts at manipulating the keurig machine which involves placing a coffee cup under it and hitting the button which at most will just make hot water if the reservoir is filled. After realizing it's just water she will take the used K cups, which only have coffee grinds in them and are never disposed of by their user, cut them open and place the coffee grinds in a cup of water thinking she can get a caffeine kick from it but she never drinks the concoction as it's not pleasant to take swigs of coffee grinds. 

She definitely takes some pleasure in trying to beat the safe guards we have in place which is evident by her repeating attempts at getting through them. One of the most worrying times in her pursuit of food was when she would take one of the large kitchen chairs over to the cabinet so she could reach the goods on the uppermost shelf, due to her small height she would have to tippy toe with tongs to grab an item, I'm surprised she never fell and hurt herself as she has episodes where she goes on falling rampages though she's been good lately. 

That's interesting you mentioned the inverse of overeating as, now that I think of it, my grandma has done the same but I always assume she just made too much to handle or it was unpalatable. Many of the times she sneaks food she leaves a large amount untouched on her bedside table.  ",,,,hardful,,,1466142287,t5_2rfqf,t3_4ohd2t,t1_d4coizy,1,1469100077,0,0,d4cphmv,dementia,1,,
"In home agency staffing works out better, buy only at first because the patient needs are minimal. Care gets progressively more expensive as the needs of the patient increase. For in home care, that care may likely extend past that 4-6 hour window to eventually around the clock and that is insanely expensive. In a facility, there are levels of care. One of may grandmothers is in a facility and the other is at home. The home care we are paying $15 per hour 24/7 because she is end stage Parkinson's with Lewy Body Dementia and she needs major in home care round the clock. That is nearly 11k per month in care. Some agencies do give deals but look at the fine print for tiers of care. My other grandmother is at a private facility that keeps getting more expensive as her care needs increase. Her care currently costs 3800 per month, soon to increase to 4500 per month. She is being moved to I believe a state run facility because she can't afford that much anymore. 

Medicare does not cover long term care, in facility or home. There is supplemental insurance that would cover it but she would have had to have purchased that before she was 65 I believe. I can't remember but Medicaid might, but there may be limits on how much you can use. If she qualifies for Medicaid, then I would absolutely look into it. Some states have programs available to help offset the cost of caring for a loved one in home, and qualification is usually also dependant on income and assets. Also if her husband was ever in the military and saw combat, she may qualify for something called Aid and Attendance. It is a pain in the butt to apply for, but hey, money is money. 

Another thing to make sure of if you are seriously considering in home care is staffing agencies insure their workers. If you hire private individuals not through an agency make sure you attach a rider on your mom's homeowners policy to free her if liability in the event that a caregiver hurts themselves in her house. 

All these numbers are pretty big. Depending on where you live it may not be so bad. I'm in California and everything here is expensive. ",,,,DoctorFlimFlam,,,1464977707,t5_2rfqf,t3_4m70wy,t1_d3ui9wl,1,1468789640,0,0,d3urtjj,dementia,1,,
"Thank you, you've been a wealth of practical information!",,,,Jewel_332211,,,1465223994,t5_2rfqf,t3_4m70wy,t1_d3urtjj,1,1468846882,0,0,d3y376y,dementia,1,,
"I'm glad your mother is finally free. ",,,,Reidoc,,,1466194296,t5_2rfqf,t3_4ojlbz,t3_4ojlbz,2,1469113566,0,0,d4dhn2y,dementia,2,,
"This exact same thing happened with my father-in-law (I'll call him Gary)! He and the family physician were old friends. Gary even built his house.

Gary was an independent, outspoken, man; and even when he couldn't operate a light switch, he could still talk about the good old days for hours on end. So, he'd see the doctor and reminisce for a while and the doctor would think things were fine. I got very angry, because we were lost as to what do do and were begging the doctor to help get Gary to a specialist and to pull his driver's license. His response was ""It's just normal age-related memory loss"". All the while Gary was getting into dangerous situations (physically and financially) and insisting that he was perfectly fine.

Within two years, Gary was in a lock-down unit, with stage 5 fronto-temporal dementia. It's been a rough ride for everyone! Incidentally, his doctor did come to visit him in the nursing home. He lost his keys and almost didn't get out because the staff thought that he was a patient!

When I first met my FIL, some sixteen years ago, I knew something was off. As time passed, I brought it up more often with my husband. It was complete denial in the family until he got to stage 4. It's been my observation that old friends and family are often quite resistant to acknowledging dementia in a loved one because it means that they have lost that person and that they might end up the same way. Scary stuff, as you know!

I can't advise you on the Canadian health care system; but she needs a neurological exam. Document her behaviors and get a group of family members to accompany her to the doctor with their concerns. Doctors generally don't want to take away a patient's independence, because it usually means a rapid decline; but there comes a point where concerns for the safety and well-being should take precedent. 

My final advice to you is that you visit an expert elder law attorney and get all paperwork in order before the diagnosis. My husband and I were able to get Gary to sign a durable power of attorney just before it was too late. It has been instrumental in our ability to manage his care. Best wishes to you and your family. Sorry that you are going through this.

",,,,whatsreallygoingon,,,1466613342,t5_2rfqf,t3_4pb3k4,t3_4pb3k4,2,1469218216,0,0,d4jjyn3,dementia,2,,
"It could be the case that you are dealing with a case of vascular dementia or the cumulative symptoms of several ""mini-strokes"" which don't necessarily cause shrinkage or plaque formation in the same way that AD does.",,,,hithazel,,,1466194153,t5_2rfqf,t3_4oil7n,t3_4oil7n,1,1469113515,0,0,d4dhj9f,dementia,1,,
"That is the biggest drawback. Reliable caregivers are very few and far between. It took me years to find an amazing mix. Despite the fact that they are super reliable, things happen. They have family events, get sick, you know, normal human stuff. I also have a few people that are what I call swing(not regularly in the mix but occasionally available to watch grandma, but that doesn't mean that they will be available to pick up a shift in the event of an absence. If no one can work, I am indeed the one that has to pick up the slack. 

I'm not going to lie, for the past 3 years I have missed 80% of weddings/birthdays/baby showers/etc, and have worked almost 100% of holidays during that same time. That is just how it goes when you are the main coordinator and your family either lives too far away or ""has too much going on"" in their own lives to give relief. This is where going through an agency or placing the patient in a facility is hugely advantageous. The patient gets care, and your life doesn't end up treading water for years. 

Here is a really excellent story to illustrate my point: Two years ago I had scheduled 2 days off for Mother's day. I made sure there was coverage backwards and forwards because I had invited like 4 mom's over for a really special meal. The morning of mother's day the caregiver on shift doesn't show. When I call her, she quits on the spot citing grams recent behavior(dementia sucks). I have an absolute meltdown. This was THE FIRST social event I felt comfortable hosting because prior to this point, grams care was a lot less reliable. I basically spent an hour on the phone with her begging her to work just that day and I would personally pay double for the shift because none of my other people could cover. I was so angry and frustrated that I had to take time out of my mother's day that I had been planning for weeks to address a major staffing issue. I wish this was the only time this happened. It happens more often than I would like. I missed my niece's birthday party a couple weeks ago becaise of a staffing conflict. 

I am not going to lie, you will have to pick up the slack at some point and you will miss events/holidays that are important to you if you take on this responsibility. That is the nature of this lifestyle. It sucks. If you have any family or friends that have a life, you will likely resent them at some point too. You really need to examine whether you are willing to give up a ton of freedom to care for your loved one. ",,,,DoctorFlimFlam,,,1464924563,t5_2rfqf,t3_4m70wy,t1_d3ttc1g,1,1468776790,0,0,d3u10xe,dementia,1,,
"Like a toddler, elderly dementia patients have little impulse control.  They also remember sexual impulses, even if they lack the ability to act on them.  Add into all that a tendency to forget who they are dealing with from one moment to the next and I'd frankly be surprised if there were never any moments of embarrassing impropriety.  My father was as likely to confuse me with my grandmother or mother as he was to recognize me as his daughter. ",,,,Lordica,,,1464925358,t5_2rfqf,t3_4mayt5,t3_4mayt5,7,1468777028,0,0,d3u1j4r,dementia,7,,
"This is the company I used http://www.universalmedicalid.com/canada/

I ordered it 3 weeks ago and it came in 2 days ago.  No monthly fee required.  If you feel it's urgent and can afford the extra fee to have it rushed, do it.  Canada Post might be going on strike very soon.

I think we got extremely lucky with the Doctor.  For years anytime my grandmother had an appointment either my mother or I would accompany her, mostly because she doesn't drive but she always wanted us in the room anyway in case she forgot to ask important questions.  So when my mother called about the changes in her she just told the receptionist that we wanted to speak the doctor about it without her present because she wasn't going to walk in there herself and admit she had a problem and we were extremely concerned.  They fit us in the same day at the end of the day, so we were able to take our time and really discuss the issues.  She even gave us a blood test order and said to tell my grandmother that her office called requesting a blood test 'because it's that time of year again' and when they couldn't reach her on the phone they called my cell so I could pick it up.  

Normally no, they cannot discuss another patient.  But we weren't asking for her records, we were giving her a heads up that when the dr asks ""how is everything?"" Her answer of ""everything is just great"" is a big fat lie.  

I was also named Guarantor in her will several years back (before she started having these problems) and have power of attorney over her financial matters.  I already do her banking for her and when she is officially deemed unable to make decisions for herself all I have to do is go to the Notary and finalize it.  

I really hate to say it but things kind of worked out very well for us so far.  She happened to hurt her foot the day before we brought her to the ER, so when she called my mother that night during a hallucination we used her sore foot as an excuse to get her there.  She was all for it until we got there and she didn't recognize the hospital.  Her heightened confusion and paranoia really tipped off the ER staff and we didn't have to do much explaining from that point.  

What we thought was an occasional problem at night and sometimes during the day when she was tired or in an unfamiliar place, has turned out to much worse than we could have imagined at this stage.  We used to call her everyday and would take turns visiting her almost daily when possible, but now that we're with her all the time we really see how far it's progressed without us noticing before.  We wonder how long it's been this bad and we didn't realize it.  ",,,,Aparty,,,1466639803,t5_2rfqf,t3_4pb3k4,t1_d4k31pt,1,1469228038,0,0,d4k4hjx,dementia,1,,
"You can't really see plaques on a CT or even an MRI, you can only image them reliably on an Amyloid SPECT scan or detect them using lumbar puncture (amyloid / tau ratio) or through a brain biopsy.

Presence of amyloid is part of the Alzheimer's process but you can see amyloid in normal petiole too so we would only use the above techniques (depending on local availability) if there was a question around the clinical diagnosis. The vast majority of diagnoses have a CT/MRI to rule out very rare causes not to diagnose dementia where they are often normal.

Hope that's helpful",,,,samirshah,,,1466170975,t5_2rfqf,t3_4oil7n,t3_4oil7n,3,1469105008,0,0,d4czxk4,dementia,3,,
Thank you for your solid advice. I'll certainly follow through with it.,,,,DeepStatic,,,1467116258,t5_2rfqf,t3_4q6mf0,t1_d4qqxbc,1,1469348670,0,0,d4r3mmc,dementia,1,,
"Sounds like you all are trying really hard to do all the right things for her.  Hats off to you!

My dad's GP is a complete ass-haddock about doing anything proactive for his dementia.  We've had to say things like, ""If we have to remove him from your care in order to make sure his needs are met, it would be unfortunate because we'd have to start over with a new doctor.  But we have to look out for Dad's needs first.""  He's grudgingly making referrals for us, but we have to fight him every step of the way.  I have no idea why this is so--they guy has tons of patients, so he can't be too concerned about loss of income from my dad not seeing him for every little thing.

Does your province or municipality have any kind of care-line that they offer for issues like where to get child care, how to help the elderly, etc?  In my state, our department of health and welfare does this, and they've given me some good referrals.  Basically, it might help to be looking for an eldercare social worker to come in and do an assessment on your grandmother.  It's not scary like a, ""OMG, they're coming to take Grandma away!"" kind of thing, but an in-home visit where they talk to her and to family members, get a baseline for her current health, and then provide recommendations to you all based on their observations.  It was really useful for us, and gave us a person to ask when we have other questions that crop up.  

I hope this helps!",,,,caseyoc,,,1466611221,t5_2rfqf,t3_4pb3k4,t3_4pb3k4,2,1469217425,0,0,d4jia6w,dementia,2,,
"When the primary caregiver is unwilling/unable to keep up with the demands, and/or when the person with dementia would benefit. It's hard to say, and it's different for everyone. I've been told by many people that if you're starting to wonder if it's time, it's probably time. 

Some common reasons: 

-  when Mom/Dad requires 24/7 care, but the caregiver cannot stay home with them

-  when the person with dementia becomes incontinent.

-   when the person starts wandering outside the home, and the home can't be adequately secured. 

-  when the person with dementia is bored and not stimulated, and would do better surrounded by more people 

-  when delusions and hallucinations are uncontrollable 

-  when aggression becomes a problem 

-  when the caregiver is burned out- their mental and physical health is at risk 

What does your mom think? How is she coping? How long will their financial resources support him staying at home? 

You may want to emphasize to mom that it's not ""giving up"" if he moves into a NH. She will still need to be very involved in his care- making sure he's being cared for, safe and happy. It would just be in a different role. 

",,,,applesangria,,,1465502546,t5_2rfqf,t3_4n91o4,t3_4n91o4,3,1468927096,0,0,d42qlf4,dementia,3,,
"It's hard.  I've never found something I could do to consistently avoid feeling really hurt.  Some days it bounces off, some days it is deeply hurtful.  Your story sounds similar to mine.  I'm sorry you're going through this.  Best I can echo is to take care of yourself.  Somedays that may mean taking care of him, other days maybe cutting the visit short and get out.",,,,yourlocalfarmer,,,1466791426,t5_2rfqf,t3_4pn44d,t3_4pn44d,2,1469269663,0,0,d4mj4ie,dementia,2,,
This is how you do it.,,,,I_WantMyMother2Die,,,1467237977,t5_2rfqf,t3_4qgjil,t3_4qgjil,6,1469384765,0,0,d4t6v26,dementia,6,,
"I'm sorry.  It's hard.  Do your best and do it with your whole heart.  I'm afraid that I let myself be overwhelmed with a sense of resentment and inadequacy.  Now that my Dad is gone, I'm left with a deep sense of guilt that I didn't give him enough of what he needed most; a warm and loving presence. ",,,,Lordica,,,1466301775,t5_2rfqf,t3_4or4ol,t3_4or4ol,1,1469138435,0,0,d4exmep,dementia,1,,
"This is my dad. ",,,,mhass24,,,1466046353,t5_2rfqf,t3_4nzlf1,t3_4nzlf1,1,1469072711,0,0,d4b4c21,dementia,1,,
"I think there's a way to get around the money aspect from medicaid. 

Check out this news article on setting up a trust for people who earn more than the medicaid limit.
http://www.nolo.com/legal-encyclopedia/how-income-trusts-help-if-you-have-too-much-income-medicaid.html


",,,,donna_mattrixx,,,1464988859,t5_2rfqf,t3_4mes2r,t3_4mes2r,1,1468793592,0,0,d3v022x,dementia,1,,
"It could be due to a loss of inhibitions that some dementias can cause. 

However, it could be something a lot simpler. If the individual recognised that people are treating them with ""kiddie gloves"" when they are clearly not a child, that person could become frustrated and be trying to work out what is going on, because they know that others are not telling them everything.",,,,basicallynotnormal,,,1465906034,t5_2rfqf,t3_4nzlf1,t3_4nzlf1,2,1469029589,0,0,d48mme9,dementia,2,,
"Thank you for the links and advice! 

I have considered talking to my dad directly about this, but I know it will mean the rage of my mother. She doesn't want me to worry or frighten him. Ideally I would like her to be on my side when we approach him about it so he feels safe and reassured. It's tricky, but I'll have to make a call on it soon. ",,,,BerbleBap,,,1464813412,t5_2rfqf,t3_4m2d0k,t1_d3s65nw,2,1468745551,0,0,d3s7o97,dementia,2,,
"Thanks for the info.  I'm in Maryland.  I called my insurance to see if there was any coverage and there were no genetic counselors, but there were some nuerology offices.  I called a couple and they didn't seem like they would be able to help.  The desk suggested I go through a primary care (which I don't have, new to the area) to be referred out.  ",,,,wilhel_ryan,,,1464916826,t5_2rfqf,t3_4ly7rt,t1_d3t3hct,1,1468774412,0,0,d3tvzcy,dementia,1,,
"Whatever.  If you have any kind of terminal disease that will make your existence a living hell and cost your family a shit ton of money to maintain your hellish existence, the only honourable thing to do is to kill yourself. ",,,,I_WantMyMother2Die,,,1467253532,t5_2rfqf,t3_4qgjil,t1_d4tckdj,2,1469389419,0,0,d4tgpgv,dementia,2,,
"The funny thing is that I'm doing exactly what you said. I never contradict her and always say stupid things so she loughs. What kills me is when she just can't stop crying and struggling. It physically and emotionally destroyes her and there is nothing I can do.

Thank you for your help

**edit** by the way. Isn't the progress just too fast? I mean. Her head doctor say her two months ago and then saw her in the hospital. He left the room almost shaking. Looked like a terrified kid",,,,morcillazo,,,1467320354,t5_2rfqf,t3_4qn31b,t1_d4uh8kl,2,1469407243,0,0,d4uhsl2,dementia,2,,
"I echo the other sentiments, but also want to add this thought. Because you're family, you might remind him of his wife. Not saying that he handled her like this ever. That or: he could be in a time mentally when he was younger. Not to say that this is how he would've or did act when he was young, but as to say that a 27 year old female is in close quarters, and he doesn't have that impulse control. Hope this helps",,,,callmesquirms,,,1464928954,t5_2rfqf,t3_4mayt5,t3_4mayt5,2,1468777968,0,0,d3u3h97,dementia,2,,
