body,score_hidden,archived,name,author,author_flair_text,downs,created_utc,subreddit_id,link_id,parent_id,score,retrieved_on,controversiality,gilded,id,subreddit,ups,distinguished,author_flair_css_class
Your mother,,,,lagnaippe,,,1468799585,t5_2rfqf,t3_4t5stl,t1_d5g6dos,1,1471497012,0,0,d5g73my,dementia,1,,
"If you are referring to me as a solicitor - you are sorely incorrect.  Here is a link to the published study of the nutrition spoken of.  There is true hope in improving one's health state... nutritional foundation is key for all body processes. http://www.ncbi.nlm.nih.gov/pubmed/22976077.   ",,,,results4life,,,1468519734,t5_2rfqf,t3_4m2d0k,t1_d4b4o33,1,1471428652,0,0,d5c91qm,dementia,1,,
"It is one of the many varieties of dementia, Alzheimer's being the most common. LBD is commonly associated with Parkinson's disease, and is named after the brain malformations that appear in people with this disease. 
Unlike Alzheimer's, the person with LBD may have good periods and bad periods- it does not progress in a linear fashion.
My husband had LBD symptoms for two years or more before being diagnosed with Parkinson's/LBD.

Edit- was not able to open your link on my phone earlier, so I jumped in. Great resource, says way more than my answer could ever have done.

",,,,Geezerette,,,1468422181,t5_2rfqf,t3_4sl46w,t3_4sl46w,1,1471400845,0,0,d5an5gr,dementia,1,,
"I've been looking into a 2-3 day a week helper / companion. Thanks for the ideas. It's definitely a struggle, and although it gets worse, I'm doing my best to keep her happy (while maintaining my sanity).",,,,throwawayyourneurons,,,1467829573,t5_2rfqf,t3_4r7jxn,t1_d4z1cu6,1,1471246137,0,0,d51pivx,dementia,1,,
"Are there any services, group homes, or senior centers that offer a sort of ""adult day care"" in your area? Even if it's just for one day a week, it will give you a slight break. These places often also provide counseling for care givers. Just talking with other people that know what you are going through can be a relief. 

Depending on your father's income, the fee for adult day care can be cheap to free. If you need help researching this, just send me a PM with your location.  I'm a librarian and my mother is going through this right now with her mother. I know the lingo and I know how to search. If you don't feel comfortable sharing that information, try searching area nursing homes and assisted living facilities for temporary care or day care.

I'm sorry this is happening to you. You are not alone.",,,,whinniethepony,,,1469888709,t5_2rfqf,t3_4vbsw7,t3_4vbsw7,2,1471797893,0,0,d5x6c6d,dementia,2,,
"I tried googling some, but there's so much different information out there, and me not having any personal experience with the combination of psychosis and memory issues, I wouldn't want to send you off on a completely useless track.

But, there are a couple of reddits for psychosis -

/r/psychoticreddit has 1,188 people subscribed

/r/psychosis, has fewer, at around 200

If you post over on those subreddits, I'd think you stand a good chance of connecting with people who have or have had similar circumstances, and hopefully they'll have some good advice for you.

Good luck!",,,,calicoan,,,1467758834,t5_2rfqf,t3_4r329h,t1_d4z2jho,1,1471227715,0,0,d50n12d,dementia,1,,
"I wish that I could give you a big hug and make everything better!

Please make sure that you have a POA who will look after you, and make your wishes known. Also keep in mind that people with FTD usually exhibit behavior that requires specific professional care; so asking to be kept out of a facility may not be reasonable.

That being said, my experience with FTD is that the patients seem to handle it gracefully and may not suffer as much as those with Alzheimer's; although there is a tendency to act out. My FIL is still able to recall memories and have good experiences. Even though he is pretty far gone, now, he still maintains a positive demeanor and doesn't seem to suffer too much for his condition.

Again, my heart goes out to you. Please set up your support network ASAP.",,,,whatsreallygoingon,,,1468714890,t5_2rfqf,t3_4t5y2m,t3_4t5y2m,1,1471478096,0,0,d5f3vfx,dementia,1,,
"Have someone help her some and make it seem ordinary. You can keep track and check out her skin. ",,,,lagnaippe,,,1468788634,t5_2rfqf,t3_4t5stl,t1_d5g0hgu,1,1471493835,0,0,d5g0lb4,dementia,1,,
"I suspect it, but they haven't done a new MRI to confirm it, just a cat scan (I think that's what it's called in english) and they say that it came out ok. 

About the injections ... yeah. I'm really worried about turning her into a pin cushion. And yes there is anxiety medication, but when it doesn't work it really doesn't work. 

Thank you for your help",,,,morcillazo,,,1467337381,t5_2rfqf,t3_4qn31b,t1_d4ui0q0,1,1471071724,0,0,d4usvkj,dementia,1,,
"I have learned in my trials with my dementia ridden 93 year old mother that you have to lead them.  I stopped saying things like, ""do you want some lunch?""  and just say, ""It's lunchtime"".  Most definitely get him to a doctor.  You might have to schedule it and just tell him its time to go to the doctor.  Memory issues are horrible and I hate to be the one to say it, but it WILL get much worse.  **You have no idea yet.**

Best of luck to you.  ",,,,j0kerdawg,,,1469047732,t5_2rfqf,t3_4tqpwg,t3_4tqpwg,7,1471563961,0,0,d5k2b1q,dementia,7,,
Wow! My grandparents are getting ready to move and once they do I'm going to take all important stuff out of his wallet. Great idea! ��,,,,KChante,,,1469155058,t5_2rfqf,t3_4tx8xl,t1_d5lfx3e,1,1471594676,0,0,d5ludbg,dementia,1,,
"Hm. Staggering *portions*; I may have to try that. Another thing is use smaller plates! We get two sizes (paper plates); 8in and 10in. Because even on websites dedicated to healthy eating they've done tests and bigger plates make you put more on them to ""fill in the gaps"" and then you wind up eating more.",,,,AvengeThe90s,,,1469210011,t5_2rfqf,t3_4u10h7,t1_d5lyt8d,2,1471608187,0,0,d5mmhgm,dementia,2,,
"Want to add that if she just has an upset stomach then good ol' ginger ale or a cup of warm water might be a solution.  Ginger has anti-nausea properties in it and warm water can help with digestion.  ",,,,Aparty,,,1469992616,t5_2rfqf,t3_4vi8n0,t1_d5yl01h,2,1471822958,0,0,d5ymksd,dementia,2,,
"I've come to learn that, even when diagnosed by a gerontologist or neurologist, Alzheimer's is the standard catch-all diagnosis for the elderly when the second most common types of dementia are ruled out via blood work, CT scans, etc.   I tend to think the family docs would refer patients more readily for more in-depth tests if the patient was younger.   

How old were your in-laws when diagnosed? ",,,,Jewel_332211,,,1468730486,t5_2rfqf,t3_4ku8o5,t1_d5fbhl3,1,1471481815,0,0,d5fblg8,dementia,1,,
[deleted],,,,[deleted],,,1467571031,t5_2rfqf,t3_4r329h,t3_4r329h,1,1471180224,0,0,d4xwn6z,dementia,1,,
"Thank you, I debated whether it was caregiver vs caretaker and changed it at the last moment. I shouldn't have second guessed myself. 

Thanks for the link, the website looks incredibly helpful!",,,,laurenj007,,,1469044155,t5_2rfqf,t3_4toa6k,t1_d5jiyfo,1,1471562506,0,0,d5jze18,dementia,1,,
"America's funniest home videos might keep her entertained for a while.   I know it is not an ""activity"" but it very well maybe something she can focus on and keep her engaged for 30 minutes at a time.
Good luck!",,,,ponyuptexas,,,1467688180,t5_2rfqf,t3_4r7jxn,t3_4r7jxn,2,1471209236,0,0,d4zkjqh,dementia,2,,
"We take care of his grandparents and they grew up during the Great Depression...haven't adapted to the modern world at all. Grandpa is diabetic and obese, eats sweets compulsively. He also gets into our groceries, so we hide them. 

  However, they love my cooking. I make nourishing meals whenever it's my turn to cook. Grandma cooks old fashioned southern meals that they eat. 

  I have also taken to simply offering a sample of my food. Like say....shrimp. I offer, knowing that they probably aren't familiar with the things I cook. They are childlike and very curious. So why not?",,,,Kat82292,,,1469291347,t5_2rfqf,t3_4ohd2t,t3_4ohd2t,1,1471627683,0,0,d5nqngh,dementia,1,,
"I've tried this already-i went for one day and it didn't end well. He gets VERY paranoid and doesn't like to be left alone or with strangers. Also it's not cheap to hire someone to come in and look after him whilst I'm gone-id almost be working for nothing. Plus paying someone is not an option at the moment. Someone mentioned volunteers that would come sit with him so I'm looking into that. ",,,,Samm1y-O1,,,1469888811,t5_2rfqf,t3_4vbsw7,t3_4vbsw7,1,1471797933,0,0,d5x6dyz,dementia,1,,
"This is an excellent idea, actually. She always gets a kick out of the random videos I show her on my cell phone. This would be the perfect 'activity' version of that.  I hate to just throw on the TV and walk away but while I'm working this could be a good solution for 2 hours increments. Thanks!",,,,throwawayyourneurons,,,1467829537,t5_2rfqf,t3_4r7jxn,t1_d4zkjqh,1,1471246123,0,0,d51phsz,dementia,1,,
"Yes, great suggestions! I also found something interesting the other day, Dramamine All Natural are actually ginger pills! ",,,,applesangria,,,1469997333,t5_2rfqf,t3_4vi8n0,t1_d5ymksd,1,1471824564,0,0,d5ypzmr,dementia,1,,
Yes! We are still looking into VA benefits but I've heard sometimes it can take up to a year to be approved. So start with the VA- we did it backwards!,,,,mgcarter3,,,1467656438,t5_2rfqf,t3_4r4gub,t1_d4ytmdx,2,1471200028,0,0,d4z1szq,dementia,2,,
"Telling them won't help when push comes to shove, you have to go to a lawyer and prepare an advance directive.",,,,parsonageturner,,,1467391598,t5_2rfqf,t3_4qgjil,t1_d4tjnv6,1,1471139083,0,0,d4vj5ar,dementia,1,,
on it.,,,,BayAreaSteppen,,,1467772016,t5_2rfqf,t3_4rfufq,t1_d50va6r,1,1471231768,0,0,d50vl20,dementia,1,,
"I was just saying to set it up for her on a weekly schedule. If she can bathe herself fine, but to me, it sounds like to need to pay closer attention to her needs.",,,,lagnaippe,,,1468802440,t5_2rfqf,t3_4t5stl,t1_d5g84mm,1,1471497838,0,0,d5g8oki,dementia,1,,
"Honestly, telling someone they have dementia/alzheimers is generally not a good idea. Who would react well to that? Nobody. It's an instant cause of fear, anger, and denial. It would be extremely hard to convince someone they have a memory problem. Perhaps in a lucid moment they'd realize something was wrong, but generally not. I'd stop wasting your efforts there. And honestly, ""telling her"" she has a problem and making a bet about it.... That seems very disrespectful to me. I would be offended if I was her. I understand you're doing what you can to get her evaluated, but it's important to go about it the right way.

You can report her to Adult Protective Services- this is probably your best option- they will come out to do an evaluation, and hopefully take over. If they don't or you're not willing to call, you can try writing a letter to her doctor expressing your concerns. Don't get in the car with her. 

Yes, there are medications that might delay progression- Namenda, Aricept and Exelon. They aren't right for everyone, but many people do take them in the early stages. There are also meds to help with anxiety, hostility, paranoia and depression she may be experiencing. ",,,,applesangria,,,1467778118,t5_2rfqf,t3_4rg4gv,t3_4rg4gv,2,1471233465,0,0,d50z6qt,dementia,2,,
"Let me start by saying thank you to your advices. Some of the things you said I didn't know where possible (or just forgot) and were extremely helpful. 

About the diagnosis portion:
 - She has talked to dead people but rarely. Looking back, they happened when she out right refused to sleep for 48 hours and sometimes after she takes the quetiapine (she really tries to fight the urge to sleep ... it usually takes at least 3/4 hours to make her sleep with 25mg of quetiapine). But she confuses people all the time and I never contradict her, even when she can't say words I just complete her thoughts with random words like ... ""thing"", ""them"", ""him"", ""her"", etc.

About the liquid medicine. I completely forgot about it. I'll talk to her physician. 

About the mood. I almost understand her behaviour like science. I can tell when she needs to pee, I can tell when she starts getting too agitated and then starts crying non stop (usually a few hours after citalopram) so I give her plidex, a medicine with 3.5mg of diazepam. It usually calms her down but it doesn't work all the time and I am really afraid of giving her too much medicine, because I know it can worsen her condition.

About the bathroom. Probably too much information given in the original text. I just meant to say that she barely walks to and from the bathroom. Today she walked a lot more than she usually does and she did it until her legs were shaking (it's really difficult to tell when she's tired ... I said she walked a lot more but it must have added up to 1 or 2 blocks, which is not much).

About the dizziness. It started in 2002/2003 (I was 14) when all of a sudden she stood up from the couch looking like she was agonizing and she ""drunk walked"" (body pressed against a wall) until she reached the bathroom and started puking. She put her head on the sink, spread her legs and put her butt on the wall (very thin bathroom) or else she would fall. I attribute that episode to the beginning of her condition, I truly believe that this is the moment she had her first micro infartion. She went to doctors but they all said: ""you're fiiiine .. you're gonna outlive us all"" and all that ""jazz"". Some of them treated her for vertigo. She suspected it wasn't vertigo, but like all doctors, if there isn't anything showing on THEIR OWN exams, then it's nothing. She did the next MRI many years later when I forced her to and by then the damage was already done.

About making feel better. The thing about doing things she liked is that the only thing she did was work, drink some [mate](http://nobsbb.nobsbb.netdna-cdn.com/wp-content/uploads/2013/10/Yerba-Mate-Bombilla-300x259.jpg) with her mother while watching TV and she can't watch TV anymore because she confuses reality and TV. Fortunately I always aggree with her reality and I go along with everything. Probably the only thing I was doing right. The only thing I can make her do is hug her and kiss her a lot, because it's the only way we can communicate, but it's really difficult for me, I'm not a very touchy person, I don't like being affectionate, I wasn't even affectionate as a child, but I can't complain. That's one f the few moments she feels well. What kills me are the 5 minutes she's completely lucid she says that she wants to die or asks me to kill her.

About coping. This is my first attempt at coping. I tried talking with her brother, but he's kinda closed up and the rest of the people don't really understand. As much as they may love their grandparents, when it happens to a parent or parental figure it's so much worst. When my grandmother had it I prepared myself and was able to get over it really fast, but now that it's happening to my mother I'm breaking down.

About being a carer. I am while I'm here. It kills me but I can't leave my job to take care of her and I can't take my job closer to her, so I'll have to worry whenever I'm away and stay by her side when I'm not working.

Again thank you for your help. Saying these things actually made me feel better and understand it a bit more, even though I couldn't give much information and also pardon my english. It's not rusty, I use it every day for my job, but it isn't my first language and I find it difficult to express myself sometimes. ",,,,morcillazo,,,1467339666,t5_2rfqf,t3_4qn31b,t1_d4unnod,2,1471072364,0,0,d4uu8ha,dementia,2,,
"Rip the band-aid off.  My mom has been in hospice for two years now.

Keeping someone alive when all they do is stare at the ceiling is awful.",,,,I_WantMyMother2Die,,,1467866402,t5_2rfqf,t3_4rlu37,t3_4rlu37,1,1471258658,0,0,d52fl3w,dementia,1,,
"&gt;Plate size won't cure the compulsion to jam too much food in her mouth

No, I know, I meant it would help control portion size; you can only fit so much on a plate.",,,,AvengeThe90s,,,1469213181,t5_2rfqf,t3_4u10h7,t1_d5mo96j,1,1471609389,0,0,d5mp19s,dementia,1,,
"Never mind. You are perfect, be happy.",,,,lagnaippe,,,1468805752,t5_2rfqf,t3_4t5stl,t1_d5gahgg,2,1471498723,0,0,d5gak62,dementia,2,,
She lives in a different state and my uncle lives with her. As soon as we realize there is a problem we try to fix it as fast as possible. My uncle is a bit of a loser and is just using her for the house so he doesn't always let the rest of us know when there is a problem right away. We are doing the best we can so please stop judging me when you have no idea about the situation! we are currently trying to move them out by us so we can watch them.,,,,shadinik1,,,1468803149,t5_2rfqf,t3_4t5stl,t1_d5g8oki,2,1471498027,0,0,d5g92z6,dementia,2,,
"i have got a diagnosis for psychosis, voices have gone away but nothing for my worsening memory",,,,dying_atheist_117,,,1467586478,t5_2rfqf,t3_4r329h,t1_d4y5g4d,1,1471184695,0,0,d4y5yn9,dementia,1,,
"""Sounds like you need to pay better attention to her needs"" yes you are judging! This hasn't been easy for her or her family and we are trying to do the best we can to make sure she has the best life that she possibly can!",,,,shadinik1,,,1468805620,t5_2rfqf,t3_4t5stl,t1_d5g9mrn,1,1471498687,0,0,d5gahgg,dementia,1,,
"Welcome to the club, dear lady. It may seem like a daunting task, but you will love yourself for what you are doing. I have found a strength in myself that I had no idea I possessed. You will too.",,,,chukklhed,,,1468995386,t5_2rfqf,t3_4toa6k,t1_d5j56pq,3,1471549980,0,0,d5j972n,dementia,3,,
"Thank you. I will. ",,,,motherfuckinghell,,,1469597085,t5_2rfqf,t3_4uqdra,t1_d5sgdqs,1,1471711609,0,0,d5sm0k8,dementia,1,,
"Please feel free to message me if you'd like to talk more! ",,,,applesangria,,,1469023033,t5_2rfqf,t3_4toa6k,t1_d5j56pq,1,1471554824,0,0,d5jjavh,dementia,1,,
"Both my in-laws were diagnosed by their idiot family doctor with Alzheimer's. My FIL's symptoms were rapid mental decline in big drops in function overnight, (which has to mean vascular dementia, does it not?) and my MIL had asthma and every symptom in the book for low thyroid function but only had a TSH test to rule it out. No Free T3; no free T4, no antibody tests. Unfortunately, they were in my SIL's care, who wouldn't listen to our input.

Given that AD has an extremely high rate of overdiagnosis, you'd think they could try a little harder to rule out what they can. Some of these issues are curable!",,,,GETitOFFmeNOW,,,1468730251,t5_2rfqf,t3_4ku8o5,t3_4ku8o5,1,1471481765,0,0,d5fbhl3,dementia,1,,
[removed],,,,[deleted],,,1469032620,t5_2rfqf,t3_4tqpwg,t3_4tqpwg,1,1471558153,0,0,d5jq741,dementia,1,,
"If assisted living is in the future, it's generally better to move sooner rather than later. As the memory declines, it will be harder and harder for her to adjust. 

Yes, it sounds like she could use some extra help. I've used care.com successfully to find caregivers, and utilized the background check feature. Make sure to call references and interview carefully, and have the carer start slow- go out for lunch one day, spend half a day, then work up to a full day. ",,,,applesangria,,,1468624381,t5_2rfqf,t3_4t10wd,t3_4t10wd,2,1471458068,0,0,d5dy6z4,dementia,2,,
"I'll do that, thank you",,,,morcillazo,,,1467337139,t5_2rfqf,t3_4qn31b,t1_d4urdur,1,1471071653,0,0,d4usq5g,dementia,1,,
"This! I found out there is an adult day care in my town. It's only $10 an hour and they do breakfast, lunch, and snacks. It's basically a nursing home but all the seniors go home at the end of the day. They get to interact with people their age, play games, take day trips etc. Now if I could just convince my dad to go...",,,,mgcarter3,,,1467643736,t5_2rfqf,t3_4qltih,t1_d4u2vf7,1,1471195893,0,0,d4yt7je,dementia,1,,
Have some one help her bathe weekly.,,,,lagnaippe,,,1468786964,t5_2rfqf,t3_4t5stl,t1_d5fp334,1,1471493321,0,0,d5fzi0b,dementia,1,,
"Just try to remember that its not her doing it, its the disease. The info they give you at hospital won't help cure it, but it will help you deal.",,,,kakatak,,,1469686826,t5_2rfqf,t3_4uqdra,t3_4uqdra,2,1471745179,0,0,d5u4hpg,dementia,2,,
"My mom is newly going through this, thank you for that comment, you just unlocked a huge piece of the puzzle for us.  We called them delusions, which really upset her.  The Wikipedia article on confabulation is excellent.  This explains so much.",,,,EnjoyingPassageTime,,,1469880988,t5_2rfqf,t3_4l2tqv,t1_d3qc71m,1,1471796407,0,0,d5x36p8,dementia,1,,
"Telling people won't help me kill myself but a legal document will?
Anyways, an advance directive is meaningless if the next of kin doesn't agree to it. Your next of kin can override any living will if you're not capable of making a decision - no matter how legal the document is. Not that I can write a legal document that says ""I'm gonna kill myself now"". Not in my state, anyways. ",,,,SarahMakesYouStrong,,,1467461466,t5_2rfqf,t3_4qgjil,t1_d4vj5ar,2,1471156048,0,0,d4wifc8,dementia,2,,
"I have had both. Just die. One died in 24 hours, the other took 10 freaking years. ",,,,corbie,,,1469144110,t5_2rfqf,t3_4rlu37,t3_4rlu37,1,1471591363,0,0,d5lnie3,dementia,1,,
"Thank you for your responce, it does seem that a specialized facility may be what she needs. Unfourtionatly I live a days drive away, but try to call often. In fact I'm taking Monday off so I can see them this weekend. :)",,,,BayAreaSteppen,,,1467818836,t5_2rfqf,t3_4rfufq,t1_d51cx18,1,1471241982,0,0,d51gr4t,dementia,1,,
"I used to care 24/7 for my grandma, and now I oversee her care. You should request regular time off, most importantly. I have a feeling you will soon be tired of 24/7 care without a break. I hired a caregiver for my grandmother, and she gets 1 evening (4 hours) off mid-week, and a 24 hour block each weekend, as well as 1 extra paid day off each month. You can also request time off (probably paid), to be arranged in advance- in which case they'd have to hire a sub or book her into respite. 

Make sure you get a reasonable salary, don't give a lowball salary just because you're family- I did that for over a year, and it bit me in the ass when I stopped doing her daily care, because I had very little saved up.

Guard your ""off time"" and mental health like it's a lion guarding her cub. Because it's family, they may expect you to bend the rules occasionally, but it's incredibly easy to be taken advantage of. If you ever feel like you need to walk away from the arrangement, do it and don't feel bad.

Make a plan for your medical insurance. Will they pay for it, or you? Most live-ins pay for their own.

Ask for a discretionary fund or weekly allowance for going out for movies, meals, etc. Ask for a credit card or debit card to use when purchasing groceries, clothes, etc for grandma- not a good idea to take it out of your account and get reimbursed. 

Decide who will be in charge of filling prescriptions and doing med boxes. Usually the aid does this, I happen to do my grandma's because I cover her day off every weekend.

Figure out how you'll pay your taxes- ask the lawyer about this. 

Beyond the legal and practical aspects, be prepared for a hell of a ride. I'm honestly wondering if you know what you're getting yourself into (not that anyone really does!). But it seems like your heart is in the right place, and that goes a long way for getting through the days. Read the 36 Hour Day, read and watch everything you can from Teepa Snow (super super helpful) and find a good support group on Facebook (caregivers hub support group is my favorite). Make sure you know how to do assist her with mobility- how to hold her arm when getting her up, how to get her into bed, etc. Read up on the type of dementia, the stages and characteristics of each, and how to handle common ""problem behaviors."" Be prepared for this to test your patience in every way imaginable. Be prepared for all reason and logic to go out the window. Don't be afraid to get creative when problem solving!! 

Other things that may make your life easier: stick-on door alarms are cheap and work great, a baby monitor for her bedroom, hygiene aids (shower seat, disposable shampoo cap, body wipes), lockable/hidden medicine organizer. 

Best wishes! You will do great.",,,,applesangria,,,1468981181,t5_2rfqf,t3_4toa6k,t3_4toa6k,3,1471546293,0,0,d5j1jhs,dementia,3,,
