body,score_hidden,archived,name,author,author_flair_text,downs,created_utc,subreddit_id,link_id,parent_id,score,retrieved_on,controversiality,gilded,id,subreddit,ups,distinguished,author_flair_css_class
"Hi r/dementia! I thought you may like this.

As you probably know, September is International Alzheimers month. For this, I'm doing a squat challenge, with all money raised going towards Alzheimers Society. 

in short, I'm doing ten squats with 100kg on the bar for every branch of my workplace (Wilko). this works out as 129 a day for 30 days, as there are 387 branches in the UK. it'll all be done via livestreams and saved afterward so it'll easily be seen as proof. 

if you can donate, that would be awesome. if not, sharing the page would be great too! it's in September so there's plenty of time to donate, and I would love you all forever for any kind of help you can give (financially or not) :)",,,,Cornupication,,,1467554770,t5_2rfqf,t3_4r23fl,t3_4r23fl,1,1471175816,0,0,d4xnmqi,dementia,1,,
"I've had both the blessing and curse of raising up a baby(now toddler) while caring for my grandmother with dementia. The crossover in observable behaviors is a real head trip sometimes. Both my grandmother and my son would do this, and luckily it was a relatively short lived phase for both. The only thing that worked that also mitigated the risk for choking was pre cutting all foods into manageable sized pieces and staggering the portions. What I mean by that is let's say you make chicken, green beans, and broccoli for dinner. I would give portion out one bite or one manageable mouthful on their plate. Nothing more. When they safely finished that portion, I would portion out some more. The major downside to this was meals became an hour+ long event and I had to tailor meals to allow me to do this. It's really hard to do this with soup FYI. Things that can be cut up work great. 

As for number 2, we call it Dementia Blindness. It gets worse and you may start noticing her reach past items to grab things. Dementia not only affects cognitive functions like the executive command center and memory, it affects our brains ability to interpret stimuli like images, sound taste, even spatial perception. Our brain naturally filters out like 90% of the stuff that comes through our optic nerve. A brain melted by dementia no longer naturally provides that same filter and suddenly someone with mid to late stage dementia has major issues with identifying things visually. I've been through the spectrum with gram in terms of dementia progression. In some cases, the brain registering even half of what is coming through the optic nerve is being exceedingly generous. Gram is essential blind, though not blind in the sense that you or I understand it. She sees stuff, but she has no way of interpreting it on a regular basis. Every once in a while a piston will fire and she'll focus on my shirt, but those instances are becoming few and far between these days. Keep an eye out on that one and if you start seeing her cram non food items in her mouth, lock up items that she may mistake for food like dish detergent other cleaning products. Gram once though a sponge was a sandwich. I had to quite literally wrestle it from her. ",,,,DoctorFlimFlam,,,1469162489,t5_2rfqf,t3_4u10h7,t3_4u10h7,3,1471596850,0,0,d5lyt8d,dementia,3,,
"He visits the doctor every 6 months ago for regular blood work done. I am not sure about a CT scan though and he is not diabetic. On his bad days he generally seems anxious and nothing like himself. He really panics and gets worked up about there being any change to his normal schedule and the way he acts is unrecognisable to what he will be like the very next day.

On his good days he will be like his 50year old self chatting, going for walks, reading etc etc... It is just so strange. 

I would love for him to have a full medical whilst here in the UK as I don't really trust the doctors in India (they seem more concerned with trying to make money from his medical needs than helping us) however, unfortunately our family in no way can afford the private medical costs.

Sorry about the late reply, its been hectic few days and thank you very much for replying!
",,,,GameNWatch0,,,1468404616,t5_2rfqf,t3_4s0h6j,t1_d55rn6g,1,1471396614,0,0,d5aeccv,dementia,1,,
It's because keeping them alive generates more income for the healthcare system than letting them die.,,,,I_WantMyMother2Die,,,1467911552,t5_2rfqf,t3_4rlu37,t1_d52v6jq,1,1471269158,0,0,d531hg5,dementia,1,,
"I understand. It's gonna work out, you'll pick yourself up and find a solution or get a break. You need some help, go find it. Hang in there!",,,,goosetavo2013,,,1469912915,t5_2rfqf,t3_4vbsw7,t3_4vbsw7,1,1471804835,0,0,d5xkq54,dementia,1,,
I agree with this,,,,rocketduck413,,,1468115690,t5_2rfqf,t3_4s0h6j,t1_d55rn6g,1,1471323706,0,0,d566o7r,dementia,1,,
"We tune them out. My SO has bore the brunt of it for many years...he brushes it off. Whenever one of those comments is directed at me, I redirect or simply do not acknowledge it. 

  We care for his grandparents. Grandma is developing dementia faster than Grandpa. Grandpa has type 2 diabetes and refuses all treatment, is convinced that his doctors are all out to take his money etc. He has no self control when it comes to food, so I hide foods that I buy for SO and I. He spends thousands on cookies and ice cream and things for Grandma to cook. ",,,,Kat82292,,,1469290831,t5_2rfqf,t3_4qgw60,t3_4qgw60,1,1471627559,0,0,d5nqcvd,dementia,1,,
"THANK YOU!! Thank you so much for your wonderful advice. You're correct, I really don't know what I'm getting myself in to, so as much advice as I can get is fantastic. ",,,,laurenj007,,,1468986991,t5_2rfqf,t3_4toa6k,t1_d5j1jhs,2,1471548011,0,0,d5j56pq,dementia,2,,
"Hi kbsncme 

Sorry for the very late reply. That is something we hope to introduce in V2.0 in our device. In 1-2 years. perhaps the technology will be there. ",,,,eSole,,,1467726903,t5_2rfqf,t3_4l0264,t1_d4s7s7f,1,1471216061,0,0,d4zyuwz,dementia,1,,
"This sucks - I'm sorry your family is having to deal with this. It's good you are involved enough to notice what's happening and are concerned. Your grandfather needs lots of support right now, as the caregiver - I don't have any Boston-area information, but I'm sure you'll be able to find something. Your grandfather might not want or need a the kind of ""support-group"" experience that younger generations are familiar with, but he will probably appreciate READING information about how others are coping. Giving him a specific reason to open up and share his thoughts and feelings will help too - when my mother was in the later stages of FTD-related dementia she and my father would periodically visit a clinic at Johns Hopkins University that was conducting research on her condition, and that gave him a practical outlet to talk - for science! - which I believe helped; whereas I doubt he would have felt comfortable joining or attending a social-network-based support group. Just a thought.  Good luck.",,,,postliterate,,,1468441899,t5_2rfqf,t3_4sp5be,t3_4sp5be,1,1471408092,0,0,d5b2b6n,dementia,1,,
"I almost laughed out loud when I read this. My mom was the same after a surgery. Packed everything up in trash bags constantly and wanted to leave this odd ""vacation home that looked just like her home"". Talk to a geriatric doctor and see if anti-anxiety or antipsychotic drugs work. For my mom, she needed to heal from brain surgery and get her meds adjusted a few times over 3 months to get back to somewhat normal (just forgetful and confused about time/place). Best wishes, you are not failing, this is just the disease. Hang in there and get professional help.",,,,goosetavo2013,,,1469587342,t5_2rfqf,t3_4uqdra,t3_4uqdra,2,1471708875,0,0,d5sgdqs,dementia,2,,
Memory loss may not always be the first signs of dementia — changes in behavior or personality might be an early clue.,,,,Taking22Tango,,,1469543593,t5_2rfqf,t3_4uowrg,t3_4uowrg,1,1471692381,0,0,d5rhxql,dementia,1,,
"They were both in their early 70s and deteriorated rapidly within just a couple of years. Not typical of Alzheimer's patients who can linger for on the average of ten years.

20% of women over 65 have low thyroid, yet a huge chunk of them are undiagnosed. Yes, the single thyroid test that is often given to rule out thyroid disease is much too big a crapshoot in sensitivity to rely upon. These folks are told by the AACE (endocrinology guidelines board) that the TSH is ""extremely accurate,"" when there is zero evidence to support that assertion. It has *never* been tested for sensitivity. The way in which the initial reference range was set included a pool of women who weren't excluded for thyroid disease. It's certainly not reliable enough, being a test of the pituitary output, to eliminate hypothyroidism as a possible culprit. There are other tests that are much less expensive than a round of Alzheimer's drugs. 

My mother-in-law had nearly every single low-thyroid symptom: extreme cold intolerance, joint aches, low appetite, extremely dry skin, fatigue, high cholesterol, anxiety, insomnia etc. etc. She should have been more thoroughly screened. 

It's impossible to say how many of those 45% of Alzheimer's patients who are misdiagnosed have thyroid disease, but my guess is that it is a lot. Thyroid disease is extremely inexpensive to correct, relying on drugs that are *long* out of patent. I feel that the influence that big pharma have over the AACE could be to blame (they fund every convention/seminar they have, many to vacation locales, etc.) As you know, it's much more lucrative to medicate someone for Alzheimer's.

The same might be said for B12 deficiency, which is also terribly underdiagnosed in the elderly. 

This might be worth checking out for more in depth understanding of testing problems in eliminating non-Alzheimer's causes of dementia: www.logicalneuro.com

",,,,GETitOFFmeNOW,,,1468775363,t5_2rfqf,t3_4ku8o5,t1_d5fblg8,1,1471489826,0,0,d5fs86d,dementia,1,,
"I feel for you, you are on the start of a tough journey.  Be sure to have your dad sign a Power of Attorney document for you, this will allow you to do stuff for him, when he can't.  He needs to give you POA while he is still cognizant of what it means.  Secondly, lookup your Area Agency on Aging office, and give them a call...they can begin to hook you up with all sorts of available resources.  You might also want to consult with a specialty eldercare attorney, they can advise you on how to best position your dad and yourself financially, to prepare for eventualities, and qualify for benefits.",,,,MostlyCivil,,,1467643245,t5_2rfqf,t3_4r4gub,t3_4r4gub,3,1471195768,0,0,d4ysy13,dementia,3,,
"What brought you into the clinic specifically for this testing? Behavior/language deficits and decline in behavior/language are still the best markers for FTD.  Did you self-refer or did a family member bring you? Look up ""lack of insight"" and FTD. While it might be more common now, FTD patients aren't often known for self-referral

Do you have history of alcoholism; do you have sleep apnea (or are extremely overweight); do you have depression? These can often muddy neuropsychiatric results and can even be seen on pet-scans. 

Is the clinic you went to especially known for FTD diagnoses and treatment? Although FTD is more well known than in the past, I would expect that diagnosis is still dicey. Unless the clinicians themselves have extensive experience with FTD, I would get to a clinic that does. A lot of time, they can help with costs. This is the biggest on the east coast: https://ftd.med.upenn.edu/our-center. There is a growing network of help for people and families with FTD and a number of support groups with FB pages, etc. I would focus though on just getting information.

I don't want to give you false hope--I'm not a clinician--but I have experience with the condition and the diagnosis itself is complex and you should really be working with a clinical staff that is experienced with it.
",,,,hackenberry,,,1468700367,t5_2rfqf,t3_4t5y2m,t3_4t5y2m,2,1471474310,0,0,d5ew0c7,dementia,2,,
"I too am caring for my dad with dementia. He doesn't have a positive diagnosis because the testing takes over four hours and is an hour away. His mother died with dementia at 98. He's only 78. We believe it started five years or so ago. It started with being very mean for no reason. We didn't notice be wake my dad has always been an asshole so it was hard for us to distinguish that as different. Fast forward a couple years and he's let junkies move into his home. They stole everything from him. Things got bad. 

Now I don't work because I can't leave him alone. He can't cook or prepare food at all. He can't drive. I'm exhausted. I have zero help. I've been here six months so far. 

I know how you feel! PM me any time to you need to chat or vent! 

* some states offer small payments for respite care, call the Alzheimer's association in your state and see what services are available. His insurance might cover some home health so you can step out to work a few hours a week. ",,,,mgcarter3,,,1467642983,t5_2rfqf,t3_4r4gub,t3_4r4gub,3,1471195703,0,0,d4yst22,dementia,3,,
"Unfortunately, this is the path most Alzheimer's therapeutics are taking. They fail the clinical trials, but if they torture the data enough, they find a small subset of patients that respond to the treatment - even though they have no explanation why they responded and others didn't. The same thing happened to Azeliragon, linked below. This is definitely a step forward, but a very insignificant one in my opinion.

http://www.alzforum.org/therapeutics/trx0237 
http://www.alzforum.org/therapeutics/azeliragon",,,,AmericanResearch,,,1469765545,t5_2rfqf,t3_4v2szf,t3_4v2szf,3,1471768661,0,0,d5vhalp,dementia,3,,
"The most common way to ""kill yourself"" is simply to refuse treatment which might prolong your existence, such as feeding tubes. All that needs to be in an advance directive, otherwise it makes things much more difficult for your next of kin
http://www.mayoclinic.org/healthy-lifestyle/consumer-health/in-depth/living-wills/art-20046303",,,,parsonageturner,,,1467572610,t5_2rfqf,t3_4qgjil,t1_d4wifc8,1,1471180665,0,0,d4xxkrx,dementia,1,,
"One of the possible symptoms of dementia is water phobia. On Mondays, I have a client that I bathe and she acts as if I am pouring boiling oil on her. I work as fast as possible. Another client we use ""No Rinse"", but bathe her less frequently. She scratches and bites.",,,,lagnaippe,,,1468762660,t5_2rfqf,t3_4t5stl,t3_4t5stl,1,1471486556,0,0,d5flhf7,dementia,1,,
"I have no appropriate advice, except to echo wha u/rocketduck413 said. I'm very sorry. ((Hugs)) ",,,,applesangria,,,1468780996,t5_2rfqf,t3_4t5y2m,t3_4t5y2m,2,1471491547,0,0,d5fvqgu,dementia,2,,
"My mother has dementia and has similar preoccupations.  I think it's because she was so independent before managing her own medicines.  But I've since taken over due to her condition.  So she fixates on requesting Tylenol, laxatives, and antacids.  After multiple doctor visits we do know she is in no distress and is just fixating. So, I've designed a placebo system that seems to be working.  Whenever she asks fora Tylenol (she only does this once per day), I give her a calcium tablet (she needs it anyway).  When she asks for a laxative (she loves Exlax for some reason, I give her a square of dark chocolate), and when she asks for an antacid I give her a certs.  

If she was in any real distress she would stay in bed and definitely appear ill and then I would most certainly give her something or take her in for a checkup. But, so far so good.",,,,babygirlga,,,1470000824,t5_2rfqf,t3_4vi8n0,t3_4vi8n0,4,1471825719,0,0,d5ys9s7,dementia,4,,
"Thank you, u/motherfuckinghell, lol. I had forgotten all about this.",,,,adj1,,,1469582953,t5_2rfqf,t3_4k6bnk,t1_d5rxski,1,1471707400,0,0,d5sd948,dementia,1,,
I'd be talking to specialists and applying for clinical studies.,,,,Lordica,,,1468712896,t5_2rfqf,t3_4t5y2m,t3_4t5y2m,1,1471477620,0,0,d5f2v34,dementia,1,,
"I'd rather my loved ones (specifically my father, who is still lucid but may well be vegetative if he makes it another year) died quickly.  There is nothing about this life that he truly enjoys enough to make it go on any longer.  It bugs me that people with clear dementia issues aren't allowed assisted suicide in US states that actually legalize suicide for the terminally ill.",,,,caseyoc,,,1467903658,t5_2rfqf,t3_4rlu37,t3_4rlu37,2,1471266167,0,0,d52v6jq,dementia,2,,
"1st - you do want to refer to yourself as a caregiver, not caretaker. There's a connotation there that makes an immediate difference in people's minds. Caretaker is for a property. 

Be ready to be more flexible than you've ever been before. You react to what is going on -right now- because that is how she will see the world. You'll get angry and exhausted, that's part of the job. It's how you deal with it that makes the difference. You take your little victories where you can and develop an extremely short memory for the things that frustrate you. 

Look through the Family Caregiver Alliance website. There's a lot of good information there. There's this too, which I printed out and still read through occasionally after 6 years of this. 
https://www.caregiver.org/communication-dementia

The time off that applesangria talked about is very important. You have GOT to get out of the house sometimes! I really think that's the difference between success and failure. 

If you only remember one thing it's this. Remember that when it gets crazy or contentious or frustrating - it's the disease talking. ",,,,Plainguy36,,,1469022472,t5_2rfqf,t3_4toa6k,t3_4toa6k,2,1471554661,0,0,d5jiyfo,dementia,2,,
"This situation sounds very similar to what I was dealing with last year with my mother-in-law. You make a lot of really great suggestions. Redirection can be a powerful tool. Keeping her happy can also help a lot - BUT - I strongly discourage cooking - that's an easy way to burn down a house. Looking through photographs or even just pretty pictures is something that requires little brain power and can be done repeatedly daily. We finally got to a sort of holding pattern by keeping her happy, reducing stress on her, and regulating her access to medications (even things like blood pressure and diabetes meds can really affect mood if taken sporadically).",,,,chemshua,,,1469634559,t5_2rfqf,t3_4uqdra,t1_d5rz9qp,1,1471727208,0,0,d5t2ya2,dementia,1,,
"Would you be able to format this with some line breaks so it's easier to read? I really want to understand what's taking place and provide whatever helpful feedback that I can, since so much of this is learning as you go along, but this is really difficult to read, and being a primary caregiver and having to divide my attention...",,,,argyle47,,,1467771531,t5_2rfqf,t3_4rfufq,t3_4rfufq,1,1471231625,0,0,d50va6r,dementia,1,,
Wow! I'm sorry to hear about your dad's accident. Your suggestions are great! I can't wait to share them with my family. Thanks for responding! ��,,,,KChante,,,1469300432,t5_2rfqf,t3_4tx8xl,t1_d5lwl8w,1,1471630336,0,0,d5nw015,dementia,1,,
She isn't bad enough yet for us to be able to make her think that she actually needs help taking a shower. Other then her crap short term memory she is still really physically healthy and still functions normally.,,,,shadinik1,,,1468798324,t5_2rfqf,t3_4t5stl,t1_d5g0lb4,1,1471496673,0,0,d5g6dos,dementia,1,,
"Also, if the affected person is a military vet (in the US), be aware there are available benefits that will help a lot: either to help with home health care or to the veteran's home (if it comes to that).",,,,not-rocket-science,,,1467644480,t5_2rfqf,t3_4r4gub,t1_d4yst22,1,1471196088,0,0,d4ytmdx,dementia,1,,
"Thank you. For your empathy and love. I live in Saudi Arabia, there aren't any care facilities for Alzheimer's patients, unfortunately. ",,,,motherfuckinghell,,,1469572753,t5_2rfqf,t3_4uqdra,t1_d5s5d4j,1,1471703742,0,0,d5s5nql,dementia,1,,
Make plans now. Choose facilities that you like. Get a health care proxy,,,,rocketduck413,,,1468699172,t5_2rfqf,t3_4t5y2m,t1_d5etl06,4,1471473992,0,0,d5evc2x,dementia,4,,
You are just a bully. You can give advice and suport without being rude.,,,,shadinik1,,,1468810055,t5_2rfqf,t3_4t5stl,t1_d5gbtii,1,1471499851,0,0,d5gcyc0,dementia,1,,
today started off very bad. it's only 9:30 am. Pawpaw woke up this morning and rampaged in my room telling me to get out of his house so I stormed out and was speeding and I killed somebody's cat so I sat on the side of the road and cried and puked and was late to work so i just called work and said i couldnt come in so now i'm back at home hiding in my bedroom,,,,Desirai,,,1469889453,t5_2rfqf,t3_4tqpwg,t1_d5k2b1q,1,1471798068,0,0,d5x6pkg,dementia,1,,
"I agree.  You have to find a way to very him to a dr. Even if it means tricking him... I'd there anyone he trust besides your grandma that can perhaps convince him to go to the Dr? If so, let them do it.  People with dementia often trust one particular person more than others.",,,,KChante,,,1469110652,t5_2rfqf,t3_4tqpwg,t3_4tqpwg,1,1471579461,0,0,d5kyn09,dementia,1,,
"Yeah, I wondered about that too... �� Thanks for the advice! ��",,,,KChante,,,1469155277,t5_2rfqf,t3_4tx8xl,t1_d5ln1sz,1,1471594745,0,0,d5luilq,dementia,1,,
"Soo... Grandma was right, not paranoid. Your mom could write a little note to pass to the waitress or find some other subtle way to communicate. ",,,,jessiquark,,,1469589301,t5_2rfqf,t3_4urkal,t3_4urkal,2,1471709583,0,0,d5shpqt,dementia,2,,
"Someone in another forum asked me to answer this. I thought maybe it might help you a little too... 

""How do you survive this disease with your sanity intact?"" 

Well, I don't think you really do. Going through this has to take some mental, physical, and emotional toll. It just has to. So you just cope as well as you can - which is all you can do. 

The necessities for me:

An intact sense of humor. When you start losing that you need help right away. That is what made me pickup the phone and call a therapist finally.  

An ability to lie. We like to call them ""fiblets"" and that's OK but sometimes you need to pull a whopper out of nowhere. 

Stay away from the booze. A little sumthin' sumthin' now and then, yes. But drinking to make it all go away is a 100% recipe for disaster. 

I have little semi hidden signs around the house. ""It's the disease stupid!"" For when my wife has really pulled something that pissed me off or made me want to cry. And I need to remind myself it's not her fault. 

A good cry now and then don't hurt nuthin. As long as you can stop. 

Learning to accept that ""I don't know"" is a perfectly acceptable answer to any ""why did you?"" question. They really don't know.

Get out of the damn house once in a while! ",,,,Plainguy36,,,1469163064,t5_2rfqf,t3_4toa6k,t1_d5jze18,2,1471596986,0,0,d5lz3m9,dementia,2,,
"It definitely helps to talk/vent and this is a decent place to do it especially until you are able to find something local to you. 

You have all my prayers and hugs in this situation concerning your grandmother. My grandmother is in a facility for dementia. There were days before she was getting help everything was up and down behavior-wise and now it seems she has settled down but we can tell when she is fixated on something from her past. She used to be a CNA for 28 years in a nursing home and now she thinks she still is in one, trying to bathe the other patients she lives with. We have had to mildly sedate her because she would not and still does not want to sit down and was constantly bossing other patients around or trying to lift them out of bed!

Everyday is easy and then hard but it certainly is an emotional adventure and you do your best to love them as much as possible and keep your sanity intact. 

I recommend looking in local papers for group meetings in your area, MeetUp.com, or even ask in a subreddit of your city if anyone can direct you to Alzheimer support groups for you, your grandpa or anyone else in your family who just needs hugs, encouragement, and/or direction with your grandmother. ",,,,JinaSensei,,,1468463470,t5_2rfqf,t3_4sp5be,t3_4sp5be,1,1471414887,0,0,d5bge6x,dementia,1,,
"Sounds like pretty typical Alzheimers unfortunately... A lot like our house here, and it lasted several years. Good medication management by a geriatric psychiatrist (they are very familiar with dementia and the meds used to manage it) was absolutely key. It took a few months to figure out what was working and what wasn't, but everything is much calmer now. 

You are not a failure, but behavioral interventions (the type of distractions you've tried) only do so much. In cases like these, meds are warranted. They have the ability to improve quality of life hugely. 

FWIW, risperidone has been the lifesaver for us. For us, the potential risks of anti psychotics (we've had zero side effects) are FAR outweighed by the peace &amp; emotional wellbeing she has now. ",,,,applesangria,,,1469990718,t5_2rfqf,t3_4uqdra,t3_4uqdra,2,1471822356,0,0,d5ylavv,dementia,2,,
"Have you considered adult daycare, or hiring a companion to sit with her for a few hours daily? 

What kinds of things did she like to do before? 

A few ideas: 

- sorting squares of fabrics (matching all the red florals, the blue florals, etc) for ""quilting"" 

-  outside time, but only if in a safe area (fenced in yard that's locked!). Lots of things to watch outside. 

-  audio books 

Honestly, as the disease progresses there are fewer and fewer activities they can do independently/with minimal guidance. It's a part of the disease process that they lose the ability to think consequently or take initiative. ",,,,applesangria,,,1467655777,t5_2rfqf,t3_4r7jxn,t3_4r7jxn,3,1471199815,0,0,d4z1cu6,dementia,3,,
