body,score_hidden,archived,name,author,author_flair_text,downs,created_utc,subreddit_id,link_id,parent_id,score,retrieved_on,controversiality,gilded,id,subreddit,ups,distinguished,author_flair_css_class
"I would take her to a good geriatric doc with experience dealing with memory issues. Their tests and much more in-depth than what the GP's do. IMHO regular docs shouldn't give advice on this, my mom's GP administered a est for a couple years where she always scored 90%+ yet couldn't count backwards from 10, always forgot where she was and could no longer drive. Best of luck!",,,,goosetavo2013,,,1471103760,t5_2rfqf,t3_4xf5uc,t3_4xf5uc,2,1473384076,0,0,d6fyzax,dementia,2,,
"The syringes hold about 5-10ml depending on size, she should be sat up when feeding her but as long as the liquid/pureed food is at a consistency she can cope with then she will be fine. It's just a case of little and often, plus fluids are miles more important than food at this stage. Keep her hydrated and I wish you all the best ",,,,Iownfish,,,1471419592,t5_2rfqf,t3_4wd0ff,t1_d6kuoh1,1,1473448830,0,0,d6kv493,dementia,1,,
"Yes...Up until Feb of this year, my mom was what we thought in  late stage 5 to early stage six. Up until that time she had been slowly loosing her speech and basically going through most of the effects of the disease. Then in March she started to rapidly decline. She could only say a word here and there, did not want to eat or drink, and started having a hard time standing and walking. We (my sisters and me) did not realize it at the time but mom had entered the stage that I call the Beginning of the End. By the time May got here mom was so weak we took her to see her doctor, hoping the doctor would give her intravenous fluids to ward off dehydration. To our surprise the doctor told us that mom had reached the end stage of the disease and it was time to call in hospice. The doctor estimated mom had 2 weeks to 2 months to live. Mom died on June 15th, 2016, 2 weeks from the time hospice can in . I was in shock for a few weeks because mom had only been diagnosed 4 years ago and I thought we would be dealing this this disgusting disease for a few more years. Today, however, I can say that as much as I miss my mom, I'm thankful she did not suffer as long as I have seen others suffer. She still knew me and my sisters, and she was only incontinent for one day. These were two of the things she dreaded the most. My mom was ready to go.

I shared my story with you because rapid decline can mean that the end is not to far away. Luckily my mom never had a fall or accident, but for four year, I read everything I could get my hands on about dementia/Alzheimer's and from what I learned, an accident or illness can bring on a rapid decline. Take it one day at a time, and try not to get to stressed out about what tomorrow will bring. Best of luck to you and your family.  ",,,,fitsme2atee,,,1470368888,t5_2rfqf,t3_4vu017,t3_4vu017,1,1473231097,0,0,d64x20w,dementia,1,,
"There will be options for her going forward, I promise.  Try your local 2-1-1 line for information (literally pick up the phone and dial 2-1-1 and tell the operator you're looking for elder-care information).  They will let you know what state resources are available to help out.  My dad had savings, Medicare and we knew he was going to need to be on Medicaid before a year or two were out--when he ran out of his own funds to pay for care centers.  They put us in touch with [A Place for Mom](http://www.aplaceformom.com), which is a service that will ask you what kind of care your grandma needs (in-home, hospice, assisted living, memory care, day care, etc) and what your budget realities are, and then you can work with your state for Medicaid assistance.

Medicaid is a sort of public insurance for people without financial resources.  Elder care facilities generally get paid one of three ways:  private pay (the person or their family pays for their care directly), or from Medicaid (where the state pays), or a combination of the two where a person pays privately until they are out of funds and then gets qualified for Medicaid.

Anyway, there is a lot of information out there, and there's more help than you'd think.  Let me know if I can help you figure it out--I don't know much, but I've learned a lot since I was at square one.",,,,caseyoc,,,1471962671,t5_2rfqf,t3_4z37nk,t3_4z37nk,1,1473557257,0,0,d6t9dyv,dementia,1,,
"You take what you can get with this s&amp;@# disease. Try and concentrate on the good reactions you get and try and ignore the rest. And it's unbelievably hard to do. 

The stages of grief for this disease are different than when someone just up and dies. And certainly aren't any easier. Crying helps. I'm an old guy and I'm not the least bit ashamed when I have a little cry. Something would be seriously wrong if you didn't. ",,,,Plainguy36,,,1471015703,t5_2rfqf,t3_4x2u20,t3_4x2u20,1,1473365342,0,0,d6emwbg,dementia,1,,
"Dementia is a pattern of behaviour that includes memory loss, poor decision making and poor judgement. It's sounds like you mum is stressed and forgot. Talk to her find out what is troubling her and see what you can do to help.",,,,bogart991,,,1471472671,t5_2rfqf,t3_4y6w5e,t1_d6lhl6j,4,1473461769,0,0,d6ltabx,dementia,4,,
"All good suggestions! It's frustrating when they fixate on a perceived issue. For my dad it's a few things, his cat is starving, he has to clean up the yard, I never feed him (major eye roll, he eats almost six meals a day!). It gets old quick! ",,,,mgcarter3,,,1470058110,t5_2rfqf,t3_4vi8n0,t3_4vi8n0,1,1473134824,0,0,d5zjtx0,dementia,1,,
"Push for a PET scan that will highlight non functioning areas.   CT and basic MRI's only show structural issues, not areas of potential plaque buildup. ",,,,ftdALIVE,,,1472569873,t5_2rfqf,t3_4w4re9,t3_4w4re9,1,1473679715,0,0,d72o1kp,dementia,1,,
"Strange behavior is part of the package with dementia. [A change in sense of humor or what they find funny is a red flag](http://www.webmd.com/alzheimers/news/20151111/change-humor-dementia)

Here is some information about the first stages of dementia called ""mild behavioral impairment"". 
[New York Times talking about ""mild behavioral impairment""](http://www.nytimes.com/2016/07/26/health/alzheimers-checklist-mild-behavioral-impairment.html?_r=2)

[Complete check list (PDF)](http://canadanews.ga/polopoly_fs/1.3000545!/httpFile/file.pdf)

Your family needs to take him to a doctor. They can give him medication that will keep the mood swings to a minimum.",,,,darthjenni,,,1470420114,t5_2rfqf,t3_4watlr,t3_4watlr,3,1473240692,0,0,d65nruk,dementia,3,,
Just leaving mom's doctor appt. They will be calling with appts for the geriatric neurologist and a sleep study. Thanks to everyone.,,,,tattooedamazon477,,,1471968685,t5_2rfqf,t3_4xf5uc,t3_4xf5uc,1,1473558969,0,0,d6tdyzv,dementia,1,,
"Oh, that's a good idea. Just wondering, would it be dangerous to feed her with it? She's always taken her food very...very slowly, if I put more food in her mouth would she risk choking or aspirating? 

",,,,xcelleration,,,1471418292,t5_2rfqf,t3_4wd0ff,t1_d69ofj3,1,1473448671,0,0,d6kuoh1,dementia,1,,
"This times a million. I found that I consistently try to communicate and interact with my dad as if he's a normal person with a normal sense of time and the ability to use reason. But he isn't and it doesn't work that way. It only causes BOTH of us anguish. I stopped using time references except with Drs appointments but even that is silly because he doesn't remember by the time we're ready to go. I used to let him know I was leaving the house. Now I just leave and usually when I get back he has no idea I've been gone. Asking yourself questions like ""are they safe? Do they have what they need? Are they comfortable?"" Sadly these are the biggest concerns because most people can't stop their lives to care for a loved one, even a parent.  Not to mention the mental and emotional toll it takes watching someone you love break down right in front of you. Their mental landscape is probably terrifying. I imagine it like the movie ""The Cell"". : ( ",,,,mgcarter3,,,1471014024,t5_2rfqf,t3_4x962n,t1_d6e7urs,3,1473364871,0,0,d6elmod,dementia,3,,
"Just a follow up, got dad rapidly moved into an assisted living center today. He had a meltdown at lunch while i was away moving his stuff. Finally got his cat and pictures and everything and he was okay when i left. Worried about tomorrow though.  :( i felt like they were going to kick him out on the spot. ",,,,Mommob,,,1470887922,t5_2rfqf,t3_4wj7ts,t3_4wj7ts,2,1473340066,0,0,d6ctblx,dementia,2,,
"There's some good advice here. You're 33. You can't and must not let this ruin your life and your marriage. And your Mom, if she was capable of understanding what's going on, surely wouldn't want you to. 

Think about it from her perspective. As soon as she sees you what does she think? She thinks you're there to take her home! When you don't she gets upset and disappointed. And then everybody's unhappy. Remember what's been mentioned here before, she is now living in the ""right now"". When she thinks about you she probably thinks about you as a little boy and probably has no idea what your life is like now. 

Go see your Mom only when you just want to go see your Mom because you miss her. I really hate to say this, but it sounds like frequent visits are hurting more than helping. And do all you can to get rid of your guilt about it. There is nothing, absolutely nothing, to feel guilty about. Seek help if you need to - I did. And it was a hard call to make, but the best thing I ever did. ",,,,Plainguy36,,,1471014939,t5_2rfqf,t3_4x962n,t3_4x962n,1,1473365124,0,0,d6emb5i,dementia,1,,
"A follow up - we tried nonalcoholic red wine and it turned out great!  

He can't tell the difference and feels comfortable to have his drink.  And as a direct result the amount of arguments and aggression at night has dropped from nearly every night to once every couple of weeks which is such an improvement in our quality of life...

Thanks guys!",,,,yetihk,,,1471173570,t5_2rfqf,t3_4dqiy0,t1_d1ttthi,1,1473397017,0,0,d6gy4ac,dementia,1,,
"Sorry that you are going through this. In addition to getting her to a neurologist, I recommend seeing an elder law attorney and getting POA, trusts and end of life documents in place. You only have small window before she may no longer be competent to sign off on these things.",,,,whatsreallygoingon,,,1471060506,t5_2rfqf,t3_4xfsl7,t3_4xfsl7,1,1473377181,0,0,d6finx1,dementia,1,,
"That seems more like a full on stroke to me. Hopefully she recovers well! Do they think there's any permanent damage? ",,,,mgcarter3,,,1471742253,t5_2rfqf,t3_4yrqaw,t3_4yrqaw,2,1473515112,0,0,d6q285j,dementia,2,,
"I can totally relate to this. Damn sorry you're going through this. My grandfather is around 93 and for some reason keeps thinking he has to buy a new house and a new car.

Actually, the hardest thing about all this is not the crazy stuff that he says sometimes, but the fact that he keeps trying to walk around without his walker, or to do physical things without being aware that he simply cannot do them. If he doesn't have his walker, he will very easily fall over. But since he tries to stand up every 10 minutes and walk away, someone has to be watching him 24/7 to remind him to use his walker so he doesn't trip. It's ridiculous, but I feel like everyone's lives who are trying to take care of him would be so much easier if he just sat still and stopped trying to do everything.

Has anyone had anything similar to this and figured out a good solution?

What a terrible disease this is.",,,,shakedown_st,,,1472433165,t5_2rfqf,t3_4z37nk,t3_4z37nk,1,1473655219,0,0,d70n9sv,dementia,1,,
"Yeah, my dad and I were having a conversation about this since I posted. You just kind of have to breath, ignore it, and support each other through it. Because you're right, the learning part is lost. 

Thank you for your response :)",,,,EvinceAgape,,,1470420684,t5_2rfqf,t3_4watlr,t1_d65lhkg,4,1473240846,0,0,d65o82w,dementia,4,,
"Just keep her comfortable and tell her Dad is out shopping. Yes, been though it.",,,,corbie,,,1470513230,t5_2rfqf,t3_4vu017,t3_4vu017,2,1473258555,0,0,d66zryz,dementia,2,,
"Its a most terrible affliction. Looking back, I know that my mother has done the most amazing job of disguising her disabilities over a couple of decades, and she did it so well that we hardly noticed her illness. Which means, though, that during that long long time she bore the burden and secret of her illness and all the anxiety and terror that goes with the growing dementia all by herself, really without our support. Sorry you've had to go through this too.",,,,seedpod02,,,1471044590,t5_2rfqf,t3_4x962n,t1_d6elmod,1,1473373684,0,0,d6f97il,dementia,1,,
[deleted],,,,[deleted],,,1471451963,t5_2rfqf,t3_4wd0ff,t1_d6kuq6p,1,1473455362,0,0,d6lbwqg,dementia,1,,
"Oh she has been, recently. Thank you. That still doesn't explain some of the other symptoms though.",,,,tattooedamazon477,,,1471095274,t5_2rfqf,t3_4xf5uc,t1_d6fkeoq,1,1473381728,0,0,d6fui6t,dementia,1,,
"My MIL went to a day program and with the daily interaction it helped her a lot. She felt like she was going to work every day and really thrived there. ",,,,kirchgirl,,,1471901757,t5_2rfqf,t3_4z2v4t,t3_4z2v4t,2,1473546104,0,0,d6seuin,dementia,2,,
I think you should consider talking to your hospice expert. There is a swab that moistens the lips and if they can get it into her mouth it stimulates thirst.,,,,lagnaippe,,,1470751614,t5_2rfqf,t3_4wd0ff,t3_4wd0ff,1,1473306093,0,0,d6adenn,dementia,1,,
"Could be a vicious circle? She's going through a lot lately.. the situations sounds like an emotional rollercoaster which could lead to stress and thus forgetfullness.. awareness about the forgetfulness could lead to a focus on remembering things instead of being aware of your surroundings thus leading to forgetfullness.. emotional distress (anxiety, depressive symptoms) also coexist with forgetfullness. Maybe she should seek some support from a psychologist. 

Someone else here states that it could be attention seeking.. could be, but there might be other, more common reasons.",,,,Fromfam_Ritter,,,1471884103,t5_2rfqf,t3_4wtccs,t3_4wtccs,1,1473541119,0,0,d6s15p4,dementia,1,,
"My mom had Lewy Body Dementia, and did the exact same thing.  All of it!  She thought I was a double, or my own ""evil twin"", and that she was in a different house that only looked like her home.  This type of delusion actually has a scientific name, ""Capgras Syndrome"".  She also did the thing about seeing little kids or babies that needed her help.

As the other commentor said, sometimes you have to reassure them by entering their reality.  I would tell my mom that her ""other"" house was getting the carpets cleaned, and we would go back soon.  And that I called the kids parents and they were  coming to pick them up, and that they wanted to thank her for keeping such good care of them.  And that I was actually a good friend of MostlyCivil, here to visit, and look I brought cookies!  It's hard, and most often doesn't work...but worth a shot.

Are there old Spanish TV shows from her youth that you can find on YouTube or something?   

Also, please look up your city + ""Area Agency on Aging""  (assuming you are in USA).  Give them a call, and say ""I need help, my grandmother is 90, speaks Spanish, and has dementia."" 

Depending on where you are at, you might get an overworked, underfunded, agency that provides little help...or you might get some free advice and connections to other social services that can provide all sorts of help.

Take care of yourself, do the best that you can, and feel no guilt about leaving to go to school.  It sounds like you have shown tremendous love and care to your grandma, and really helped out your parents by stepping up.  But now that you are going to school, they'll have to figure it out and find a way to make it work, they can't expect you to sacrifice your future.

From experience, I know that no advice ever really helps in this situation...  I wish you and your family strength and happiness.  ",,,,MostlyCivil,,,1471918083,t5_2rfqf,t3_4z37nk,t3_4z37nk,2,1473549993,0,0,d6sprgh,dementia,2,,
"When you go to the doctor tell them all the behavior problems he is having. If dad is irritable that day, you may want to have the conversation with out him in the room. 

If you think it will help fill out this check list, and use it as a guide when you talk to the doctor.
http://canadanews.ga/polopoly_fs/1.3000545!/httpFile/file.pdf",,,,darthjenni,,,1470613141,t5_2rfqf,t3_4wj7ts,t1_d67ry9j,1,1473278388,0,0,d68di43,dementia,1,,
"I'll bring all this up to her and i can get back at you with more information when she wakes up, she just had some dental work done so she's asleep lol. Thank you =)",,,,PsychoticDreams47,,,1470359145,t5_2rfqf,t3_4w7d3r,t1_d64pt6j,1,1473228954,0,0,d64qyng,dementia,1,,
"Ok, since you're done.

1. ""Those records will be available to his doctor, not you"". And when we tried to get him an appointment, we had to go through an unnerving process to just be allowed to take him seeing as the state still holds his money hostage.

2. He actually does remember the promise. Sometimes he'll talk about it randomly and bring it up and say ""Did i ever send you the money for the car?"" and we'll remind him ""Yes, and I paid you back, we have the reciepts saved, remember?"" and he'll laugh and just shrug it off on a ""I guess it slipped my mind. Thanks"".

3. Lets talk about his personality and life. Which for the most part decades ago, was mostly drug and hooker filled. Also, removed from a place where he was stable? Tell that to the people that had to grab him because he jumped over a fence trying to, and i'll quote this ""Escape from this hell hole so we can run away with my money"". As far as going cold turkey off his meds, we literally couldn't do anything about it. Infact, we were told that at that time he didnt even need medication.

Prior to ALL of this, we fought for (i cant remember the word at the moment) because some random lady representing the VA was treating him horribly. We took him to his doctor appointments, we visited him every week, and prior to gaining caregiver, we were told  ""he doesn't need meds"".

You have absolutely no understanding of OUR situation. I gave you the smallest amount of detail because they were the important ones. 

So before you sit there and judge us, let me just say for starters, eat a fucking dick. and for ends, learn the god damned story before you attempt to tell me off based on a person i've known for 20 fucking years.",,,,PsychoticDreams47,,,1470375715,t5_2rfqf,t3_4w7d3r,t1_d650c4o,2,1473232322,0,0,d650lxb,dementia,2,,
"Bolt a lock on to it? Your family can't take care of her if you're all sick! ",,,,rocketduck413,,,1472480729,t5_2rfqf,t3_502vif,t3_502vif,2,1473662280,0,0,d717vk7,dementia,2,,
"Does that happen a lot? if not then she just forgot.
Forgetting where you  put your car keys is normal.
Forgetting that you have a car is not.",,,,bogart991,,,1471454838,t5_2rfqf,t3_4y6w5e,t3_4y6w5e,5,1473456384,0,0,d6lee9s,dementia,5,,
"My dad was always a jerk. Now it's way way worse. He recently got an RX for something called Namzaric. With his insurance it's about $20 a month. It doesn't slow memory loss or stop the disease. It does however, manage the symptoms. It's helping A LOT in keeping him from being unmanageable. Again, it's just treating the symptoms so it may really help your grandpa with the ride outbursts and what not! Best of luck to you! ",,,,mgcarter3,,,1470492325,t5_2rfqf,t3_4watlr,t1_d65orf8,1,1473253803,0,0,d66nvu8,dementia,1,,
"Brain imaging could maybe give you some more clarity on his mental state. A diagnosis solely based on your information is very difficult..

Picks disease is a protein build up in his brain, while a stroke causes damage because brain regions get deprived of blood/oxygen. 

Another possiblity is vasculair dementia in the frontal regions. Basicely this means there are more 'chronic' small strokes in the brains, which leads to progressively worse cognitive functioning over time.

I'm curious: did you get some kind of answer from the clinician?

",,,,Fromfam_Ritter,,,1471884508,t5_2rfqf,t3_4w4re9,t3_4w4re9,1,1473541232,0,0,d6s1gv0,dementia,1,,
"Yes. They can also start to get better before eventually passing, so try to take it a day at a time even if that sounds like a ridiculous cliche. Hold close to the people who are there for you and who can understand and who will be around when she is gone. If possible, find some nurse or social worker or doctor who can help explain your exact prognosis and options and sit with your family while you explore them.",,,,hithazel,,,1470163718,t5_2rfqf,t3_4vu017,t3_4vu017,2,1473158880,0,0,d61dlpw,dementia,2,,
"do you or nearby friends/family have a dog or cat that could come visit? pets are great for dementia patients, can help keep them happy and occupied for a long time, even after the dog leaves and they forget he was ever there. they wont loose interest in a living pet like they will with a movie and the interaction can be benificial beyond the time they spent with the pet. have a read here maybe: http://www.alzheimers.net/2013-05-17/how-can-pets-benefit-alzheimers-patients/",,,,pll1234,,,1470536926,t5_2rfqf,t3_4r7jxn,t3_4r7jxn,1,1473263816,0,0,d67d22y,dementia,1,,
"Here's the one I've been looking at -- founded and run by a Brit and his Thai wife. There's another one run someone else that's Swiss/German (we don't speak German so that one's out). They have graduated care, a 1:1 caregiver:patient ratio, and believe in involving patients with ""home skills"" like setting napkins at a table to keep ""family normalcy"" as much as possible. 

Downsides: it's a 20 hour flight (at least from Seattle, where we are). My partner is...somewhat distant...from life and craves hot/humid so for him it's a potential good fit. We're going over in the next few months to check it out. He's excited about the possibility. 

PS: Care costs are half of comparable care in the US. ",,,,geneve,,,1470502118,t5_2rfqf,t3_4w8pwy,t3_4w8pwy,3,1473255898,0,0,d66t505,dementia,3,,
A new study out of The Rockefeller University has linked Zika to things like memory loss in adults.,,,,Taking22Tango,,,1472581933,t5_2rfqf,t3_50cndc,t3_50cndc,1,1473682892,0,0,d72xbln,dementia,1,,
"A lot of questions can be researched at lbda.org
Please pay particular attention to the ""don't use"" drug list.  I've been surprised at the negative side effects of allergy meds, valium, etc.

Source: diagnosed a year and half ago",,,,Littlewookiedog,,,1472185516,t5_2rfqf,t3_4yz8og,t3_4yz8og,2,1473607104,0,0,d6x40nn,dementia,2,,
