body,score_hidden,archived,name,author,author_flair_text,downs,created_utc,subreddit_id,link_id,parent_id,score,retrieved_on,controversiality,gilded,id,subreddit,ups,distinguished,author_flair_css_class
"Oh, yes. I'm very familiar with the feelings of being sneaky! It really sucks, because the change is so gradual and insidious that you can't mark the point when they have lost control. It's exacerbated by the moments of apparent lucidity.

What helped me was to frame it as maturing in reverse. She is currently somewhere around the level of a preteen. She makes sense and wants to do things, but she can't be trusted with adult responsibilities, and needs supervision. Even though she may be outspoken and will get angry; you have to view it from the perspective of someone who is looking out for her best interest and safety, when she is no longer able to do so for herself.

You'll get to the point where she is like a five-year-old and you won't feel so bad about making the decisions. Just remember what she did when the tables were turned and imagine what she would want if she were able to choose. Also, don't feel bad about not being able to keep her at home and devote your life to her care. She will be much better off in a care facility, where she can be looked after by experts and have all of her needs met.

There will be a time when you will delve into a complete fantasy life with her. Whatever she says or sees will be her reality, and you must play along. Trying to force her to remember or tell her that she's wrong will have no good result, and will cause her distress. I was recently at the facility where my FIL lives and sat with an Alzheimer's patient by the front door. We had a loop of this conversation for about 30 minutes:

Jewel (Resident, as she looks out the door): I'd walk home if it wasn't raining.

Me: Oh, yes. It's raining very hard. Best to stay here, for now.

Jewel: Yes, my house is just on the other side of the expressway. As soon as it stops raining, I'm going to walk home.

Me: It sure is raining hard. Maybe you should stay her for the night?

Jewel: I stayed here last night. I might have to stay again. But as soon as the rain stops, I'm going to walk home.

Me: That sounds like a good plan.

One minute passes, repeat conversation, over and over again.

Best of wishes to you and your family, and feel free to contact me if you need to vent or ask questions!

",,,,whatsreallygoingon,,,1466641116,t5_2rfqf,t3_4pb3k4,t1_d4k2umk,1,1469228446,0,0,d4k5cpq,dementia,1,,
"Ha, you sound just like me with most other people in my life except him.  I'm getting better about it, though--I did stand up to him the night he hurt me so bad and I made it extremely clear he had done an awful thing and I wouldn't put up with it.  One of the things that really burned me is that he said it in front of my 10 year old daughter (who knows Grandpa is an asshole).  His comment was about my weight, and I have been so extremely careful to not drag home any issues or shame about bodies--skinny, fat, tall, short, etc.  So the fact that he put that down in front of her, combined with how strongly it affected me, adds to my fury about it.  It's just kind of a helpless fury though, because I cannot affect any change with him due to the dementia.

In some ways, it almost seems kinder to leave him in a ditch somewhere, because his end would come quickly.  Even though it would be awful, I don't think it's less awful than this long, lingering thing where he's miserable and he makes everyone around him miserable too.  ",,,,caseyoc,,,1467296669,t5_2rfqf,t3_4qgw60,t1_d4tpfhf,1,1469398278,0,0,d4tz7tr,dementia,1,,
"&gt; POA assigned to either my brother or me

That is the step that happens when the person is still competent to assign this authority.   Having an attorney draft POA paperwork is usually $200-$300.

*After* the dementia diagnosis and a competency declaration (which do not go hand-in-hand as people with dementia can function independently for a time after diagnosis), acquiring a POA is no longer legally possible.  Instead, your family would have to apply for a conservatorship or guardianship.   It's a much longer, more expensive, and more cumbersome process.  The conservator or guardian is also required to provide quarterly financial reports to the court from then on.  
  
With regard to the care facility, your Mom is protected by the Patient Bill of Rights.  Meaning that, if she doesn't want to voluntarily be there,  the care facility won't accept her.   The exception is if she has been declared incompetent and the POA, guardian, or conservator admits her.

Your Mom is like all of us in wanting to be at home until the end.  We visualize wiling away the last of our days puttering around our home and garden just to gently fade away in our own bed surrounded by our loved ones.  

Unfortunately, the path of aging and dying is rarely that peaceful or smooth.  If her home is is set up to handle her changing physical needs as she ages (wheelchair width hallways, spacious bathrooms with an easy to get into tub and shower, one level living with hard surfaces, no steps, no fall hazards), you've won half the battle.  

The other half of the battle is finding and paying for in-home caregiving for the hours needed, especially care givers familiar with memory care issues.   It can be far more expensive and less efficient for her to be home rather than a facility depending on those needs.    And, there are loads of requirements to be met if any of the caregiving expenses are to be covered by Medicare.    Plus, with age and infirmity, should she ever require IV meds or has other issues requiring a skilled nurse (versus a ""homemaker"" type of aid), in-home care will make very little sense.

Lastly, at a certain point given her dementia, safety and flight risk are huge issues, plus she isn't going to be as much aware of the difference between being in a facility versus her home.  

Caring for an aging parent is difficult, much less one with memory loss, so be open for any number of scenarios so that you don't get needlessly stressed by emotionally locking yourself onto one path. 

Best wishes to your family.
",,,,Jewel_332211,,,1464814166,t5_2rfqf,t3_4lzu2c,t1_d3s21ao,1,1468745822,0,0,d3s890r,dementia,1,,
"So is there nothing a caregiver can do about it, other than try to manage their own reactions?",,,,caseyoc,,,1467296705,t5_2rfqf,t3_4qgw60,t1_d4tcfb6,1,1469398291,0,0,d4tz8qm,dementia,1,,
"I have worked full time as a recreation provider on a Dementia unit for 7 years. I offer programming to 43 residents. 

The answer will vary, but three of the strongest things that might help her are music, and an old familiar activity/something meaningful to do, and tea.

Learn about what music she likes. Try to familiarize yourself with it as well. When you visit with her, play the music. Depending on the style, sing along, or even dance (a lot of my residents will go from anxious to joyously happy for the duration of a dance). If that's not her/your style, you could also try sitting beside her, and putting headphones on her ears so she can listen to it. Hold her hand and just enjoy the moment together.

Another thing I try to engage my residents in is Montessori for Dementia - style programming. Bring some laundry from home and fold it together. Was she a knitter/crocheter? Bring some supplies with you and try it. Keep in mind if she's ever an aggressive type, consider what you bring her. She may or may not be allowed to keep that stuff in her room. Knitting, for those who did it their whole life, and can still see well enough/have mobile enough hands, can work wonders. I have a resident that wanders in a panic for a good 80% of her unstructured time every day. I can get her to sit for a good 30 minutes and focus on knitting. Knitting/crocheting might be too hard, but something to think about. I have residents who are really into coloring, flipping through magazines/catalogues, some who like to tidy up. 

Another relaxer is a nice, hot cup of tea, if that was your grandma's way to mellow out. You can bring decaf in if you're worried about caffeine consumption. 

You can try different combinations. Maybe come, visit with her, have a tea/cookie. Try a different activity for a while then settle in and listen to music. If she isn't too overstimulated, the music can help as a mood setter, while you engage in other things.",,,,shannon0303,,,1466641397,t5_2rfqf,t3_4pd39j,t3_4pd39j,2,1469228536,0,0,d4k5jnh,dementia,2,,
"Does she eat all of whatever treat she finds? I guess something to find out is if she's actually hungry, or if she just likes to beat the ""challenge"" of the locks.  
My grandma is always ""hongry"", but it's because she can't remember eating just 10 minutes ago. So when you fix her whatever she claims to want, of course she leaves 90% of it uneaten. Cause she's too full from what she just ate before.",,,,AvengeThe90s,,,1466140144,t5_2rfqf,t3_4ohd2t,t3_4ohd2t,2,1469099624,0,0,d4coizy,dementia,2,,
My dad is 51 and has FTD. Seen symptoms from 3 years back but now its moving VERY FAST and to the point where he cant control his bowels and his reasoning and personallity are all gone. Got back from genetics test appointment and found out he has this PSEN2 gene and there was only 1 other case in the world right now in their database of what he has. An extremely rare case and now Me and my sister have a 50% of developing this early onset dementia. (Im 23 shes 26). She recently had a child and now if she has the gene her son will have the same 50% chance of developing this. We were told we can get tested but it may not show up until the disease spreads and we get a bit older. Im not getting tested I DO NOT want to know if this will happen to me or not. So now having kids for me is out since if I have it my child will be 50% having it too. Wish there were some scientists or something that I could help do research since its so rare. Id gladly help out as long as they dont tell me if I have the gene or not,,,,Leafs44,,,1465704387,t5_2rfqf,t3_4ly7rt,t3_4ly7rt,1,1468977273,0,0,d45nceu,dementia,1,,
"From a behavioral standpoint, as the brain degrades, it makes perfect sense to view everything in the environment as a threat. If the patient lacks the mental ability to sort out threat from non threat, treating everything as threat is more likely to assure survival. The next stage is apathy. It can really help to step back and deal with the outbursts from a more detached position.",,,,[deleted],,,1467246423,t5_2rfqf,t3_4qgw60,t3_4qgw60,1,1469387387,0,0,d4tcfb6,dementia,1,,
"My grandmother is not officially diagnosed, but this kind of behaviour also started with her when her memory started to decline a few years ago and in recent months has almost gotten more....aggressive.",,,,SoSullied,,,1466608386,t5_2rfqf,t3_4nzlf1,t3_4nzlf1,2,1469216405,0,0,d4jg49y,dementia,2,,
[removed],,,,[deleted],,,1465484599,t5_2rfqf,t3_4m70wy,t3_4m70wy,1,1468920398,0,0,d42ck12,dementia,1,,
Also - good luck. It's not easy,,,,donna_mattrixx,,,1464988988,t5_2rfqf,t3_4mes2r,t1_d3v022x,1,1468793633,0,0,d3v0570,dementia,1,,
"Having seen many people try to hold on past the point where they need to let the medical professionals help, please know that it is very possible for him, you, and the rest of your family to be healthier and happier because of this decision. It's hard because you feel obligated, or like you should be able to be responsible for someone that you love, but please rest assured that there are people who you should allow to help you with your struggle. I've seen family caregivers sent to early graves from the pain and stress.",,,,hithazel,,,1466194032,t5_2rfqf,t3_4oj96s,t3_4oj96s,2,1469113474,0,0,d4dhg2w,dementia,2,,
"I really appreciate this perspective. You're absolutely correct; he is like a child. He doesn't know what he's doing.  I suppose most of the shock here is coming from the fact that this is the first time he's gone this far with anyone (to our family's knowledge) and this is the first time it's ever happened to me in general. 

I plan to keep visiting him but am not comfortable being alone with him right now. I can still help him while keeping my distance which is the silver lining here I suppose. 

",,,,slumber_queen,,,1464925440,t5_2rfqf,t3_4mayt5,t1_d3u19rs,4,1468777050,0,0,d3u1kwa,dementia,4,,
"Regular exercise of any type in middle age – from walking the dog to mountain climbing — is the best lifestyle change you can make to improve your memory loss and prevent dementia in the later years, suggest results of a 20-year study.",,,,Taking22Tango,,,1465934001,t5_2rfqf,t3_4o3az1,t3_4o3az1,1,1469039514,0,0,d4978gu,dementia,1,,
Just checked out Teepa Snow.  She is amazing!,,,,jkbsncme,,,1467163327,t5_2rfqf,t3_4mcplr,t1_d3x852i,2,1469364078,0,0,d4rzuul,dementia,2,,
"I worked with a lady who thought I was her son, father, and her husband, often at the same meal. Sometimes she'd say shocking things that were embarrassing, and although she never touched me, I can that plenty of females with dementia have grabbed my butt over the years. More than a handful have grabbed a handful!

None of them were related to me, and I understand that this makes your situation infinitely harder. But I just want to put it into context - there's a very high chance that his action felt normal for him. He might have mistaken you for an old lover briefly, and that's probably what happened. 

So my only concern is that you don't dump him into care because of one incident, but rather only if it's the best thing for him. Which it may very well be! And don't take it personally - in fact, have a beer, try to forget it, and if you can't, at least try to forgive him.",,,,Rob_At_Neville,,,1464974336,t5_2rfqf,t3_4mayt5,t3_4mayt5,2,1468788405,0,0,d3up77j,dementia,2,,
"I'm sorry you lost her, especially so young.  I'm thankful though that she gained her freedom.  ",,,,caseyoc,,,1466183623,t5_2rfqf,t3_4ojlbz,t3_4ojlbz,3,1469109543,0,0,d4d9987,dementia,3,,
[deleted],,,,[deleted],,,1466170165,t5_2rfqf,t3_4l733c,t3_4l733c,2,1469104778,0,0,d4czfx4,dementia,2,,
Oh that is another thing that may help. If he is over 80 years old I believe and he qualifies for hospice care it should be cost free and covered by insurance. Hospice would add an extra layer of help for him and the family to keep him comfortable at home.,,,,FreyaStone,,,1464987719,t5_2rfqf,t3_4mes2r,t1_d3uyk5g,1,1468793227,0,0,d3uza6s,dementia,1,,
Hi there! Its to better know the needs of the dementia patients so that we can combat them making the lives of caregivers easier :),,,,nicholaswz,,,1466667524,t5_2rfqf,t3_4oz460,t1_d4k5rgn,1,1469235130,0,0,d4kj85w,dementia,1,,
"Thank you very much! That's a great idea :) ",,,,BerbleBap,,,1464891337,t5_2rfqf,t3_4m2d0k,t1_d3t1z8i,1,1468765863,0,0,d3teabq,dementia,1,,
Check out alz.org - lots of resources there...,,,,calicoan,,,1465002973,t5_2rfqf,t3_4mes2r,t3_4mes2r,1,1468797640,0,0,d3v8hxk,dementia,1,,
"Well, lets just start by saying that this is a difficult situation. This yelling could very well be a part of his dementia, especially if it is happening around the same time every night (patterns develop in behavior). Its likely nothing to do with abuse. What would concern me is the fact that it goes on for hours at a time. This could possibly be evidence of neglect. 

A good course of action would be to contact your local Ombudsman's office and let them know whats going on. They can go in there and check the place out as well as dig around if they see anything suspicious. 
You can also contact the local Community Care Licensing office and make a complaint (Its the social services department for senior care facilities). The facilities' licensing number will be posted on their website  somewhere, use that to reference when making the complaint. 

If everything is fine then there will be nothing found, its better to be safe than sorry. ",,,,thatredheadedfella,,,1467082118,t5_2rfqf,t3_4q6mf0,t3_4q6mf0,8,1469342602,0,0,d4qqxbc,dementia,8,,
My close friend and roommate in college's father was diagnosed with dementia. It was so sad to see his father begin to lose his personality over time.,,,,TurtlePie_Jon,,,1465164494,t5_2rfqf,t3_4mcplr,t3_4mcplr,1,1468833395,0,0,d3xb4wk,dementia,1,,
"Holy fuck this hits home. I just quit working at a dementia clinic for my dream job, and am saddened. It was heartbreaking and heartwarming to work there the whole time. The families is the hardest part, it's a hard disease to live with but equally trying to love someone with it",,,,SpyDad24,,,1466232079,t5_2rfqf,t3_4ojlbz,t1_d4d4set,3,1469123208,0,0,d4e1xgp,dementia,3,,
"Thank you! ",,,,eSole,,,1465688328,t5_2rfqf,t3_4nlgqv,t1_d4531z9,1,1468973356,0,0,d45f6j0,dementia,1,,
"I wasn't the only one caring for him and the family is able to care for him still. He is not being dumped and everyone involved understands the circumstances.

I personally won't be seeing him anymore but only because I have emotional issues that I need to prioritize. I plan to still visit him but I will no longer be caring for him. ",,,,slumber_queen,,,1465195624,t5_2rfqf,t3_4mayt5,t1_d3up77j,1,1468841646,0,0,d3xsgzb,dementia,1,,
"My grandmother is living with my mother and has asked to go home too, she refuses to go to bed when she's in that state and gets aggressive and mean.  My mother calls me when it happens and I talk to her, tell her ""I'll be there first thing in the morning but not before so you may as well go to bed"" and it's enough to satisfy her (for now). When she wakes up I'm there and she has no memory of it.  We take drives a couple of times a week to the area where she raised her kids, she reminisces and is pretty happy by the end of it.  ",,,,Aparty,,,1466697357,t5_2rfqf,t3_4pfjsv,t3_4pfjsv,2,1469241710,0,0,d4kx16o,dementia,2,,
"He is in Arkansas. I don't think they qualify for medicaid because of his disability/SSI income. But at the same time the SSI/disability is not enough that it would cover a care facility. I feel like we are in no mans land. 
",,,,fr0zen_yetti,,,1464985662,t5_2rfqf,t3_4mes2r,t1_d3uxn3z,1,1468792532,0,0,d3uxt55,dementia,1,,
"With my grandpa we would take him for a ride through town and most of the time he would be content with that. Unfortunately, home for him was his childhood farm home and when he didn't go there, there wasn't much we could do to calm him. ",,,,krabs,,,1466688936,t5_2rfqf,t3_4pfjsv,t3_4pfjsv,2,1469238842,0,0,d4kqyvf,dementia,2,,
"SSI and Disability income don't disqualify him for Medicaid.  Medicaid kicks in once his share of the marital assets are spent down to somewhere around $2000.   Then, he can keep something like $50 in his income for personal expenses from then on with the rest of his income going toward his memory care facility cost.  If he has any life insurance policies or annuities valued over $1500, those have to be signed over to Medicaid as well.    

Your Mom should make an appointment with an Elder Law Attorney in your area to discuss how to preserve her assets when it comes to applying for Medicaid for him.   ",,,,Jewel_332211,,,1465160557,t5_2rfqf,t3_4mes2r,t1_d3uxt55,1,1468832245,0,0,d3x8p09,dementia,1,,
"You are a strong person reaching out for help and advice.  I have some good new for you that fits inline with your mother's wishes.  A 12 month study was done on a aloe based nutritional product with severe Alzheimer's - 100% of the participants responded favorably. The doctor in charge said ""it was like watching people come out of a cocoon"". You can listen to the interview with the doctor(s) at [hope4alz.info](http://hope4alz.info)  In addition to taking the supplement everyday with meals, the patiences got together and exercised (walked, threw a ball back and forth, danced, sang, memorized scripture -- these all give the brain a workout) The product used in the study is New Eden sold at [ResultsHappen.org](http://resultshappen.org) and on Amazon.   I have been using this product with my clients for 8 years and can positively say that when taken daily, you obtain measurable results.  I saw the same symptoms with my own mother-in-law and after some family discussion they took her to the doctor where she was diagnosed with early onset ALZ, we started giving her the product as used in the study and praise the Lord, she also responded positively and has obtained mental clarity once again. I hope that his give you some hope with your family situation. Blessings to you.",,,,results4life,,,1464841899,t5_2rfqf,t3_4m2d0k,t3_4m2d0k,1,1468754207,0,0,d3spve0,dementia,1,,
"This sounds exactly like my mother-in-law! Seriously.

She was sometimes mean before she was diagnosed with Alzheimer's and then she became truly nasty. My spouse was her caregiver and every day her mother would say the most horrible, hurtful things to her. She was accusing my spouse of planning to steal her house for the past ten years. She was completely delusional and in a very short few weeks, was placed into long term care.

What happened next surprised the whole family. She became cheerful and kind. The mean, hurtful woman was no more. Alzheimer's changed her personality for the better. It was kind of amazing.

I don't have any special words of wisdom for you and your husband but please be kind to each other since dementia has an impact on the whole family. Your dad could continue to be mean or maybe his personality will change too. Try to remember that he is out in his own world and won't even remember what he said to you.

",,,,joefourstrings,,,1467225631,t5_2rfqf,t3_4qgw60,t3_4qgw60,1,1469379956,0,0,d4swybd,dementia,1,,
"OP, you're in a tough situation. The whole family is. This disease is super difficult to deal with regardless of who the caretaker is. What has your mom told you the reason for not taking him to a home is? Many times it's anxiety over feeling you're abandoning a loved one. Sometimes it's just money, an assisted living center with memory care isnt cheap at all. Have a good long talk. Be empathetic, this isn't just about you and your needs, whatever you're going through, your mom is going through it too, probably worse since it's her dad.  
Help her look for part-time caregivers that can come and take a load-off. Maybe your city/county has senior services for folks with memory issues. Look into these and give your mom some options. There may be something else than putting him in a home. Be part of the solution.  ",,,,goosetavo2013,,,1467301488,t5_2rfqf,t3_4qltih,t3_4qltih,4,1469400072,0,0,d4u2vf7,dementia,4,,
"I only offer words when my loved one starts getting visibly frustrated/agitated. Sometimes she doesn't have a word to describe something, so I'll say ""can you show me?"" and she will take me to it. When I really can't understand what she's saying (she also has delusions/hallucinations, so sometimes she's talking about something literally not there), I respond with ""oh, I didn't know"" or ""I'm sorry, I don't understand"" or ""its okay, tell me later."" 

Hang in there ",,,,applesangria,,,1465393058,t5_2rfqf,t3_4mzcuk,t3_4mzcuk,1,1468894259,0,0,d40u4p9,dementia,1,,
&lt;3 thanks.,,,,hithazel,,,1465762250,t5_2rfqf,t3_4no4x1,t3_4no4x1,2,1468990906,0,0,d46dvpn,dementia,2,,
"My dad had been battling dementia for the past couple of years. It really spiraled this past January when he fell and broke his hip. The anesthesia really messed him up. There were several times during his recovery we thought he might just be well enough to come home but a subsequent fall would really set him back. Has last fall put him into hospice and watching the pain and agony in his face was horrible. In his more lucid moments he openly declared he couldn't go on. There hasn't been a day, in the past six months, I haven't silently hoped one day he just wouldn't wake up. This isn't how he wanted it. Finally we got the call he only had days left so my brothers and I flew in to visit. My dad hung on until we could all say goodbye passing this past Wednesday only an hour after the last of my brothers arrived. It's just so much of a relief. Though he was 90, this isn't how he wanted to live, not how he saw his own end. I have no doubt he is in a better place. 

As hard as it is, you don't have to worry about tomorrow, or next week, or next month or next year. Now you can allow yourself to celebrate her life and carry the best parts of her memory with you.",,,,evman2006,,,1466212556,t5_2rfqf,t3_4ojlbz,t3_4ojlbz,5,1469118943,0,0,d4dt10x,dementia,5,,
"From my experience of taking care of two people with dementia, research etc and being a CNA, 
1. Don't get a concussion
2. Never drink heavily
3. Don't eat sugar
4. Stay away from processed food
5. Stay away from drugs, both legal and illegal. 

Statins and those pills for indigestion are the latest linked with dementia 

I don't think there is a test to see if you might get it.",,,,corbie,,,1466696713,t5_2rfqf,t3_4pe5wv,t3_4pe5wv,1,1469241465,0,0,d4kwif9,dementia,1,,
"I found this article to be long on ""should and shouldn'ts"" but short on applicable practical advice.   For practical advice, I recommend Teepa Snow's videos on YouTube. ",,,,Jewel_332211,,,1465159716,t5_2rfqf,t3_4mcplr,t3_4mcplr,3,1468831914,0,0,d3x852i,dementia,3,,
He must have been a great guy to have a family that loves him and cares for him so much.  You are the proof.,,,,plotthick,,,1466177024,t5_2rfqf,t3_4oj96s,t3_4oj96s,1,1469107057,0,0,d4d44pk,dementia,1,,
