body,score_hidden,archived,name,author,author_flair_text,downs,created_utc,subreddit_id,link_id,parent_id,score,retrieved_on,controversiality,gilded,id,subreddit,ups,distinguished,author_flair_css_class
"Adult protective services, in my experience will do nothing. I called to report that my father was being robbed and abused and they let it go. That doesn't mean don't call, CALL TODAY. Shit, call every day until someone listens to you. Also those medications listed do not slow the progression of the disease nor do they return memory function. As explained by our neurologist they only lessen the symptoms of the disease so that people who interact with said person aren't always driven to the point of insanity themselves. 

TAKE HER CAR KEYS. Do not take the car. Just the keys. Don't even say anything. This woman does not need to be driving. If you do this you need to accept responsibility for providing food and whatever else she needs. It is exhausting but I would sleep much better knowing she can't drive. Does your grandmother have any other children? You need to call them now. One of her children needs to have a legal evaluation and be established as POA or guardian/conservator. Once that happens the person chosen to take on this enormous responsibility can make decisions about her living arrangements, finances, etc. 

You have to keep shouting about this. Don't even talk to grandma about it. It's the other people in your life that need to listen! 

Let me also second medications for anxiety and depression. They are a must! It's good for grandma and good for everyone else. Also, if you can, seek help with any care she needs. I am caring for my father alone and it is exhausting and maddening to say the least. ",,,,mgcarter3,,,1467812998,t5_2rfqf,t3_4rg4gv,t3_4rg4gv,2,1471239961,0,0,d51cmqs,dementia,2,,
"my dad lost his wallet all the time.  I got him prepaid debit cards with about $50 on them so he lost very little but could still spend.  Once you get all the other stuff replaced, make copies for him to carry and keep the originals in a safe place.  If you feel his driving is unsafe, see if the DMV will require a re-test to replace the license if you flag his record.  My Dad lost a fortune because his doctor or the DMV wouldn't pull his license and he caused an accident.  Thank God, no one was killed or seriously injured. ",,,,Lordica,,,1469158460,t5_2rfqf,t3_4tx8xl,t3_4tx8xl,3,1471595722,0,0,d5lwl8w,dementia,3,,
Thankyou for replying-if you don't mind I'll definitely be in touch. It's nice to know there are others in the same boat.,,,,Samm1y-O1,,,1467737751,t5_2rfqf,t3_4r4gub,t1_d4yst22,1,1471219825,0,0,d506stu,dementia,1,,
"Heartfelt, and beautiful. Intimately warm. I'm so sorry for your loss. Stay strong. ",,,,motherfuckinghell,,,1469563130,t5_2rfqf,t3_4k6bnk,t3_4k6bnk,2,1471700013,0,0,d5rxski,dementia,2,,
"My late grandma would say the same. My mother still owned the house she lived in all her life so she would constantly drive between the two often up to twice a week (100 mile one way) to placate her. She was highly intelligent and a dominant personality so couldn't be reasoned with. I found that it was best to answer a question with another question, that was the only way to avoid her bending the conversation to her demands and driving my mother to tears. We all had to work to keep her awake until midnight at least so that we could all get sleep. My grandma told us she wanted to die and stopped eating. We coaxed her and spoonfed her as well as we could and brought her to doctors but she slipped into unconsciousness and died within a day.",,,,squeezeonein,,,1469925083,t5_2rfqf,t3_4pfjsv,t3_4pfjsv,1,1471808117,0,0,d5xrn6t,dementia,1,,
"Hey. My heart goes out to you. I listened to this podcast ages ago. May or may not be of help. http://m.thisamericanlife.org/radio-archives/episode/532/magic-words

X",,,,brookemason,,,1469774068,t5_2rfqf,t3_4uqdra,t3_4uqdra,2,1471770540,0,0,d5vla3o,dementia,2,,
I know that's not her problem. She just can't remember when she showered last so she doesn't realize that she really does need to shower even if she's not doing much that day.,,,,shadinik1,,,1468770186,t5_2rfqf,t3_4t5stl,t1_d5flhf7,1,1471488346,0,0,d5fp334,dementia,1,,
"She doesn't actually need help she just doesn't remember that she hasn't done it, she is 100% capable of still doing it she just can't remember so we need to know how to remind her without offending her.",,,,shadinik1,,,1468788470,t5_2rfqf,t3_4t5stl,t1_d5fzi0b,1,1471493785,0,0,d5g0hgu,dementia,1,,
"You aren't failing. And I don't know about what your doctor was trying to convey but proper care will not stop the progression of the disease, it will only make the behaviors less severe in theory. There is no treatment for dementia in terms of stopping the progression that I am aware of. Take my opinion with a grain of salt as I am not an MD but dementia care has been my life for the past 3 years. 

Have you discussed the possibility with her doctor about an anti anxiety or other medication that may help the delusions? Her crying ever day is not good. This needs to be seriously looked at by a doctor or psychologist. 

Trust me you are not failing, and I know how you are feeling. It is horrible to feel like you are making no progress and your efforts feel totally wasted. They aren't wasted. She needs someone who understands her, who can calm her, who can advocate for her when doctors just try to shrug their shoulders. 

You want to feel some sort of momentum? Focus on getting her crying seriously addressed by a doctor. You may have to really push. In my experience most doctors are like 'well this is dementia so deal with it'. That isn't a medical answer. Your mom is having breakdowns every day. If meds won't help, maybe a psychologist trained in geriatric and impaired psychology will be able to pinpoint what may help and give you better tools to help her because right now you are kind of flying blind and that's not your fault.

Until then, take most of the stuff out if her room and put it elsewhere. Leave just enough to be placed in a small piece of luggage because for her packing is a comfort. Leave her the comfort, just make the quantity of it manageable for you as well if possible. 

Have you tapped into her world as a form of redirection? Maybe try to get her to 'bake' something for the kings servants who are coming to pick her up as a gesture of thanks. Maybe make them cards. Make her time constructive but do it within her world. Redirect her to a constructive task to look forward to. 

Im just stabbing in the dark. I know that what you wrote is just the tip of the iceberg and you feel like you are drowning. Hugs! Feel free to PM me if you need to. ",,,,DoctorFlimFlam,,,1469564879,t5_2rfqf,t3_4uqdra,t3_4uqdra,8,1471700709,0,0,d5rz9qp,dementia,8,,
"Shoot. Well, know that you have NOT failed miserably. You can only do what you're capable of, and your own mental health/stress level needs to be accounted for. Don't ever feel like you need to be doing more if you simply CAN'T. It is not your job to make her happy. The illness doesn't seem to allow that with her. You can keep her fed, clean, and safe. That is more than enough right now.

I would see if you can get a prescription for anti-psychotics for her. They typically are overused in Alzheimer's patients, but it sounds like her behaviour warrants it. It would help you and the rest of the caregivers too.

Again, best of luck and sending love.",,,,missthinks,,,1469573001,t5_2rfqf,t3_4uqdra,t1_d5s5nql,1,1471703830,0,0,d5s5uhc,dementia,1,,
"Thanks for the feedback all-currently living from savings whilst getting benefits in order. Never thought about POA-will definitely look into that asap. 

I've worked within dementia care before but that was always when a person had had it for a while-I've never seen it happen from the start so that is scary,especially when it's someone so close-and they don't think there is a problem. 

For the meantime were managing but I know it's going to get a lot worse",,,,Samm1y-O1,,,1467737691,t5_2rfqf,t3_4r4gub,t3_4r4gub,1,1471219802,0,0,d506r2c,dementia,1,,
"I've been mulling this a lot myself lately. The decision to have future kids, for me, is 100% dependent on results of genetic testing. Ive kind of decided I'd rather know now so I can have that option available to me. OP, my mother contacted The Brain Support Network out in California, they can help you find out what you need to do to get genetic testing.",,,,erhatfield,,,1467745754,t5_2rfqf,t3_4ly7rt,t1_d45nceu,1,1471222917,0,0,d50d6zk,dementia,1,,
"If you can afford it; then absolutely! For everything that you see, there are probably a dozen things that she has managed to hide from you, or that have happened when no one was aware.

A companion will also help boost her mood and outlook, by helping her regain some semblance of independence. 

Don't put a whole lot of stock in what the doctor says. She needs to be seen by a specialist (neuropsychiatrist, I want to say?) who knows how to run the tests. My father-in-law was stubborn, because he feared being put in a nursing home. Unfortunately, that's what ended up being the only way to take care of him.

I found the best approach (which didn't set off his alarm bells about dementia) was to say ""I've noticed that you've been behaving a little bit differently. You know that mini-strokes can cause memory loss; and that early diagnosis and treatment can mean the difference between a good prognosis or ending up in a nursing home."" I presented it as getting looked at could mean keeping his freedom for longer.

The hardest part in all of this is that you will have to become a really good liar. When someone gets to the point where they can no longer care for themselves (yet are still able to express their wishes) you may have to deceive them, in order to look after their best interests. Don't feel guilty about this, as long as you are taking good care of them. At this point, they are regressing back to the mentality of a child, and you have to protect them as you would a child.

Best wishes to you. It's a tough situation. ",,,,whatsreallygoingon,,,1468637699,t5_2rfqf,t3_4t10wd,t3_4t10wd,2,1471461590,0,0,d5e5idl,dementia,2,,
"It's tough. But know that your frustration's temporary. Assign a day or two each week to have to yourself to do whatever you please. Most importantly, currently, sit down and work things out in your head. Sort shit out, man. Get a report from the hospital to prove your honesty. 
Kids and elders go along pretty well. Take the kid and your father out to a park, or a beach. Let them walk around and have fun while you relax and breathe. It's going to be okay. Feel free to PM me if you need to vent more about it. ",,,,motherfuckinghell,,,1469941022,t5_2rfqf,t3_4vbsw7,t3_4vbsw7,1,1471812215,0,0,d5y0662,dementia,1,,
"I'm actually in Saudi Arabia. Her doctor hasn't prescribed her any anti psychotics. He had her on Seroquel for a while, but I confronted him about it being a terrible thing to be on after I've done my research on it. She doesn't take that anymore. I'm planning on talking to him about giving her a milder daily anti psychotic pill, and maybe sedatives for her breakdowns as well. ",,,,motherfuckinghell,,,1469597281,t5_2rfqf,t3_4uqdra,t1_d5sky21,1,1471711651,0,0,d5sm3tv,dementia,1,,
Having someone try to help her shower would be an unnecessary violation or her privacy and she would never let it happen. The only thing we need help with is figuring out how to help her remember when she needs to shower. of course when she gets to the point where she can't shower herself we will get help for her but that time hasn't come yet.,,,,shadinik1,,,1468801448,t5_2rfqf,t3_4t5stl,t1_d5g73my,1,1471497497,0,0,d5g84mm,dementia,1,,
Sorry you're having a rough time hope it gets better,,,,yuhkih,,,1469917050,t5_2rfqf,t3_4vbsw7,t3_4vbsw7,1,1471805977,0,0,d5xn5fx,dementia,1,,
"Hi there

My SO and I care for his eldest grandparents. Both are showing signs of dementia. 

  Open up to your Mom about what you've been going through. I can understand taking care of a loved one, but it is not fair for that to fall on you completely. ",,,,Kat82292,,,1469263159,t5_2rfqf,t3_4qltih,t3_4qltih,2,1471622491,0,0,d5ng9zo,dementia,2,,
Something's about to go down at Anavex and I don't think it's the stock price ;),,,,altrockaddict,,,1469583019,t5_2rfqf,t3_4elaep,t3_4elaep,1,1471707422,0,0,d5sdaup,dementia,1,,
"I assume you have been to a doctor about this, correct? 

What, so far, *has* been done, such as medications, therapies, etc.? ",,,,calicoan,,,1467585579,t5_2rfqf,t3_4r329h,t3_4r329h,1,1471184453,0,0,d4y5g4d,dementia,1,,
"It seems like she needs to be in a specialized dementia facility. Women with dementia are especially difficult. I have noticed a lot of docs just don't care. They don't care to get the meds right or take the time to try different options. I don't blame your mom for taking a break. I've been caring for my dad with dementia for the past 6 months and I'm slowly losing my mind. 

Ask your mom what you can do to help her! Stock her fridge at home, make some phone calls so she doesn't have to, wash dishes, hug her. She is more fragile than she looks!  ",,,,mgcarter3,,,1467813438,t5_2rfqf,t3_4rfufq,t3_4rfufq,2,1471240096,0,0,d51cx18,dementia,2,,
"Can you go back to working part time, and hire someone to watch him? Or at least find someone to come in 1-2 afternoons per week, so you can get out of the house and do things? 

Nothing easy about this. ",,,,applesangria,,,1469888466,t5_2rfqf,t3_4vbsw7,t3_4vbsw7,2,1471797836,0,0,d5x67tk,dementia,2,,
This is so damn sad and I really hope you can get things under control soon. Have they considered sertraline(zoloft) for her? It seems like you need another physician's opinion if your current doctor is being truly inflexible. A dementia dedicated facility is most likely your best bet as well.,,,,hithazel,,,1467821737,t5_2rfqf,t3_4rfufq,t3_4rfufq,1,1471243057,0,0,d51j16e,dementia,1,,
"My mom at one time had to reverse all of the locks on the house so you have to have a key to get out of the house. Granted, they live out in the middle of the sticks so it's highly unlikely anyone will take advantage of just being able to walk into the house...it's probably not practical if you live in town but maybe there's a type of lock that opens by key both ways?",,,,erhatfield,,,1467745151,t5_2rfqf,t3_4mygu6,t3_4mygu6,2,1471222694,0,0,d50cpxo,dementia,2,,
"Further reading:

http://www.prnewswire.com/news-releases/taurx-reports-first-phase-3-results-for-lmtx-588363261.html

http://www.thetimes.co.uk/article/scientists-create-the-first-drug-to-halt-alzheimers-xzlkvrkvp

http://www.biopharmadive.com/news/taurx-alzheimers-drug-flunks-late-stage-study/423370/

http://www.forbes.com/sites/matthewherper/2016/07/27/alzheimers-maverick-taurx-tries-to-weave-success-from-failed-trial/",,,,dmbream,,,1469737827,t5_2rfqf,t3_4v2szf,t3_4v2szf,2,1471759387,0,0,d5uy4gm,dementia,2,,
yes,,,,dying_atheist_117,,,1467657532,t5_2rfqf,t3_4r329h,t1_d4yqnv9,1,1471200375,0,0,d4z2jho,dementia,1,,
"That doesn't sound like dementia to me. When was the last time he's been to the doctor? Last time he had a CT scan? Blood work? Is he diabetic? It could be A LOT of things. And I'm no doctor but my mom had a TIA a year or so before your grandad and she sometimes forgets or uses the wrong word but nothing like that. Honestly, it could just be that he has bad days, old people feel bad a lot. My dad has said those same things a lot, mostly for attention. But a trip to the doc couldn't hurt! ",,,,mgcarter3,,,1468089297,t5_2rfqf,t3_4s0h6j,t3_4s0h6j,2,1471316463,0,0,d55rn6g,dementia,2,,
"Is she in pain? That seems like it would be an obvious place to start. Have her checked out by the doctor for ulcers, heartburn, gall stones, and constipation. Complaints shouldn't necessarily be ignored just because of dementia... Sometimes they're exaggerated, but there's often a reason for them. :) 

If there's nothing wrong, then they should just go with it. Get mints or Tic Tacs, and give them to her saying that they'll help. Even some colored Crystal Light or something can be passed off as ""liquid medicine,"" with the bonus of keeping her hydrated. A tumbler with a straw would be easy for her to manage &amp; sip on. They can even ""schedule"" her medicine for a few times every day, which might give her some reassurance. ",,,,applesangria,,,1469990277,t5_2rfqf,t3_4vi8n0,t3_4vi8n0,5,1471822213,0,0,d5yl01h,dementia,5,,
All I wanted to know was how to remind her to shower without offending her. This is hard enough without jerks like you making me feel like im not doing enough. You seem like the one who thinks their perfect! I bet you never make any mistakes. this forum is supposed to be for suport. Not for judging and telling people they are doing everything wrong!,,,,shadinik1,,,1468806096,t5_2rfqf,t3_4t5stl,t1_d5gak62,1,1471498813,0,0,d5gar5a,dementia,1,,
"I'm so sorry to hear about your hard time. I work in dementia/Alzheimer's research, and I can empathize with how hard some individuals are to care for in the later stages of the illness.

Where do you live? Do you have access to institutional care? At this point, it may be best for her, and for everyone else involved. Guilt is always a common feelings in these situations, but you've done all you can. She will succumb to the illness...you shouldn't have to as well.

Sending my love.",,,,missthinks,,,1469572351,t5_2rfqf,t3_4uqdra,t3_4uqdra,1,1471703603,0,0,d5s5d4j,dementia,1,,
"Just accidentally spill something all over her!

Just kidding.

Sorry, this is a tough one because you don't want her to take it the wrong way.  What if you set up a shower calendar and ""Schedule"" for certain things so it's checked off by a family member when she does it, and if she argues she ""just showered"" you can together check the schedule?",,,,jenniferjuniper,,,1468694518,t5_2rfqf,t3_4t5stl,t3_4t5stl,2,1471472740,0,0,d5esoe3,dementia,2,,
