body,score_hidden,archived,name,author,author_flair_text,downs,created_utc,subreddit_id,link_id,parent_id,score,retrieved_on,controversiality,gilded,id,subreddit,ups,distinguished,author_flair_css_class
" One of the great difficulties I've had in caring for my mother, who is in now in the final stages of dementia, is importantly accepting where she is, and how she understands the world. 

As a result most times, I'm sure looking back, I was responding to her as if she was in a world she was not. I'd tell her, for instance, that I was going to the shop and would be back in an hour, knowing full well that she did not know really what an hour was anymore, and that even if she had an idea of what it was, she had no way of telling when an hour was up, or what time had passed since I'd left. In fact she had no idea of the time at all... sometimes I'd leave the room and come back in a minute and she'd express joy at seeing me ""after such a long time"". Other times she would not know who I was when I walked back into the room after a minute or two.

What I'm saying is, that at SL4 dementia, your parents are inevitably living in a terrible world of confusion and anxiety which they hate, and you have become their chopping block for much of the anxiety and blame-gaming that goes with that. BUT, given all that and no doubt much much more, it does not change the fact that they don't know what the time or the day is, let alone what season, month or year it is, or how long it has been since they saw you, and when you were there last. 

You need to step into their world in order to make rational and emotional decisions about them which will be helpful to them, and which will also make sense of your life and your and your wife and future children's needs. 

Trouble is that stepping into how someone with dementia is experiencing their world, and such things as time, is actually a huge leap for someone sane like you, let alone for someone who wants nothing other than to pull their loved one back from that insane world of dementia and is resisting understanding their world at every step. 

But you need to do that. You need to step into their world and understand how they are experiencing it and things like time, and the time between your visits. And then ask yourself, whether it is really sane to drive 2 hours a day to see your mum, who will not remember that you've been there to visit and how long it has been since your last one. And most important of all, you need to do your mother the honour of remembering her when she was sane, and ask her, whether she would want you in these terrible circumstances to spend your time tearing your own little family apart to visit her every day? My guess, she'd say no, or course not!",,,,seedpod02,,,1470981317,t5_2rfqf,t3_4x962n,t3_4x962n,3,1473359676,0,0,d6e7urs,dementia,3,,
"Has she been formally diagnosed? Her husband sounds as if he's either in denial or is just oblivious. A formal diagnosis, in this case, would be for your partner, first, so a plan can be formulated. It would also really help to know what type of dementia is at play. My mom (in her mid-80s) has vascular dementia, which isn't particularly pronounced, compared a friend's mom who had full on Alzheimers. Things you can do now, without any formal treatment, is to keep the mother socially engaged. That's not going to halt the progression, but can at least slow it. It's not going to help her at all if she's left alone to her own devices everyday with nothing other to do than watch TV. If her husband isn't willing or is unable to step up to the plate, hire a caregiver. Isolation is probably the mom's greatest enemy in terms of the progression of dementia. Get that formal diagnosis.",,,,argyle47,,,1471936589,t5_2rfqf,t3_4z2v4t,t3_4z2v4t,1,1473553166,0,0,d6syq4s,dementia,1,,
"It's hard because you just want it to be over, even though you know that can only happen one way. You feel guilty because it feels like you're wishing get dead, but that's not what you're wishing for at all. You just want the pain and the confusion to end. ",,,,LittleMissP,,,1470218443,t5_2rfqf,t3_4vu017,t3_4vu017,1,1473171135,0,0,d62a75k,dementia,1,,
"Yes, it won't cover the other symptoms.  sadly.",,,,MET1,,,1471115130,t5_2rfqf,t3_4xf5uc,t1_d6fui6t,1,1473386645,0,0,d6g6374,dementia,1,,
"From what I understand, he could level out and live for several years in this state. I thought hospice was for those who were given 6 months or less to live?",,,,dontmakemelivethatwa,,,1471319300,t5_2rfqf,t3_4xxiz8,t1_d6j9kvw,2,1473427667,0,0,d6j9ot1,dementia,2,,
"She does not live by herself. My adult daughter lives with her and I live next door. We are getting ready to move next year and we will be living together. ",,,,tattooedamazon477,,,1471034696,t5_2rfqf,t3_4xf5uc,t1_d6f1g1n,1,1473371102,0,0,d6f27qq,dementia,1,,
"According to everything I know about dealing with dementia, you did exactly the right thing. Meet her where she is, and gently steer her in the direction of reality f you can. You can't argue with her or it will confuse her more. Don't worry about it.
",,,,Geezerette,,,1472507756,t5_2rfqf,t3_507188,t3_507188,8,1473669252,0,0,d71shuh,dementia,8,,
"Still do it. So was my dad. Then he died.  Shit storm happened so I could get all paperwork in place to make decisions. It was extremely difficult and more expensive. Put paperwork in place for your dad and then have back up plans in place. ",,,,Mitzukai_9,,,1472566397,t5_2rfqf,t3_4xfsl7,t1_d6g2ikk,1,1473678896,0,0,d72llap,dementia,1,,
"Just take her to her general doc, express your concerns and they will write you a referral to a neurologist. There they can give her a general test to determine whether somethings happening or not. She might have something starting but the neuro will ask questions she can't fake answers to. If you even slightly think it's a possibility tackle it soon! ",,,,mgcarter3,,,1471050227,t5_2rfqf,t3_4xfsl7,t3_4xfsl7,4,1473374988,0,0,d6fcqzu,dementia,4,,
My dad is still around and is in really good mental shape.  He'll be able to make decisions on her behalf.,,,,brettdavis4,,,1471109498,t5_2rfqf,t3_4xfsl7,t1_d6finx1,1,1473385340,0,0,d6g2ikk,dementia,1,,
"Unfortunately I know this feeling too well. 

My papa passed away on Valentines Day this year. May last year he had a fall and then he went down hill from there. From Christmas he didn't eat, from late January he couldn't even drink. Days prior he lost his speech. 

Even with the morphine and medication, somewhere deep down she knows what you are say. Tell her you love her, tell her everything you want to tell her. As hard as it is try and enjoy the last moments. My papa couldn't remember my nana had died 11 years prior, it broke my heart having to tell her she had passed away. To see him grieve all over again because I had to tell him she wasn't here any more,was one of the worst moments.. all you can do is hope she forgets that thought once again.

4 days prior to my papa passing away we had a day where we chatted about going to the beach for ice cream. We then had a sleep next to each other and we chatted in between the hallucinations and agitation. This day together helped give me closure, especially since the next day he lost his speech.

It's not going to be easy, it will prob be harder before it stops. You'll prob be wishing it would end, it's okay to think that, as you don't want to see her go through it. Also don't beat yourself up if you feel like a weight has been lifted when she does pass, it's a natural feeling. 

Best advice I could give is reassure her that its okay to go. This is probably the hardest conversation you will have, cause you know when they do, there is no way to bring them back. I put off having this conversation as I wasn't ready, but I knew i had to. He told me he didn't want to leave me as he wanted to make sure i was okay. I told him I would be fine ( even though deep down, i wasn't sure i would be if he went). I had that conversation on the Saturday night and he was gone by the Sunday lunchtime. Sometimes they just need to know, its okay to go.

After he passed away in my arms, I had left the room and broke down in the corridor. When I went back in and looked at him, it was the strangest thing as he looked happy for the first time in months now that he was at peace. It hurts so much, but remember you are not alone. 

My love and thoughts are with you, if you need to talk, i'm here. ",,,,Skiwilass,,,1470348165,t5_2rfqf,t3_4vu017,t3_4vu017,1,1473226333,0,0,d64jij1,dementia,1,,
"Know that when you cry, you don't cry alone. We are there with you. I'm sorry that this is happening to you and your family.  The follow is a bit of rambling and a few suggestions.  The suggestions may or may not help, as everyone with dementia reacts differently. Take it with a grain of salt and hopefully you will find something that works for your situation. 

I almost hate the ""good days"" because they are fleeting. Today my SO played the piano and did really well. It's been weeks since he has been able to play anything recognizable (it comes and goes) but today was great! He is more with it and happier today. I know it won't last. It may not make it through the day even. It reminds me of what he has lost and what I have lost and it's painful each time. I try to focus on the happiness durning the good times and limit anxiety (everyone's) during the bad times.  This sometimes means ""lying"". I use quotation marks because I'm not sure if it qualifies as a lie when the person you say it too can't comprehend the truth. That girl with your things? We hired her and she is bringing them later in the week. We can't leave right now because your daughter will be home soon and she won't be able to find us. I find a favorite tv show, food or song can be a well timed distraction when they are locked into a loop.  Sometimes I take a warm wash cloth and wipe down my SO's face. He closes his eyes reflexively and even though he is mad I'm asking him to hold still he enjoys the feeling and it helps him to calm down a bit. 

A final bit of unasked for advice, ask for and accept help. It's hard to accept help, I always feel a bit like I have let him down when I can't do it alone. It is simply not possible to do alone. 

Check out [The National Institute on Aging](https://www.nia.nih.gov/alzheimers/topics/caregiving) as well as checking for a local council on aging as they may have resources we don't know about. I found a few things googling adult day care, adult day trips etc. these will have a cost involved but I find using them occasionally give a much needed break. ",,,,Myfeelingsarehurt,,,1471909963,t5_2rfqf,t3_4z37nk,t3_4z37nk,1,1473548138,0,0,d6skfsu,dementia,1,,
"How exactly would you employ such a system?  ",,,,seb21051,,,1472594403,t5_2rfqf,t3_50cr3n,t3_50cr3n,2,1473686258,0,0,d736y4t,dementia,2,,
"Who diagnosed a 70 year old with early onset? As far as I'm aware early onset is like 40s and 50s. It's *early*. 70s is sad but doesn't seem early to me. 

Edit: it's defined as before 65. Your uncle should see a new physician 

Early onset does have identifiable hereditary markers however the rest of dementias generally dont, or its way too many that are poorly understood. My genetic counselor says they don't do testing for anything other than early onset. The rest of dementias can trend in families but are not thought to be hereditary. ",,,,zebra-stampede,,,1471563637,t5_2rfqf,t3_4yej1n,t3_4yej1n,2,1473482280,0,0,d6ncgb3,dementia,2,,
Wow. Does he get physically violent or just menacing along with the rants?  Have you been able to get him on anti-anxiety meds? My dad resists taking meds - even tylenol - unless I was there to watch him take them. There are shorter-acting meds that might help too.  I tell him that it seems like he is feeling anxious.  Then I say  I want him to have a drink of water and take this to help him feel better. Talk to the doctor and ask about this or if he's already taking some maybe the dose needs to be adjusted.,,,,MET1,,,1470547802,t5_2rfqf,t3_4wj7ts,t3_4wj7ts,3,1473265957,0,0,d67iehb,dementia,3,,
"I work as a geriatric psychologist in the Netherlands. LBD is distinctive from other types of dementia since it usely goes hand in hand with Parkinsonism (Parkinson like features: rigidity, bradykenisia, tremors, mask like face without expression, difficulties in swallowing etc.). 

Cognitive functioning can change on a daily basis (you constantly have to adjust your approach). One day they are quite adequate, the next day their consciousness is diminshed. LBD features could also include positive symptoms (hallucinations/delusions), proneness to bodily infections and comorbid delirious behaviours, problems in executive functioning (problem solving, task shifting, planning, mental flexibility) and attention (easily distracted, difficulty keeping up with the conversation). They could also have slower thought processes, so it takes more time to proces basic information (if this is the case present information more slowly and in small chunks). LBD is also characterized by visuospatial problems: coordinating and evaluating their movement in space which could result in being unable to properly grab a fork or spoon or walking into things (danger of falling over).


Problems in the circadian rhythm is also common: trouble sleeping at night while super sleepy during the day, or not sleepy at all..It's important to adjust to their rhythm but don't overdo it: If they can't sleep, they can't sleep. Tips concerning sleep patterns: Daylight (together with melatonin supplements) and daily 'exercise' is important. 

Other important tips concerning hallucinations and delusions:

http://www.alz.org/care/alzheimers-dementia-hallucinations.asp

AND:

People with LBD are very sensitive to Haloperidol (haldol) and is counter effective in treating hallucinations/delusions. Hopefully your doctor keeps this in mind. 

Sorry for the messy lay out, and good luck! If you have any more questions let me know.
",,,,Fromfam_Ritter,,,1471882984,t5_2rfqf,t3_4yz8og,t3_4yz8og,5,1473540808,0,0,d6s0apt,dementia,5,,
"I'll chime in with the other responders: yes, absolutely you did the right thing. You're not trying to plant harmful weird things in her head or manipulate her, and it makes her happy. That's a gift. ",,,,not-rocket-science,,,1472517527,t5_2rfqf,t3_507188,t3_507188,4,1473671518,0,0,d71z7yu,dementia,4,,
"Oh my gosh, that's terrible.  I'm sure this is very hard on him.  A toast to better days for your family.",,,,caseyoc,,,1471532895,t5_2rfqf,t3_4xxiz8,t1_d6m9gou,1,1473473668,0,0,d6mnybi,dementia,1,,
"Do you have any experience with eldercare attorneys?  I want to ensure I am protecting my assets from his situation and that my family bears no liability for his actions.

We are in ""the most remote urban area in the Lower 48 states,"" which means that we have many good medical options, but not all the ones a less remote place would have.  There is literally one geriatric specialist MD in the area.  So a mental health hospital (there's only one in town) isn't going to have a geriatric unit, per se.   

He was on seroquel and doing really well with it, but the assisted living didn't want him on it during the daytime because of the risk of sleepiness and balance issues.  Since he wasn't on lockdown, they really didn't want him taking a walk and falling as a result of the medication.  So about 2 weeks ago, his psychiatric nurse switched him over to risperidone.  Dad is now refusing to take his evening meds (they suspect because he wants to control at least one element in his life), and so he's only getting a half-dose of anything.  We think this is why he's getting so wild.  The plan is to get him to the memory care and put him back on seroquel twice a day.  I'm not familiar with mirtazapine, but this psych nurse of his has a reputation for working miracles with meds.  Getting him to take them is the challenge, for sure.  I'm hoping the crush orders work and he levels out.

Thank you very much for the information!",,,,caseyoc,,,1470160195,t5_2rfqf,t3_4vsnry,t1_d614401,2,1473157817,0,0,d61aojz,dementia,2,,
"That's a very similar situation! I'm hoping the ""sugar pills"" will work!",,,,CasenW,,,1470104115,t5_2rfqf,t3_4vi8n0,t1_d5ys9s7,1,1473147445,0,0,d60hpat,dementia,1,,
"A [medicine syringe](https://www.google.co.uk/search?q=medicine+syringe&amp;client=ms-android-samsung&amp;prmd=sinv&amp;source=lnms&amp;tbm=isch&amp;sa=X&amp;ved=0ahUKEwiOrd3Z97LOAhUJmBoKHQPLByUQ_AUICCgC&amp;biw=360&amp;bih=560#imgrc=-EDlvJ8hgVUCiM%3A) we use these at work when we have to, the tip is small enough to put in the mouth and you can just release as much food as she can take each time. Pureed food and thickened juice, even the likes of ensure or any other liquid based food/supplement.

It does sound like she's in the very end stages and I'm truly sorry you're having to see a loved one like this. ",,,,Iownfish,,,1470697798,t5_2rfqf,t3_4wd0ff,t3_4wd0ff,1,1473296752,0,0,d69ofj3,dementia,1,,
"You absolutely did good. Keep it up &lt;3 ",,,,buscemi_buttocks,,,1472527882,t5_2rfqf,t3_507188,t3_507188,3,1473673816,0,0,d72672r,dementia,3,,
"This is so hard to deal with. My SO has Alzheimer's disease. How do you grieve for a person who sits across from you? How do you grieve just the part that is missing? On good days he is closer to whole, how does that effect the grieving process? I miss the loving relationship we had, even as we continue loving each other today. It is one of the things that I did not expect. I knew the day He wouldn't know my name was coming but somehow it was still a shocking blow.  My heart goes out to you and your family. Know that when you cry, you don't cry alone. We are with you. ",,,,Myfeelingsarehurt,,,1470869488,t5_2rfqf,t3_4x2u20,t3_4x2u20,5,1473334519,0,0,d6chaqg,dementia,5,,
I am so sorry for your loss :(,,,,dontmakemelivethatwa,,,1471363485,t5_2rfqf,t3_4xxiz8,t1_d6jgcd6,5,1473435175,0,0,d6ju3su,dementia,5,,
"Thanks for the checklist! I used it and we had a successful dr visit. ",,,,Mommob,,,1470887815,t5_2rfqf,t3_4wj7ts,t1_d68di43,2,1473340041,0,0,d6ct9fb,dementia,2,,
"You can request a feeding tube, but I question the kindness of this.  Your grandma is in the final stages.  If she's not receiving hospice care, she should be.  They will explain the final stages and help you to deal with them.  I'm so sorry you have to deal with this. ",,,,Lordica,,,1470494707,t5_2rfqf,t3_4wd0ff,t3_4wd0ff,2,1473254238,0,0,d66p0o1,dementia,2,,
Indeed! It's driving my friend crazy so I'm trying to find a way to help her. I hate seeing her so stressed!,,,,CasenW,,,1470104152,t5_2rfqf,t3_4vi8n0,t1_d5zjtx0,1,1473147453,0,0,d60hq6e,dementia,1,,
"I am so sorry you are going through this. All I can say is I went through my moms dementia process; It was the same hell, but different. That's to say I could type my experience out for you, but you might have things turn out complete opposites. 
I lived with my mom and dad for the worst 5 years of her dementia slide. It was horrible, but I think I helped my parents at least some. It wasn't enough. For the 5 years after that, I lived a few blocks away and my dad finally put my mom first part time and then full time in care. I still helped whenever needed.  6 months ago, my dads heart gave out. Now my mom is starting to shut down with the end stage.   
You've got to live your life...you've got young children to enjoy. Don't miss a minute there, where you're really needed.  
I am sorry for your dad and mom and family...but if you're an ocean away or next door, there is not a lot that can help. Just be supportive in your own way. My dad wouldn't dream of putting my mom in full time care until it was just too overwhelming. He sort of had the martyr thing going on. I finally had to let him do his thing and was as supportive as I could be. 
If he's in the UK, I believe they had some progressive programs there. (Dementia friendly societies and non-profit organizations). I worked for the US Alzheimers Assoc. for a while and I studied some of their ideas. So maybe look into help for him from those organizations?
Good luck...feel free to pm me for info or to talk. ",,,,Mitzukai_9,,,1472224267,t5_2rfqf,t3_4zkqfm,t3_4zkqfm,2,1473613251,0,0,d6xkrnl,dementia,2,,
"Thank you, that makes me feel better. ",,,,Sardonokick,,,1472508847,t5_2rfqf,t3_507188,t1_d71shuh,3,1473669506,0,0,d71t9sm,dementia,3,,
"My mother was diagnosed with dementia 8 years ago, and has been in residential care for the past 3 and a half. She stopped recognising me around 2 years ago. It's hideous. People don't understand how it feels. How the person I go to see is wearing my mothers body but that mum died years ago. It's like we're just waiting for her body to catch up with her brain. We make her laugh, we give her sweet treats, but I don't know who this child like person is, and she sure as hell doesn't know me. ",,,,LittleMissP,,,1470845571,t5_2rfqf,t3_4x2u20,t3_4x2u20,5,1473327082,0,0,d6byew9,dementia,5,,
A place like this is where I dream of sending my mom when she gets worse. Gotta get back to work.,,,,goosetavo2013,,,1471621198,t5_2rfqf,t3_4yiaji,t3_4yiaji,2,1473492286,0,0,d6o5znx,dementia,2,,
"Keep an eye on things to make sure she isn't getting/trying to get the medicine on her own since you guys won't give it to her. ",,,,AvengeThe90s,,,1470442107,t5_2rfqf,t3_4vi8n0,t3_4vi8n0,1,1473246140,0,0,d663e1j,dementia,1,,
"Check out the website for the [Association for Frontotemporal Degeneration](http://www.theaftd.org/).  They have lots of helpful information.

FTD mainly effects behavior, personality, speech, and executive function.  Memory loss would not necessarily be a symptom, but if she is really worried she can see a genetic counselor and even get a DNA test.",,,,Fu3go,,,1470705772,t5_2rfqf,t3_4wtccs,t3_4wtccs,1,1473298742,0,0,d69tqdf,dementia,1,,
"Thank you, will will definitely look into palliative care. ",,,,dontmakemelivethatwa,,,1471363534,t5_2rfqf,t3_4xxiz8,t1_d6jkxwg,1,1473435189,0,0,d6ju56w,dementia,1,,
"Sweetie, I lost my dad to cancer about 4 years ago, but I lost him to dementia 2 years before that.  Dementia, Alzheimer's, whatever label they choose to apply, it's got to be the most cruel of diseases.  I despise it as if it were a human itself.

You said, ""I just have a lot of hurt that I need to write about. Even if no one is listening,"" and """"She is my Gramma, but she also isn't my Gramma.""

She's still in there. It's just that sometimes the disease is stronger than she is.  Sometimes you don't know if you're getting past the disease to connect to her.  And sadly, sometimes you know a connection couldn't be made right then. But even near the end, there were short periods when he was my dad again.  Those brief ""visits"" with his real self made it all worthwhile.

I still weep for him. For the mental, emotional and physical pain that wracked his mind and body. And for what the disease did to my mother.  And for my own self in missing him.

I think I've known some of your pain. For whatever it's worth, this is an offer to listen to as much of anything you may want to say.  I'm an old, disabled Army vet, 64 y.o., cancer survivor, mom to 3 amazing adults who's recovering from a recent hip fracture/replacement, so my time is pretty free.  Maybe something we share can lead you to finding some peace of mind.
",,,,imjustyittle,,,1470899339,t5_2rfqf,t3_4x2u20,t3_4x2u20,4,1473341995,0,0,d6cyfdy,dementia,4,,
"It's also a complete and utter b-tch. ",,,,geneve,,,1470371455,t5_2rfqf,t3_4sl46w,t3_4sl46w,1,1473231597,0,0,d64yi6r,dementia,1,,
"Take her to an opthalmologist.  She could need some treatment -  cataracts, macular degeneration or even just need new glasses. Being able to see better could make dementia symptoms a lot better. My dad has very poor vision and having neglected to get treatment for years he doesn't have a lot of chance of improvement now - I think if he could read better it would be easier for him to function more independently.     ",,,,MET1,,,1471064055,t5_2rfqf,t3_4xf5uc,t3_4xf5uc,1,1473377815,0,0,d6fkeoq,dementia,1,,
"The ones who are there day in and day out always seem to get the shaft over the ""golden child"" who couldn't care less.  It's the whole Biblical story of the ""prodigal son"" all over again.    Obviously, it's a story as old as the ages. ",,,,Jewel_332211,,,1470776077,t5_2rfqf,t3_4wu0ab,t3_4wu0ab,2,1473313062,0,0,d6awp52,dementia,2,,
"My SO has Alzheimer's disease. He has made many changes. We have had a wonderful caregiver for several years. He brings him stuffed animals that he loves, takes him on special trips, buys him thing out of his own pocket makes him special meals etc. In the past two years my SO has decided he doesn't like him. Not much of a reason when you ask (he says he is dumb) and my SO says cruel things about him, sometimes to him. It has gotten to the point that the caregiver is getting a part time job elsewhere and I found another part time caregiver.  In all our time together I've never seen him treat someone so poorly and never someone who has done so much for him. On a side note I am almost grateful that it was him he decides to hate and not me. ",,,,Myfeelingsarehurt,,,1470716668,t5_2rfqf,t3_4wu0ab,t3_4wu0ab,2,1473300989,0,0,d69zrf4,dementia,2,,
She can't suck. Kind of forgot how to and also forgot how to properly open her mouth when she eats. Right now I put her food in a cup and pour it into her mouth but it often just leaks off the side of her mouth.  It can take an hour to feed her.,,,,xcelleration,,,1470445226,t5_2rfqf,t3_4wd0ff,t1_d6658gt,1,1473246814,0,0,d665apj,dementia,1,,
