body,score_hidden,archived,name,author,author_flair_text,downs,created_utc,subreddit_id,link_id,parent_id,score,retrieved_on,controversiality,gilded,id,subreddit,ups,distinguished,author_flair_css_class
"What a wonderful idea! This sounds like a high tech version of a book I gave my grandparents when I was little. They filled it out and gave it back. I treasure those books. It would feel even more special if their voice was associated with it. I'm a Speech Language Pathologist who works mainly with geriatric patients. I can think of so many uses for an app like this, mostly with patients who have degenerative conditions. 

Someone in the early stages of dementia can use this to record their memories, not just for themselves, but for their family members. While recent memories tend to go first, earlier memories as well as speech function are eventually lost. This is an easy way to record those memories. This can also be useful for patients in a nursing home. There are a few studies out that when the staff knows something about their patient, they are more likely to spend time with them. Your app could have a function where the family, Speech Pathologist, nurse, etc. selects 10 pre-recorded stories that the caregivers listen to as they are providing cares to the patient. That can then facilitate conversation. Even if the patient has limited language function, social interaction is very important. It can also be an activity family members participate in when they come and visit. Listen to a story together as told by their loved-one. 

People with ALS typically loose the ability to speak towards the end of the disease. This sounds like an easy way for them to record their life story for their family members. 

This could be super useful for someone who has had a stroke. If the stroke affects a certain part of the brain, it can cause aphasia, loss of language function. While they would have had to already record their stories, an app like this could be really valuable to them. In grad school I participated in a group called ""Tell your Life Story"" where participants made a scrapbook of their lives. They then (in theory) used it to communicate with others and facilitate conversation. With this app, they could continue to tell their grandkids stories about their childhood. 

Other ideas:
-Allow users to upload pictures then record a caption for the picture. 
-Make it so family members can set up the questions beforehand.
-Set a reminder to do one a day. 
-Make the controls SUPER simple and even have the ability to turn on step-by-step instructions (either written or audible)",false,false,t1_cnqh3ui,briecheese1414,,0,1421374960,t5_2rfqf,t3_2shmnk,t3_2shmnk,2,1424851256,0,0,cnqh3ui,dementia,2,,
You probably get more correct than us neuro-normals get! lol!,false,false,t1_co0ak9i,WormsInMyPee,,0,1422201525,t5_2rfqf,t3_2tkk70,t1_co0a54e,1,1424400143,0,0,co0ak9i,dementia,1,,
"Thank you, and if I could've explained to mrs. White that someone'd wish her blessings from far away - she'd probably be a slight bit confused and then get shy and very touched, saying it's very sweet and heartwarming that a stranger would do that! 

Blessings to you too!",false,false,t1_cnw6uzn,siepel,,0,1421859569,t5_2rfqf,t3_2so3ed,t1_cnsnk4r,2,1424483910,0,0,cnw6uzn,dementia,2,,
"Thank you for writing this, it was such a pleasure to read. Her thoughts are beautiful, and so is your heart.

My mother spent a few years in a nursing home, recovering from a cerebral hemorrhage. She introduced me to some of the other patients there, who received very few visitors and were simply aching for companionship. One by one I started adding them to my visits. My favorite was a 100 year old Albanian woman, who loved to relive how it felt to be a young girl, sweeping the courtyard with her sister, and the boys who gathered outside the door to catch a glimpse of the two of them. Her words made me feel like I was there with them, and the way her face lit up when she talked was simply beautiful. 
",false,false,t1_cnsgkxn,mykittenisaninja,,0,1421548479,t5_2rfqf,t3_2so3ed,t3_2so3ed,4,1424817139,0,0,cnsgkxn,dementia,4,,
"What you are doing is, in my opinion, beautiful. My greatgrandmother (who I called Mumums), came to America from Ireland as a young woman looking to escape poverty. She went from washing sheep in the river on her family farm, to finding work as a laborer. She was a strong woman, with class and dignity. Towards the end, she had developed dementia and had to live in a nursing home. She too would cry and become frightened, calling my granmother to come bring her home. Eventually she began to lose touch with reality more often than not. She was, in her mind, a 20 year old woman living in Irleand again having amazing adventures. My grandmother would go to see her and ask, ""What did you do today Ma?"", and Mumums would tell her some wonderful story of having seen the priest at his home, or marching in a parade. At first this was heartbreaking, but we realized that if these ""memories"" made her life better, then why not celebrate the things she was ""doing""? These memories are as real to her as anything, enjoy the times you spend with her, in reality or otherwise. Thanks for the love you share for such a sweet sounding woman.",false,false,t1_cnsn7ge,ihateyoumagicman,,0,1421565610,t5_2rfqf,t3_2so3ed,t3_2so3ed,3,1424813976,0,0,cnsn7ge,dementia,3,,
"You might want to check in /r/legaladvice as to options for obtaining guardianship over him...

Others may have better, less drastic thoughts, but my first reaction is if he's that intractable about it, taking over his affairs may be the only answer.

I don't know if, as an architect, he's in a position to do anyone harm (unsafe design leading to injury?), but if so that might be a factor...",false,false,t1_cnvogrp,calicoan,,0,1421810676,t5_2rfqf,t3_2t43tx,t3_2t43tx,6,1424492703,0,0,cnvogrp,dementia,6,,
"Talk to your dad and get a referral from her PCP to a neurologist. There may be nothing wrong, but if there *is* something wrong you will all be glad you addressed it early while she's still appropriate for therapy -- in the early stages, rehab therapists can design maintenance programs that help her maintain functional ability as long as possible (source: I'm an SLP who works in rehab). 

Obviously I'm not a neurologist and I can't/won't give medical advice over the internet, but you should know there are different types of dementia; frontotemporal dementia is a form of dementia that initially presents with personality changes. ",false,false,t1_cnum26e,jstar222,,0,1421727335,t5_2rfqf,t3_2t0g6x,t3_2t0g6x,3,1424510972,0,0,cnum26e,dementia,3,,
Why isn't it EOD then?,false,false,t1_co08x6c,WormsInMyPee,,0,1422197040,t5_2rfqf,t3_2tkk70,t1_co08735,1,1424400909,0,0,co08x6c,dementia,1,,
"I am 63 with EOD.  I recently started using MCT oils, and find it has improved my cognitive abilities.

I take other substances known as Smart Drugs or Nootropics as well.  Studying the pharmacology

of these substances (mostly OTC) helps me stay focussed and alert; somewhat self-serving, but when you

realize that your brain is your single most valuable possession, its worth the fight.

I certainly would be interested in any comments.",false,false,t1_cnlkg7n,seb21051,,0,1420996491,t5_2rfqf,t3_2s2n0c,t3_2s2n0c,1,1424936356,0,0,cnlkg7n,dementia,1,,
[deleted],false,false,t1_cngh299,[deleted],,0,1420574484,t5_2rfqf,t3_2rjmpo,t3_2rjmpo,1,1425025062,0,0,cngh299,dementia,1,,
"I am so sorry you are dealing with all of this. 

I don't have any advice for you, other than to hang in there and make sure you take care of your body while you are going through it. You have the advantage of being young, but stress like that can really take a toll. Be gentle to yourself and make sure you have support and respite. We are always here if you need to vent or talk. ",false,false,t1_cnawiy4,buscemi_buttocks,,0,1420080795,t5_2rfqf,t3_2qvwyk,t3_2qvwyk,2,1425122287,0,0,cnawiy4,dementia,2,,
"I submitted one of my original pieces to be judged in a contest called “Piano Hero” and they accepted it! One of the prizes is a Steinway piano worth 10 000$. If I am lucky enough to win it and since I already have two pianos at home, my plan would be to auction it off and give the proceeds to the Alzheimer’s Society of Canada. Two years ago I lost my paternal grandfather to this terrible disease. He was also an amateur pianist who always enjoyed playing. Although my maternal grandmother is still able to play a few pieces from time to time, I’m now slowly losing her to Alzheimer too. What if through this contest, my passion for piano could help make a little difference in finding a cure for Alzheimer and as a bonus I would hear myself on the radio?!

Please share and vote! Let’s see where we can take this!!!",false,false,t1_cnqtonp,Pantoufle2298,,0,1421411794,t5_2rfqf,t3_2smfr2,t3_2smfr2,1,1424845209,0,0,cnqtonp,dementia,1,,
"What about trying a family intervention, similar to what is done with folks who are addicted, to urge them to accept help? Are more family members nearby, or close friends or good neighbors of your parents who would be willing to take part? There are professionals you can hire to lead the intervention so as to keep the loved one from feeling he is being ganged up on. 

Is there a local council on aging in their community? It might be worth giving them a call to see if they have referrals to professionals who can help. If their wills are not in place and/or they have not named either of you as power of attorney and healthcare surrogate and don't have a living will, you really need to see an attorney about getting those in place.

Since your mother has serious health issues, surely she sees a doctor regularly. A doctor can give a little oral test in the office which lets them spot dementia problems. If you have their healthcare proxy you could call your mother's doctor, let him/her know your concerns and the next time she's due for an appt. the test can be given and the doctor can issue a referral to a neurologist. If you don't have the healthcare proxy then write a letter to the doctor (sent registered, return receipt requested), explaining their situation and asking him/her to consider getting your mother in there and giving her the test. You can't make them do anything without the legal document but if it's a caring physician perhaps this will help.

Finally, since this sub doesn't provide a lot of help, you might try these organizations. Some of them have active forums where you can discuss your problems with others in your situation and perhaps find more creative ideas on how to intervene:

[Alzheimer's Association](http://www.alz.org), 

[Alzheimer's Foundation of America](http://alzfdn.org)

[National Institute on Aging](http://www.nia.nih.gov/alzheimers)

[Bright Focus Foundation](http://www.brightfocus.org/alzheimers/livingwith/everydaylife.html)
",false,false,t1_co0a5o6,sadatay,,0,1422200517,t5_2rfqf,t3_2tkk70,t3_2tkk70,1,1424400332,0,0,co0a5o6,dementia,1,,
"The ""Broken Hip Curse"" in my experience is a myth. The onset usually happens because of depression, if you can find a way to maintain his dignity and mobility while allowing for recovery he should be fine.  ",false,false,t1_cnkzy06,Raptorsatan,,0,1420937000,t5_2rfqf,t3_2ryh4z,t3_2ryh4z,1,1424946132,0,0,cnkzy06,dementia,1,,
"I work full time on a dementia unit in a nursing home; I have witnessed probably a dozen or so people (with moderate to advanced dementia) go through a hip or pelvic fracture. This is anecdotal, of course, YMMV, etc...

About half of them did die within a year. Most of those people were otherwise frail, depressed, and NOT getting appropriate physiotherapy (or nutrition).

That still leave the other HALF who were either motivated or resilient enough to get through it somehow. Some people need to get up and get walking after surgery and cannot be stopped. They keep on trucking for years with only mild progression of their dementia.

The biggest difference between the two groups was pro-active family support. I've seen families have to fight extremely hard to get the proper physiotherapy and after care to make the success stories. It's the people without family who stay belted in wheelchairs and never get the physio to get walking again; then die from the relentless pain of joint contractures.

My advice is to be internally realistic about your father's limits. But be externally optimistic, with him and  especially with clinicians and bureaucrats. They are predisposed to see the lives of the elderly and/or demented as much worse than they are. Don't let them write him off if you feel he can fight through the treatment.",false,false,t1_cnqbqzb,SpryfieldHomegrown,,0,1421365155,t5_2rfqf,t3_2ryh4z,t3_2ryh4z,2,1424853756,0,0,cnqbqzb,dementia,2,,
"My mom's purse is littered with Post-it notes that never get read. She used to use computers back when she was working, but stopped using them roughly around the time of Windows 3.1. I'm not sure if I'd be able to get her to use a tablet, but she was very interested in a video that was playing on my iPad about the Asian American experience down through the decades.",false,false,t1_cnqmf3l,argyle47,,0,1421385058,t5_2rfqf,t3_2shmnk,t1_cnqm6hk,1,1424848598,0,0,cnqmf3l,dementia,1,,
So where on your scale would you say you are these days?,false,false,t1_cnyl9nq,seb21051,,0,1422041207,t5_2rfqf,t3_2tb7dz,t1_cnyl2dk,1,1424433492,0,0,cnyl9nq,dementia,1,,
"Well, my mom is a narcissist, so she wasn't the most pleasant person for us to be around before the dementia.  She's been diagnosed with mid stage dementia with psychosis and paranoia, but her speech is fine and she still has good communication skills. 

 Her biggest problem is the paranoia, coupled with anger from being taken from her home and put in assisted living.  She stays on the phone all afternoon and spreads lies about me, my sister and my bil to everyone she knows.  We don't know how much is due to her paranoia and how much is just her narcissism coupled with her anger at us.  She's telling everyone that we're stealing her money, put her away so we can steal her money because there's not a thing wrong with her, we've sold her house out from under her, and on and on.  None of it is true, but most of her friends and family believe her.  We've gotten a lot of backlash from it, but people will believe what they want to believe. 

We can't visit her.  She is very verbally abusive, has told me I'm not longer her daughter, told my sister she didn't love her.  She's been verbally abusive toward us much of our lives, but now it 10 times worse.  I would like to go get her and take her out to lunch, or shopping, or just visit with her, but I'm not putting myself into the position for her to verbally bash me.  I've had several people at the assisted living home tell me it will get better and eventually we'll be able to visit....but they don't know my mother.  I think she will have to totally forget who we are before that will happen.",false,false,t1_cnyaiz2,Ciscokid60,,0,1422023048,t5_2rfqf,t3_2t62k3,t3_2t62k3,1,1424438636,0,0,cnyaiz2,dementia,1,,
"Remember he may have difficulty reading after a while. If you see him turn away from things he liked, there's probably a reason (cant read well anymore, or forgetting the theme pf the article halfway through). At that point, try to think ways around it like choosing short blurbs instead of articles and reading them out loud for him.",false,false,t1_cnssbsv,weary_dreamer,,0,1421589969,t5_2rfqf,t3_2s3uyq,t1_cnn03sf,1,1424811541,0,0,cnssbsv,dementia,1,,
"His dementia is pretty advanced mentally but he is very mobile and normally speed walks throughout the home. He can't listen enough to do rehab and will refuse to stay in bed. His recovery will be interesting. Thanks for replying. ",false,false,t1_cnkq1ya,RedhairedLady,,0,1420918432,t5_2rfqf,t3_2ryh4z,t1_cnkn4xm,1,1424950904,0,0,cnkq1ya,dementia,1,,
"Oh, good idea bout the pics, I actually brought a whole bunch of black and white photos from his house, I should break them out. Oh, and even a newspaper might keep him entertained. It takes a lot of effort for me to get him out of the house, but if he likes newspapers it would give me an easy way to get him out and get him something he enjoys.",false,false,t1_cnn03sf,chronobot,,0,1421106998,t5_2rfqf,t3_2s3uyq,t1_cnmaeoo,2,1424911620,0,0,cnn03sf,dementia,2,,
"What did he do, for work and for fun, before dementia?

And don't feel too guilty about lots of TV. Its a safe activity.",false,false,t1_cnlxs2a,curious_skeptic,,0,1421019271,t5_2rfqf,t3_2s3uyq,t3_2s3uyq,1,1424929892,0,0,cnlxs2a,dementia,1,,
Best compliment ever!!! Thank you!,false,false,t1_cnw6w1j,siepel,,0,1421859616,t5_2rfqf,t3_2so3ed,t1_cnsstzl,2,1424483897,0,0,cnw6w1j,dementia,2,,
"wow. this was very, very poignant. don't feel bad in any way for living through this patient's 'made up' stories.  you are enriching the rest of her life, while elongating the precious memories that she so longs to hold on to.  in some ways it would be rude NOT to live the stories through with Miss White. blessings to you nurse, and to Miss White. ",false,false,t1_cnsnk4r,solituce,,0,1421566875,t5_2rfqf,t3_2so3ed,t3_2so3ed,4,1424813811,0,0,cnsnk4r,dementia,4,,
"Yes, do give it shot, I think you will find some things that will occupy his attention:) ",false,false,t1_cnn95xm,smiles_and_nods,,0,1421122998,t5_2rfqf,t3_2s3uyq,t1_cnn01ag,1,1424907020,0,0,cnn95xm,dementia,1,,
"Two of my elderly relatives went though this stage.  It's normal.  He's wanting reassurance and is also probably losing track of time.  Eventually, your family member will forget how to use the phone or screw up dialing.  Your dad should talk only when he can.  Reassure and redirect and get off the phone.

In terms of helping your father, one thing you can do is to have call your relative sometimes so your relative has someone else to talk to.  Send cards with very simple wording.  Send pictures.",false,false,t1_co2988x,DontRunReds,,0,1422355539,t5_2rfqf,t3_2tc97v,t3_2tc97v,1,1424366407,0,0,co2988x,dementia,1,,
"&gt; I don't believe they're fully made up - even if they didn't happen in this way, your patient is living them through talking with you. In a way, you are too.

Wow! This is changed my whole mind. When mrs. tells me about our adventures together, she uses so much details. Enough to make me imagine the 'memory'.

Just, wow!!! Thank you so much.",false,false,t1_cns8ldy,siepel,,0,1421531008,t5_2rfqf,t3_2so3ed,t1_cns3g7x,8,1424820919,0,0,cns8ldy,dementia,8,,
its cool. i thought it was like some French acronym :),false,false,t1_co09xqw,WormsInMyPee,,0,1422199949,t5_2rfqf,t3_2tkk70,t1_co08yj2,1,1424400435,0,0,co09xqw,dementia,1,,
"&gt; At this point, my father is just an elderly man I care for. The man he was, good and bad, died a long time ago.

This.

I didn't have the option of not visiting because I cared for my mother in her home during my father's illness and after he died. Her dark moods were frequent, and she used to stand in the bathroom raging at the image in the mirror. I figured if she didn't recognize herself she certainly wasn't hating me personally when she raged at me. 

&gt;how to stay supportive and continue visiting?
&gt;he might rather stay home.

The sad truth is that in the end it won't matter. But I agree with u/Lordica above. Don't hang around for the verbal rant. Disappear for awhile and return to see if things are any better, and if not, leave. Try to go on a weekend morning or early afternoon to avoid the sundown effect. Always speak in a calm, soothing tone, and try not to contradict what is being said that is hurtful because that is just fueling the fire. And don't take it personally.

Good luck.",false,false,t1_cnx3s02,sadatay,,0,1421927959,t5_2rfqf,t3_2t62k3,t1_cnw295f,3,1424466536,0,0,cnx3s02,dementia,3,,
"Understood.  From the detail of your reporting and research I would say you are quite on top of things, but my own experience is that things can vary a lot from day to day.

People tell me I show very few or any symptoms of EOD, but then I know I am not able to function as an effective project manager any more.

I used to do online IQ tests for fun, and about 5 years ago i could still top 130. At the peak of my cognitive decline, before i started with the nootropics, I could scarcely hit 100.  These days I hover around 115 to 120, and it seems reasonably stable in that range.",false,false,t1_cnykkuf,seb21051,,0,1422040112,t5_2rfqf,t3_2tb7dz,t1_cnyk8xc,2,1424433813,0,0,cnykkuf,dementia,2,,
[deleted],false,false,t1_cnb07qj,[deleted],,0,1420091841,t5_2rfqf,t3_2qvwyk,t3_2qvwyk,1,1425120545,0,0,cnb07qj,dementia,1,,
"That was a beautiful story to read. Those memories of hers sound so beautiful as well. From the day I posted this, I have started thinking so differently about dementia. I first thought of them as random memories just popping up in a persons head, but now I feel like people with dementia actually relive those moments and are *there* when they talk or think about them. It kind of puts my heart at peace, a little bit. I feel bad about the fact that dementia exists, but when I think of it after reading about how they get so caught up in the moment *as if they are there, right there happening* it actually turns into something a tiny bit better.

To every person with dementia, I wish they will only relive the good moments, not the bad. Because they are memories too, and have probably had impact. That's what I hate most about it, I think.

Thank you for your beautiful story!",false,false,t1_cnw6q5g,siepel,,0,1421859354,t5_2rfqf,t3_2so3ed,t1_cnsn7ge,3,1424483973,0,0,cnw6q5g,dementia,3,,
Understood.,false,false,t1_cnyn6q4,seb21051,,0,1422044241,t5_2rfqf,t3_2tb7dz,t1_cnylrsn,2,1424432597,0,0,cnyn6q4,dementia,2,,
"I totally agree with /u/jstar222 - Instead of trying to convince your dad she's ""going senile"", try to help him see that, not being doctors yourselves, there's no way any of you can know what the explanation is for some of these behaviors.

Most of those things your describe can have quite a number of different causes, and it would be terribly sad if the fear of senility kept him from helping her get treatment for something that could have been helped.

Hope this helps!",false,false,t1_cnvcs19,calicoan,,0,1421790555,t5_2rfqf,t3_2t0g6x,t3_2t0g6x,1,1424498226,0,0,cnvcs19,dementia,1,,
Is there a way to convince him to retire? It seems impossible to reason with him.,false,false,t1_cnx4kkq,josem79,,0,1421931112,t5_2rfqf,t3_2t43tx,t1_cnvogrp,1,1424458669,0,0,cnx4kkq,dementia,1,,
"Oh, yes, *lots* of variability. People could see me at two different times of day and think I was two different people.",false,false,t1_cnyl2dk,wildcard235,,0,1422040881,t5_2rfqf,t3_2tb7dz,t1_cnykkuf,1,1424433586,0,0,cnyl2dk,dementia,1,,
"In my mom's case, it's the short-term memories that seem to be a problem retaining. She's great at recalling things that happened years ago. It would be wonderful for there to be a way of addressing that unobtrusively; repeatedly peppering someone with dementia with questions is pretty universally discouraged.",false,false,t1_cnqi8dk,argyle47,,0,1421376982,t5_2rfqf,t3_2shmnk,t3_2shmnk,2,1424850731,0,0,cnqi8dk,dementia,2,,
"The -E4 allele generally only predicts a higher likelihood of later life Alzheimer's disease, but there are something like half a dozen other genes that can impact your odds of getting AD. I assume you've been checked out for TIA's and hydrocephalus and all that...but...food for thought I guess?

Anyway, yeah. I hear a lot (a lot!) of different new potential treatments for AD or dementia or other related illnesses from blueberries to coconut milk to turmeric to not eating gluten to not taking statins along with dozens and dozens of others. The ketogenic diet is one of the few that I personally give any credence to right now because it actually does change the metabolism of your neurons if you are doing it right.

Good luck!",false,false,t1_co0pboc,hithazel,,0,1422229688,t5_2rfqf,t3_2tb7dz,t1_co0hwzs,2,1424393116,0,0,co0pboc,dementia,2,,
"Want to also offer support. My father suffers from a similar dementia. I spent my life as a teenager standing between him and actual physical abuse that he threatened to dole out. Over time, his dementia actually made him a pleasant, child like shell of his former self.

It was impossible to make me feel better then, when I was villainized. Over time I came to adjust my expectations, through support, and that had the most impact for me. You can help your husband by reassuring him that the things said aren't true and helping him reset his expectations, over time, about what his father will do or say. But you should also seek support - it's helped me immensely over the last 6 years.

You should consider talking to an attorney to ensure you protect your MIL, and her assets, from your FIL. For a variety of reasons, including the relative certainty that he will need long term care, good planning now could alleviate many pitfalls. ",false,false,t1_cni8sej,tigereyes69,,0,1420710044,t5_2rfqf,t3_2rndgy,t3_2rndgy,2,1424994573,0,0,cni8sej,dementia,2,,
