body,score_hidden,archived,name,author,author_flair_text,downs,created_utc,subreddit_id,link_id,parent_id,score,retrieved_on,controversiality,gilded,id,subreddit,ups,distinguished,author_flair_css_class
"Do you know the source of your MCI and has it been diagnosed? I ask because being in the mid 50s you aren't really a very good candidate for Alzheimer's unless you have an inherited familial version of the disease.

I've known many people to try out the Medium Chain Triglycerides products like Axona or just eating coconut oil and the results haven't really been there. The same goes for most of the research- it has been studied in Alzheimer's patients, like many things have, but no one improvements were shown.

On the other hand, in the research it seems like a more strict ketogenic diet could hold some promise. In the brains of people with Alzheimer's disease there is often a huge insulin resistance problem that crops up after the accumulation of beta-amyloid but before the brain starts to be damaged irreparably. Hypothetically, removing the brain's dependence on that sugar that is impacted by the insulin resistance could offer you some resilience.",false,false,t1_co0eltd,hithazel,,0,1422210001,t5_2rfqf,t3_2tb7dz,t3_2tb7dz,2,1424398187,0,0,co0eltd,dementia,2,,
"Interesting about the fidgety toys, I'll look into them and see how that goes! Thanks for the advice!",false,false,t1_cnn01ag,chronobot,,0,1421106873,t5_2rfqf,t3_2s3uyq,t1_cnmb9mi,2,1424911652,0,0,cnn01ag,dementia,2,,
Thank you very much. It seems it would really only be of much value before the dementia starts in.,false,false,t1_cnps0sg,OneMoreLuckyGuy,,0,1421332830,t5_2rfqf,t3_2shmnk,t1_cnppyw8,2,1424863241,0,0,cnps0sg,dementia,2,,
Thanks,false,false,t1_co6wea1,genki-sama,,0,1422727079,t5_2rfqf,t3_2ub71p,t1_co6ux59,1,1424287033,0,0,co6wea1,dementia,1,,
"Thanks for making me feel better about the TV.. I guess it really is a good thing because he is pretty unstable and falls a lot. I do try to keep the TV on documentaries and science things, which is more his style. I'll look into the fidget toys too, sounds interesting! He keeps saying he is not interesting in puzzles but I think I'll throw one out and see how he does.",false,false,t1_cnmzzv4,chronobot,,0,1421106799,t5_2rfqf,t3_2s3uyq,t1_cnmyukb,1,1424911670,0,0,cnmzzv4,dementia,1,,
"Get Professional help, they're obviously not going to listen to you. And in a way, you may be enabling them as well. Don't feel guilty about wanting to help them, even if it means a little tough love.  You are now the adults, and they are becoming more child like.

A little context:  I am 63, retired, diagnosed with OED.  I am fighting it every day with nootropics (smart drugs), diet, as much mental and physical stimulation as I can muster.",false,false,t1_co01618,seb21051,,0,1422165034,t5_2rfqf,t3_2tkk70,t3_2tkk70,3,1424404629,0,0,co01618,dementia,3,,
"Pot bread.  Will keep them mellow and dozy, is inert in low doses, and also is good for alzheimers / dementia as a brain cleanser. 

Worked for my dad.",false,false,t1_cnigj0n,gameoverplayer1,,0,1420733761,t5_2rfqf,t3_2rndgy,t3_2rndgy,1,1424990843,0,0,cnigj0n,dementia,1,,
Articles about super preliminary studies with ridiculously overhyped headlines should not be posted here.,false,false,t1_cnxspam,dumbmatter,,0,1421973948,t5_2rfqf,t3_2tc19q,t3_2tc19q,1,1424447145,0,0,cnxspam,dementia,1,,
"I don't have any thoughts on how you'd convince someone to retire if they're impossible to reason with...

The only additional thought I have that might be helpful is about you-

From an outsider's perspective, I feel that I see you recognizing that he can not be reasoned with, yet simultaneously not recognizing that.

I imagine that there's a part of you that hasn't been able yet to accept that things have really, truly come to this very sad situation.  And, part of you is maybe trying to be completely fair, to leave no stone unturned in the effort to find a solution that lets him have a say in what happens next.

Again, from this outsider's perspective, if several doctors, plus all his family have failed to make a dent in his determination to keep working, I'd say there's really no hope that there are any other means to persuade him.

It might help if you focus your own thoughts on the fact that it is the physical condition of his brain that is causing him to be impossible to reason with.

In reality, the situation he's in now, he's no more able to reason well about the pros and cons of things than is a person who was ***born*** with a brain problem.

We all are very much challenged by the fact that this person who ***was*** well able to reason has now lost that ability.

But it ***is*** well and truly lost.

Maybe it helps to think of it this way - If you were responsible for someone who was born with a brain problem that makes it impossible to care for themselves, would you have any problem with doing whatever it takes to keep them (and others) safe?  Sometimes that might mean a lie or two, sometimes it might mean ""Because I said so"" instead of explanations.

It's probably perfectly fair to think now of your father in the same way.

Anyway, I hope there's something helpful in there somewhere...  Let me know if there's anything else you'd like to ask...",false,false,t1_cnxhfwq,calicoan,,0,1421955547,t5_2rfqf,t3_2t43tx,t1_cnx4kkq,3,1424452469,0,0,cnxhfwq,dementia,3,,
"I am really tired mentally right now. I think the last set of marks was only from a few days ago, and changes do not appear to be rapid, so about the same as the last column. I plan to post updates.",false,false,t1_cnylrsn,wildcard235,,0,1422041997,t5_2rfqf,t3_2tb7dz,t1_cnyl9nq,1,1424433257,0,0,cnylrsn,dementia,1,,
Grandma had a stroke (we think) then several days later fell and broke her hip. Recovering in the hospital after the first surgery there's no doubt she had dementia. Later she crawled out of bed in the middle of the night and broke her other one. She was to high risk and never got it operated on and her mental state accelerated further into Alzheimer's to the point that she didn't recognize me anymore (I was the only one she always remembered). Then 2 or so year's after he passed away due to breathing problems which was this august. All of this was over the course of 10 years so bottom line is a surgery isn't always a killer but you have to watch them incredibly closely afterward.,false,false,t1_cnkqvwj,tootacticool,,0,1420920073,t5_2rfqf,t3_2ryh4z,t3_2ryh4z,1,1424950517,0,0,cnkqvwj,dementia,1,,
"I definitely really enjoy this idea.. My father has a Parkinsonian movement disorder and has some dementia-like symptoms that have come along with this in the process. Writing is very hard for him though he does want to write down stories like this for the future. I tried teaching him to use Dragon dictation, but it didn't go over well. This app, though it may have faults when marketed directly to typical dementia sufferers as other users have shared, could be of great use to some people! They have notebooks/journals that help save these similar memories, but to be able to record in your own voice and share with family and others could be a really special thing.",false,false,t1_cnqd4xk,truthinthemiddle,,0,1421367643,t5_2rfqf,t3_2shmnk,t3_2shmnk,1,1424853109,0,0,cnqd4xk,dementia,1,,
"The broken hip curse comes from the loss of mobility.  If the patient is scrupulous about doing their physical therapy and keeping as mobile and upright as possible, a full recovery is achievable.  I've seen it go both ways.  Does your father suffer from dementia already?  If so, is he compliant with his caregivers?  Either way, if he suffers from osteoporosis, that needs to be addressed.  My MIL is on a course of a medication called Forteo that actually helps rebuild the lost bone.  There are possible side effects, but her doctors and she agreed that the risk of future fractures was higher.   ",false,false,t1_cnkn4xm,Lordica,,0,1420912746,t5_2rfqf,t3_2ryh4z,t3_2ryh4z,2,1424952267,0,0,cnkn4xm,dementia,2,,
"Disclaimer: all dementia is different, so I'm about to generalize

The app sounds really good as a concept, unfortunately, the reality of dementia is often more sinister. Older memories are fairly easy to remember (mostly), but more recent memories are harder. 

There are a few problems though:

Understanding technology is a mental skill. Dementia also causes the loss of technological understanding.... apps go early, remote controls and stuff in the middle, forks and toilets at the end. Now, a caregiver could still operate an app for the benefit of the person with Dementia... However....

looking, watching, understanding are also skills. There are so many times my Mother in law is thirsty, so she yells ""water"". But she is sitting on her bed, and right beside her on the table is water. So I point at it and say your water is right on the table.. she looks straight at me. So I say ""Look on the table"" and point again.. but still she does not see it. Even if I hold it right in front of her, she looks at the ceiling instead of at the water. While she can sometimes watch very familiar movies, showing her a picture and expecting her to understand is very difficult. A lot of times She will also lie and pretend she understands what you are showing her ""This is you riding a unicorn...""""Oh yeah, I see that"" ""... this is a picture of an apple..."" So her ability to comprehend that is limited. She sees herself in the mirror, and it is a stranger looking back. 

So this is an interesting concept you have here, and it sort of enforces the future of ""cyberbrains"" concept.. but for dementia, it is of limited value. I do appreciate you taking the time to post here, and perhaps for those other forms of dementia it would be more valuable. ",false,false,t1_cnppyw8,foxsable,,0,1421327422,t5_2rfqf,t3_2shmnk,t3_2shmnk,1,1424864199,0,0,cnppyw8,dementia,1,,
"I guess a lot depends on where he is at with the progression, but here's some stuff that we've tried with my mom:

* kid sized jigsaw puzzles and sorting toys, I usually find a good variety (and some good ideas) at the thrift store
* kinetic sand
* poker chips (and then having her sort into different colors)
* fun catalogs (like skymall)
* do a search on amazon (or wherever) for ""fidget toys""

Hope this helps, but yeah, don't feel bad about TV time, sometimes it's the only option.  My mom does seem more responsive with her favorite shows from the past.  
",false,false,t1_cnmyukb,MostlyCivil,,0,1421104718,t5_2rfqf,t3_2s3uyq,t3_2s3uyq,1,1424912207,0,0,cnmyukb,dementia,1,,
"Mom had hip replacement around age 65 and recovered quite well. Had a nice sized yard to putter in and did volunteer work once a week with her friend and went out for lunch once a week with the same friend. Fell again at age 87 and broke it again. Never left hospital and passed within several weeks of second replacement. Her staying active, husband, and grand-kids seemed to be the best medicine after the first fall. Very tired and frail before the second fall.

Don't let him just sit/lay around and mildew. ",false,false,t1_cnkg0gl,flashlight2,,0,1420892459,t5_2rfqf,t3_2ryh4z,t3_2ryh4z,2,1424955659,0,0,cnkg0gl,dementia,2,,
"With an irreversible condition like dementia, most doctors will not recommend the use of a feeding tube because it can, in many cases, lead to increased suffering and lengthening of the time a person spends in the most painful part of their illness.

My experience is that patients in this stage are best served by having family around them as much as possible, although that can mean a week or more spent in hospice. The time a person lives in this state will also depend on their general health and any comorbidities.

Also, [here's](http://www.webmd.com/balance/questions-answers-artificial-nutrition-hydration-end-of-life-decision-making) a quick link that discusses some of these issues and might give you more concrete information.
&gt;Is there evidence that avoiding artificial nutrition and hydration contributes to a more comfortable death?

&gt;Yes. Much of this evidence is based on observations by those who have had a great deal of experience caring for people who are dying, such as hospice workers. They have noticed that patients who are not tube fed seem more comfortable than those who are.",false,false,t1_cnhedrv,hithazel,,0,1420650764,t5_2rfqf,t3_2rkyky,t3_2rkyky,1,1425009093,0,0,cnhedrv,dementia,1,,
So me at 20 with numerous head injuries could develop it? I've been reading and much of the symptoms of dementia match with what's going on with me now.,false,false,t1_co6tdbu,genki-sama,,0,1422720926,t5_2rfqf,t3_2ub71p,t1_co6srfg,0,1424288445,0,0,co6tdbu,dementia,0,,
"Not a doctor here.  Look up anti inflammatory drugs like the cannaboids in cannabis, there are many other in nature. 

I would make sure I spoke with at least 2 doctors and would start taking tests to measure your abilities and see if they degrade by taking the same test weekly or monthly etc.

You brain needs time to heal so do your best to not reinjur it again.",false,false,t1_co6ux59,gameoverplayer1,,0,1422724141,t5_2rfqf,t3_2ub71p,t1_co6tdbu,2,1424287722,0,0,co6ux59,dementia,2,,
"My father in law broke his hip and died in three months. He was full on dementia and it was horrible.  He had a stroke which is probably why he fell. He wasn't walking well to begin with, using a walker to shuffle very short distances. They wanted to do surgery and put in a feeding tube as he suddenly couldn't swallow. We said no way.That last 13 days where he starved to death was horrible. We are kinder to our pets. The myth is of the ""peaceful"" death. Oh , he was 90.",false,false,t1_cnoq033,corbie,,0,1421249433,t5_2rfqf,t3_2ryh4z,t3_2ryh4z,1,1424881386,0,0,cnoq033,dementia,1,,
"This is quite beautiful. I am a psychology doctoral student studying the experience of living in dementia care, and your account reminds me keenly of the memories I 'make up' with the residents I have met in the care home. I don't believe they're fully made up - even if they didn't happen in this way, your patient is living them through talking with you. In a way, you are too. You sound like a wonderful nurse and just what this lady needs. Best wishes to you and your patient. ",false,false,t1_cns3g7x,oiseleur,,0,1421520258,t5_2rfqf,t3_2so3ed,t3_2so3ed,15,1424823376,0,0,cns3g7x,dementia,15,,
"Excellent post!  Thank you!

I have EOD, and am doing much the same, with Organic Coconut Oil, and attempting to stay closer to ketogenic side of the equation with a paleo diet. Have lost weight around my stomach slowly over the last few months.

I take the Oil along with some nootropics to help with the cognitive issues, and feel that i have slowed down the degradation to some extent.

You may find this amusing:  /r/oldernoots

How old are you?",false,false,t1_cnyjeu3,seb21051,,0,1422038286,t5_2rfqf,t3_2tb7dz,t3_2tb7dz,2,1424434358,0,0,cnyjeu3,dementia,2,,
"If he was mobile before his broken hip, the odds are good that he can regain that mobility with proper therapy.  Does he live independently, or is he in some sort of assisted living facility?  You might find [this](http://www.annalsoflongtermcare.com/article/6903) article helpful.",false,false,t1_cnkskjq,Lordica,,0,1420923438,t5_2rfqf,t3_2ryh4z,t1_cnkq1ya,1,1424949682,0,0,cnkskjq,dementia,1,,
Thanks! I hope it can have a good impact on at least some people.,false,false,t1_cnrb2w3,OneMoreLuckyGuy,,0,1421443568,t5_2rfqf,t3_2shmnk,t1_cnqd4xk,1,1424836938,0,0,cnrb2w3,dementia,1,,
":(

:)

:(

:)",false,false,t1_cnt5jdy,kilkil,,0,1421617639,t5_2rfqf,t3_2so3ed,t3_2so3ed,2,1424805215,0,0,cnt5jdy,dementia,2,,
"Sorry it was so frustrating for you. 

Unfortunately, many of us have family members in this situation and aren't able to just quit. I certainly wouldn't wish this on anyone who has a choice though, it is not an easy road to walk an I don't think anyone understands what it is like until they go through it. ",false,false,t1_cnir9ff,foxsable,,0,1420751209,t5_2rfqf,t3_2rs3lb,t3_2rs3lb,3,1424985795,0,0,cnir9ff,dementia,3,,
"The contents of your blood can be changed much more easily than the metabolism of the brain, so the higher blood ketones aren't as meaningful to me as the potential for the brain chemistry changes on a very strict ketogenic diet.

Have you looked into any of the research recently done on fasting? There's some evidence that the brain chemistry changes that result from the ketogenic diet could also be instigated by intermittent fasting. I spoke to one of the researchers who is working on this and he brought up this story of fasting being used long ago to ""cast out evil spirits"" and that that could have been a proxy for helping people deal with neurological problems.",false,false,t1_co0ttlu,hithazel,,0,1422237886,t5_2rfqf,t3_2tb7dz,t1_co0q8bl,2,1424390935,0,0,co0ttlu,dementia,2,,
"Head injuries, football, rugby, car accidents. Definitely possible.",false,false,t1_co6srfg,gameoverplayer1,,0,1422719546,t5_2rfqf,t3_2ub71p,t3_2ub71p,1,1424288745,0,0,co6srfg,dementia,1,,
This a good idea. Thanks.,false,false,t1_co0c5xe,OneMoreLuckyGuy,,0,1422205104,t5_2rfqf,t3_2shmnk,t1_co0bc2g,2,1424399396,0,0,co0c5xe,dementia,2,,
Oops.  Slight Dyslexia.,false,false,t1_co08yj2,seb21051,,0,1422197158,t5_2rfqf,t3_2tkk70,t1_co08x6c,1,1424400891,0,0,co08yj2,dementia,1,,
"Or until it gets to the dis-associative phase, which some people can be in for a long time. 

The thing that is hard to understand about Dementia/Alzheimer's is that memory is not just remembering things, but how to control your body, perception, etc. It's really strange, and you never quite get used to it, as a caregiver. ",false,false,t1_cnps6j2,foxsable,,0,1421333175,t5_2rfqf,t3_2shmnk,t1_cnps0sg,1,1424863167,0,0,cnps6j2,dementia,1,,
"The main advice I would give is to urge you to act as soon as possible. From the sounds of things you may have already passed the point where it is possible for you to get them to agree and stick with anything but you may need to try to get legal and financial responsibility for their situation handed over to someone who can understand what is happening. If you are in the US, there should be a local area agency on aging in the vicinity of your parents that you need to contact right away. They should be able to give you some legal and financial advice and options.

The financial situation will ultimately define your options- if your parents are behind on bills or taxes or, god forbid, they have been robbed or scammed and they don't even know it, it's going to severely limit what can be done to help them as far as professional intervention.",false,false,t1_co0edj2,hithazel,,0,1422209553,t5_2rfqf,t3_2tkk70,t3_2tkk70,1,1424398294,0,0,co0edj2,dementia,1,,
Early Onset Dementia.,false,false,t1_co08735,seb21051,,0,1422194588,t5_2rfqf,t3_2tkk70,t1_co0217q,1,1424401303,0,0,co08735,dementia,1,,
