body,score_hidden,archived,name,author,author_flair_text,downs,created_utc,subreddit_id,link_id,parent_id,score,retrieved_on,controversiality,gilded,id,subreddit,ups,distinguished,author_flair_css_class
"Plate size won't cure the compulsion to jam too much food in her mouth. We have these little desert plates that I use at lunch. They are maybe 6 inches and I sue them because they perfectly fit a sandwich and a small handful of chips or fruit. It didn't matter what type of plate we used. She would still try to stuff her mouth and it was a major choking hazard because she has dysphagia. Portioning out food was the only thing that worked. Eventually her condition progressed where she was no longer able to self feed so I am very easily able to control how much she gets into her mouth, but before we got to this point it was a major battle for a little while to keep her from choking on things. The issue now is she still wants to put things into her mouth which these days is basically just her blanket. ",,,,DoctorFlimFlam,,,1469212215,t5_2rfqf,t3_4u10h7,t1_d5mmhgm,1,1471609021,0,0,d5mo96j,dementia,1,,
Hugs to you! I couldn't do it. It was such a huge relief that my FIL had to go to the hospital and then straight to a home. Hope you get a break soon.,,,,whatsreallygoingon,,,1469927463,t5_2rfqf,t3_4vbsw7,t3_4vbsw7,1,1471808729,0,0,d5xsxuk,dementia,1,,
"am not judging! ",,,,lagnaippe,,,1468804118,t5_2rfqf,t3_4t5stl,t1_d5g92z6,1,1471498285,0,0,d5g9mrn,dementia,1,,
"As their world gets smaller and smaller it is always good to find something that will bring a chuckle to them.  It may be something that you can still share with her til the end.   Good luck my friend, I hope that it works out for you both. ",,,,ponyuptexas,,,1467863571,t5_2rfqf,t3_4r7jxn,t1_d51phsz,1,1471257913,0,0,d52e06e,dementia,1,,
"Oh! This explains so much!

The first thing that you need to understand is that your grandfather is not in his right mind. This is so difficult, because dementia patients can be quite adamant and determined. You must step back and separate yourself from the emotional aspect of being his grandchild, and look at his behavior objectively.

My own FIL was once a successful businessman. As he descended into dementia, he receded into a an angry state where he accused my husband's mother of ruining him and destroying his millions. Of course, the truth was that he squandered away his money, and treated everyone terribly, in-general.

You have to wrap your head around the fact that your grandfather is operating in another reality. In his mind, everything he believes is the absolute truth. You must approach this as you would a five-year-old who insists that they have to eat a cupcake for dinner.  Of course, they want that. Of course, they insist that is reality. But, they no longer have agency.

It's especially difficult for you; because you have to help your mother through the pain of losing her father while he is still alive. She is facing the challenge of a former authority (who still looks and talks like her father), yet who can no longer make rational decisions. In essence, you may need to be the rational mind for both your grandfather and your mother. Try to empathize by imagining how hard it would be if your mother suddenly began acting like a small child.

Of course, you want to give your mother the opportunity to stand up to him and take control. She should arrange guardianship and oversee every aspect of his care. At the point that you describe, he is too far gone to manage his own care.

The fact that he vomits could be your out. Wait until he does this, with your mother away, and call emergency services. Explain to them that he has dementia and that you fear for his life. The key is to get him into managed care.

Now, keep in mind that he will quickly lose his fortune, once this takes place. If your mother is invested in her inheritance, she should have the opportunity to take over his money and make sure that he has caretakers. If, at any point, he is neglected; then you should report it to elder services. 

So sorry for your situation. The good news is that you have more options than most people do. Don't forget that you are dealing with someone who is financially capable of receiving adequate care. There is absolutely **NO** reason that you should have to be his caretaker!",,,,whatsreallygoingon,,,1467341335,t5_2rfqf,t3_4qltih,t1_d4uue0n,2,1471072828,0,0,d4uv7x7,dementia,2,,
"Its rough! One thing I found from being in nursing homes is that men do not usually live very long. Unless its the early onset. ",,,,iiiiiiiiiiii,,,1469881033,t5_2rfqf,t3_4vbsw7,t3_4vbsw7,1,1471796415,0,0,d5x377r,dementia,1,,
"Ah.  So I'm guessing they have you on an anti psychotic medication - is that right?  ",,,,calicoan,,,1467638371,t5_2rfqf,t3_4r329h,t1_d4y5yn9,1,1471194693,0,0,d4yqnv9,dementia,1,,
"It progresses differently for everyone.  :\ I've seen people walking and talking (although very confused) pass a few weeks later from rapid decline.  I've seen one woman linger for a few years bed bound and completely unable. Total assistance with everything. It may be unusually fast but it isn't unheard of.

As for the behavior I would recommend seeing if there is any medication that could be given as needed.  The key thing in my opinion is comfort.",,,,rocketduck413,,,1467334851,t5_2rfqf,t3_4qn31b,t1_d4uhsl2,3,1471071021,0,0,d4urdur,dementia,3,,
"Does he have a doctor? Call the doctor up and tell him your concerns. 

Tell pawpaw he and grandma both need to go in for full physicals. Hopefully by having them both go in it will lesson the stress of the situation. 

The mood swings concern me the most, but pawpaw is going to give everyone in the house heat stroke if he keeps the heater on. 

",,,,darthjenni,,,1469032093,t5_2rfqf,t3_4tqpwg,t3_4tqpwg,2,1471557964,0,0,d5jpsjv,dementia,2,,
"I probably wouldn't rush to replace the driver's license...just because the dr lets him drive doesn't mean he should be driving.  ",,,,Aparty,,,1469143405,t5_2rfqf,t3_4tx8xl,t3_4tx8xl,3,1471591146,0,0,d5ln1sz,dementia,3,,
"had to look up how to do page breaks, hope this works. ",,,,BayAreaSteppen,,,1467772414,t5_2rfqf,t3_4rfufq,t1_d50vl20,1,1471231886,0,0,d50vu3i,dementia,1,,
"Your grandparents are lucky to have you. This is scary or them, I'm sure. 
If you can get a diagnosis for her, she may qualify for a home health aid worker paid through her health insurance. Check with any services in your area that deal with the senior population.
",,,,Geezerette,,,1468640729,t5_2rfqf,t3_4t10wd,t3_4t10wd,1,1471462304,0,0,d5e70zl,dementia,1,,
They are visiting us now and my mom and aunt who lives near by have decided that's it's gotten to the point where something needs to be done to keep her safe. They are going to conference call with the rest of the siblings but a home care person is seeming like the best option for now.,,,,shadinik1,,,1468641445,t5_2rfqf,t3_4t10wd,t1_d5e70zl,1,1471462468,0,0,d5e7dgs,dementia,1,,
"I know it's worrisome, and I'm sorry you have to deal with this. If you've always stumbled over words that is not necessarily dementia or anything to worry about. I would do whatever you can to keep your brain active. You may describe yourself as uneducated but that doesn't mean you can't do things to learn and keep your brain active. Also, if your father has issues with alcohol that may have a lot to do with his symptoms. 

Keep yourself healthy, eat right, exercise your brain. Good luck!",,,,not-rocket-science,,,1469500080,t5_2rfqf,t3_4ul06a,t3_4ul06a,2,1471682509,0,0,d5qxdii,dementia,2,,
"Chewable melatonin! Just tell him it's candy! And then don't leave the bottle out where he can find it! I've started this with my dad. It helps some but often he's up half the night anyway. ",,,,mgcarter3,,,1467643409,t5_2rfqf,t3_4qltih,t1_d4u1tji,1,1471195809,0,0,d4yt15j,dementia,1,,
"Schedule a doctors appointment for her for an evaluation. The day of the appointment you can tell her the truth or say you're going out for ice cream (but you'll have to get ice cream!) and then go to the appointment first. If she is a danger to herself or others a memory care facility might be the best option. It's dangerous for someone to live alone, if she can't afford an adequate nursing home or memory facility it might be time to live with family. ",,,,mgcarter3,,,1467658075,t5_2rfqf,t3_4r7kmb,t3_4r7kmb,2,1471200550,0,0,d4z2wtj,dementia,2,,
I definitely don't mind! I have great friends here but none of them really get what my life is like. It would be nice to chat with someone who understands how maddening this is!,,,,mgcarter3,,,1467749423,t5_2rfqf,t3_4r4gub,t1_d506stu,1,1471224356,0,0,d50g2q3,dementia,1,,
Ive worked in dementia home before but this is so different. After work I could just clock out leave it there and not think about it again until the following day. plus Ive only ever looked after people who already were in advanced staged of dementia-ive never seen it from the beginning until now. Its also early onset.,,,,Samm1y-O1,,,1469881288,t5_2rfqf,t3_4vbsw7,t3_4vbsw7,1,1471796454,0,0,d5x3a8w,dementia,1,,
"""TauRx’s tau aggregation inhibitors (TAIs) are the product of nearly 30 years of research, preclinical and clinical investigations. The company’s first-generation TAI, rember®, is a patented, highly-purified version of methylene blue, a compound previously used to treat a variety of conditions.

The TauRx team reported encouraging Phase 2 clinical trial results with rember®, providing strong support for the tau hypothesis and adding to the well-established correlations confirmed by many groups linking the spread of tau aggregation pathology with clinical dementia from its earliest detectable stages. The findings suggested that a treatment targeting the tau aggregation cascade could potentially delay the progression of cognitive decline in mild to moderate Alzheimer’s.

TauRx is now confirming these findings in Phase 3 clinical trials with the company's second-generation TAI, LMTX®. The Phase 3 clinical trial programme involves over 1,900 patients and comprises three separate trials: two in Alzheimer's disease and one in the rare neurodegenerative disorder, behavioural variant frontotemporal dementia. This Phase 3 programme is now coming to a conclusion but TauRx will not be making any public comments or issuing any statements about the individual trial results until the data from the final study to complete is available for analysis. The company currently plans to make an initial announcement of the results of the first two trials to complete at two presentations at the Alzheimer's Association International Conference (AAIC) in Toronto, Canada on 27th July. Until then, TauRx believes it would be scientifically inappropriate to comment on results as data analysis is still ongoing.""

AAIC (Alzheimer’s Association International Conference) info here:

http://www.alz.org/aaic/",,,,dmbream,,,1468812617,t5_2rfqf,t3_4td5hd,t3_4td5hd,1,1471500510,0,0,d5gecrh,dementia,1,,
"I'd say suicide, because of the feelings people often have that they should have known, there must be something they could have done. 

Not that those things are true, just that they're what people often feel in that circumstance. 

But that doesn't mean losing your mother as you have is really any less painful...  I think a lot of people are perhaps less likely to process the feelings through out the course of the illness.  And even so, it's hard to know ahead of time how you'll feel when she does die...

Life really throws some curve balls, doesn't it? ",,,,calicoan,,,1467868912,t5_2rfqf,t3_4rlu37,t3_4rlu37,2,1471259244,0,0,d52gtuw,dementia,2,,
"You haven't given a location; so I'll assume that you are in the U.S.

I think that the first thing you must do is discern all contributing factors to this situation. Keep in mind that I'm going to speak from my own experience, and in simplified terms.

Your grandfather is living with you for one (or a combination) of the following reasons:

**1. Cultural:** Your mom is conditioned to believe that you take care of family ""no matter what"". She comes from a place where multi-generational households are the norm; and it's cause of shame to abandon loved ones because of failing physical or mental health.

In this case, she may be blind to the fact that her children are not of the same mindset.

**2. Financial Distress:** Your grandfather may be destitute, and your mother believes that there is no way to pay for his professional care.

**3. Financial Greed:** Your grandfather may have money, that your mother is utilizing, and she understands how quickly it will vanish once his is being cared for, properly.

**4. Ignorance:** Your mother has no knowledge (or inclination to learn) of the services available for your grandfather.

Once you figure out which one applies, you can be better equipped to act.

The most important thing to remember is that your grandfather had the opportunity to live his life. At some point, he was able to think about, and plan for, his future. Had he done this, adequately, he would be taken care of. Since that is not the case, you should not be expected to sacrifice your youth in payment for his misfortune. The gift of palliative care should only be a ""gift"" and not a burden. And, since it is of your mother's choosing, it should be her gift (not yours). 

The Medicaid system is set up to provide complete care for the indigent. If your grandfather is indigent, then you just need a dementia diagnosis, and an assessment that he is unable to care for himself, to begin the placement process. This is expedited by a medical emergency. In our case, my FIL had a panic attack that looked like a cardiac event. Once we got him to the emergency room the system kicked in. He was diagnosed and sent to rehab, where they assessed him for long-term-care. Now, it's imperative that someone (preferably your mother and/or you) have a durable Power of Attorney or guardianship in place. Otherwise, he will be at the mercy of the state.

If the pieces are in place, then you can get him into a memory care unit. It may seem terrible; but at least you have the ability to choose where he goes. They will make sure he is fed, bathed, toileted and looked after. It may not be wonderful; but trained professionals can provide better care than you can. Plus, it's completely unfair to saddle you with this!

If this is a cultural issue, or if you mother is in some type of denial (very common with children of demented parents), then this will be much more difficult. Start by utilizing the social services and advocacy organizations at your disposal. They may be able to help your mother come to terms with why keeping him at home is not necessarily in his best interest. If she can't accept this, then you may need to make yourself unavailable by moving out or taking an extended leave of absence from your house.

The final scenario ""Financial Greed"" is much more insidious; and I hope is not the case. If your grandfather has a certain number of assets, then he does not qualify for Medicaid. This would mean that any facility he is put into would require full payment, until he is out of money. This is called ""paying down assets"". He can also pay down assets by giving your mother money for expenses while he lives with her. If there is a large inheritance, then your mother could be biding time until he dies and she gets it. Putting him into a facility would quickly eat that up.

So, what it comes down to is that your grandfather is perfectly eligible for good care, and your mother is either too ignorant or too greedy to make that happen. Instead, she is imposing upon you to buy time until there isn't a choice to be made. 

Make it your job to understand what your granfather's financial situation is, what the local social services provide (in-home care, adult daycare, palliative care, etc.) and what Medicaid options are available. The best option is to talk to a qualified elder law attorney.

Good luck to you, and please don't let your mother's decision be a detriment to your life!",,,,whatsreallygoingon,,,1467331957,t5_2rfqf,t3_4qltih,t3_4qltih,3,1471070200,0,0,d4upn38,dementia,3,,
"How about getting her an evaluation for speech-language therapy? Seeing that your mother is in the early stages, she can participate and make functional gains. In the sessions, they may target identifying activities at her level to increase participation; establishing a memory book to supplement memory; promote sustained attention for engagement of activities; and work on orientation to environment and situation. I work with dementia and Alzheimer's patients daily at a skilled nursing home, but usually they aren't the best rehab candidates. I wish I could treat more patients at her level. As her diseases progresses, she will likely be referred for a speech consult for dysphagia (swallowing disorder). People with dementia show signs of leaving food in their mouth and other poor swallowing problems that place them at risk for other serious medical problems, like aspiration pneumonia. ",,,,leahxdarling,,,1468340033,t5_2rfqf,t3_4r7jxn,t3_4r7jxn,1,1471378380,0,0,d59cach,dementia,1,,
"Thank you so much for this - I apologize for not replying right away - I am still learning my way around reddit and didn't notice I had messages!!

We talked as a family and she is going to get a referral to a neurologist.  Thanks!!  :-)",,,,Melphinidae37,,,1467380351,t5_2rfqf,t3_4otqn0,t1_d4oiw6p,1,1471135125,0,0,d4vax4q,dementia,1,,
"This post came through just as I replied to the other one. 

I appreciate the advice and will look into it-he doesn't actually accept that there is anything wrong so it's difficult to persuade him to go somewhere like that. Again paying for someone/somewhere is not an option right now. His friend takes him to church once a week for 1 1/2 hours so that is a brief break,but spent catching up and maybe baking a quick cake with my daughter. Life is crazy. ",,,,Samm1y-O1,,,1469889086,t5_2rfqf,t3_4vbsw7,t1_d5x6c6d,1,1471797982,0,0,d5x6ixz,dementia,1,,
"I am a professional caregiver. My mistake, you are perfect.",,,,lagnaippe,,,1468808007,t5_2rfqf,t3_4t5stl,t1_d5gar5a,2,1471499316,0,0,d5gbtii,dementia,2,,
"I understand completely. ((Hugs)) I recommend care.com for finding someone, it is easy to search/post. ",,,,applesangria,,,1467830497,t5_2rfqf,t3_4r7jxn,t1_d51pivx,2,1471246503,0,0,d51qate,dementia,2,,
"Look for a local Alzheimer's Association office, and make an appointment to speak with someone there. They have a lot of information on dealing with people with dementia (not just ALZ) and you may even find a support group of people going through similar things. I agree with /u/MostlyCivil about the POA, it's critical. Do it before someone else does (my FIL's gold-digging girlfriend tried to get him to sign over POA but thankfully it didn't work). 
",,,,not-rocket-science,,,1467644393,t5_2rfqf,t3_4r4gub,t3_4r4gub,1,1471196063,0,0,d4ytkl7,dementia,1,,
"I'm sorry for what you are going through and I sympathize with it all. 

Are you in the US?

Does the doctor have her on any meds? 
If so which ones?
",,,,sotomoto,,,1469594909,t5_2rfqf,t3_4uqdra,t3_4uqdra,1,1471711105,0,0,d5sky21,dementia,1,,
"The thing to do in this stage, where things have changed, but he can't remember those changes, is to fib a bit... 

Reminding him that those things are no longer his doesn't help, since he's no longer capable of remembering  what you tell him.

Therefore, each time you tell him his house is gone, his cars are gone, he's literally hearing it for the first time. And the pain he feels is the pain of learning *just now* that he no longer has a home or cars.

Instead, how you can help him is to give him some reason for those things not being around that sounds temporary, such as the cars are in the shop because they needed a tune-up, or he's staying with you because the house is getting a new roof.

You don't have to worry that later he'll be asking you why it's taking so long to tune up the cars, because he won't remember you told him that any more than he now remembers you telling him that they've been sold.

So each time you tell him they're getting a tune-up, he'll be hearing it for the first time.

A lot of people are uncomfortable with the idea of lying to somebody they respect and love. It can seem underhanded and manipulative.

But, if you Google it a bit, you'll find that this technique is actually what professionals in the field recommend.

Anyway, hope this helps, good luck!",,,,calicoan,,,1467578586,t5_2rfqf,t3_4r38hr,t3_4r38hr,1,1471182423,0,0,d4y1bb3,dementia,1,,
"My grandpa has lost his wallet, glasses, and teeth multiple times. Now, he just carry a wallet with $20 and his address and phone number. My grandma holds everything else :D",,,,nibble25,,,1469133147,t5_2rfqf,t3_4tx8xl,t3_4tx8xl,2,1471587705,0,0,d5lfx3e,dementia,2,,
"Because my current plan of sitting in a diner eating pie until time stops isn't working very well. ",,,,geneve,,,1468696084,t5_2rfqf,t3_4t5y2m,t3_4t5y2m,2,1471473167,0,0,d5etl06,dementia,2,,
"At this point, I would reach out to the local social services offices for resources.  They have people dedicated to checking on the condition of people like your Grandfather.  I am sure you don't want to hear this, but you need to step up and take some control of this situation.  They need your help as much as you need to help them!  If you need help finding resources message me and I will do what I can to assist you.
",,,,j0kerdawg,,,1469940679,t5_2rfqf,t3_4tqpwg,t1_d5x6pkg,1,1471812139,0,0,d5y0098,dementia,1,,
Family caregiving is a job we don’t often anticipate and can be challenging in regards to time and patience. Having a diagnosis of dementia adds to the challenge and people are often in denial which can cause troubled dynamics for families coping with dementia.,,,,Taking22Tango,,,1467654496,t5_2rfqf,t3_4r8ch5,t3_4r8ch5,1,1471199402,0,0,d4z0h51,dementia,1,,
Am so glad that I am not related to you. Hope you and yours have a wonderful day.,,,,lagnaippe,,,1468842568,t5_2rfqf,t3_4t5stl,t1_d5gcyc0,2,1471505599,0,0,d5goxvc,dementia,2,,
"I battle with similar feelings as well. I've found that waiting until you feel capable of keeping your cool and being compassionate is a valuable move. I always regret being snippy, and even though she may not even remember THAT I was snippy, I still do and it adds to the pile of emotional stresses regardless. On the other hand, I've had my bad days and spent time with my grandma after/during, but somehow seeing her helpless in her situation and being able to smile at her while she smiles back, temporarily takes me out of my own issues and sticks me into that ""now"" of just being present with her. I remember that her world is different from mine and it feels like a privilege to add some sort of fleeting positivity to her day, if even for a moment. 

But again, sometimes we are just not at that point, and you can't take good care of anyone while you yourself are in a bad spot.  I find nothing wrong with not being chatty. A small smile goes a long way, but nothing wrong with zipping in and out for some food. Or quickly exiting the room to ""go to the bathroom"". 

It all depends on how you're feeling in the moment, but I've definitely found that I sometimes feel better by talking to her instead of avoiding her. Feel like I've done something nice or constructive for her situation. But AGAIN, it flip flops and I also definitely know when it is best to keep my distance. 

Not sure if I've helped or resolved anything with this little rant but just wanted to say hang in there and it's is ok to take some time for yourself and not engage when you feel it is necessary. Take it day to day and take care of yourself wherever possible, nothing wrong with recharging. 

All the best to you and your grandma :)",,,,whst,,,1467347230,t5_2rfqf,t3_4qpmnz,t3_4qpmnz,2,1471129230,0,0,d4uygfp,dementia,2,,
[deleted],,,,[deleted],,,1467571658,t5_2rfqf,t3_4pn44d,t1_d4mafic,1,1471180395,0,0,d4xx0cf,dementia,1,,
"Say that it's a smaller hospital so he can get better care, so that he can recover. 

You're doing right thing, it's easiest moving into a NH right after hospitalization. ",,,,applesangria,,,1469828575,t5_2rfqf,t3_4v7su8,t3_4v7su8,1,1471785443,0,0,d5wga5z,dementia,1,,
"Thank you so much! This is great advice. Surprisingly my grandfather is a millionaire yet refuses to pay for nursing home care because he thinks they are just trying to ""drain his money"". Doesn't seem fair that he has no problem using his family though. He does not pay rent and my mother makes literally any excuse you can think of for him. I told my mom that my grandfather told me this morning he doesn't feel good so I told my mom and she didn't believe me. He also vomits in the toilet multiple times a day/night so I also brought this to my mother's attention and she told me ""he has been doing it for a long time now it's nothing to worry about"". I am just so angry that my mother is being so selfish and blind to the reality of this situation.",,,,kruziikrell,,,1467339928,t5_2rfqf,t3_4qltih,t1_d4upn38,2,1471072437,0,0,d4uue0n,dementia,2,,
