body,score_hidden,archived,name,author,author_flair_text,downs,created_utc,subreddit_id,link_id,parent_id,score,retrieved_on,controversiality,gilded,id,subreddit,ups,distinguished,author_flair_css_class
"&gt; 
&gt; Prior to being caregiver, he had offered my mom help to pay for certain things. Car Repairs, Food, Gas

&gt; It wasn't until recently that we realized he was medicated. The VA and state didn't give us any information on what he took or any of his medical records.

&gt; The worst part of everything......The state hasn't paid my mom....OR HIM.


1) You didn't get his medical records. You didn't get a meds list. 

2) You were counting on someone with dementia to remember a promise about money 

3) The worst part of this is that the man has a brain disease which is sucking away his personality and life. The worst part is that he was removed from a place where he was stable, and went cold turkey off meds that should NOT be handled that way. 

I'm done with this conversation. 

",,,,applesangria,,,1470375129,t5_2rfqf,t3_4w7d3r,t1_d6501oc,1,1473232226,0,0,d650c4o,dementia,1,,
"Excessive forgetfullness in the young can also be a sign of attention seeking, especially from dysfunctional upbringing.",,,,seb21051,,,1470784473,t5_2rfqf,t3_4wtccs,t3_4wtccs,1,1473315277,0,0,d6b2wiy,dementia,1,,
"Impossible to say what's going on, but I think you're doing exactly the right thing with the neuro consult.  If you don't feel like you're getting results from her current doctor, find another one.  

Does she live by herself right now?  If she gets a prescription for something, will she be able to manage her medication?",,,,caseyoc,,,1471033712,t5_2rfqf,t3_4xf5uc,t3_4xf5uc,2,1473370791,0,0,d6f1g1n,dementia,2,,
"We had a solid set plan, we knew exactly what we were getting into. We did all our research and thought everything out before we initiated the plan.

but, things fall apart when he isn't getting the money he deserves from the VA and forcing us to not only pay for his food, but he also eats all of our food too.

The only reason this is going very sour and we sound unprepared, is because they are screwing him and us over intentionally.

We now do actually have a plan for him to be put into a home thats far more fitting for him. But we still want the money we are owed by the state for taking care of him in the past few months.",,,,PsychoticDreams47,,,1470373926,t5_2rfqf,t3_4w7d3r,t1_d64zoiv,1,1473232029,0,0,d64zrog,dementia,1,,
"Its not quite so clear cut as that. You can be approved with 2 or more life limiting conditions. 6 months is the general guideline, but if the doctor OKs it to continue, you're good. I know people who have been on hospice for over a year, at a similar stage to what you've described. If the meds are discontinued, that may reduce life expectancy quite a bit. Taking away blood pressure meds, diabetes meds, etc definitely ups the chances there will be an adverse health event. 

As far as ethics, that's a difficult question to answer. My guideline has been this: will the removal of the meds cause pain or discomfort? ",,,,applesangria,,,1471319766,t5_2rfqf,t3_4xxiz8,t1_d6j9ot1,4,1473427763,0,0,d6j9ygt,dementia,4,,
"You mean that you create one yourself or is there a particular one you had in mind? www.mindmate-app.com is great for the person themselves to keep notes, reminders and to-do lists and you as a family member could help them set it up? (There is also other great features and it's FREE)! It's for iPads, iPhones and Tablets. ",,,,Gabrielaellala,,,1472595349,t5_2rfqf,t3_50cr3n,t3_50cr3n,1,1473686497,0,0,d737m6c,dementia,1,,
"Even my terrible small town has adult day care called 55 and alive, they have a shuttle that will pick people up and it's $10 an hour. They do crafts, play bingo, have breakfast and lunch, and take field trips. I WISH I could have gotten my dad going there. Maybe there's something like that in your city? ",,,,mgcarter3,,,1471910390,t5_2rfqf,t3_4z2v4t,t3_4z2v4t,2,1473548235,0,0,d6skpti,dementia,2,,
"Thank you for your honest reply.  She currently has a live in nurse, but I fear it will need to change in the next year or two.  

All your information was a helpful guide for the future.  Thanks again for reaching out!
",,,,mybossthinksimworkng,,,1471892114,t5_2rfqf,t3_4yz8og,t1_d6rqqlm,1,1473543406,0,0,d6s7eml,dementia,1,,
"My sympathies.  As the time honored airline training goes, use your own oxygen mask first.  Can either of them use the phone still, or can you set up a Skype/Facetime with a cheap tablet? Visit them that way when the drive is too much. Are any other sibs ever available? Even a weekend here or there would take the pressure off. Do what you can, take care of yourself, but remember that this is temporary.
",,,,Geezerette,,,1470964730,t5_2rfqf,t3_4x962n,t3_4x962n,7,1473356014,0,0,d6dy3il,dementia,7,,
"I unfortunately have experience with this. Nobody wants a dementia patient with violent tendencies. There are a rare few places that ""specialize"" in difficult/violent/reluctant patients. You may want to call a few caregiver hotlines/support lines, they will give you good info. I called Care2Caregivers (not sure if that's available where you are) and they gave me a few leads to pursue. Ultimately we decided to give it another 6 months at home to re-assess. 

Yes, a psychiatric hold is an option if the patient is violent/endangering themself or others. You want to avoid this if possible, because it means they'll be transported to the ER. If you're lucky, there will be an open bed at a nearby geriatric psych unit; if you live in an area with limited resources, there may be nowhere for them to go, and they will be kept in the ER (very confusing, not particularly safe). Transfer to a geriatric psych unit will be confusing for him but they are definitely the best people to get his meds evaluated &amp; stable. If an ambulance is called, direct them to take him to a hospital WITH a geriatric psych unit, even if it's not the closest one. Transfer within hospital is much easier than transferring to a different hospital/system. If a 5150 is what it comes to, you can also refuse to take him back. If you are adamant that he cannot come home to you, the hospital social workers will be forced to assume responsibility for his placement. 

His private pay to Medicaid transition is not that unusual. I wouldn't worry too much about it. Find a place that takes Medicaid, and just go through the process. GET IT IN WRITING that they will allow him to transfer from private pay to Medicaid!! You are also right that he will need to be declared incompetent. A psychiatric hold may streamline that process a little more than if you have to go through the court system again. 

Keep persisting with the doctors to get crush orders, or a switch to liquid meds. If he's refusing to take meds, that's probably contributing to his fluctuations in behavior. What is he on, and how long has he been on it? It may be time to reassess and try different meds, because this regime obviously isn't working. For what it's worth, we tried several different things. What finally worked (and has been a complete game changer) is risperidone twice per day, and mirtazapine once per day. I was very reluctant to go down the anti-psychotic route, but it's made the hugest, most amazing difference. The extreme paranoia, threats, accusations, and physical abuse have stopped completely.

You are NOT the first person to go through this. I am so sorry you are, because there is a huge gap in memory care--- there are the sweet, confused dementia patients... And then people like our family members, who are verbally and physically absuive, and who nobody wants to care for. The good news is that the memory care unit will be MUCH more equipped to handle his outbursts than assisted living. He will not be their first patient to go through this. And, while I understand you're afraid they will kick him out in a few weeks... That gives you a few weeks, and buys you some time to research and see if the new meds are helping at all. Go through with the move, hope for the best, and have a backup plan just in case. It will probably be easiest if you guys just quietly move him in, without fanfare or explanation. If he is agitated by the move, white lie!!  Say that there was a flood in the other part of the building, and this is his newer/nicer room. No need to rationalize or try to explain. 

Edit: also wanted to say... Memory care units have seen worse than a cup of coffee thrown at someone! My family member is at home, but has threatened with knives, hit people in the head with frying pans and flower vases, given black eyes, twisted arms, pinched &amp; hit. It would be unusual for a dementia patient to never have a moment of belligerence, honestly. Your biggest hurdles right now are getting him into the new unit (again, lie! Like a rug!), and then the nurses need to focus on getting meds into him. This is not an impossible situation, though I know it feels like it. ",,,,applesangria,,,1470151982,t5_2rfqf,t3_4vsnry,t3_4vsnry,6,1473155436,0,0,d614401,dementia,6,,
"My mother is rapidly approaching final stage dementia and is pretty much unable to do anything much, but she still lashes out at the couple of 4 year old's running around the house. A couple of months ago it was really dangerous for them to be around her as she was more able to move around and she would wait until I was out of sight and then lunge at and collar them and hold them down so they could not get away, all the while pulling dreadful fearsome faces at them.

Their response was to get angry at her which compounded the problem as they'd do spiteful things like sidle past her with their ice lollies, knowing she loves them and that she didn't have one, which would make her even more vitriolic. 

So, I think young kids and a demented person makes for a pretty unhappy house. Perhaps even a dangerous house for kids to be in.",,,,seedpod02,,,1471045599,t5_2rfqf,t3_4wj7ts,t3_4wj7ts,2,1473373916,0,0,d6f9uqc,dementia,2,,
"You absolutely can talk to the doctor about this as health care POA.

While hospice is an option, apparently Medicare has gotten stricter. My father was on it for a full six months and came off, then a year later the doctor wanted him back on but the hospice provider wouldn't accept him. Reading between the lines it sounds like they were afraid of not getting reimbursed if he came off a second time. As his condition deteriorated he was eventually accepted, and died on hospice.

Ask the doctor about palliative care. Like hospice the goal is comfort, not cure, but is more open-ended. My father was put on palliative care when he was rejected for hospice.

One other thing to consider: when the medications were reduced my father's health and mental state improved. He had fewer falls as well. He was more alert and active, and regained his appetite. He still declined, but it was a small bright spot.",,,,xnedski,,,1471349409,t5_2rfqf,t3_4xxiz8,t3_4xxiz8,5,1473431771,0,0,d6jkxwg,dementia,5,,
"It's very unusual for feeding tubes to be used with dementia patients. The unpredictability of the disease would make a feeding tube more of a danger than helpful. Using a feeding tube on someone with Alz. would be like putting someone who is brain dead on life support and not pulling the plug.  ",,,,fitsme2atee,,,1470551684,t5_2rfqf,t3_4wd0ff,t1_d66p0o1,1,1473266577,0,0,d67jw6c,dementia,1,,
Same. I saw a documentary on a nursing home in the UK that adapts to the world the person is inhabiting. They even went as far as to get hold of the car one man's dad drove in the fifties and took him out for the day. I was going to recommend it to you but I can't remember what it was called. /r/irony,,,,HairyLenny,,,1471621959,t5_2rfqf,t3_4yiaji,t1_d6o5znx,1,1473492492,0,0,d6o6m4u,dementia,1,,
"Neuro to the rescue! At least for a diagnosis. Sorry you're going through this, I wish you all the best. ",,,,mgcarter3,,,1471053622,t5_2rfqf,t3_4xf5uc,t3_4xf5uc,1,1473375745,0,0,d6fes5z,dementia,1,,
"OMG, this sounds SO MUCH like my father in many ways.  It's so freaking frustrating because they are with it enough to know your sore spots so that they can continually poke at you but can't remember the last sentence they just uttered.  Just left my dad's place due to an argument. I feel for you.  It's hard to know just how much crap you have to take in order to accommodate a person with dementia.  Sometimes I feel like a punching bag...",,,,depoqueen,,,1472262785,t5_2rfqf,t3_4watlr,t3_4watlr,2,1473624081,0,0,d6yc24h,dementia,2,,
Straw?  Bottle with a suck top?,,,,plotthick,,,1470445119,t5_2rfqf,t3_4wd0ff,t3_4wd0ff,1,1473246791,0,0,d6658gt,dementia,1,,
"I've dealt with this but from my grandmother. I'm from an affluent family (I hate saying that, it sounds so braggy but it's important to what I'm going to say) 

She has always been almost a little snobby due to her status, but ever since dementia has kicked in she is almost intolerable (God that sounds awful) but she's very rude to serving staff at restaurants and to cashiers at stores. Before it kicked in she held in rude comments until we left the establishment but now she says how she feels to the person's face. I've seen a waitress almost cry.

I realize she can't control it but I feel aggravated as a result, then feel guilty for that. It's stressful.",,,,BethJones91,,,1470451067,t5_2rfqf,t3_4watlr,t3_4watlr,3,1473247994,0,0,d668ndu,dementia,3,,
"it is only wrong if it upsets her. ",,,,ponyuptexas,,,1472522429,t5_2rfqf,t3_507188,t3_507188,4,1473672631,0,0,d722l9m,dementia,4,,
This was so hard to read.   I feel your pain.  You are not alone.  Thank you for going to see her anyway... it does make a difference.  Sending hugs your way.,,,,jenniferjuniper,,,1470850164,t5_2rfqf,t3_4x2u20,t3_4x2u20,4,1473328546,0,0,d6c250y,dementia,4,,
"I had the same thing with my wife who had early onset FTD. Drove me nuts. Couldn't get anything done. Went on all day and night. Chronic sleep deprivation for me. She'd just sleep all day if she was tired. Respite care or adult day care would have been good. The carer's mental health ie yours is often at risk. Mine was. It was a difficult and lonely road for me. Hope you get some good advice, help, support. You can try all sorts of distractions. Didn't work for me and her. She just kept popping into my home office to say hello. It's a phase that will pass. ",,,,Larsent,,,1470045481,t5_2rfqf,t3_4r7jxn,t3_4r7jxn,2,1473132750,0,0,d5zetf1,dementia,2,,
"I am 46 and have Frontotemporal Dementia.   My smartphone is a godsend and certain apps help me so much just from a living and functioning perspective, let alone keeping engaged, entertained and my brain stimulated.  It allows my wife to leave the house with much less stress that something bad will happen if I'm on my own.  I can uber to places I simply cannot drive.  I have a GPS on me at all times allowing me to find things and be found in case of emergency. 

So many people think dementia is just old clueless people.  ",,,,ftdALIVE,,,1472568379,t5_2rfqf,t3_4z873k,t3_4z873k,1,1473679355,0,0,d72myt8,dementia,1,,
"So what I did find out is that he doesn't have the dementia most people on this thread has. I think it's ""Offset dementia"" if i heard right? 
He knows my mom, knows me, knows a lot of his past, but cant remember anything from 5 minutes ago or a day ago, constantly pacing, constantly talking to himself etc.

So he was diagnosed with dementia, just not severe

The problem is he wanted my mom to be his caregiver for years for a few reasons, he knew she'd get paid by the state and he'd live in a comfortable area where he felt safe.

But something happened and something went wrong, the VA started to say he was insane and they gave him another ""caregiver"" (that's not the word, i just cant remember the actual name for it at the moment). And we had to fight for, i guess...custody over him lol.

After finally getting it, we got his stuff from the hospital, moved him here, and he was happy. then about a month and a half ago he just started acting different.

The VA refuses to give us any money, only enough money to eat for a day or 2, and we get that money once a month. And she hasn't gotten paid. So lawyers are involved and stuff.

Now we decided we want him to live in a home because it's not fair to us to be getting screwed by the state. And the person that was his conservater or whatever, was not a nice person. 

A lot of weird stuff happened, so. I'm sorry for the weirdness lol.",,,,PsychoticDreams47,,,1470377034,t5_2rfqf,t3_4w7d3r,t1_d650y23,1,1473232525,0,0,d6517bw,dementia,1,,
"&gt; Does that happen a lot?

not really... it's just troubling how she forgot about the conversation completely and still can't recall even after me trying my best... her blood pressure is slightly above normal, could be that? We just moved some time back and she is still settling in and she does seem a bit more stressed out than normal about things as well... 
",,,,IAmMohit,,,1471458523,t5_2rfqf,t3_4y6w5e,t1_d6lee9s,1,1473457542,0,0,d6lhl6j,dementia,1,,
"We are in this together! Feel free to message anytime even just to vent. ",,,,Myfeelingsarehurt,,,1470720003,t5_2rfqf,t3_4wu0ab,t1_d6a0w8w,2,1473301608,0,0,d6a1ehr,dementia,2,,
[deleted],,,,[deleted],,,1470421061,t5_2rfqf,t3_4w7d3r,t1_d650c4o,1,1473240949,0,0,d65oir2,dementia,1,,
"Well first off, I'd recommend getting a actual diagnosis. Dementia is never a diagnosis, it's just a category of symptoms. From what you're saying, its more short term memory, behavioral and mood issues, it sounds a lot like frontal temporal dementia. (I'm not a doctor though, get that checked!)

The VA probably assigned hours to another caretaker, but when you got 'custody' you essentially just gave up those hours, they didn't get transferred to your mom. 

The money they are 'giving' you, i'd find out what it is actually for, doesn't sound like its for caregiver, and its too little for a monthly allowance. Again, I'd totally talk to a VA case manager who can break the numbers down for you, so you can figure out what his benefits are, and what your options are. ",,,,bevkc,,,1470377541,t5_2rfqf,t3_4w7d3r,t1_d6517bw,1,1473232599,0,0,d651fa3,dementia,1,,
I am so sorry.  How are you doing with it all?,,,,caseyoc,,,1471356268,t5_2rfqf,t3_4xxiz8,t1_d6jgcd6,2,1473433182,0,0,d6jopfe,dementia,2,,
"I am not trying to be a bitch, and we can leave the conversation here. But if you guys knew exactly what you were getting into, you would've had a list of his medications. You would've realized someone with dementia cannot understand, remember, or give consent to things like giving money for food/gas/etc. 

My best advice is to speak to an elder care attorney, as they are very familiar with insurance and Medicare, as well as custody. I hope the financial mess is resolved quickly for you guys.",,,,applesangria,,,1470374284,t5_2rfqf,t3_4w7d3r,t1_d64zrog,1,1473232088,0,0,d64zxxt,dementia,1,,
"On 16th June this year, my girlfriend's Nan suddenly passed away, and it is by far the worst thing that's ever happened to her. In her last few months dementia took over, and she was losing all the great memories she had with her family. It would be amazing if you could donate anything, and if not maybe share with friends who could. Her fundraising page is https://www.justgiving.com/fundraising/MW16kimberleybond . Maybe, together we can help build a world without dementia.",,,,ManjGMK,,,1471891354,t5_2rfqf,t3_4z21dt,t3_4z21dt,1,1473543179,0,0,d6s6tbj,dementia,1,,
"Honestly, I'd just roll with it for the time being.  He may be a little more lucid in an hour or in a day or even a week, and then the grief could hit.  Unfortunately, the initial shock and subsequent grief could happen over and over as he forgets the dog is dead and then ""finds out"" that she is gone.  ",,,,caseyoc,,,1472150888,t5_2rfqf,t3_4zjyd1,t3_4zjyd1,4,1473598606,0,0,d6wfzss,dementia,4,,
"I started giving her Ensure when her weight began dropping and the Dr said to give her up to 6 meals a day - I used it as a filler food between her standard 3 meals. But I stopped when she started struggling with whole food, and I started doing veg purees for her. Good idea to get her back on Ensure now she's struggling with purees :)",,,,seedpod02,,,1471451963,t5_2rfqf,t3_4wd0ff,t1_d6kuq6p,1,1473455362,0,0,d6lbwqt,dementia,1,,
"Hm. My mother mentioned getting another (cause it's the family fridge she's going into not someone's private one in the open; sorry for the bad explain) fridge and putting it in the garage and anything fresh-but-easily-opened or leftovers would go out there. Not sure what that leaves in the in-house fridge, but okay.",,,,AvengeThe90s,,,1472501586,t5_2rfqf,t3_502vif,t1_d71gsrr,1,1473667673,0,0,d71nrd9,dementia,1,,
"Thank you for commenting- this is all really helpful information.  Her mind is still relatively sharp- she still plays Scrabble, etc. But she goes in and out of focus.  She has had night terrors for years.  I'm sure this was one of the signs that LBS was coming but didn't realize it at the time.

Again, I appreciate all this information and will share it with the family.  Thanks.",,,,mybossthinksimworkng,,,1471892385,t5_2rfqf,t3_4yz8og,t1_d6s0apt,2,1473543482,0,0,d6s7m5n,dementia,2,,
"Just make her comfortable. Usually people die an average of seven years after diagnosis. They may go through a fearful or aggressive period early on, but eventually that goes away too. 

Later on they won't remember much, save for the deepest memories. For awhile, my mother started speaking Italian again, that information was so deep.

Make sure legal and financial matters are in order. Find a good nursing home for the later stages. At some point you won't be able to care for her.

Eventually she will start having physical issues like urinary tract infections from sitting in diapers all the time. Finally, she won't be able to swallow, as that part of her brain deteriorates. 

I'm sorry for you and your family. Just be brave and face it head on without delusions. ",,,,DocCyane,,,1471867464,t5_2rfqf,t3_4yz8og,t3_4yz8og,2,1473537190,0,0,d6rqqlm,dementia,2,,
"Man, I feel you.  Dementia multiplies behavior.  Impulse control is quickly lost.  My dad became such a creepy old man that embarrassed me almost every time we went out in public.  The bad side of dementia is that learning is lost, so you can't train them out of this bad behavior.  ",,,,Lordica,,,1470417278,t5_2rfqf,t3_4watlr,t3_4watlr,3,1473239881,0,0,d65lhkg,dementia,3,,
"My heart goes out to you! 
The sting is still there but at least I know I'm not the only one dealing with this. It's so crazy to see someone you have known so well completely just evolve into a 180 version of themselves. I feel for the caregiver too, it's a total slap in the face &lt;/3 ",,,,silentecko929,,,1470718904,t5_2rfqf,t3_4wu0ab,t1_d69zrf4,1,1473301420,0,0,d6a0w8w,dementia,1,,
"My mother still recognizes me, but she's in a different country and I've not been able to see her for 16 months. We talk on the phone, but she's getting worse and worse. She doesn't remember the name of my youngest kid, or stuff I told her five minutes ago. Other relatives have just said it's because she can't see well, but I think they're in denial.

I know you're grieving, but I want you also to be thankful that you do get to see her in person. Take photos, record some video... Cherish what you have.",,,,IHaveSomethingToAdd,,,1470852239,t5_2rfqf,t3_4x2u20,t3_4x2u20,3,1473329213,0,0,d6c3uzg,dementia,3,,
"I understand why they developed it, but I wonder how many dementia patients are comfortable using a smart phone, let alone new apps on it. I'm still having to explain to my mom that the time displayed on her flip phone is the current time; not a time stamp from a missed call.",,,,ductoid,,,1472490300,t5_2rfqf,t3_4z873k,t3_4z873k,1,1473664662,0,0,d71evmr,dementia,1,,
"It's ok to feel guilt, it's a normal part of the process. If you feel it's not passing or interfering with your life talk to a therapist, putting your parents in a home may have accentuated problems you already had with your relationship with your parents. Get help and talk to someone, take care of yourself first and those around you will get better.",,,,goosetavo2013,,,1471007672,t5_2rfqf,t3_4x962n,t3_4x962n,2,1473363238,0,0,d6ehdoy,dementia,2,,
"You're right, we didnt do or ask any of that to anybody before we did any of this. We said to ourselves ""Lol, old guy, lets make some money babyyyy!!!!!""

Sorry",,,,PsychoticDreams47,,,1470374506,t5_2rfqf,t3_4w7d3r,t1_d64zxxt,2,1473232125,0,0,d6501oc,dementia,2,,
"Thanks! They've had her checked, I went out and bought some crystal light and tic tacs so maybe that will help.:)",,,,CasenW,,,1470104065,t5_2rfqf,t3_4vi8n0,t1_d5yl01h,1,1473147433,0,0,d60ho1v,dementia,1,,
This is why this condition is so hideous and hidden. How do you talk about that fact that the person you love is gone even though you see them every day. That the care we give is in memoriam.,,,,sharpstick,,,1470859016,t5_2rfqf,t3_4x2u20,t3_4x2u20,4,1473331365,0,0,d6c9chg,dementia,4,,
Are your parents upset by this?,,,,plotthick,,,1472444777,t5_2rfqf,t3_502vif,t3_502vif,1,1473657574,0,0,d70u2wu,dementia,1,,
"Put a mini fridge in your room? Can't imagine that this is a habit that will change, unless you lock the fridge (and I'm not sure about the ethics of that)",,,,applesangria,,,1472483029,t5_2rfqf,t3_502vif,t3_502vif,2,1473662821,0,0,d719fuh,dementia,2,,
"Nope, yours! I doubt she'd use it. You could keep your stuff separate and ensure it stays clean. ",,,,applesangria,,,1472492767,t5_2rfqf,t3_502vif,t1_d71albq,1,1473665342,0,0,d71gsrr,dementia,1,,
