body,score_hidden,archived,name,author,author_flair_text,downs,created_utc,subreddit_id,link_id,parent_id,score,retrieved_on,controversiality,gilded,id,subreddit,ups,distinguished,author_flair_css_class
"The benefits of an earlier memory clinic assessment ",false,false,t1_cnwh83x,mmmp3sa6,,0,1421875361,t5_2rfqf,t3_2t7psc,t3_2t7psc,1,1424478920,0,0,cnwh83x,dementia,1,,
"Perhaps add music.  Have popular songs from different eras, let them listen and then ask for a memory connected with the song.  Include hymns, show tunes and movie music.",false,false,t1_co0bc2g,Lordica,,0,1422203315,t5_2rfqf,t3_2shmnk,t3_2shmnk,1,1424399783,0,0,co0bc2g,dementia,1,,
"One of the first things I noticed about my mil,long before she was diagnosed with Alzhiemers, was the staring.  She would just stare out into space and wouldn't join in a conversation unless you asked her a direct question, which she would answer and go back to staring.  

I noticed the signs in my mil long before my husband.  Even when it started to become more obvious, he and his sister pretty much refused to see it....were in denial.  I started pestering my husband, telling him that things were not normal, but it took the police calling him at work to tell him they had pulled over his mother for driving erratically before he started admitting to himself that there might be a problem.  ",false,false,t1_cnyazv7,Ciscokid60,,0,1422024092,t5_2rfqf,t3_2t0g6x,t3_2t0g6x,1,1424438414,0,0,cnyazv7,dementia,1,,
"What worked well for my mom was toys for toddlers. I guess depending on how advanced his condition is, you could choose toys for different ages, but you get the gist. 

Play-doh, coloring books, really easy puzzles for kids (again, I was using toys for age 3 kids), memory games for kids, picture books, etc. There's actually a bunch of cool stuff once you start looking at the kids' section. We had a blast with the games until she kept deteriorating and is too self conscious to play anymore because she doesnt want to get anything wrong. Now I stick to play-doh.",false,false,t1_cnssabm,weary_dreamer,,0,1421589809,t5_2rfqf,t3_2s3uyq,t3_2s3uyq,1,1424811560,0,0,cnssabm,dementia,1,,
"Patience is key with a lady like mrs. White. Sometimes she'll get too emotional while trying to put her thoughts into words, but the things she'll share with you after you hold her hand and tell her it's okay to be sad sometimes... I can't find my words here! I just feel really blessed I get to share these special moments with her.",false,false,t1_cns93z4,siepel,,0,1421532120,t5_2rfqf,t3_2so3ed,t1_cnrqg2g,3,1424820679,0,0,cns93z4,dementia,3,,
What is OED?,false,false,t1_co0217q,sadatay,,0,1422167487,t5_2rfqf,t3_2tkk70,t1_co01618,1,1424404225,0,0,co0217q,dementia,1,,
"
This thread has been linked to from another place on reddit.

- [/r/bestof] [Nurse /u/siepel describes beautiful &amp;amp; bittersweet experience of 'making up' memories with a dementia patient](http://np.reddit.com/r/bestof/comments/2srnlf/nurse_usiepel_describes_beautiful_bittersweet/)


^Do ^not ^vote ^or ^comment ^in ^linked ^threads. ^\([Info](/r/TotesMessenger/wiki/) ^| ^[Contact](/message/compose/?to=\/r\/TMTest))",false,false,t1_cns7wx0,TotesMessenger,,0,1421529582,t5_2rfqf,t3_2so3ed,t3_2so3ed,3,1424821236,0,0,cns7wx0,dementia,3,,
"That is an excellent suggestion, thank you! I have not studied it but I saw one study result that reported that night-fasts of 9 hours is good and 12 hours is better. That's all I remember of that.

I tried fasting many years ago and could not go half a day without getting severe brain fog. By the end of a whole day I would be completely dysfunctional, unable to even stand up. That was before I was diagnosed with hypoglycemia, and I have not tried it again since then.

Before this keto diet, I used to eat many small meals, I would either eat immediately before bed or I would wake up in the middle of the night and need to eat urgently. When I woke up I usually needed to eat urgently. All of that has stopped on this keto diet. I get hungry much less often and it is never urgent. I am getting curious as to how well I would function on a 24-hour fast, but I think I want more than one month on a keto diet to ensure full adaptation before I try that.",false,false,t1_co19o8g,wildcard235,,0,1422283380,t5_2rfqf,t3_2tb7dz,t1_co0ttlu,1,1424383436,0,0,co19o8g,dementia,1,,
"This would be highly individual.  Some people just can't bear it.  I find the best strategy is for the target of the abuse to leave.  If anyone else is there, they can try to appease her.  The target can usually re-enter the room after about 15 minutes of distraction, but not always.  Some people just can't emotionally handle it, it kills their love for the patient.  At this point, my father is just an elderly man I care for.  The man he was, good and bad, died a long time ago.  ",false,false,t1_cnw295f,Lordica,,0,1421851565,t5_2rfqf,t3_2t62k3,t3_2t62k3,5,1424486060,0,0,cnw295f,dementia,5,,
"I'm sorry that you and your husband are going through this.  

My mom has Lewy Body Dementia, and went through this phase.  I was accused, each morning of stealing her money and working for the Mafia, or I was an impostor.  And the list went on, every morning.  I think most dementia sufferers go through this phase or one like it, so just know that you are not alone.  As little as that helps.

It's hard, because you and your family may understand logically that it is the disease speaking, not your *real* FIL, but that does not lessen the emotional impact of having a love one say nasty things to you.  My advice won't help much, but here it is:

Look into a support group for your family.  A local Alzheimer's group would be best, and they won't care what the actual dementia diagnoses is. Being able to trade stories about whose family member said the most vile/evil thing last week helps to keep it in perspective.

Bear in mind, that for whatever reason, dementia makes them act the most horrible to the people that they actually care about the most.

You didn't mention what age your kids are... but have them write down their favorite memories of their grandpa, so that they don't all end up replaced by the bad things.

I'm not religious at all, but it really helped me to visualize my real mom as a ""force ghost"" (from Return of the Jedi) who was watching everything that happened, and was aghast and embarrassed about how her body was acting, and would remind me that she never felt that way, it was only the disease speaking.  It sounds stupid, but it helped me remember who my real mom was and draw support from her. 

Again, talk to a support group, they can get you in contact with more resources, and your entire family will need that.  I really feel for your MIL too, she's probably spending a lot of time trying to apologize for her husband's actions and suffering from them as well.

Argh, I wish I had better advice.  It just all sucks so much.

",false,false,t1_cnhwgqt,MostlyCivil,,0,1420680196,t5_2rfqf,t3_2rndgy,t3_2rndgy,2,1425000408,0,0,cnhwgqt,dementia,2,,
"Yeah, my dad went through a stage of this, too.  Reassure your dad that the nursing staff are there to help and that he doesn't have to respond to every single call.  I hit a point where I thought I was going to go insane from all the pleading phone calls.  Caring for someone with dementia is exhausting.  You feel helpless, hopeless and inadequate.  Sit your dad down and have a long talk with him about how unhealthy it is for him to let this become his life.",false,false,t1_cnydlun,Lordica,,0,1422029019,t5_2rfqf,t3_2tc97v,t3_2tc97v,3,1424437221,0,0,cnydlun,dementia,3,,
"I do not have copies of my neurologist's records about me. I know she made my MCI diagnosis after a neuropsychologist's report concluded probable amnestic MCI (with all the standard caveats). I had been complaining of increasingly serious memory problems for years. My body is also way, way ahead of the curve for enlarged prostates, having had surgery twice. That's totally unrelated, of course, but it shows my cognitive issues are not the only thing ahead of a curve with me. I have one APOE4 allele, but I only found that out in the last couple of weeks, through 23andme.com raw gene data.

There is now no doubt with me or my family that my ketogenic diet has provided me with some major improvements. It remains to be seen if those improvements are temporary, if I will stabilize at an improved state, or if improvements will continue. Obviously I am hoping for continued improvement.",false,false,t1_co0hwzs,wildcard235,,0,1422216177,t5_2rfqf,t3_2tb7dz,t1_co0eltd,1,1424396642,0,0,co0hwzs,dementia,1,,
"What you are doing seems perfect to me.  You can't bring them back to the real world, all you can do is join them in theirs and make it as pleasant as possible for them.",false,false,t1_cnricrg,Lordica,,0,1421457166,t5_2rfqf,t3_2so3ed,t3_2so3ed,15,1424833483,0,0,cnricrg,dementia,15,,
"Wow, that's a tough situation. Unfortunately this sub isn't very active, so I don't know how much help you'll get here. My recommendation would be to try talking to a social worker to see what advice they have. You might also try attending a caregiver support group because those guys often have useful tips. What you really want is to have power of attorney over both of them so that you can take over all of their affairs, but it sounds like it'll be difficult to get them to sign that contract. Ultimately, it's their life, and there's only so much you can do. If they repeatedly refuse to let you help them, then you can't help them, it's simple as that. However, if I were you, I'd keep trying. I would be careful about being too forceful about it, but know that the situation will surely get worse, and eventually they absolutely will need help. Best of luck to you and your family.",false,false,t1_co03vd2,defyingnormal,,0,1422173871,t5_2rfqf,t3_2tkk70,t3_2tkk70,1,1424403367,0,0,co03vd2,dementia,1,,
"Coconut oil gave me a slight increase in blood ketones, peaking and disappearing in about an hour, but it was barely enough to register (.1 to .2 mmol/L). I noted a slight, subtle sense of improvement, which could have just been placebo effect, but it was enough that when I heard about ketogenic diets, it seemed like a super-hyper-coconut-oil option with far higher amounts of ketones, for every minute of every day. It seemed worth trying, and I am glad I did.",false,false,t1_co0q8bl,wildcard235,,0,1422231402,t5_2rfqf,t3_2tb7dz,t1_co0pboc,1,1424392693,0,0,co0q8bl,dementia,1,,
"It's time for the talk with them.  Sounds like they both need help.  But a lot of old people are scared.  Scared by the loss of independence, scared by the roll reversal, scared by the prospect of nursing homes.  (I know I'm totally going to be that way when I'm old).  Maybe try getting help in baby steps.  See if they'll let you make a doctor appointment and go with them.  Maybe they will listen to an authority figure?  Is there an older friend they have that enjoys having a home health aide?  Is there a volunteer agency in their town that spends time with older folks?

If your parents won't come around to a reality check, you may need to work towards getting guardianship or conservatorship so that you guys can get care for your parents.  It sounds like they need a home health aid for a day shift, at minimum.

 ",false,false,t1_co29buj,DontRunReds,,0,1422356045,t5_2rfqf,t3_2tkk70,t3_2tkk70,1,1424366359,0,0,co29buj,dementia,1,,
mid-50's,false,false,t1_cnyk8xc,wildcard235,,0,1422039587,t5_2rfqf,t3_2tb7dz,t1_cnyjeu3,1,1424433969,0,0,cnyk8xc,dementia,1,,
Touche!,false,false,t1_co0ewm3,seb21051,,0,1422210585,t5_2rfqf,t3_2tkk70,t1_co0ak9i,1,1424398047,0,0,co0ewm3,dementia,1,,
"Lol, understood!  I notice my dyslexia is slowly worsening, but it helps in deciphering Captcha codes.",false,false,t1_co0a54e,seb21051,,0,1422200476,t5_2rfqf,t3_2tkk70,t1_co09xqw,1,1424400339,0,0,co0a54e,dementia,1,,
"You might want to try looking at his old family pictures with him as well as asking him to tell you his story, how it used to be, etc. Maybe try a puzzle or read him the newspaper.
It can really help, put things in a new perspective for you, and I'm sure he'll love it too.
Good luck.",false,false,t1_cnmaeoo,nikkiali,,0,1421045704,t5_2rfqf,t3_2s3uyq,t3_2s3uyq,3,1424923976,0,0,cnmaeoo,dementia,3,,
Thank you!!,false,false,t1_cnw68yq,siepel,,0,1421858605,t5_2rfqf,t3_2so3ed,t1_cnricrg,3,1424484196,0,0,cnw68yq,dementia,3,,
"Thank you for the kind and thoughtful response.

We met with hospice and the palliative care nurse today.  He has opted against the feeding tube in his living will.  My mom and sisters and I felt strongly that he wouldn't want to artificially prolong his life, and made our decisions with that consideration in mind.  That includes discontinuing the IV hydration and letting him choose when he wants to drink.

The IV hydration has the possible complication of his body just rejecting the liquid, which can be uncomfortable for him.  He's going to have nursing care and people trying to feed him, but it's ultimately up to him whether or not he eats or drinks.  If he begins to get dehydrated again, hospice will ask my mother if she wants to put him back on the IV, or if she wants to let it run its course at that time.

The nurse explained that at this stage, it's sort of like having the flu - when you have the flu, you don't really feel like you want to eat (except for your brain telling you that you have to!).  His breathing will slow and he'll sleep more and more, but he won't be in any pain.  If he eats or drinks, because of the muscles not cooperating in his throat, there is the chance that the food or drink could go into his lungs instead of his stomach, and cause an infection or pneumonia.  As part of our discussions, we opted against antibiotics or other drugs that aren't palliative care (i.e. if he gets a UTI from the catheter, he can get antibiotics for it because UTIs are painful).

We've been told that based on their experience and observations, once a patient stops eating and drinking, without a miraculous recovery, it takes them about two weeks to die.

Today was a hard day, in other words.

I know all too well right now how hard this is on your family, and I wish you all the comfort in the world.",false,false,t1_cni0yob,sat0123,,0,1420688533,t5_2rfqf,t3_2rkyky,t1_cnh8iri,1,1424998296,0,0,cni0yob,dementia,1,,
"Just try to stay open minded, and one of the biggest things I have learned is that patience is important. ",false,false,t1_cnrqg2g,colinvern1994,,0,1421475892,t5_2rfqf,t3_2so3ed,t3_2so3ed,5,1424829637,0,0,cnrqg2g,dementia,5,,
"It might not hurt to ask if there is anything prescription-wise that could be attempted.

My mom got put on prozac early on because her primary physician was looking hard for some other diagnosis, and sometimes memory problems in older people are a sign of depression.

After couple of years, when it was crystal clear that depression was not the problem, we decided to drop the prozac, since it seemed completely irrelevant.

Lo and behold, mom got a lot nastier, a lot harder to ""handle"".

Brought back the prozac, and mom went back to being easier to be around.

Anyway, just one person's story, but couldn't hurt to ask...",false,false,t1_cnwzu6m,calicoan,,0,1421910123,t5_2rfqf,t3_2t62k3,t3_2t62k3,2,1424470028,0,0,cnwzu6m,dementia,2,,
Thank you very much. Those are great ideas!,false,false,t1_cnrb137,OneMoreLuckyGuy,,0,1421443485,t5_2rfqf,t3_2shmnk,t1_cnqh3ui,1,1424836961,0,0,cnrb137,dementia,1,,
"You are my Florence Nightingale... ",false,false,t1_cnsstzl,oh_no_aliens,,0,1421591795,t5_2rfqf,t3_2so3ed,t3_2so3ed,2,1424811305,0,0,cnsstzl,dementia,2,,
"My Mom has the same problem, so I suggested she carries a little notebook with her all the time, and takes notes of anything she might need to remember, such as shopping or to-do lists.

I asked her to try to get into the habit of checking it every morning to see if it helps jog her memory.

She missed the computer revolution, so an app would unfortunately help very little.",false,false,t1_cnqm6hk,seb21051,,0,1421384542,t5_2rfqf,t3_2shmnk,t1_cnqi8dk,1,1424848709,0,0,cnqm6hk,dementia,1,,
"I had dealt with something quite similar, except our grandparents' genders were reverse.  I got really good at putting a silver lining every time grandpa asked to see grandma, and with practice, you will too.  I know it took weeks and weeks for him to accept that she was gone, and unfortunately for us, it's caused his health to decline rapidly (this is in my personal experience with one man, so don't freak out about this).  It may be a blessing for you that your grandfather's passing wasn't a big shock as losing my grandma was for our family, because you are going to have to live that moment of truth with her over and over and over again while it processes for her.

I really hope that this isn't a response that causes dread or anything negative like that, I just want you to be prepared to deal with that, and if you're not, then you really need to have your family step up and help with her.  I wouldn't have made it without my friends, family, and fiancée, so I absolutely needed them, you might too.",false,false,t1_co1ynrd,RustyKumquats,,0,1422326212,t5_2rfqf,t3_2tq2cu,t3_2tq2cu,5,1424371479,0,0,co1ynrd,dementia,5,,
"thanks, I think I needed this. I'ts true a part of me wants him to be able to reason, but he lives in another reality now. Thanks again.",false,false,t1_cnxkiw5,josem79,,0,1421960407,t5_2rfqf,t3_2t43tx,t1_cnxhfwq,3,1424451030,0,0,cnxkiw5,dementia,3,,
"There is also early onset Alzheimer's.. But 20s are fairly young. Its highly genetic so there's a lower chance if you don't know anyone else in the family with it. There are many other factors that can mimic dementia as well ",false,false,t1_co6xmt0,bevkc,,0,1422729445,t5_2rfqf,t3_2ub71p,t3_2ub71p,1,1424286456,0,0,co6xmt0,dementia,1,,
"This. 

Hopefully your MIL has an attorney and is preparing for their future (power of attorney, long term care, assets, etc). 

As for OP, his current state can very well be a phase. My dad went through phases where he lacked a filter and wouldn't realize that his words/actions were hurtful.  As the disease progressed, different symptoms and ticks formed replacing the previous ones.  Find ways to change the subject and let his comments go in one ear and out the other. The day will come when he can no longer communicate. Try getting stories or kind words out of him while you can. ",false,false,t1_cnkfrkm,RedhairedLady,,0,1420891113,t5_2rfqf,t3_2rndgy,t1_cni8sej,1,1424955776,0,0,cnkfrkm,dementia,1,,
"Ah... beautiful! I love it when they talk about back in their days. It's as if you automatically go back in time, right? Have you ever seen pictures of the Albanian lady, from when she was the age she was talking about? I have seen mrs. White's old pictures, whenever she tells me about a time, and I ask her ""when?"" she either tells me a story of when she was 5-10, 10-15, 15-25 and 25-40. I can mostly guess, because she'll give me enough details for it, and I'll imagine her looking like one of the pictures I've seen of her from (probably) around that time! It makes listening even more fun!",false,false,t1_cnw6f51,siepel,,0,1421858874,t5_2rfqf,t3_2so3ed,t1_cnsgkxn,2,1424484116,0,0,cnw6f51,dementia,2,,
"Both of my parents have had broken hips.  My dad fell out of the shower and broke his, had surgery and rehab.  He came home and was doing very well, but was stubborn and stopped using his walker.  He balance still wasn't very good.  One evening he lost his balance and fell off the porch onto the sidewalk and crushed the same hip.  He had surgery again, but he couldn't put weight on his leg afterwards and we had to put him in a nursing home because my mom was also sick and couldn't take care of him.  He passed away a month later. He had other medical problems though, so his death wasn't really due to the broken hip. 

Three months after my dad passed away, my mom fell on the stairs and broke her hip, had surgery and rehab.  That was in 2012 and she's still alive and walks with her walker.  

I think it has a lot to do with their health prior to the broken hip. My dad was on dialysis, had a major stroke a few years before and just wasn't very active before his fall.  My mom was in bad health too.  She has a lot of heart problems, but she's always been a busy person and was still pretty active before she fell.",false,false,t1_cnya15d,Ciscokid60,,0,1422021868,t5_2rfqf,t3_2ryh4z,t3_2ryh4z,1,1424438876,0,0,cnya15d,dementia,1,,
"Best of luck!  Had you not quit it is questionable that those responsible would have had the motivation to do anything to change the situation.  They may still decide not to move her to an institution and dump another unsuspecting carer into the situation.

I understand that the family cannot walk away, but if the patient needs to be admitted because of behavioral issues, there is not much else to do.",false,false,t1_cnj1feb,seb21051,,0,1420769139,t5_2rfqf,t3_2rs3lb,t3_2rs3lb,2,1424979785,0,0,cnj1feb,dementia,2,,
"You may want to try fidgety things, I made something similar to this  [Imgur](http://i.imgur.com/VKBhcJv.jpg) and it is better than you'd think at keeping him entertained.  Its a lot of trial and error, my grandpa is in the late stages, a few things that we found were:  Those moving sand pictures that you flip over were a great find, or really anything that does something when you flip it over(picture all those plastic things with blob-like liquid inside that moves in a cool way), Also things with buttons that make a sound or an action, and cards-- the fascination with those musical cards is ridiculously strong here! Good luck &amp; experiment! ",false,false,t1_cnmb9mi,smiles_and_nods,,0,1421048652,t5_2rfqf,t3_2s3uyq,t3_2s3uyq,1,1424923575,0,0,cnmb9mi,dementia,1,,
"He pretty much has been self-absorbed in his own psychotic-ness, paranoia, and delusions for the past few decades..  writing letters to the government for corruption, etc. but before that he had a masters in oceanography, and was a commercial fisherman. He has been a genius with numbers (he still rattles off things I could never compute in my brain) but I can't see him doing things like sudoku, as they don't have a point. He's really good with building things... although his house was a dump, he had it solar rigged and his power bill was down to 9 bucks a month (That is extremely low for an outer-laying island in Hawaii). I'm pretty at a loss here for ideas.. his left side of his body is also extremely weak, so typing and instruments (he played banjo) are also a chore.",false,false,t1_cnlzc7e,chronobot,,0,1421021989,t5_2rfqf,t3_2s3uyq,t1_cnlxs2a,1,1424929151,0,0,cnlzc7e,dementia,1,,
"Hey, I'm really sorry to hear about your father. Mine has the same kind of dementia and he's in the same stage as your own. We're sort of preparing for the situation you have right now.

I don't know if it will go for your situation, but we've chosen not to give my father a feeding tube if the need arises. The reason for this is because if he was in his own mind and able to make decisions for himself, he wouldn't have wanted it anyway. We've made a lot of our decisions for dad based on what he would have wanted while still integrating the best available care for him. It's important to remember that while the person can't speak for themselves, they are still there and we would only be disrespecting the person we knew/know when it comes to making decisions they wouldn't have wanted. 

I don't know how long they can survive without food in a hospice setting, but I imagine the rule of three applies in some way; three weeks without food, three days without water, three minutes without air.

The unfortunate thing about feeding tubes with dementia patients is that they can cause confusion and fear. There's no way to explain that we're trying to help or what is on their body, and it's only natural they would try to remove it. At least, this would apply in my father's case, yours may have a different reaction. 

I realize I don't have much info here, but I wanted to remind you that you're not alone in your decisions, regardless of what path you take. We're all just trying to do the best for our loved ones, and don't let anyone make you think otherwise. 

Wishing you all the best. ",false,false,t1_cnh8iri,Euryno,,0,1420639318,t5_2rfqf,t3_2rkyky,t3_2rkyky,2,1425011825,0,0,cnh8iri,dementia,2,,
