body,score_hidden,archived,name,author,author_flair_text,downs,created_utc,subreddit_id,link_id,parent_id,score,retrieved_on,controversiality,gilded,id,subreddit,ups,distinguished,author_flair_css_class
"Ugh.  So lucky to be in a state that would allow euthanasia and so stupid (sorry) not to take advantage of it.

We won't know until after the autopsy but if it's the type of early onset Alz that is 50% heritable....if I find out I am going to go down that road I will off myself in the cleanest way possible.",,,,I_WantMyMother2Die,,,1466272325,t5_2rfqf,t3_4ojlbz,t1_d4eh4bt,1,1469130638,0,0,d4ehixk,dementia,1,,
"In order to survive and grow emotionally, you are going to have to learn to tune it out. Learn to always smile and have a positive outlook. Very often such behaviour is meant to be an attention getter. If it gets no special attention, the payoff becomes smaller and smaller. Improperly parented children employ very similar techniques to intimidate, manipulate and ultimately take control of their hapless parents.

Watch ""Grace Under Fire""; especially the interaction between Grace and her Mother In Law.",,,,seb21051,,,1467238789,t5_2rfqf,t3_4qgw60,t3_4qgw60,1,1469385039,0,0,d4t7fzc,dementia,1,,
"Best of luck to you. What you face is not easy, and what you have faced equally so. 

Caring for a parent or loved one is so isolating. It made me feel so overwhelmed, lonely, and helpless. Caring for my mom on her bad days felt like such a thankless task, especially when she was unable to even comprehend her own situation and the amount of time and effort it takes to keep her fed, clothed, meds, etc. 


While the bad days were miserable, knowing I was able to help my mother live a full life when she would have otherwise suffered was worth it. 
Best of luck. ",,,,msgreyson,,,1466298803,t5_2rfqf,t3_4or4ol,t3_4or4ol,1,1469137658,0,0,d4ew4e9,dementia,1,,
@caseyoc thank you very much ��,,,,nicholaswz,,,1466491814,t5_2rfqf,t3_4oz460,t3_4oz460,1,1469186451,0,0,d4hpmb6,dementia,1,,
"It's a GPS enabled insole for shoes, incase anyone was wondering'",,,,Remington_Underwood,,,1465667466,t5_2rfqf,t3_4nlgqv,t3_4nlgqv,1,1468967502,0,0,d4531z9,dementia,1,,
"No but I've seen similar. Don't know if it's right but I assumed it was because she knew she was forgetting things and wanted to sponge all information or because once memory loss hits it causes paranoia when people tell you things you don't believe. Causing people to think things being said especially whispered are about them. 

Not an expert",,,,SpyDad24,,,1465885689,t5_2rfqf,t3_4nzlf1,t3_4nzlf1,1,1469026376,0,0,d48fyeq,dementia,1,,
"Thank you so much for your input. I hadn't thought about any of those. She is a huge fan of Conway Twitty and Elvis so I'll see about playing some of that for her.

As for the second portion, she is very easily agitated in her current state so I don't think that would be a great idea. She used to love to needlepoint and crochet but her Parkinson's like symptoms and lack of eyesight has taken those from her. I would love nothing more, as a 26 year old man, than to be able to sit down and have her teach me needlepoint. 

Lastly, she wasn't much for tea or coffee. Her thing has always been Diet Coke but she's only allowed water right now due to the fact that she keeps forgetting to drink at all and is getting overly dehydrated. 

I will definitely try out the music and go from there depending on her mood. 

Thanks again.",,,,mharris17,,,1466646505,t5_2rfqf,t3_4pd39j,t1_d4k5jnh,1,1469230160,0,0,d4k8u7q,dementia,1,,
"The wost important thing you should keep in mind... it might not be long before she needs more care, so be prepared. I started my mom with 4 hours/day 3x/week 18 months ago, and now she can't be alone at all, even at night.",,,,dumbmatter,,,1464913895,t5_2rfqf,t3_4m70wy,t3_4m70wy,1,1468773492,0,0,d3tu6bf,dementia,1,,
Did she grow up in a household where food wasn't easy to get? Sounds like a mischievous habit a kid might have.,,,,hithazel,,,1466194356,t5_2rfqf,t3_4ohd2t,t3_4ohd2t,1,1469113587,0,0,d4dhoql,dementia,1,,
"We live in Oregon which has the death with dignity act. However, my parents don't believe in taking your own life for religious reasons. So they opted not to go down that path years ago. 

There is a 33% chance I could have what she had and I would never want to end up how she did. It was awful. ",,,,photobooth_luv,,,1466271631,t5_2rfqf,t3_4ojlbz,t1_d4dhtna,2,1469130447,0,0,d4eh4bt,dementia,2,,
"I have been clear and consistent to my husband and to my sister (the two people who I know will respect and trust my judgment on this) that if I ever get diagnosed with anything close to what my mom went through I'm taking my own life. If it's going to kill me, it's going to kill me on my terms. ",,,,SarahMakesYouStrong,,,1467258695,t5_2rfqf,t3_4qgjil,t3_4qgjil,2,1469390813,0,0,d4tjnv6,dementia,2,,
"If there’s one thing I’ve learned from my multiple dealings with my great uncle Dain (a sexual predator who threatened the purity of young schoolchildren all across town), it is that it is absolutely disgraceful to treat yourself as some sort of hate-sponge, where you just suck it all up and turn the other cheek.  No one sings songs of praise for the spineless punching bags of the world.  Tell your sad sack of shit of a father that he’d better shape up and be fucking quick about it or his ungrateful ass is going to end up alone in a rural ditch with the cockroaches and rats.  Even the goodliest of souls have their limits, and if you continue putting up with his hateful bullshit you run the very high risk of suffering his corrupting influence and eventually reciprocating it with your own children.  The human subconscious is very strange, and one often finds themselves inexplicably defiled by negative influences against their will.  It’s a very “children of alcoholics become alcoholics” sort of thing (which occurs at an alarmingly high percentage).  Make sure to put an end to his insane ramblings immediately.  I think even the most senile old fools would understand the weight behind the words “if you don’t cut that shit out I’ll chop off your dick and feed it to the pigs.”",,,,WyattHiggins,,,1467272295,t5_2rfqf,t3_4qgw60,t3_4qgw60,6,1469393596,0,0,d4tpfhf,dementia,6,,
"I'm sorry for your loss. She is at rest now, no more fighting that terrible disease. ",,,,SpyDad24,,,1466231966,t5_2rfqf,t3_4ojlbz,t3_4ojlbz,2,1469123189,0,0,d4e1w3f,dementia,2,,
"I, too, would like to hear recommendations for this.",,,,throwawayyourneurons,,,1464873999,t5_2rfqf,t3_4m70wy,t3_4m70wy,1,1468759827,0,0,d3t1mkj,dementia,1,,
[deleted],,,,[deleted],,,1466714433,t5_2rfqf,t3_4pe5wv,t3_4pe5wv,1,1469248395,0,0,d4lawzp,dementia,1,,
Thank you so much for replying and sharing your experience. We do  have a telehealth line that I hadn't thought of going though but I will definitely be looking into this now.,,,,SoSullied,,,1466637068,t5_2rfqf,t3_4pb3k4,t1_d4jia6w,1,1469227189,0,0,d4k2opg,dementia,1,,
I love this story! Haha,,,,medicinedelete,,,1464757407,t5_2rfqf,t3_4l2tqv,t3_4l2tqv,1,1468731162,0,0,d3rdqi3,dementia,1,,
"I'm in the same boat mate.  Wish there were a legal way to just end her suffering sooner.
",,,,I_WantMyMother2Die,,,1466194538,t5_2rfqf,t3_4ojlbz,t1_d4d4set,3,1469113651,0,0,d4dhtna,dementia,3,,
"Firstly, I am so sorry you are struggling with this. I am a dementia specialist carer completing a degree in Dementia Studies in the UK, I will try to answer your questions as thoroughly as I can.

Please excuse the wall of text, I'm on my phone. 

Progression: It's likely that due to her vascular dementia she is continuing to have what are known as TIA'S, which is a ""transient ischemic attack."" This is basically a mini stroke and could be behind the quick deterioration. Alzheimers disease progresses steadily instead of in steps. A vascular dementia will be like going down in steps, and can happen over a few days or a few years. 

Diagnosis: whilst this is not the nicest fact, it's true. The only way to 100% diagnose a dementia is via an autopsy of the brain. When a doctor diagnoses a dementia, it is not set in stone. So far the vascular dementia diagnosis sounds accurate, so does the alzheimers disease. You mentioned she also talks to people that aren't there, do you mean she is talking to a person and mistaking them for someone else or talking to an empty space? If it's the latter, it is possible she has a lewy body dementia also. This can cause hallucinations and symptoms like Parkinsons disease. There are around 500 different types of Dementia. It is unfortunately very difficult to diagnose.

Medication: most medications are also available in a liquid form, and if not then in a soluble form so they dissolve in water. You can also get medication that dissolves in the mouth, speak to your mum's regular doctor about switching to liquid or soluble medication. If it's pain relief, you can get transdermal patches (usually either fentanyl or buprenorphine). These are basically plasters that stay on for between 3-7 days and release a certain hourly dose of pain relief that is absorbed through the skin.

Her mood: with dementia one of the most difficult things is often that the person cannot express themselves anymore. Think of your mum like an iceberg (weird but hear me out) what you see is what is above the surface  (crying or being angry) and that's her way of communicating to you that something is wrong. Below the surface, that's where the problem is and unfortunately you can't see it. It could be something like needing the toilet, pain, feeling sick, shoes being too tight, discomfort, not hearing well, not seeing well, things being in the wrong place, frustration as she doesn't know what to do, she's tired. It's mostly about trial and error. It could be that she is experiencing depression as this is unfortunately very common in people living with a dementia, especially alzheimers disease. Medication like fluoxitine or citalopram (which are available in liquid form) can help.

Stages of dementia: the link is not very accurate. Everyone's experience of Dementia is intrinsic to them, no one else will experience it the same way. Generally stages are referred to as ""early"", ""middle"" or ""late"".

Dizziness: if by bathroom you mean urinating, she may have a urinary tract infection. If you mean pooing, she could be constipated. If she is just getting dizzy when she stands, it could be an issue with her blood pressure. It could also be none of those and something else entirely.

How can you make her feel better: you will know this better than anyone else. Try things that your mum liked in the past, or really anything at all. Again it's a bit of trial and error. You may not always be able to make her feel better. It's also important to focus on what she can do, not what she can't do. If she is able to eat with her fingers instead of cutlery then great, that means she can eat independently and will give her that little bit of confidence. Try and encourage her to do as much as she can.  Try to go along with her reality. If in that moment she believes you are her brother, try not to tell her otherwise. I know it's very upsetting :(

Coping: there is no one way to cope with this. I live in the UK, and we have a couple of organisations that can help on the Internet.  Try www.alzheimers.org.uk or www.dementiafriends.org.uk. Both of these have forums and people to talk to who are going through similar things as you. 

If you have any more questions please feel free to message me and ask. If I don't know the answer I can try and point you towards organisations that do. Most importantly, remember to take care of yourself. It is extremely hard being a carer for a family member and you need to make sure you are the number one priority.",,,,elephant_8,,,1467328769,t5_2rfqf,t3_4qn31b,t3_4qn31b,4,1469410077,0,0,d4unnod,dementia,4,,
"I have the same problem except it's with my mom, we were able to get caregiver but the allocated hours of care was not enough for her needs and we had to get more government help involved. She also had SSI, what you need to do is find the social services organization in your area and they will help you find a nursing home or adult home care for your dad. I'm in WA, we have dshs that provides all that. There are a few caveats but it will be major financial relief and your dad will be in good hands. Just make sure you are happy with the facility. I'm waiting for my mom to get transferred to an adult home care. She has been in hospitals for almost 2 years and there is no way we could afford that care shes been getting.",,,,acerbell,,,1465021631,t5_2rfqf,t3_4mes2r,t3_4mes2r,2,1468802048,0,0,d3vhpb9,dementia,2,,
"This s hard, because you can't *force* her to do anything.  Often, you just have to watch them and hold your breath.  My dad convinced the DMV to let him keep his license long after he was competent to drive.  I tried reporting him to no avail.  Luckily, the accident the culminated his driving career didn't kill anyone, even though it cost him close to $40,000.  Make sure her insurances are up to date (don't take her word for it) and try to get a POA. ",,,,Lordica,,,1466364568,t5_2rfqf,t3_4otqn0,t3_4otqn0,3,1469151167,0,0,d4fo6xv,dementia,3,,
"When my father in law gets into this kind of ""loop"" (for lack of a better term), we just pick an answer (e.g. ""They'll be here in the morning so need to get a good night's sleep"") and be prepared to answer it over and over again. Sometimes my SO will adjust the answer a bit based on how my FIL reacted to the last one. We're going for whatever soothes him and seems to sit well with him. Occasionally we have some luck changing to a completely different subject, and if he's too agitated then ice cream often resets his mood. 

You might want to talk with her doctor about her not sleeping through the night as well, in case there is anything s/he can do.

Much respect to you for taking care of your grandmother at home. It's got to be exhausting. ",,,,not-rocket-science,,,1466676581,t5_2rfqf,t3_4pfjsv,t3_4pfjsv,8,1469236355,0,0,d4kltr1,dementia,8,,
"She's fine with her date of birth and address. For her SSN, she hasn't worked in over 3 decades so hasn't needed to recall that; my dad handled all of the financial matters. It can take her a bit of effort to recall her mother's maiden name (her mom passed away when she was a toddler and she was raised in a mission with her sisters, so that doesn't come up very often, and I didn't even know that until fairly recently). She has a more difficult time recalling various bits of information if she's put on the spot and/or if she doesn't quite understand why that information is being asked of her. She understands the general principle of banks and savings, but doesn't understand things like CDs maturing and minimum distributions for IRAs. One option is to have her physicians have her formally declared not mentally competent and have POA assigned to either my brother or me. I need to get a clearer idea of why my brother is reluctant to do that, but he mentioned something about the costs associated with that. I'll have to press him for more details on that because it seems like something that's gonna have to be done eventually.

Note that, at one point, my brother mentioned having her put into a care facility, which I consider to be the absolute last option; she's lived in our home for over 40 years and I'd like it if she doesn't ever have to live elsewhere, unless she chooses to do so, like our grandma requested way back.",,,,argyle47,,,1464806101,t5_2rfqf,t3_4lzu2c,t1_d3rra8k,2,1468742824,0,0,d3s21ao,dementia,2,,
"I'm sorry for your mother's passing, but more importantly am thrilled that her soul is finally free. My mother is not yet free and I silently hope every day for her burden to be lifted.",,,,DocCyane,,,1466177899,t5_2rfqf,t3_4ojlbz,t3_4ojlbz,10,1469107368,0,0,d4d4set,dementia,10,,
"Oh no! Thats terrible....i just dont understand how people like that can work in this industry ",,,,thatredheadedfella,,,1467090678,t5_2rfqf,t3_4q6mf0,t1_d4qtvtm,2,1469344763,0,0,d4qvczw,dementia,2,,
[removed],,,,[deleted],,,1466621262,t5_2rfqf,t3_4pcbhd,t3_4pcbhd,1,1469221307,0,0,d4jqhyv,dementia,1,,
"There is no harm in applying for Medicaid. If they say no, then you aren't out anything.

Does he have home health care yet? Medicare will pay for a home health nurse to come out anywhere between once per day, to a few times a week. They will help bathe him, etc. 

Try calling the local adult protective services. They know who to call, what's available to him, etc.
",,,,bpoppygirl,,,1464986701,t5_2rfqf,t3_4mes2r,t1_d3uxt55,1,1468792886,0,0,d3uyk5g,dementia,1,,
[deleted],,,,[deleted],,,1466710982,t5_2rfqf,t3_4pfjsv,t3_4pfjsv,1,1469247022,0,0,d4l85m9,dementia,1,,
"The only thing you would see from MRI/CT scan would be brain shrinkage in the effected areas. Like others have said you would not see the plaques with out specific amyloid pet imaging. It is also important that many types of dementia have similar memory loss symptoms with diverse pathologies. ",,,,nbx909,,,1466186159,t5_2rfqf,t3_4oil7n,t3_4oil7n,2,1469110508,0,0,d4dbay5,dementia,2,,
"I work in nursing homes. I deal with dementia a lot.  

People with dementia tend to have plateaus and then they decline and then they plateau again for a bit. Especially when there's a big change in what's happening or you take them out of their usual Comfort setting it can trigger a decline.  There's been a bit of research in transfer trauma.  There's a reason old people don't like change. 

What I can say about coping is that with family members of those affected by dementia this is really where the grieving process start to happen. Your mother is no longer who she was. You may have glimpses of the past ohlf what what she wants was.  But there will be no recovery. It does not get better it's really about prolonging the life and keeping the affected as comfortable as possible.  

Whenever you are dealing with behavior the best thing you can do is meet her where she is. If she is looking for her mother do not tell her her mother is dead. Tell her that Mom is at the store or someone else is watching Mom for a bit and she gets to relax depending on what time her mind is at.  I'm a firm believer that reorienting is one of the worst things you can do because it causes the person to relive that grief every time.

Don't push yourself too hard and know where you're at your limits. You can't be a good caretaker when you're tired.  If you need help get help. Whether it be an in-home aide to help you or seeing a therapist about the stress level.

I wish you the best.  I hope this helps you.  If you ever have any questions about a particular Behavior or something like that feel free to inbox me.  I work in Recreation.",,,,rocketduck413,,,1467319645,t5_2rfqf,t3_4qn31b,t3_4qn31b,2,1469406981,0,0,d4uh8kl,dementia,2,,
"oh wow. I did not know this! I will have to look into that. I will definitely give adult protective services a call and see if they can offer anything. ",,,,fr0zen_yetti,,,1464987901,t5_2rfqf,t3_4mes2r,t1_d3uyk5g,1,1468793286,0,0,d3uzeph,dementia,1,,
"This is bullshit, don't listen to him. He's a solicitor. 

My parents are immigrants, and I'm in the exact same boat as you. My dad has a lot of finances that he hasn't sorted yet, and he's in his mid 60s. His symptoms affect everyone, and not everyone can understand. PM me if you wanna talk more. ",,,,mhass24,,,1466046923,t5_2rfqf,t3_4m2d0k,t1_d3tef0w,2,1469072868,0,0,d4b4o33,dementia,2,,
"Thank you, this confirms a lot of what I had been thinking. I am working on my family about visits an attorney to get things signed over while her time is mostly relatively lucid and they have been very resistant so far - I think that while my Mom/Aunts/Uncles know that it is happening and want to get her help but as you said are reluctant to make the harder decisions because it means we truly are loosing her. There is also this slight feeling of almost sneaking around and trying not to fully let on to her that all of this is going on before we get a diagnosis.",,,,SoSullied,,,1466637316,t5_2rfqf,t3_4pb3k4,t1_d4jjyn3,2,1469227267,0,0,d4k2umk,dementia,2,,
"Let his doctor know, first of all. Medication can reduce the frequency and severity of the symptoms. Finding out if the outburst is being caused by pain or some other type of avoidable distress can also be very important
(tips: https://www.alz.org/care/alzheimers-dementia-aggression-anger.asp#respond) Urinary tract infections are a common cause. Other than that, you can choose whether or not to expose your daughter (or yourself)  to it. My uncle has the typical ""dirty old man"" behavior of frontotemporal degeneration and is not at all safe around kids. Unfortunately this is the hereditary type and two of his grandchildren have early onset dementia. Sometimes leaving them in a ditch is not enough to leave the problem behind. ",,,,[deleted],,,1467304122,t5_2rfqf,t3_4qgw60,t1_d4tz8qm,2,1469401045,0,0,d4u4xr7,dementia,2,,
"To add to this: Exercise!  Treat your body well and it will support your mind.  Try to minimize sources of chronic stress, but don't just watch TV all day. 

As for tests , there are some new methods I'm investigating currently, but the best way right now (if you think it is hereditary) is to get a gene test.  23and me is the big name in this space, and once you get results you can use Web tools to interpret them, looking at the Apoe alleles, which are associated with risk of AD",,,,vvanderbred,,,1466701566,t5_2rfqf,t3_4pe5wv,t3_4pe5wv,1,1469243320,0,0,d4l0g6m,dementia,1,,
Replied; I hope it helps.,,,,caseyoc,,,1466440746,t5_2rfqf,t3_4oz460,t3_4oz460,2,1469170704,0,0,d4gsy5v,dementia,2,,
"Yes she can. She identifies her home. When she leaves her home she flips. At least for the moment she recognizes it. 

Thank you for your help",,,,morcillazo,,,1467320442,t5_2rfqf,t3_4qn31b,t1_d4ugny6,1,1469407276,0,0,d4uhv2r,dementia,1,,
"Very helpful, thank you!",,,,spicy_buns,,,1466171494,t5_2rfqf,t3_4oil7n,t1_d4czxk4,1,1469105161,0,0,d4d096a,dementia,1,,
"There will come a point where the situation will come unbearable and your Mom will ""turn the corner"" with regard to her current insistence on avoidance.   I can't tell you what the circumstances will be, but it will happen.  At that point, she will finally reach out for help.  

In the meantime, consider visiting various memory care centers in their area for research purposes.   Put together a list of pros/cons along with pricing so you'll have it when the time comes. ",,,,Jewel_332211,,,1464874576,t5_2rfqf,t3_4m2d0k,t3_4m2d0k,1,1468759992,0,0,d3t1z8i,dementia,1,,
I dont know what state you are in but he may qualify for medicaid. It varies from state to state. If its availible there are facilities that take it and would cover his care. At least here in missouri. But as i said everwhere is different.,,,,FreyaStone,,,1464985424,t5_2rfqf,t3_4mes2r,t3_4mes2r,1,1468792454,0,0,d3uxn3z,dementia,1,,
"I'm so sorry you are dealing with this. It is so hard. Having experienced something similar with my dad I know how heartbreaking it can be. I do believe that no matter how much he can or can't understand he can feel your love and that is extremely powerful. The most important thing I would suggest to you is to make sure to take care of yourself first - this will benefit both you and your dad's physical and emotional well being. Best of luck and take care. ",,,,catattatt,,,1466320159,t5_2rfqf,t3_4or4ol,t3_4or4ol,1,1469142349,0,0,d4f5rx4,dementia,1,,
"Thank you for your very frank reply.   One last question:  is there a financial savings with in-home staffing or is it about the same as the expense of having your Gram in a facility?   Have you found that Medicare/Medicaid picks up any of the in-home staffing expense? ",,,,Jewel_332211,,,1464965283,t5_2rfqf,t3_4m70wy,t1_d3u10xe,1,1468785072,0,0,d3ui9wl,dementia,1,,
"He's exhibited other behaviors that the assisted living staff have learned to ignore in order to stop them, and that works.  I'll have to keep that in mind.",,,,caseyoc,,,1467297045,t5_2rfqf,t3_4qgw60,t1_d4t7fzc,1,1469398407,0,0,d4tzhjw,dementia,1,,
"I'm very sorry. Caregiving is really tough- easily the toughest job/role I've ever had. Please start now- find someone who can do 1-2 days per week, or a few hours at least, so that you can have some respite. You will need it. Care.com is a good place to start. ",,,,applesangria,,,1466300648,t5_2rfqf,t3_4or4ol,t3_4or4ol,1,1469138172,0,0,d4ex27u,dementia,1,,
"I'm going to just make an appointment with a neurologist this week since I haven't been getting anywhere.  I got in touch with a genetics office and they said that would be the best thing to do and to get a reference.  She said the wait time is about a year though.  My mom never got a genetic test as far as I know.  I guess she still can, but she doesn't see a doctor anymore since she's so far advanced, but I'll try to get something worked out in the next couple weeks.",,,,wilhel_ryan,,,1465736632,t5_2rfqf,t3_4ly7rt,t1_d45nceu,1,1468982170,0,0,d45xkvv,dementia,1,,
